{
  "rag_type": "literag",
  "dominio": "LiteRAG_Bench_01",
  "n_libros": 0,
  "timestamp": "2026-05-04T17:10:48.339996",
  "qa_results": [
    {
      "question": "Which VBA keyword is used to declare a constant instead of a variable?",
      "ground_truth": "Const",
      "answer": "The VBA keyword used to declare a constant is `Const`.",
      "contexts": [
        "## Direct Evidence (Source Text)\n[Direct Result]: if you require no-rounding fractions, use the Currency data type.\n  * If the variable may sometimes contain a fraction, declare it as the Single or Double data type.\n  * If the variable will always contain a string, declare it as the String data type.\n\n* * *\n\nIf You're Unsure, Test a Variable's Type Using a Variant\n\nIf you aren't sure what type of variable will best contain the information you're planning to use, start by declaring the variable as a Variant. Then step through the procedure in Break mode with the Locals window displayed (View ⇒ Locals Window). The Locals window displays local variables, their value, and their type. As you press F8 to step through your procedure, see what Variant subtype VBA assigns to the variable. You'll see the type, such as Variant/Double or Variant/String, in the Type column. Test the procedure a couple more times to make sure this subtype is consistent, and then try declaring the variable as the data type indicated by the subtype. Run the code a few times to make sure the new data type works.\n\n* * *\n\n# Working with Constants\n\nA constant is a named item that keeps a constant value during execution of a program. VBA provides many built-in constants, but you can also declare your own constants to help you work with information that stays constant through a procedure. But recall that many programmers simply use variables rather than constants, even for values that won't change (such as the number of eggs in a dozen). However, constants are available if you or your superiors find them of value.\n\n## Declaring Your Own Constants\n\nTo declare your own constants, use the Const statement. By declaring a constant, you can simplify your code when you need to reuse a set value a number of times in your procedures.\n\n### Syntax\n\nThe syntax for the Const statement is as follows:\n\n    [Public/Private] Const _constant_ [As _type_ ] = _expression_\n\nHere, Public and Private are optional keywords used for declaring public or private scope for a constant. You'll learn how they work in a moment. _constant_ is the name of the constant, which follows the normal rules for naming variables. _type_ is an optional argument that specifies the data type of the constant. _expression_ is a literal (a value written into your code), another constant, or a combination of the two.\n\nAs with variables, you can declare multiple constants in the same line by separating the statements with a comma:\n\n    Const conPerformer As String = \"Carmen Singer\", _\n        conTicketPrice As String = \"$34.99\"\n\n### Example\n\nDeclaring a constant in VBA works in a similar way to declaring a variable explicitly, but you declare the value of the constant when you declare the constant (rather than at a later point of your choosing). You can't change its value afterward.\n\nAs an example, take a look at the following statements:\n\n    Const conVenue As String = \"Davies Hall\"\n    Const conDate As Date = #December 31, 2013#\n    MsgBox \"The concert is at \" & conVenue & \" on \" _\n    & conDate & \".\"\n\nThe first line declares the constant conVenue as a String data type and assigns it the data Davies Hall. The second line declares the constant conDate as a Date string type and assigns it the date December 31, 2013. (When you finish creating this line of code and move the insertion point to another line, VBA changes the date to the date format set in your computer's clock—#12/31/2013#, for example.) The third line displays a message box containing a string concatenated from the three text items in double quotation marks, the conVenue string constant, and the conDate date constant.\n\n## Choosing the Scope and Lifetime for Your Constants\n\nScope works the same way for constants as it does for variables. The default scope for a constant declared in a procedure is local—that is, its scope is the procedure that declares it. Consequently, its lifetime is the time for which the procedure runs. But you can set a different scope and lifetime for your constants by using the Public or Private keyword.\n\n  * To declare a private constant, place the declaration at the beginning of the module in which you want the constant to be available. A private constant's lifetime isn't limited, but it's available only to procedures in the module in which it's declared:\n\n    Private Const conPerformer As String = \"Carmen Singer\"\n\n  * To declare a public constant, place the declaration at the beginning of a module. A public constant's lifetime isn't limited, and it's available to all procedures in all modules in the project in which it's declared:\n\n    Public Const conTicketPrice As String = \"$34.99\"\n\n# Working with Enumerations\n\nIn addition to constants you can create in your code, VBA includes sets of predefined constants. An _enumeration_ is a predefined list of unique integers (numbers) that have individual names. It's a set of items, related in some way.\n\nHere's an enumeration, a set of items that you need to paint a room. Note that another way to describe this is that it's a numbered list:\n\n1. Brushes\n\n2. Paint\n\n3. Masking tape\n\n4. Drop cloth\n\n5. Sandpaper\n\nYou could now refer to any of these items by either their number in the enumeration or by their name.\n\nAn enumeration is typically used in your programming to specify a property of an object. Each integer in the enumeration has a meaning to VBA and a name that allows you to refer to it easily. The names that correspond to the integers in the enumeration are called _enumerated constants_.\n\nFor example, when you use the MsgBox function to display a message box using VBA, you can pick one of\n\n[Direct Result]: memory area.)\n\nFor example, if you need the user to input their name via an input or a dialog box, you'll typically store the name in a variable so you can work with it further down in some later statement in the procedure. Or perhaps you're adding several numbers that the user types in. You would have a variable that holds the current sum total—which keeps changing (varying) as the user types in more numbers.\n\nVBA uses several types of variables, including these:\n\n_Strings_ store text characters or groups of characters.\n\n_Integers_ store whole numbers (numbers without fractions).\n\n_Objects_ store objects.\n\n_Variants_ can store any type of data. Variant is the default type of variable.\n\nEither you can let VBA create Variant variables as the default type, or you can specify another data type if you wish. Specifying the types of variables has certain advantages that you'll learn about in due course.\n\nFor the moment, try creating a variable in the Immediate window. Type the following line and press Enter:\n\n    myVariable = \"Some sample text\"\n\nNothing visible happens, but VBA has created the myVariable variable. It has set aside some memory and labeled that area myVariable. It also stored the text string Some sample text in that variable. Now, type the following line and press Enter:\n\n    MsgBox myVariable\n\nThis time, you can see the result: VBA goes to the memory area you specified (with the variable name myVariable) and retrieves the value, the string. A message box appears containing the text you had stored in the variable.\n\nYou can declare variables either explicitly or implicitly. An _explicit_ declaration is a line of code that specifies the name you want to give the variable, and usually its type, before you use the variable in your code. Here's an explicit variable declaration:\n\n    Dim myVariable As String\n\nAn _implicit_ declaration means that you don't bother with that explicit declaration statement. Instead, you just use the variable name in some other statement. VBA then stores the data in a Variant variable. (You have not specified the type.)\n\nIn other words, if you _just use_ a variable in your code without declaring it, it's implicit.\n\nHere's an example of implicit declaration:\n\n    myVariable = \"Some sample text\"\n\nYou never _explicitly_ declared this variable. The first time it appeared in your code, you just assigned some data, the text, to it. So VBA assumes that you want to create the variable implicitly.\n\nIn the next few chapters, you'll use a few implicit variable declarations to keep things simple. In other words, you won't have to type in lines of code to declare implicit variables. VBA will create them for you when you first use them in an assignment or other statement.\n\nHowever, many educators and professional programmers insist on explicit declaration, so we'll do that for the most part in the later sections of this book. Explicit variable declarations make your code run faster and make it easier to understand. What's more beneficial, some types of errors can be avoided if you explicitly declare all your variables. So declaring is a good habit to get into.\n\n# Constants\n\nA _constant_ is similar to a variable. It's a named item that keeps a constant value while a program is executing. The constant's meaning _doesn't change_ during the macro's execution. (So in this way, it's unlike a _variable_.)\n\nVBA uses two types of constants: _intrinsic constants_ , which are built into the VBA language itself (and individual Office applications' implementations of VBA), and _user-defined constants_ , which you can create. For example, the built-in constant vbOKCancel is always available in VBA to be used with the MsgBox function. This constant creates a message box that contains an OK and a Cancel button. There are sets of built-in constants for colors, printing (vbTab, for example), and other properties.\n\nConcerning constants that you define, you might want to create one to store a piece of information that doesn't change, such as the name of a procedure or the distance between Boston and New York. In practice, the built-in _intrinsic_ constants are used quite often in VBA programming; user-defined constants not so much. It's just as easy to put the distance between those cities in a variable, even though it won't vary.\n\n# Arguments\n\nAn _argument_ is a piece of information—supplied by a constant, a variable, a literal, or an expression—that you pass to a procedure, a function, or a method. Some arguments are required; others are optional. The text hello there in this MsgBox function is an argument:\n\n    MsgBox \"hello there\"\n\nHere's another example. As you saw earlier, the following statement uses the optional argument SaveChanges to specify whether Word should save any unsaved changes while closing the active document:\n\n    ActiveDocument.Close SaveChanges:=wdDoNotSaveChanges\n\nThis optional argument uses the built-in constant wdDoNotSaveChanges.\n\n* * *\n\nUnderstanding Literals\n\nA _literal_ can be used instead of a constant or variable, if you wish. With a literal, you just type the actual value into the argument. For example, you could display a message box that says \"Hi there\" by using a variable:\n\n    txtMsg = \"Hi there!\"\n    MsgBox (txtMsg)\n\nOr you could simply avoid the variable and employ a literal (the actual text string) as the argument:\n\n    MsgBox (\"Hi there!\")\n\nBoth of these approaches have the same result.\n\n* * *\n\nThe Visual Basic Editor's helpful prompts and the Visual Basic Help file show the list of arguments for a function, a procedure, or a method in parentheses, with any optional arguments enclosed in brackets. If you have its Auto Quick Info feature activated, the Editor displays the argument list for a function,\n\n[Direct Result]: such as Stop or End. There are also restrictions such as not using special characters.\n\n**Master It**\n\nThis variable name cannot be used, for two reasons. Fix it so it is a legitimate variable name:\n\n    Dim 1Turn! as Integer\n\n**Solution**\n\n    Dim Turn as Integer\n\nYou can't begin a variable name with a digit, nor can you use an exclamation point anywhere in the name.\n\n**Specify the scope and lifetime of a variable.**\n\nVariables have a range of influence, depending on how you declare them.\n\n**Master It**\n\nCreate a variable named AnnualSales that will be available to any procedure within its own module but not to other modules.\n\n**Solution**\n\nConstants, like variables, are named locations in memory that contain a value. Unlike variables, however, the value in a constant does not change during program execution.\n\n**Work with constants.**\n\nConstants, like variables, are named locations in memory that contain a value. Unlike with variables, however, the value in a constant does not change during program execution.\n\n**Master It**\n\nDefine a string constant using the Dim command. Name your constant FirstPrez, and assign it the value George Washington.\n\n**Solution**\n\nThis code line defines a constant, and assigns a value to it:\n\n    Const FirstPrez As String = \"George Washington\"\n\n**Work with enumerations.**\n\nEnumerations provide a handy name for each item in a list, often a list of properties.\n\n**Master It**\n\nIn the Project Explorer, click the ThisDocument object to select it. Then locate the JustificationMode property in the Properties window, and choose one of that property's enumerated constants by clicking the small down-arrow that appears, then clicking one of the constants in the drop-down list.\n\n**Solution**\n\nYou'll see the drop-down list of enumerated values for the JustificationMode property, as illustrated in the following screenshot.\n\n# Chapter 7: Using Array Variables\n\n**Understand what arrays are and what you use them for.**\n\nArrays play an important role in computer programming. In some ways they resemble a mini-database, and organized data is central to computing. Computers are sometimes called data processors for good reason, and arrays make it easier for you to manipulate variable data.\n\n**Master It**\n\nWhat is the difference between an array and an ordinary variable?\n\n**Solution**\n\nAn ordinary (scalar) variable can contain only a single value; an array can contain multiple values, identified by index numbers.\n\n**Create and use arrays.**\n\nWhen you create a new array, you _declare_ it and, optionally, specify the number of values it will contain.\n\n**Master It**\n\nThere are four keywords that can be used to declare arrays. Name at least three of them.\n\n**Solution**\n\nArrays can be declared using the same keywords that are employed to declare ordinary variables: Dim, Private, Public, or Static.\n\n**Redimension an array.**\n\nIf you want to resize an existing dynamic array, you can redimension it.\n\n**Master It**\n\nRedimensioning an array with the ReDim statement causes you to lose any values that are currently in that array. However, you can preserve these values using a special keyword. What is it?\n\n**Solution**\n\nTo preserve values when redimensioning an array, use the Preserve command, like this:\n\n    ReDim Preserve arrTestArray(5)\n\n**Erase an array.**\n\nYou can erase all the values in a fixed-size array or completely erase a dynamic array.\n\n**Master It**\n\nWrite a line of code that erases an array named arrMyArray.\n\n**Solution**\n\nUse the Erase statement with the name of an array you want to erase. The following statement erases the contents of the fixed-size array named arrMyArray:\n\n    Erase arrMyArray\n\n**Find out whether a variable is an array.**\n\nAn array is a type of variable, and you may occasionally need to check whether a particular variable name denotes an array or an ordinary _scalar variable_ (a variable that isn't an array).\n\n**Master It**\n\nWhich built-in function can you use in VBA to find out whether a variable is an array or an ordinary, single-value variable?\n\n**Solution**\n\nUse the IsArray function with the variable's name to see if a variable is an array. For example, the following statement checks the variable MyVariable to see if it's an array:\n\n    If IsArray(MyVariable) = True Then\n\n**Sort an array.**\n\nVisual Basic .NET includes array objects with built-in search and sort methods. In VBA, however, you must write a bit of code to search and sort the values in an array.\n\n**Master It**\n\nName a popular, understandable, but relatively inefficient sorting technique.\n\n**Solution**\n\nThe bubble sort is easy to visualize, but relatively inefficient.\n\n**Search an array.**\n\nSearching through an array can be accomplished in two primary ways. If you have a relatively small array, you can use the simpler, but less efficient technique. With large amounts of data, though, it's best to use the more robust approach.\n\n**Master It**\n\nName two common ways to search an array.\n\n**Solution**\n\nYou can use either the simple linear search or the binary search, which requires that an array be sorted first.\n\n# Chapter 8: Finding the Objects, Methods, and Properties You Need\n\n**Understand and use objects, properties, and methods.**\n\nContemporary programming employs a hierarchical method of organization known as object-oriented programming (OOP). At the very top of the hierarchy for any given application is the Application object. You go through this object to get to other objects that are lower in the hierarchy.\n\n**Master It**\n\nBy using _creatable_ objects, you can often omit the Application object when referencing it in code. What are creatable objects?\n\n**Solution**\n\nBecause you'd have to go through the Application object to get to pretty much anything in the application, most applications"
      ],
      "latency_s": 13.65,
      "rag_type": "literag",
      "dominio": "LiteRAG_Bench_01",
      "titulo": "",
      "error": ""
    },
    {
      "question": "What is the name of the root object in the Excel object model hierarchy?",
      "ground_truth": "Application",
      "answer": "The provided text does not explicitly name the root object of the Excel object model hierarchy. However, it frequently refers to the `Application` object as a starting point for accessing other objects within the Excel object model. For example, it states, \"Most VBA host applications, including all the major Office applications, have an Application object that represents the application as a whole.\" It also mentions that \"In a typical object model, the Application object essentially contains all the other objects (and collections—groups—of objects) that make up the application.\"",
      "contexts": [
        "## Direct Evidence (Source Text)\n[Direct Result]: at the ways OOP is employed in team programming at the end of this chapter.\n\nObjects can—and frequently do—contain other objects. Typically, the objects in an object-oriented application are arranged into a hierarchy called the _object model_ of the application. This hierarchy is intended to make it easier to figure out where—within a large library of objects—you'll find a particular object that you want to use in your macros. It's similar to the way a biography is likely to be found in the library's nonfiction area.\n\n* * *\n\nObject Models Covered in Depth Later in the Book\n\nThis chapter discusses object models only a little, at the conceptual level: You need to know what an object model is in order to make sense of what you'll be learning in the following chapters, but you don't need to know the specifics of each object model to manipulate the objects used in the examples. Part 5 of this book, \"Creating Effective Code,\" examines the object models of each of the applications covered in this book in enough detail to get you started on exploring the depths of each object model on your own.\n\n* * *\n\nMost VBA host applications, including all the major Office applications, have an Application object that represents the application as a whole. The Application object has properties and methods for things that apply to the application as a whole. For example, many applications have a Quit method that exits the application and a Visible property that controls whether the application is visible or hidden.\n\nIn a typical object model, the Application object essentially contains all the other objects (and collections—groups—of objects) that make up the application. For example, Excel has an Application object that represents the Excel application, a Workbook object (grouped into the Workbooks collection) that represents a workbook, and a Worksheet object (grouped into the Sheets collection) that represents a worksheet. The Workbook object is contained within the Application object because you normally need to have the Excel application open to work with an Excel workbook.\n\nIn turn, the Worksheet object is contained within the Workbook object because you need to have an Excel workbook open to use a worksheet. Walking further down the object model, the Worksheet object contains assorted other objects, including Row objects that represent the individual rows in the worksheet, Column objects that represent columns in the worksheet, and Range objects (which represent ranges of cells). And these objects in turn contain further objects.\n\nTo get to an object, you typically walk down through the hierarchy of the object model until you reach the object you're looking for.\n\nTo get to a Range object in Excel, for example, you would go through the Application object to the Workbook object, through the Workbook object to the appropriate Sheet object, and then finally to the Range object. The following statement shows how to select the range A1 in the first worksheet in the first open workbook (more on this in a minute):\n\n    Application.Workbooks(1).Sheets(1).Range(\"A1\").Select\n\n## Understanding Creatable Objects\n\nThe Application object, however, is optional and is usually left out of code lines. Why? Because you'd have to go through the Application object to get to pretty much _anything_ in the application, most applications _expose_ (make available to you) a number of _creatable_ objects. Creatable merely means that you can access something without having to type the word Application in your code. It's assumed. This is similar to the fact that you don't have to include the word _Earth_ when addressing an envelope. There's only that one possibility.\n\nThese creatable objects are usually the most-used objects for the application, and by going through them, you can access most of the other objects without having to refer to the Application object. For example, Excel exposes the Workbooks collection as a creatable object, so you can use the following statement, which doesn't require that you type in Application. See the alternative example a couple of paragraphs earlier in this chapter.\n\n    Workbooks(1).Sheets(1).Range(\"A1\").Select\n\nAny object can have properties and methods. The next sections discuss these items in detail.\n\n## Properties\n\nIn VBA, a _property_ is an attribute or characteristic of an object. Most objects have multiple properties that specify each aspect of it.\n\nEach property has a specific data type for the information it stores. For example, the objects that represent files (such as documents, workbooks, or presentations) typically have a Boolean property named Saved that stores a value denoting whether all changes in the object have been saved (a value of True) or not (a value of False). These two values encompass the entire range of possibilities for the object: it can either contain unsaved changes or not contain unsaved changes. There is no third state. And a Boolean data type is used because that type has only two possible values.\n\nSimilarly, most objects that represent files have a Name property that contains the name of the file in question. The Name property contains a String data type because it needs to contain text. And that text can be just about anything, limited only by the 255-character path that Windows permits for files and by certain characters—such as colons and pipe (|) characters—that Windows forbids in filenames.\n\nTo work with a property, you _get_ (fetch or return) it to find out its current value or _set_ (change) it to a value of your choosing. Many properties are _read/write_ , meaning that you can both _get_ and _set_ their values, but some properties are _read-only_ , meaning that you can view their values but not change them.\n\nThe Saved property is read/write for most applications, so you can set it. This means that you can tell the application that a file contains unsaved changes when it really doesn't or that it contains no unsaved changes when it actually has some. (Changing\n\n[Direct Result]: In other words, you want to remove the web-page table definitions but leave the data in a usable format within Word.\n\nThe following macro does just that:\n\n    Sub Untable()\n\n    On Error Resume Next\n\n       Selection.Rows.ConvertToText Separator:=wdSeparateByCommas, NestedTables:= _\n         True\n       Selection.MoveDown Unit:=wdLine, Count:=1\n\n    If Err Then MsgBox \"No table was detected, dude.\"\n\n    End Sub\n\nTo use this macro, click somewhere within the text you've pasted from the Internet to put the insertion cursor in a table (or a suspected table; they often don't look like tables, merely like an area of bizarre formatting), then execute the macro. You may need to execute this macro more than once to completely eliminate all the tabular formatting debris left over from the original HTML. The macro tells you when all table structures have been destroyed, and not only that—it calls you \"dude.\"\n\n# The Bottom Line\n\n**Use Find and Replace via VBA.**\n\nWord's Find and Replace utilities are frequently valuable to the VBA programmer. You'll want to master them and also some subtleties associated with their use.\n\nMaster It\n\nSometimes when replacing, you need to go through a document more than once—using a loop structure. Why would you ever need to repeatedly search and replace the same document? Doesn't the Replace All setting in fact _replace all_?\n\n**Work with headers, footers, and page numbers.**\n\nAll Word documents contain headers and footers, even if they are empty. In addition, you can insert various types of headers and footers.\n\nMaster It\n\nName two types of headers you can use in a Word document.\n\n**Manage sections, page setup, windows, and views.**\n\nAmong the various ways you can view a document, you sometimes want to have the document automatically scroll to a particular table, graphic, or other target.\n\nMaster It\n\nWhat method of the Window object can be used to easily accomplish this task?\n\n**Manipulate tables.**\n\nWhen you need to manage tables in Word documents, you can employ VBA to work with the Table object to represent a single table. If there is more than one table, they are referenced by a collection of Table objects.\n\nMaster It\n\nName two important and useful objects within the Tables collection or the Table object.\nChapter 22\n\nUnderstanding the Excel Object Model and Key Objects\n\nThis chapter shows you how to start working with the Excel object model, the architecture underlying Excel. It also shows you how to perform common actions with the most immediately useful Excel objects. These objects include the Workbooks collection and the Workbook object, the ActiveCell object, and Range objects. You'll also see how to set options in Excel.\n\nIn this chapter you will learn to do the following:\n\n  * Work with workbooks\n  * Work with worksheets\n  * Work with the active cell or selection\n  * Work with ranges\n  * Set options\n\n# Getting an Overview of the Excel Object Model\n\nAs with the other Office applications, it's not necessary (or even possible for most people) to understand how the entire Excel object model fits together in order to work with VBA in Excel, but most people find that knowing the main objects in the object model is helpful. And often the code examples in the Help system's object-model reference are invaluable—showing you how and where to employ objects in your own programming.\n\nTo see the Excel object-model reference, follow these steps:\n\n1. Launch or activate Excel, and then press Alt+F11 to launch or activate the VBA Editor.\n\n2. Move your cursor to a blank space in the code window (to avoid context-sensitive help).\n\n3. Press F1 in the Editor to launch the web page for the VBA language reference for Office 2013.\n\n4. In the Bing search field, type **excel 2013 object model** and press Enter.\n\n5. Click the link _Object Model Reference_ ( _Excel 2013 Developer Reference_ ). You'll now have access to the whole collection of syntax specifications, useful descriptions, and code examples, as shown in Figure 22.1.\n\nFigure 22.1 The entries in the Excel object model reference will help you write your own VBA code.\n\n* * *\n\nHelp When Migrating Legacy Code from Earlier Office Projects\n\nIf you've inherited VBA code written in earlier versions of Office, those procedures might contain objects, methods, and properties that have been changed in Office 2013. Though modifications to object models are generally few, some incompatibilities can crop up and \"break\" the code so it won't run correctly. Fortunately, you can download a free utility, the Office Code Compatibility Inspector, that will flag objects and their members that have changed. It does a text comparison of the Office 2013 object model against VBA code written in earlier versions of Office. You can download the Compatibility Inspector from this web page:\n\nwww.microsoft.com/en-us/download/details.aspx?id=15001\n\n* * *\n\n# Understanding Excel's Creatable Objects\n\nExcel _exposes_ (makes available for your use in code) various _creatable_ objects, meaning that you can employ most of the important objects in its object model without explicitly going through (mentioning) the Application object. For most programming purposes, these creatable objects are the most commonly used objects. Here's a list:\n\n  * The Workbooks collection contains the Workbook objects that represent all the open workbooks. Within a workbook, the Sheets collection contains the Worksheet objects that represent the worksheets and the Chart objects that represent chart sheets. On a sheet, the Range object gives you access to ranges, which can be anything from an individual cell to a complete worksheet. Remember that, because the workbooks object is creatable, you need not write Application.Workbooks in your code. You can leave off the\n\n[Direct Result]: saved with the document or template that contains it and can be accessed at any time (whether or not a procedure is running).\n\n**Manipulate options**\n\nWord contains many options that can be manipulated from within VBA.\n\n**Master It**\n\nIn Word, one object controls many of the options. This object has dozens of properties but no methods. Name this object.\n\n**Solution**\n\nThe Options object controls many of the options in Word.\n\n# Chapter 21: Working with Widely Used Objects in Word\n\n**Use Find and Replace via VBA.**\n\nWord's Find and Replace utilities are frequently valuable to the VBA programmer. You'll want to master them and also some subtleties associated with their use.\n\n**Master It**\n\nSometimes when replacing, you need to go through a document more than once—using a loop structure. Why would you ever need to repeatedly search and replace the same document? Doesn't the Replace All setting in fact _replace all_?\n\n**Solution**\n\nIn some situations, the act of replacing actually generates new instances of the target of the replacement activity. Let's say you want only single-space strings in a document. (For example, you want sentences separated by only a single space character, but sometimes a typist accidentally presses two or more spaces.) You set up a search and replace that looks for double-space character strings and replaces them with single-space characters. You have to take into account that there can also be some multiple-space-character strings. Consider a string of six adjacent space characters. During the first pass, your double-to-single search and replace reduces the six-space string to a three-space string (three instances of double spaces would reduce to three instances of single spaces). The second pass through a loop would reduce it to a two-space string, requiring yet a third pass through the loop to achieve the desired single space. This same situation can apply to multiple-paragraph spacing (multiple blank lines) and tabs.\n\n**Work with headers, footers, and page numbers.**\n\nAll Word documents contain headers and footers, even if they are empty. In addition, you can insert various types of headers and footers.\n\n**Master It**\n\nName two types of headers you can use in a Word document.\n\n**Solution**\n\nHere are the major types of Word headers: the primary header, different first-page headers, different even-page headers, and different sets of headers for each of the sections in the document.\n\n**Manage sections, page setup, windows, and views.**\n\nAmong the various ways you can view a document, you sometimes want to have the document automatically scroll to a particular table, graphic, or other target.\n\n**Master It**\n\nWhat method of the Window object can be used to easily accomplish this task?\n\n**Solution**\n\nThe ScrollIntoView method of the Window object moves the view to a target you specify.\n\n**Manipulate tables.**\n\nWhen you need to manage tables in Word documents, you can employ VBA to work with the Table object to represent a single table. If there is more than one table, they are referenced by a collection of Table objects.\n\n**Master It**\n\nName two important and useful objects within the Tables collection or the Table object.\n\n**Solution**\n\nSome of the most useful objects within a Table object or a Tables collection are as follows:\n\nThe Rows collection contains the rows in the table. Each row is represented by a Row object.\n\nThe Columns collection contains the columns in the table. Each column is represented by a Column object.\n\nThe Cell object provides access to a specified cell directly from the Table object. You can also reach the cells in the table by going through the row or column in which they reside.\n\nThe Range object provides access to ranges within the table.\n\nThe Borders collection contains all the borders for the table.\n\nThe Shading object contains all the shading for the table.\n\n# Chapter 22: Understanding the Excel Object Model and Key Objects\n\n**Work with workbooks.**\n\nYou often need to create a new, blank workbook in a macro (mimicking a user clicking the File tab on the Ribbon, then clicking the New button). And writing code that accomplishes this is not difficult. It requires only two words.\n\n**Master It**\n\nWhat code would you write to create a new, blank notebook?\n\n**Solution**\n\nTo create a blank workbook, omit the Template argument, like this:\n\n     Workbooks.Add\n\n**Work with worksheets.**\n\nMost workbooks you access via VBA will contain one or more worksheets, so most procedures will need to work with worksheets—inserting, deleting, copying, or moving them, or simply printing the appropriate range from them.\n\n**Master It**\n\nName the object you use in VBA code to represent a worksheet.\n\n**Solution**\n\nEach worksheet is represented by a Sheet object. The Sheet objects are contained within the Sheets collection.\n\n**Work with the active cell or selection.**\n\nIn a procedure that manipulates a selection that the user has made, you'll typically work with either the active cell or the current selection.\n\n**Master It**\n\nWhat is the difference between the active cell and a selection?\n\n**Solution**\n\nThe active cell is always a single cell, but the selection can either be a single cell or encompass multiple cells or other objects.\n\n**Work with ranges.**\n\nWithin a worksheet, you'll often need to manipulate ranges of cells. Excel includes a special kind of range—represented by the UsedRange property.\n\n**Master It**\n\nWhat is unique about UsedRange?\n\n**Solution**\n\nIf you need to work with all the cells on a worksheet (but not with any unoccupied areas of the worksheet), use the UsedRange property. UsedRange ignores empty areas of a worksheet.\n\n**Set options.**\n\nWord employs an Options object to contain most of the options that you find in the Word Options dialog box (click the File tab on the Ribbon, then click Options). Excel uses a different object to contain its options.\n\n**Master It**\n\nFrom which object do you access\n\n## Entity Definitions\n**EXCEL OBJECT MODEL**: The EXCEL OBJECT MODEL is the underlying architecture of Microsoft Excel, providing a hierarchical structure that represents all the elements within the application. This structure allows users to programmatically access and manipulate various Excel components using Visual Basic for Applications (VBA). Essentially, it defines the relationships between different objects in Excel, such as workbooks, worksheets, cells, charts, and more, enabling developers to automate tasks, customize functionality, and build sophisticated Excel-based solutions.\n\n## Community Context\n\n**Community 13**: The community is centered around Visual Basic for Applications (VBA) and its extensive integration with Microsoft Office applications, particularly Word and Outlook. VBA serves as a powerful tool for automating tasks, customizing functionalities, and developing custom applications within these environments. The relationships highlight how VBA is used to enhance productivity, manage data, and create user interfaces, with specific mentions of its role in handling dialog boxes, ribbons, and properties. The presence of entities like 'Richard Mansfield' and the book 'Mastering VBA for Microsoft Office 2013' indicates a focus on learning and mastering VBA. The broader ecosystem includes related programming concepts and functions that are utilized within VBA."
      ],
      "latency_s": 1.33,
      "rag_type": "literag",
      "dominio": "LiteRAG_Bench_01",
      "titulo": "",
      "error": ""
    },
    {
      "question": "What is the expected value of the squared deviation from the mean called in computer science statistics?",
      "ground_truth": "Variance",
      "answer": "The expected value of the squared deviation from the mean is called the **variance**.",
      "contexts": [
        "## Direct Evidence (Source Text)\n[Direct Result]: very slightly) different numbers are called the standard deviation of a dataset. One—the one we use in this chapter—is an estimate of the scale of the data, as we describe it. The other differs from our expression very slightly; one computes\n\n![\n$$\\\\displaystyle{\\\\mathsf{stdunbiased}\\\\left \\(\\\\left \\\\{x\\\\right \\\\}\\\\right \\) = \\\\sqrt{\\\\frac{\\\\sum _{i } \\(x_{i } - \\\\mathsf{mean } \\\\left \\(\\\\left \\\\{x\\\\right \\\\} \\\\right \\) \\)^{2 } } {N - 1}} }$$\n](A442674_1_En_1_Chapter_Equr.gif)\n\n(notice the N − 1 for our N). If N is large, this number is basically the same as the number we compute, but for smaller N there is a difference that can be significant. Irritatingly, this number is also called the standard deviation; even more irritatingly, we will have to deal with it, but not yet. I mention it now because you may look up terms I have used, find this definition, and wonder whether I know what I'm talking about. In this case, I do (although I would say that).\n\nThe confusion arises because sometimes the datasets we see are actually samples of larger datasets. For example, in some circumstances you could think of the net worth dataset as a sample of all the net worths in the USA. In such cases, we are often interested in the standard deviation of the underlying dataset that was sampled (rather than of the dataset of samples that you have). The second number is a slightly better way to estimate this standard deviation than the definition we have been working with. Don't worry—the N in our expressions is the right thing to use for what we're doing.\n\n### 1.3.3 Computing Mean and Standard Deviation Online\n\nOne useful feature of means and standard deviations is that you can estimate them online. Assume that, rather than seeing N elements of a dataset in one go, you get to see each one once in some order, and you cannot store them. This means that after seeing k elements, you will have an estimate of the mean based on those k elements. Write ![\n$$\\\\hat{\\\\mu }_{k}$$\n](A442674_1_En_1_Chapter_IEq11.gif) for this estimate. Because\n\n![\n$$\\\\displaystyle{\\\\mathsf{mean}\\\\left \\(\\\\left \\\\{x\\\\right \\\\}\\\\right \\) = \\\\frac{\\\\sum _{i}x_{i}} {N} }$$\n](A442674_1_En_1_Chapter_Equs.gif)\n\nand\n\n![\n$$\\\\displaystyle{\\\\sum _{i=1}^{k+1}x_{ i} = \\\\left \\(\\\\sum _{i=1}^{k}x_{ i}\\\\right \\) + x_{k+1},}$$\n](A442674_1_En_1_Chapter_Equt.gif)\n\nwe have the following recursion\n\n![\n$$\\\\displaystyle{\\\\hat{\\\\mu }_{k+1} = \\\\frac{\\\\left \\(k\\\\hat{\\\\mu }_{k}\\\\right \\) + x_{k+1}} {\\(k + 1\\)}.}$$\n](A442674_1_En_1_Chapter_Equu.gif)\n\nSimilarly, after seeing k elements, you will have an estimate of the standard deviation based on those k elements. Write ![\n$$\\\\hat{\\\\sigma }_{k}$$\n](A442674_1_En_1_Chapter_IEq12.gif) for this estimate. We have the recursion\n\n![\n$$\\\\displaystyle{\\\\hat{\\\\sigma }_{k+1} = \\\\sqrt{\\\\frac{\\(k\\\\hat{\\\\sigma }_{k }^{2 }\\) + \\(x_{k+1 } -\\\\hat{\\\\mu } _{k+1 } \\)^{2 } } {\\(k + 1\\)}}.}$$\n](A442674_1_En_1_Chapter_Equv.gif)\n\n### 1.3.4 Variance\n\nIt turns out that thinking in terms of the square of the standard deviation, which is known as the variance, will allow us to generalize our summaries to apply to higher dimensional data.\n\nDefinition 1.3 (Variance)\n\nAssume we have a dataset {x} of N data items, x 1,..., x N . where N > 1. Their variance is:\n\n![\n$$\\\\displaystyle\\\\begin{array}{rcl} \\\\mathsf{var}\\\\left \\(\\\\left \\\\{x\\\\right \\\\}\\\\right \\)& =& \\\\frac{1} {N}\\\\left \\(\\\\sum _{i=1}^{i=N}\\(x_{ i} -\\\\mathsf{mean}\\\\left \\(\\\\left \\\\{x\\\\right \\\\}\\\\right \\)\\)^{2}\\\\right \\) {}\\\\\\\\ & =& \\\\mathsf{mean}\\\\left \\(\\\\left \\\\{\\(x_{i} -\\\\mathsf{mean}\\\\left \\(\\\\left \\\\{x\\\\right \\\\}\\\\right \\)\\)^{2}\\\\right \\\\}\\\\right \\). {}\\\\\\\\ \\\\end{array}$$\n](A442674_1_En_1_Chapter_Equ3.gif)\n\nOne good way to think of the variance is as the mean-square error you would incur if you replaced each data item with the mean. Another is that it is the square of the standard deviation. The properties of the variance follow from the fact that it is the square of the standard deviation. I have broken these out in a box, for emphasis.\n\nUseful\n\n[Direct Result]: i}\\\\right \\\\}\\\\right \\). }$$\n](A442674_1_En_1_Chapter_Eque.gif)\n\nAll this means that the mean is a location parameter; it tells you where the data lies along a number line.\n\nI prove ![\n$$\\\\begin{array}{c} \\\\mbox{ argmin}\\\\\\\\ \\\\mu \\\\end{array} \\\\sum _{i}\\(x_{i}-\\\\mu \\)^{2} = \\\\mathsf{mean}\\\\left \\(\\\\left \\\\{x\\\\right \\\\}\\\\right \\)$$\n](A442674_1_En_1_Chapter_IEq1.gif) below. This result means that the mean is the single number that is closest to all the data items. The mean tells you where the overall blob of data lies. For this reason, it is often referred to as a location parameter. If you choose to summarize the dataset with a number that is as close as possible to each data item, the mean is the number to choose. The mean is also a guide to what new values will look like, if you have no other information. For example, in the case of the bar, a new person walks in, and I must guess that person's net worth. Then the mean is the best guess, because it is closest to all the data items we have already seen. In the case of the bar, if a new person walked into this bar, and you had to guess that person's net worth, you should choose $107,903.\n\nProperty 1.1\n\nThe Average Squared Distance to the Mean is Minimized\n\nProposition\n\n![\n$$\\\\begin{array}{c} \\\\mathit{\\\\mbox{ argmin}}\\\\\\\\ \\\\mu \\\\end{array} \\\\sum _{i}\\(x_{i}-\\\\mu \\)^{2} = \\\\mathsf{mean}\\\\left \\(\\\\left \\\\{x\\\\right \\\\}\\\\right \\)$$\n](A442674_1_En_1_Chapter_IEq2.gif)\n\nProof\n\nChoose the number μ such that the sum of squared distances of data points to μ is minimized. That number is the mean. In notation:\n\n![\n$$\\\\displaystyle{\\\\begin{array}{c} \\\\mbox{ argmin}\\\\\\\\ \\\\mu \\\\end{array} \\\\sum _{i}\\(x_{i}-\\\\mu \\)^{2} = \\\\mathsf{mean}\\\\left \\(\\\\left \\\\{x\\\\right \\\\}\\\\right \\)}$$\n](A442674_1_En_1_Chapter_Equf.gif)\n\nWe can show this by actually minimizing the expression. We must have that the derivative of the expression we are minimizing is zero at the value of μ we are seeking. So we have\n\n![\n$$\\\\displaystyle\\\\begin{array}{rcl} \\\\frac{d} {d\\\\mu }\\\\sum _{i=1}^{N}\\(x_{ i}-\\\\mu \\)^{2}& =& \\\\sum _{ i=1}^{N}2\\(x_{ i}-\\\\mu \\) {}\\\\\\\\ & =& 2\\\\sum _{i=1}^{N}\\(x_{ i}-\\\\mu \\) {}\\\\\\\\ & =& 0 {}\\\\\\\\ \\\\end{array}$$\n](A442674_1_En_1_Chapter_Equ1.gif)\n\nso that ![\n$$2N\\\\mathsf{mean}\\\\left \\(\\\\left \\\\{x\\\\right \\\\}\\\\right \\) - 2N\\\\mu = 0$$\n](A442674_1_En_1_Chapter_IEq3.gif), which means that ![\n$$\\\\mu = \\\\mathsf{mean}\\\\left \\(\\\\left \\\\{x\\\\right \\\\}\\\\right \\)$$\n](A442674_1_En_1_Chapter_IEq4.gif).\n\n### 1.3.2 Standard Deviation\n\nWe would also like to know the extent to which data items are close to the mean. This information is given by the standard deviation, which is the root mean square of the offsets of data from the mean.\n\nDefinition 1.2 (Standard Deviation)\n\nAssume we have a dataset {x} of N data items, x 1,..., x N . The standard deviation of this dataset is:\n\n![\n$$\\\\displaystyle{\\\\begin{array}{ll} \\\\mathsf{std}\\\\left \\(\\\\left \\\\{x_{ i}\\\\right \\\\}\\\\right \\)&=\\\\sqrt{ \\\\frac{1} {N}\\\\sum _{i=1}^{i=N}\\(x_{i} -\\\\mathsf{mean}\\\\left \\(\\\\left \\\\{x\\\\right \\\\}\\\\right \\)\\)^{2}} \\\\\\\\ & =\\\\sqrt{\\\\mathsf{mean } \\\\left \\(\\\\left \\\\{\\(x_{i } - \\\\mathsf{mean } \\\\left \\(\\\\left \\\\{x\\\\right \\\\} \\\\right \\) \\)^{2 } \\\\right \\\\} \\\\right \\)}.\\\\end{array} }$$\n](A442674_1_En_1_Chapter_Equg.gif)\n\nYou should think of the standard deviation as a scale. It measures the size of the average deviation from the mean for a dataset, or how wide the spread of data is. For this reason, it is often referred to as a scale parameter. When the standard deviation of a dataset is large, there are many items with values much larger than, or much smaller than, the mean. When the standard deviation is small, most data items have values close to the mean. This means it is helpful to talk about how many standard deviations away from the mean a particular data item is. Saying that data item x j is \"within k standard deviations from\n\n[Direct Result]: One way to avoid getting mixed up is to remember that variances add, and derive expressions for standard deviations from that.\n\n### 4.2.3 Expectations and Statistics\n\nI have now used each of the terms mean, variance, covariance, and standard deviation in two slightly different ways. One sense of each term, expounded in Sect. 1.​3, describes a property of a dataset. These are known as descriptive statistics. The other sense, described above, is a property of probability distributions. These are known as expectations. The reason we use one name for two notions is that the notions are not really all that different.\n\nHere is a useful construction to illustrate the point. Imagine we have a dataset {x} of N items, where the i'th item is x i . Build a random variable X using this dataset by placing the same probability on each data item. This means that each data item has probability 1∕N. Write ![\n$$\\\\mathbb{E}\\\\left \\[X\\\\right \\]$$\n](A442674_1_En_4_Chapter_IEq66.gif) for the mean of this distribution. We have\n\n![\n$$\\\\displaystyle{\\\\mathbb{E}\\\\left \\[X\\\\right \\] =\\\\sum _{i}x_{i}P\\(x_{i}\\) = \\\\frac{1} {N}\\\\sum _{i}x_{i} = \\\\mathsf{mean}\\\\left \\(\\\\left \\\\{x\\\\right \\\\}\\\\right \\)}$$\n](A442674_1_En_4_Chapter_Equae.gif)\n\nand, by the same reasoning,\n\n![\n$$\\\\displaystyle{\\\\mathsf{var}\\\\left \\[X\\\\right \\] = \\\\mathsf{var}\\\\left \\(\\\\left \\\\{x\\\\right \\\\}\\\\right \\).}$$\n](A442674_1_En_4_Chapter_Equaf.gif)\n\nThis construction works for standard deviation and covariance, too. For this particular distribution (sometimes called the empirical distribution), the expectations have the same value as the descriptive statistics.\n\nIn Sect. 4.3.4 , we will see a form of converse to this fact. Imagine we have a dataset that consists of independent, identically distributed samples from a probability distribution (i.e. we know that each data item was obtained independently from the distribution). For example, we might have a count of heads in each of a number of coin flip experiments. Then the descriptive statistics will turn out to be accurate estimates of the expectations.\n\n## 4.3 The Weak Law of Large Numbers\n\nAssume you see repeated values of a random variable. For example, let X be the random variable which has value 1 if a coin comes up heads (which happens with probability p) and − 1 if it comes up tails. You now actually flip a coin N times, recording 1 for heads and − 1 for tails. Intuition should say that the average of these numbers should be a good estimate of the value of ![\n$$\\\\mathbb{E}\\\\left \\[X\\\\right \\]$$\n](A442674_1_En_4_Chapter_IEq67.gif), by the following argument. You should see 1 about pN times, and − 1 about (1 − p)N times. So the average should be close to p − (1 − p), which is ![\n$$\\\\mathbb{E}\\\\left \\[X\\\\right \\]$$\n](A442674_1_En_4_Chapter_IEq68.gif). Furthermore, intuition should suggest that this estimate gets better as the number of flips goes up.\n\nThese intuitions are correct. You can estimate expectations accurately by experiment. This is extremely useful, because it means that you can use quite simple programs to estimate values that might take a great deal of work to obtain any other way. Most people find it natural that something of this sort should be true. What is neat is that it is quite easy to prove.\n\n### 4.3.1 IID Samples\n\nWe need first to be crisp about what we are averaging. Imagine a random variable X, obtained by flipping a fair coin and reporting 1 for an H and − 1 for a T. We can talk about the probability distribution P(X) of this random variable; we can talk about the expected value that the random variable takes; but the random variable itself doesn't have a value. However, if we actually flip a coin, we get either a 1 or a − 1. Observing a value is sometimes called a trial. The resulting value is often called a sample of the random variable (or of its probability distribution); it is sometimes called a realization. So flipping the coin is a trial, and the number you get is a sample. If we flipped a coin many times, we'd have a set of numbers (or samples). These numbers would be independent. Their histogram would look like P(X). Collections of data items like this are important enough to have their own name.\n\nAssume we have a set of data items x i such that (a) they are independent; and (b) the histogram of a very large set of data items looks increasingly like the probability distribution P(X) as the number of data items increases. Then we refer to these data items as independent identically distributed samples of P(X); for short, iid samples or even just samples. It's worth knowing that it can be a difficult computational problem to get IID samples from some given probability distribution. For all of the cases we will deal with, it will be obvious how to get IID samples. Usually, they were generated for us—i.e. somebody flipped the coin, etc.\n\nNow assume you take N IID samples, and average them. The weak law of\n\n[Direct Result]: _Equm.gif)\n\nNow\n\n![\n$$\\\\displaystyle\\\\begin{array}{rcl} \\\\mathbb{E}\\\\left \\[\\(X^{\\(N\\)}\\)^{2}\\\\right \\]& =& \\\\frac{N\\\\mathbb{E}\\\\left \\[\\(X^{\\(1\\)}\\)^{2}\\\\right \\] + N\\(N - 1\\)\\\\mathbb{E}\\\\left \\[X_{ 1}X_{2}\\\\right \\]} {N^{2}} {}\\\\\\\\ & =& \\\\frac{\\\\mathbb{E}\\\\left \\[\\(X^{\\(1\\)}\\)^{2}\\\\right \\] + \\(N - 1\\)\\\\mathbb{E}\\\\left \\[X_{1}X_{2}\\\\right \\]} {N} {}\\\\\\\\ & =& \\\\frac{\\(\\\\mathsf{popsd}\\\\left \\(\\\\left \\\\{X\\\\right \\\\}\\\\right \\)^{2} + \\\\mathsf{popmean}\\\\left \\(\\\\left \\\\{X\\\\right \\\\}\\\\right \\)^{2}\\) + \\(N - 1\\)\\\\mathsf{popmean}\\\\left \\(\\\\left \\\\{X\\\\right \\\\}\\\\right \\)^{2}} {N} {}\\\\\\\\ & =& \\\\frac{\\\\mathsf{popsd}\\\\left \\(\\\\left \\\\{X\\\\right \\\\}\\\\right \\)^{2}} {N} + \\\\mathsf{popmean}\\\\left \\(\\\\left \\\\{X\\\\right \\\\}\\\\right \\)^{2} {}\\\\\\\\ \\\\end{array}$$\n](A442674_1_En_6_Chapter_Equ2.gif)\n\nso we have\n\n![\n$$\\\\displaystyle\\\\begin{array}{rcl} \\\\mathsf{var}\\\\left \\[X^{\\(N\\)}\\\\right \\]& =& \\\\mathbb{E}\\\\left \\[\\(X^{\\(N\\)}\\)^{2}\\\\right \\] - \\\\mathbb{E}\\\\left \\[X^{\\(N\\)}\\\\right \\]^{2} {}\\\\\\\\ & =& \\\\frac{\\\\mathsf{popsd}\\\\left \\(\\\\left \\\\{X\\\\right \\\\}\\\\right \\)^{2}} {N} + \\\\mathsf{popmean}\\\\left \\(\\\\left \\\\{X\\\\right \\\\}\\\\right \\)^{2} -\\\\mathsf{popmean}\\\\left \\(\\\\left \\\\{X\\\\right \\\\}\\\\right \\)^{2} {}\\\\\\\\ & =& \\\\frac{\\\\mathsf{popsd}\\\\left \\(\\\\left \\\\{X\\\\right \\\\}\\\\right \\)^{2}} {N}. {}\\\\\\\\ \\\\end{array}$$\n](A442674_1_En_6_Chapter_Equ3.gif)\n\nThis is a very useful result which is well worth remembering together with our facts on the sample mean, so we'll put them in a box together.\n\nUseful Facts 6.2 (Expressions for Mean and Variance of the Sample Mean)\n\nThe sample mean is a random variable. Write X (N) for the mean of N samples. We have that:\n\n![\n$$\\\\displaystyle\\\\begin{array}{rcl} \\\\mathbb{E}\\\\left \\[X^{\\(N\\)}\\\\right \\]& =& \\\\mathsf{popmean}\\\\left \\(\\\\left \\\\{X\\\\right \\\\}\\\\right \\) {}\\\\\\\\ \\\\mathsf{var}\\\\left \\[X^{\\(N\\)}\\\\right \\]& =& \\\\frac{\\\\mathsf{popsd}\\\\left \\(\\\\left \\\\{X\\\\right \\\\}\\\\right \\)^{2}} {N} {}\\\\\\\\ \\\\mathsf{std}\\\\left \\(X^{\\(N\\)}\\\\right \\)& =& \\\\frac{\\\\mathsf{popsd}\\\\left \\(\\\\left \\\\{X\\\\right \\\\}\\\\right \\)} {\\\\sqrt{N}}{}\\\\\\\\ && {}\\\\\\\\ \\\\end{array}$$\n](A442674_1_En_6_Chapter_Equ4.gif)\n\nThe consequence is this: If you draw N samples, the standard deviation of your estimate of the mean is\n\n![\n$$\\\\displaystyle{\\\\frac{\\\\mathsf{popsd}\\\\left \\(\\\\left \\\\{X\\\\right \\\\}\\\\right \\)} {\\\\sqrt{N}} }$$\n](A442674_1_En_6_Chapter_Equn.gif)\n\nwhich means that (a) the more samples you draw, the better your estimate becomes and (b) the estimate improves rather slowly—for example, to halve the standard deviation in your estimate, you need to draw four times as many samples.\n\n### 6.1.3 When The Urn Model Works\n\nIn our model, there was a population of N p data items x i , and we saw N of them, chosen at random. In particular, each choice was fair (in the sense that each data item had the same probability of being chosen) and independent. These assumptions are very important for our analysis to apply. If our data does not have these properties, bad things can happen. For example, assume we wish to estimate the percentage of the population that has beards. This is a mean (the data items take the value 1 for a person with a beard, and 0 without a beard). If we select people according to our model, then ask them whether they have a beard, then our estimate of the percentage of beards should behave as above.\n\nThe first thing that should strike you is that it isn't at all easy to select people according to this model. For example, we might select phone numbers at random, then call and ask the first person to answer the phone whether they have a beard; but many children won't"
      ],
      "latency_s": 6.35,
      "rag_type": "literag",
      "dominio": "LiteRAG_Bench_01",
      "titulo": "",
      "error": ""
    },
    {
      "question": "Which mathematical inequality provides an upper bound for the probability of a random variable deviating from its mean?",
      "ground_truth": "Chebyshev's inequality",
      "answer": "Chebyshev's inequality provides an upper bound for the probability of a random variable deviating from its mean.\n\nThe inequality is stated as:\n$$P\\(\\\\left \\\\{\\\\vert X - \\\\mathbb{E}\\\\left \\[X\\\\right \\]\\\\vert \\\\geq a\\\\right \\\\}\\) \\\\leq \\\\frac{\\\\mathsf{var}\\\\left \\[X\\\\right \\]} {a^{2}}.$$\nThis can also be seen in the form:\n$$P\\(\\\\left \\\\{\\\\vert X - \\\\mathbb{E}\\\\left \\[X\\\\right \\]\\\\vert \\\\geq k\\\\sigma \\\\right \\\\}\\) \\\\leq \\\\frac{1} {k^{2}}.$$",
      "contexts": [
        "## Direct Evidence (Source Text)\n[Direct Result]: 674_1_En_4_Chapter_Equak.gif)\n\nfor the relevant indicator function.\n\nI used a small x in the definition, because this is a function; the argument doesn't need to be a random variable. You should think about an indicator function as testing the value of its argument to tell whether it lies in the event or not, and reporting 1 or 0 accordingly. For example,\n\n![\n$$\\\\displaystyle{\\\\mathbb{I}_{\\\\left \\[\\\\left \\\\{\\\\vert x\\\\vert \\\\right \\\\}\\\\leq a\\\\right \\]}\\(x\\) = \\\\left \\\\{\\\\begin{array}{cc} 1&\\\\mbox{ if } - a <x <a\\\\\\\\ 0 & \\\\mbox{ otherwise} \\\\end{array} \\\\right.}$$\n](A442674_1_En_4_Chapter_Equal.gif)\n\nIndicator functions have one useful property.\n\n![\n$$\\\\displaystyle{\\\\mathbb{E}_{P}\\\\left \\[\\\\mathbb{I}_{\\\\left \\[\\\\mathcal{E}\\\\right \\]}\\\\right \\] = P\\(\\\\mathcal{E}\\)}$$\n](A442674_1_En_4_Chapter_Equam.gif)\n\nwhich you can establish by checking the definition of expectations.\n\nProposition\n\nMarkov's inequality: for X a random variable, a > 0,\n\n![\n$$\\\\displaystyle{P\\(\\\\left \\\\{\\\\mid \\\\!\\\\!X\\\\!\\\\!\\\\mid \\\\geq a\\\\right \\\\}\\) \\\\leq \\\\frac{\\\\mathbb{E}\\\\left \\[\\\\mid \\\\!\\\\!X\\\\!\\\\!\\\\mid \\\\right \\]} {a}.}$$\n](A442674_1_En_4_Chapter_Equan.gif)\n\nProof\n\n(from Wikipedia). Notice that, for a > 0,\n\n![\n$$\\\\displaystyle{a\\\\mathbb{I}_{\\\\left \\[\\\\left \\\\{\\\\vert X\\\\vert \\\\geq a\\\\right \\\\}\\\\right \\]}\\(X\\) \\\\leq \\\\vert X\\\\vert }$$\n](A442674_1_En_4_Chapter_Equao.gif)\n\n(because if | X | ≥ a, the LHS is a; otherwise it is zero). Now we have\n\n![\n$$\\\\displaystyle{\\\\mathbb{E}\\\\left \\[a\\\\mathbb{I}_{\\\\left \\[\\\\left \\\\{\\\\vert X\\\\vert \\\\geq a\\\\right \\\\}\\\\right \\]}\\\\right \\] \\\\leq \\\\mathbb{E}\\\\left \\[\\\\vert X\\\\vert \\\\right \\]}$$\n](A442674_1_En_4_Chapter_Equap.gif)\n\nbut, because expectations are linear, we have\n\n![\n$$\\\\displaystyle{\\\\mathbb{E}\\\\left \\[a\\\\mathbb{I}_{\\\\left \\[\\\\left \\\\{\\\\vert X\\\\vert \\\\geq a\\\\right \\\\}\\\\right \\]}\\\\right \\]=a\\\\mathbb{E}\\\\left \\[\\\\mathbb{I}_{\\\\left \\[\\\\left \\\\{\\\\vert X\\\\vert \\\\geq a\\\\right \\\\}\\\\right \\]}\\\\right \\]=aP\\(\\\\left \\\\{\\\\vert X\\\\vert \\\\geq a\\\\right \\\\}\\)}$$\n](A442674_1_En_4_Chapter_Equaq.gif)\n\nand so we have\n\n![\n$$\\\\displaystyle{aP\\(\\\\left \\\\{\\\\vert X\\\\vert \\\\geq a\\\\right \\\\}\\) \\\\leq \\\\mathbb{E}\\\\left \\[\\\\vert X\\\\vert \\\\right \\]}$$\n](A442674_1_En_4_Chapter_Equar.gif)\n\nand we get the inequality by division, which we can do because a > 0.\n\nProposition\n\nChebyshev's inequality: for X a random variable, a > 0,\n\n![\n$$\\\\displaystyle{P\\(\\\\left \\\\{\\\\vert X - \\\\mathbb{E}\\\\left \\[X\\\\right \\]\\\\vert \\\\geq a\\\\right \\\\}\\) \\\\leq \\\\frac{\\\\mathsf{var}\\\\left \\[X\\\\right \\]} {a^{2}}.}$$\n](A442674_1_En_4_Chapter_Equas.gif)\n\nProof\n\nWrite U for the random variable ![\n$$\\(X - \\\\mathbb{E}\\\\left \\[X\\\\right \\]\\)^{2}$$\n](A442674_1_En_4_Chapter_IEq72.gif). Markov's inequality gives us\n\n![\n$$\\\\displaystyle{P\\(\\\\left \\\\{\\\\vert U\\\\vert \\\\geq w\\\\right \\\\}\\) \\\\leq \\\\frac{\\\\mathbb{E}\\\\left \\[\\\\vert U\\\\vert \\\\right \\]} {w} }$$\n](A442674_1_En_4_Chapter_Equat.gif)\n\nNow notice that, if w = a 2,\n\n![\n$$\\\\displaystyle{P\\(\\\\left \\\\{\\\\vert U\\\\vert \\\\geq w\\\\right \\\\}\\) = P\\(\\\\left \\\\{\\\\vert X - \\\\mathbb{E}\\\\left \\[X\\\\right \\]\\\\vert \\\\geq a\\\\right \\\\}\\)}$$\n](A442674_1_En_4_Chapter_Equau.gif)\n\nso we have\n\n![\n$$\\\\displaystyle{\\\\begin{array}{rl} P\\(\\\\left \\\\{\\\\vert U\\\\vert \\\\geq w\\\\right \\\\}\\)& = P\\(\\\\left \\\\{\\\\vert X - \\\\mathbb{E}\\\\left \\[X\\\\right \\\n\n[Direct Result]: _4_Chapter_Equbo.gif)\n\n  3. (c)\n\nChoose some function f. Write {f} for the dataset whose i'th item is f(x i ). Write F for the random variable f(X). Show that\n\n![\n$$\\\\displaystyle{\\\\mathsf{mean}\\\\left \\(\\\\left \\\\{f\\\\right \\\\}\\\\right \\) = \\\\mathbb{E}\\\\left \\[F\\\\right \\] = \\\\mathbb{E}_{P\\(X\\)}\\\\left \\[f\\\\right \\].}$$\n](A442674_1_En_4_Chapter_Equbp.gif)\n\nMarkov and Chebyshev Inequalities\n\n4.16 The random variable X takes the values − 2, − 1, 0, 1, 2, but has an unknown probability distribution. You know that ![\n$$\\\\mathbb{E}\\\\left \\[\\\\mid \\\\!\\\\mid \\\\!\\\\!X\\\\!\\\\!\\\\mid \\\\!\\\\mid \\\\right \\] = 0.2$$\n](A442674_1_En_4_Chapter_IEq88.gif). Use Markov's inequality to give a lower bound on P({X = 0}). Hint: Notice that P({X = 0}) = 1 − P({∣​∣​​X​​∣​∣ = 1}) − P({∣​∣​​X​​∣​∣} = 2).\n\n4.17 The random variable X takes the values 1, 2, 3, 4, 5, but has unknown probability distribution. You know that ![\n$$\\\\mathbb{E}\\\\left \\[X\\\\right \\] = 2$$\n](A442674_1_En_4_Chapter_IEq89.gif) and ![\n$$\\\\mathsf{var}\\\\left \\(\\\\left \\\\{X\\\\right \\\\}\\\\right \\) = 0.01$$\n](A442674_1_En_4_Chapter_IEq90.gif). Use Chebyshev's inequality to give a lower bound on P({X = 2}).\n\n4.18 You have a biased random number generator. This generator produces a random number with mean value − 1, and standard deviation 0.5. Write ![\n$$\\\\mathcal{A}$$\n](A442674_1_En_4_Chapter_IEq91.gif) for the event that the number generator produces a non-negative number. Use Chebyshev's inequality to bound ![\n$$P\\(\\\\mathcal{A}\\)$$\n](A442674_1_En_4_Chapter_IEq92.gif).\n\n4.19 You observe a random number generator. You know that it can produce the values − 2, −1, 0, 1, or 2. You are told that it has been adjusted so that: (1) the mean value it produces is zero and; (2) the standard deviation of the numbers it produces is 1.\n\n  1. (a)\n\nWrite ![\n$$\\\\mathcal{A}$$\n](A442674_1_En_4_Chapter_IEq93.gif) for the event that the number generator produces a number that is not 0. Use Chebyshev's inequality to bound ![\n$$P\\(\\\\mathcal{A}\\)$$\n](A442674_1_En_4_Chapter_IEq94.gif).\n\n  2. (b)\n\nWrite ![\n$$\\\\mathcal{B}$$\n](A442674_1_En_4_Chapter_IEq95.gif) for the event that the number generator produces − 2 or 2. Use Chebyshev's inequality to bound ![\n$$P\\(\\\\mathcal{B}\\)$$\n](A442674_1_En_4_Chapter_IEq96.gif).\n\nUsing Expectations\n\n4.20 Two players P1 and P2 agree to play the following game. Each puts up a stake of 1 unit. They will play seven rounds, where each round involves flipping a fair coin. If the coin comes up H, P1 wins the round, otherwise P2 wins. The first player to win four rounds gets both stakes. After four rounds, P1 has won three rounds and P2 has won one round, but they have to stop. What is the fairest way to divide the stakes?\n\n4.21 Imagine we have a game with two players, who are playing for a stake. There are no draws, the winner gets the whole stake, and the loser gets nothing. The game must end early. We decide to give each player the expected value of the game for that player, from that state. Show that the expected values add up to the value of the stake (i.e. there won't be too little or too much money in the stake.\n\nProgramming Exercises\n\n4.22 An airline company runs a flight that has six seats. Each passenger who buys a ticket has a probability p of turning up for the flight. These events are independent.\n\n  1. (a)\n\nThe airline sells six tickets. What is the expected number of passengers, if p = 0. 9?\n\n  2. (b)\n\nHow many tickets should the airline sell to ensure that the expected number of passengers is greater than six, if p = 0. 7? Hint: The easiest way to do this is to write a quick program that computes the expected value of passengers that turn up for each the number of tickets sold, then search the number of tickets sold.\n\n4.23 An airline company runs a flight that has 10 seats. Each passenger who buys a ticket has a probability\n\n[Direct Result]: to these data items as independent identically distributed samples of P(X); for short, iid samples or even just samples. It's worth knowing that it can be a difficult computational problem to get IID samples from some given probability distribution. For all of the cases we will deal with, it will be obvious how to get IID samples. Usually, they were generated for us—i.e. somebody flipped the coin, etc.\n\nNow assume you take N IID samples, and average them. The weak law of large numbers states that, as N gets larger, this average is an increasingly good estimate of ![\n$$\\\\mathbb{E}\\\\left \\[X\\\\right \\]$$\n](A442674_1_En_4_Chapter_IEq69.gif). This fact allows us estimate expectations (and so probabilities) by simulation. Furthermore, it will allow us to make strong statements about how repeated games with random outcomes will behave. Finally, it will allow us to build a theory of decision making.\n\n### 4.3.2 Two Inequalities\n\nTo go further, we need two useful inequalities. Consider\n\n![\n$$\\\\displaystyle{\\\\mathbb{E}\\\\left \\[\\\\mid \\\\!\\\\!X\\\\!\\\\!\\\\mid \\\\right \\] =\\\\sum _{x\\\\in D}\\\\mid \\\\!\\\\!x\\\\!\\\\!\\\\mid P\\(\\\\{X = x\\\\}\\).}$$\n](A442674_1_En_4_Chapter_Equag.gif)\n\nNow notice that all the terms in the sum are non-negative. Then the only way to have a small value of ![\n$$\\\\mathbb{E}\\\\left \\[\\\\mid \\\\!\\\\!X\\\\!\\\\!\\\\mid \\\\right \\]$$\n](A442674_1_En_4_Chapter_IEq70.gif) is to be sure that, when ∣​​x​​∣ is large, P({X = x}) is small. It turns out to be possible (and useful!) to be more crisp about how quickly P({X = x}) falls as ∣​​x​​∣ grows, resulting in Markov's inequality (which I'll prove below)\n\nDefinition 4.16 (Markov's Inequality)\n\nMarkov's inequality is\n\n![\n$$\\\\displaystyle{P\\(\\\\left \\\\{\\\\mid \\\\!\\\\!X\\\\!\\\\!\\\\mid \\\\geq a\\\\right \\\\}\\) \\\\leq \\\\frac{\\\\mathbb{E}\\\\left \\[\\\\mid \\\\!\\\\!X\\\\!\\\\!\\\\mid \\\\right \\]} {a}.}$$\n](A442674_1_En_4_Chapter_Equah.gif)\n\nNotice that we've seen something like this before (the result about standard deviation in Sect. 1.​3.​2 has this form). The reason this is worth proving is that it leads to a second result, and that gives us the weak law of large numbers. It should seem clear that the probability of a random variable taking a particular value must fall off rather fast as that value moves away from the mean, in units scaled to the standard deviation. This is because values of a random variable that are many standard deviations above the mean must have low probability, otherwise the values would occur more often and so the standard deviation would be bigger. This result is Chebyshev's inequality, which I shall also prove below.\n\nDefinition 4.17 (Chebyshev's Inequality)\n\nChebyshev's inequality is\n\n![\n$$\\\\displaystyle{P\\(\\\\left \\\\{\\\\vert X - \\\\mathbb{E}\\\\left \\[X\\\\right \\]\\\\vert \\\\geq a\\\\right \\\\}\\) \\\\leq \\\\frac{\\\\mathsf{var}\\\\left \\[X\\\\right \\]} {a^{2}}.}$$\n](A442674_1_En_4_Chapter_Equai.gif)\n\nIt is common to see this in another form, obtained by writing σ for the standard deviation of X, substituting kσ for a, and rearranging\n\n![\n$$\\\\displaystyle{P\\(\\\\left \\\\{\\\\vert X - \\\\mathbb{E}\\\\left \\[X\\\\right \\]\\\\vert \\\\geq k\\\\sigma \\\\right \\\\}\\) \\\\leq \\\\frac{1} {k^{2}}}$$\n](A442674_1_En_4_Chapter_Equaj.gif)\n\nWe care about Chebyshev's inequality because it gives us the weak law of large numbers.\n\n### 4.3.3 Proving the Inequalities\n\nAn indicator function is a function that is one when some condition is true, and zero otherwise. The reason indicator functions are useful is that their expected values have interesting properties.\n\nDefinition 4.18 (Indicator Functions)\n\nAn indicator function for an event is a function that takes the value zero for values of x where the event does not occur, and one where the event occurs. For the event ![\n$$\\\\mathcal{E}$$\n](A442674_1_En_4_Chapter_IEq71.gif), we write\n\n![\n$$\\\\displaystyle{\\\\mathbb{I}_{\\\\left \\[\\\\mathcal{E}\\\\right \\]}\\(x\\)}$$\n](A442674_1_En_4_Chapter_Equak.gif)\n\nfor the relevant indicator function.\n\nI used a small x in the definition, because this is a function; the argument doesn't need to be a random variable. You should think about an indicator function as testing the value of its argument to tell whether it lies in the event or not, and reporting 1 or 0 accordingly. For example,\n\n![\n$$\\\\displaystyle{\\\\mathbb{I}_{\\\\left \\[\\\\\n\n[Direct Result]: E}\\\\left \\[X\\\\right \\]\\\\vert \\\\geq a\\\\right \\\\}\\)}$$\n](A442674_1_En_4_Chapter_Equau.gif)\n\nso we have\n\n![\n$$\\\\displaystyle{\\\\begin{array}{rl} P\\(\\\\left \\\\{\\\\vert U\\\\vert \\\\geq w\\\\right \\\\}\\)& = P\\(\\\\left \\\\{\\\\vert X - \\\\mathbb{E}\\\\left \\[X\\\\right \\]\\\\vert \\\\geq a\\\\right \\\\}\\) \\\\\\\\ & \\\\leq \\\\frac{\\\\mathbb{E}\\\\left \\[\\\\vert U\\\\vert \\\\right \\]} {w} = \\\\frac{\\\\mathsf{var}\\\\left \\[X\\\\right \\]} {a^{2}}\\\\end{array} }$$\n](A442674_1_En_4_Chapter_Equav.gif)\n\n### 4.3.4 The Weak Law of Large Numbers\n\nAssume we have a set of N IID samples x i of a probability distribution P(X). Write\n\n![\n$$\\\\displaystyle{X_{N} = \\\\frac{\\\\sum _{i=1}^{N}x_{i}} {N}.}$$\n](A442674_1_En_4_Chapter_Equaw.gif)\n\nNow X N is a random variable (the x i are IID samples, and for a different set of samples you will get a different, random, X N ). Notice that P(X = x 1, X = x 2,..., X = x n ) = P(X = x 1)P(X = x 2)...P(X = x n ), because the samples are independent and each is a sample of P(X). This means that\n\n![\n$$\\\\displaystyle{\\\\mathbb{E}\\\\left \\[X_{N}\\\\right \\] = \\\\mathbb{E}\\\\left \\[X\\\\right \\]}$$\n](A442674_1_En_4_Chapter_Equax.gif)\n\nbecause\n\n![\n$$\\\\displaystyle{\\\\mathbb{E}\\\\left \\[X_{N}\\\\right \\] = \\\\left \\( \\\\frac{1} {N}\\\\right \\)\\\\sum _{i=1}^{N}\\\\mathbb{E}\\\\left \\[X\\\\right \\].}$$\n](A442674_1_En_4_Chapter_Equay.gif)\n\nThis means that\n\n![\n$$\\\\displaystyle{\\\\frac{\\\\sum _{i=1}^{N}x_{i}} {N} }$$\n](A442674_1_En_4_Chapter_Equaz.gif)\n\nshould be an accurate estimate of ![\n$$\\\\mathbb{E}\\\\left \\[X\\\\right \\]$$\n](A442674_1_En_4_Chapter_IEq73.gif). The weak law of large numbers states that, as N gets large, the estimate becomes more accurate.\n\nDefinition 4.19 (Weak Law of Large Numbers)\n\nIf P(X) has finite variance, then for any positive number ε\n\n![\n$$\\\\displaystyle{\\\\lim _{N\\\\rightarrow \\\\infty }P\\(\\\\{\\\\mid \\\\!\\\\!X_{N} - \\\\mathbb{E}\\\\left \\[X\\\\right \\]\\\\!\\\\!\\\\mid \\\\geq \\\\epsilon \\\\}\\) = 0.}$$\n](A442674_1_En_4_Chapter_Equba.gif)\n\nEquivalently, we have\n\n![\n$$\\\\displaystyle{\\\\lim _{N\\\\rightarrow \\\\infty }P\\(\\\\{\\\\mid \\\\!\\\\!X_{N} - \\\\mathbb{E}\\\\left \\[X\\\\right \\]\\\\!\\\\!\\\\mid <\\\\epsilon \\\\}\\) = 1.}$$\n](A442674_1_En_4_Chapter_Equbb.gif)\n\nProposition\n\nWeak law of large numbers\n\n![\n$$\\\\displaystyle{\\\\lim _{N\\\\rightarrow \\\\infty }P\\(\\\\{\\\\mid \\\\!\\\\!X_{N} - \\\\mathbb{E}\\\\left \\[X\\\\right \\]\\\\!\\\\!\\\\mid \\\\geq \\\\epsilon \\\\}\\) = 0.}$$\n](A442674_1_En_4_Chapter_Equbc.gif)\n\nProof\n\nWrite ![\n$$\\\\mathsf{var}\\\\left \\(\\\\left \\\\{X\\\\right \\\\}\\\\right \\) =\\\\sigma ^{2}$$\n](A442674_1_En_4_Chapter_IEq74.gif). Choose ε > 0. Now we have that\n\n![\n$$\\\\displaystyle\\\\begin{array}{rcl} \\\\mathsf{var}\\\\left \\(\\\\left \\\\{X_{N}\\\\right \\\\}\\\\right \\)& =& \\\\mathsf{var}\\\\left \\(\\\\left \\\\{\\\\frac{\\\\sum _{i=1}^{N}x_{i}} {N} \\\\right \\\\}\\\\right \\) {}\\\\\\\\ & =& \\( \\\\frac{1} {N^{2}}\\)\\\\mathsf{var}\\\\left \\(\\\\left \\\\{\\\\sum _{i=1}^{N}x_{ i}\\\\right \\\\}\\\\right \\) {}\\\\\\\\ & =& \\( \\\\frac{1} {N^{2}}\\)\\(N\\\\sigma ^{2}\\) {}\\\\\\\\ & & ~~~~~~\\\\mbox{ the }x_{i}\\\\mbox{ are independent} {}\\\\\\\\ & =& \\\\frac{\\\\sigma ^{2}} {N} {}\\\\\\\\ \\\\end{array}$$\n](A442674_1_En_4_Chapter_Equ6.gif)\n\nand that\n\n![\n$$\\\\displaystyle{\n\n[Direct Result]: i }^{2 }} {N}} }$$\n](A442674_1_En_1_Chapter_Equj.gif)\n\nwe have that, for this rather specially constructed dataset,\n\n![\n$$\\\\displaystyle{\\\\sigma = \\\\sqrt{\\\\frac{Nrk^{2 } \\\\sigma ^{2 } } {N}} }$$\n](A442674_1_En_1_Chapter_Equk.gif)\n\nso that\n\n![\n$$\\\\displaystyle{r = \\\\frac{1} {k^{2}}.}$$\n](A442674_1_En_1_Chapter_Equl.gif)\n\nWe constructed the dataset so that r would be as large as possible, so\n\n![\n$$\\\\displaystyle{r \\\\leq \\\\frac{1} {k^{2}}}$$\n](A442674_1_En_1_Chapter_Equm.gif)\n\nfor any kind of data at all.\n\nThe bound in proof 1.2 is true for any kind of data. The crucial point about the standard deviation is that you won't see much data that lies many standard deviations from the mean, because you can't. This bound implies that, for example, at most 100% of any dataset could be one standard deviation away from the mean, 25% of any dataset is 2 standard deviations away from the mean and at most 11% of any dataset could be 3 standard deviations away from the mean. But the configuration of data that achieves this bound is very unusual. This means the bound tends to wildly overstate how much data is far from the mean for most practical datasets. Most data has more random structure, meaning that we expect to see very much less data far from the mean than the bound predicts. For example, much data can reasonably be modelled as coming from a normal distribution (a topic we'll go into later). For such data, we expect that about 68% of the data is within one standard deviation of the mean, 95% is within two standard deviations of the mean, and 99% is within three standard deviations of the mean, and the percentage of data that is within (say) ten standard deviations of the mean is essentially indistinguishable from 100%.\n\nProperty 1.3\n\nFor any dataset, there must be at least one data item that is at least one standard deviation away from the mean.\n\nProposition\n\n![\n$$\\\\displaystyle{\\(\\\\mathsf{std}\\\\left \\(\\\\left \\\\{x\\\\right \\\\}\\\\right \\)\\)^{2} \\\\leq \\\\max _{ i}\\(x_{i} -\\\\mathsf{mean}\\\\left \\(\\\\left \\\\{x\\\\right \\\\}\\\\right \\)\\)^{2}.}$$\n](A442674_1_En_1_Chapter_Equn.gif)\n\nProof\n\nYou can see this by looking at the expression for standard deviation. We have\n\n![\n$$\\\\displaystyle{\\\\mathsf{std}\\\\left \\(\\\\left \\\\{x\\\\right \\\\}\\\\right \\) = \\\\sqrt{ \\\\frac{1} {N}\\\\sum _{i=1}^{i=N}\\(x_{i} -\\\\mathsf{mean}\\\\left \\(\\\\left \\\\{x\\\\right \\\\}\\\\right \\)\\)^{2}}.}$$\n](A442674_1_En_1_Chapter_Equo.gif)\n\nNow, this means that\n\n![\n$$\\\\displaystyle{N\\(\\\\mathsf{std}\\\\left \\(\\\\left \\\\{x\\\\right \\\\}\\\\right \\)\\)^{2} =\\\\sum _{ i=1}^{i=N}\\(x_{ i} -\\\\mathsf{mean}\\\\left \\(\\\\left \\\\{x\\\\right \\\\}\\\\right \\)\\)^{2}.}$$\n](A442674_1_En_1_Chapter_Equp.gif)\n\nBut\n\n![\n$$\\\\displaystyle\\\\begin{array}{rcl} \\\\sum _{i=1}^{i=N}\\(x_{ i} -\\\\mathsf{mean}\\\\left \\(\\\\left \\\\{x\\\\right \\\\}\\\\right \\)\\)^{2} \\\\leq N\\\\max _{ i}\\(x_{i} -\\\\mathsf{mean}\\\\left \\(\\\\left \\\\{x\\\\right \\\\}\\\\right \\)\\)^{2}& & {}\\\\\\\\ \\\\end{array}$$\n](A442674_1_En_1_Chapter_Equ2.gif)\n\nso\n\n![\n$$\\\\displaystyle{\\(\\\\mathsf{std}\\\\left \\(\\\\left \\\\{x\\\\right \\\\}\\\\right \\)\\)^{2} \\\\leq \\\\max _{ i}\\(x_{i} -\\\\mathsf{mean}\\\\left \\(\\\\left \\\\{x\\\\right \\\\}\\\\right \\)\\)^{2}.}$$\n](A442674_1_En_1_Chapter_Equq.gif)\n\nThe properties proved in proof 1.2 and proof 1.3 mean that the standard deviation is quite informative. Very little data is many standard deviations away from the mean; similarly, at least some of the data should be one or more standard deviations away from the mean. So the standard deviation tells us how data points are scattered about the mean.\n\nThere is an ambiguity that comes up often here because two (very slightly) different numbers are called the standard deviation of a dataset. One—the one we use in this chapter—is an estimate of the scale of the data, as we describe it. The other differs from our expression very slightly; one computes\n\n![\n$$\\\\displaystyle{\\\\mathsf{stdunbiased}\\\\left \\(\\\\left \\\\{x\\\\right \\\\}\\\\right \\) = \\\\sqrt{\\\\frac{\\\\sum _{i } \\(x_{i } - \\\\mathsf{"
      ],
      "latency_s": 36.97,
      "rag_type": "literag",
      "dominio": "LiteRAG_Bench_01",
      "titulo": "",
      "error": ""
    },
    {
      "question": "In regular expressions, which metacharacter is used to represent the beginning of a line or string?",
      "ground_truth": "^",
      "answer": "The caret symbol (`^`) is used in regular expressions to represent the beginning of a line or string.",
      "contexts": [
        "## Direct Evidence (Source Text)\n[Direct Result]: is a regular expression which matches the null character at the beginning of a line.\"\n\n$ | \"c) _$_ is a regular expression which matches the null character before the character <nl> [newline] (usually at the end of a line).\"\n\n. | \"d) _._ is a regular expression which matches any character except <nl> [newline].\"\n\n[<string>] | \"e) \"[<string>]\" is a regular expression which matches any of the characters in the <string> and no others.\"\n\n[^<string>] | \"f) \"[^<string>] is a regular expression which matches any character but <nl> [newline] and the characters of the <string>.\"\n\n* | \"g) A regular expression followed by \"*\" is a regular expression which matches any number (including zero) of adjacent occurrences of the text matched by the regular expression.\"\n\n|\n\n\"h) Two adjacent regular expressions form a regular expression which matches adjacent occurrences of the text matched by the regular expressions.\"\n\n| | \"i) Two regular expressions separated by \"|\" form a regular expression which matches the text matched by either of the regular expressions.\"\n\n( ) | \"j) A regular expression in parentheses is a regular expression which matches the same text as the original regular expression. Parentheses are used to alter the order of evaluation implied by g), h), and i): _a(b|c)d_ will match _abd_ or _acd_ , while _ab|cd_ matches _ab_ or _cd_.\"\n\n{ } | \"k) If \"<regexp>\" is a regular expression, \"{<regexp>}x\" is a regular expression, where _x_ is any character. This regular expression matches the same things as <regexp>; it has certain side effects as explained under the Substitute command.\" [The Substitute command was formed _(.,.)S/ <regexp>/<string>/_ (see page 13 of the memo), similar to the way it is still used in programs like _sed_ and Perl.]\n\n\\E | \"l) If <rexname> is the name of a regular expression named by the E command (below), then \"\\E<rexname>\" is a regular expression which matches the same things as the regular expression specified in the E command. More discussion is presented under the E command.\" [The \\E command allowed you to name a regular expression and repeat its use by name.]\n\n|\n\n\"m) The null regular expression standing alone is equivalent to the last regular expression encountered. Initially the null regular expression is undefined; it also becomes undefined after an erroneous regular expression and after use of the E command.\"\n\n|\n\n\"n) Nothing else is a regular expression.\"\n\n|\n\n\"o) No regular expression will match text spread across more than one line.\"\n\n# Metacharacters\n\nThere are 14 metacharacters used in regular expressions, each with special meaning, as described in Table A-2. If you want to use one of these characters as a literal, you must precede it with a backslash to escape it. For example, you would escape the dollar sign like this `\\$`, or a backslash like this `\\\\`.\n\nTable A-2. Metacharacters in regular expressions\n\nMetacharacter| Name| Code Point| Purpose  \n---|---|---|---\n\n. | Full Stop | U+002E | Match any character\n\n\\ | Backslash | U+005C | Escape a character\n\n| | Vertical Bar | U+007C | Alternation (or)\n\n^ | Circumflex | U+005E | Beginning of a line anchor\n\n$ | Dollar Sign | U+0024 | End of a line anchor\n\n? | Question Mark | U+003F | Zero or one quantifier\n\n* | Asterisk | U+002A | Zero or more quantifier\n\n+ | Plus Sign | U+002B | One or more quantifier\n\n[ | Left Square Bracket | U+005B | Open character class\n\n] | Right Square Bracket | U+005D | Close character class\n\n{ | Left Curly Brace | U+007B | Open quantifier or block\n\n} | Right Curly Brace | 007D | Close quantifier or block\n\n( | Left Parenthesis | U+0028 | Open group\n\n) | Right Parenthesis | U+0029 | Close group\n\n# Character Shorthands\n\nTable A-3 lists character shorthands used in regular expressions.\n\nTable A-3. Character shorthands\n\nCharacter Shorthand| Description  \n---|---\n\n\\a | Alert\n\n\\b | Word boundary\n\n[\\b] | Backspace character\n\n\\B | Non-word boundary\n\n\\cx | Control character\n\n\\d | Digit character\n\n\\D | Non-digit character\n\n\\d _xxx_ | Decimal value for a character\n\n\\f | Form feed character\n\n\\r | Carriage return\n\n\\n | Newline character\n\n\\o _xxx_ | Octal value for a character\n\n\\s | Space character\n\n\\S | Non-space character\n\n\\t | Horizontal tab character\n\n\\v | Vertical tab character\n\n\\w | Word character\n\n\\W | Non-word character\n\n\\0 | Null character\n\n\\x _xx_ | Hexadecimal value for a character\n\n\\u _xxxx_ | Unicode value for a character\n\n# Whitespace\n\nTable A-4 is a list of character shorthands for whitespace.\n\nTable A-4. Whitespace characters\n\nCharacter Shorthand| Description  \n---|---\n\n\\f | Form feed\n\n\\h | Horizontal whitespace\n\n\\H | Not horizontal whitespace\n\n\\n | Newline\n\n\\r | Carriage return\n\n\\t | Horizontal tab\n\n\\v | Vertical whitespace\n\n\\V | Not vertical whitespace\n\n# Unicode Whitespace Characters\n\nWhitespace characters in Unicode are listed in Table A-5.\n\nTable A-5. Whitespace characters in Unicode\n\nAbbreviation or Nickname| Name| Unicode Code Point| Regex\n\n[Direct Result]: , Metacharacters\n\nas metacharacters, Metacharacters\nusage examples, Quoting Literals, Character Classes\nstrings and string literals, Matching a North American Phone Number, Matching a North American Phone Number, Quoting Literals–A Sample of Applications, Matching String Literals, The Beginning and End of a Line–The Beginning and End of a Line, Quoting a Group of Characters as Literals, Transforming Plain Text with sed–Handling the Lines of the Poem with sed, Transforming Plain Text with Perl–Using a File of Commands with Perl, Regular Expression Glossary\n\ndescribed, Matching a North American Phone Number, Regular Expression Glossary\nmatching, Matching String Literals\nmatching beginning and end of lines, The Beginning and End of a Line–The Beginning and End of a Line\nmatching phone numbers, Matching a North American Phone Number\nquoting, Quoting Literals–A Sample of Applications, Quoting a Group of Characters as Literals\ntransforming with Perl, Transforming Plain Text with Perl–Using a File of Commands with Perl\ntransforming with sed, Transforming Plain Text with sed–Handling the Lines of the Poem with sed\nStubblebine, Tony, Learning More\nsubpatterns, Subpatterns\nsubstitute (s) command, Using sed to Mark Up Text, Using Perl to Mark Up Text, Capturing Groups and Backreferences, Capturing Groups and Backreferences, Substitution with sed, Using a Command File with sed, Handling Roman Numerals with Perl\n\nwith Perl, Using Perl to Mark Up Text, Capturing Groups and Backreferences, Handling Roman Numerals with Perl\nwith sed, Using sed to Mark Up Text, Capturing Groups and Backreferences, Substitution with sed, Using a Command File with sed\n\n### T\n\n\\t (horizontal tab) character shorthand, Matching Word and Non-Word Characters, Character Shorthands\ntab characters, Matching Word and Non-Word Characters, Matching Word and Non-Word Characters, Character Shorthands, Character Shorthands\n\nhorizontal tab shorthand, Matching Word and Non-Word Characters, Character Shorthands\nvertical tab shorthand, Matching Word and Non-Word Characters, Character Shorthands\ntags, Adding Tags, Adding Tags with sed–Adding Tags with sed, Adding Tags with Perl, Matching Tags, Appending Tags–Using a Command File with sed\n\nadding with Perl, Adding Tags with Perl\nadding with sed, Adding Tags with sed–Adding Tags with sed\nappending, Appending Tags–Using a Command File with sed\ndescribed, Adding Tags\nmatching, Matching Tags\ntext, Transforming Plain Text with sed (see strings and string literals)\nTextMate editor, A Sample of Applications, Technical Notes\nThompson, Ken, Preface, What Is a Regular Expression?, Technical Notes, Technical Notes, Regular Expressions in QED, Technical Notes, Regular Expression Glossary, Regular Expression Glossary, Regular Expression Glossary\n\ned editor and, Regular Expression Glossary\ngrep and, Technical Notes, Regular Expression Glossary\nQED editor and, What Is a Regular Expression?, Technical Notes, Regular Expressions in QED, Technical Notes, Regular Expression Glossary\nregular expressions and, Preface\n\n### U\n\n\\u (Unicode) character shorthand, Matching Word and Non-Word Characters, Matching a Unicode Character, Character Shorthands\nu modifier (Perl), Alternation, Options/Modifiers\nunderscore (_), Matching Tags, Technical Notes\nUnicode, What Is a Regular Expression?, Matching Word and Non-Word Characters, Matching Unicode and Other Characters, Matching a Unicode Character–Matching Characters with Octal Numbers, Matching a Unicode Character, Matching Unicode Character Properties–Matching Unicode Character Properties, Character Shorthands, Unicode Whitespace Characters, Regular Expression Glossary, Regular Expression Glossary\n\ncharacter shorthand, Matching Word and Non-Word Characters, Matching a Unicode Character, Character Shorthands\ncode point assignments, What Is a Regular Expression?, Regular Expression Glossary\ndescribed, Matching Unicode and Other Characters, Regular Expression Glossary\nmatching character properties, Matching Unicode Character Properties–Matching Unicode Character Properties\nmatching characters, Matching a Unicode Character–Matching Characters with Octal Numbers\nwhitespace characters in, Unicode Whitespace Characters\nunion of character sets, Union and Difference\n[:upper:]] POSIX character class, [POSIX Character Classes, POSIX Character Classes\n\n### V\n\n\\v (vertical tab) character shorthand, Matching Word and Non-Word Characters, Character Shorthands\n\\v (vertical) whitespace character, Matching Whitespace, Whitespace\n\\V (non-vertical) whitespace character, Matching Whitespace, Whitespace\nvan Rossum, Guido, Python\nvertical (\\v) whitespace character, Matching Whitespace, Whitespace\nvertical bar (|), Quoting Literals, Regular Expressions in QED, Metacharacters\n\nas metacharacter, Metacharacters\nQED regex feature, Regular Expressions in QED\nusage example, Quoting Literals\nvertical tab (\\v) character shorthand, Matching Word and Non-Word Characters, Character Shorthands\nvi editor, Technical Notes, Regular Expression Glossary\nvim editor, Word and Non-word Boundaries, Using vim, Technical Notes, Regular Expression Glossary\n\nadditional information, Technical Notes\ndescribed, Regular Expression Glossary\nmatching Unicode characters, Using vim\nsearch command in, Word and Non-word Boundaries\nVoltaire (philosopher), Matching Unicode and Other Characters\n\n### W\n\n\\w (word) character shorthand, Matching Word and Non-Word Characters–Matching Word and Non-Word Characters, Matching Word and Non-Word Characters, Character Shorthands\n\ndescribed, Matching Word and Non-Word Characters, Character Shorthands\nmatching, Matching Word and Non-Word Characters–Matching Word and Non-Word Characters\n\\\n\n[Direct Result]: )\n\nThis book has a web page listing errata, examples, and any additional information. You can access this page at:\n\n<http://orei.ly/intro_regex>  \n---\n\nTo comment or to ask technical questions about this book, send email to:\n\nbookquestions@oreilly.com  \n---\n\nFor more information about O'Reilly books, courses, conferences, and news, see its website at <http://www.oreilly.com>.\n\nFind O'Reilly on Facebook: <http://facebook.com/oreilly>\n\nFollow O'Reilly on Twitter: <http://twitter.com/oreillymedia>\n\nWatch O'Reilly on YouTube: <http://www.youtube.com/oreillymedia>\n\n# Acknowledgments\n\nOnce again, I want to express appreciation to my editor at O'Reilly, Simon St. Laurent, a very patient man without whom this book would never have seen the light of day. Thank you to Seara Patterson Coburn and Roger Zauner for your helpful reviews. And, as always, I want to recognize the love of my life, Cristi, who is my _raison d'être_.\n\n# Chapter 1. What Is a Regular Expression?\n\nRegular expressions are specially encoded text strings used as patterns for matching sets of strings. They began to emerge in the 1940s as a way to describe regular languages, but they really began to show up in the programming world during the 1970s. The first place I could find them showing up was in the QED text editor written by Ken Thompson.\n\n> \"A regular expression is a pattern which specifies a set of strings of characters; it is said to match certain strings.\" —Ken Thompson\n\nRegular expressions later became an important part of the tool suite that emerged from the Unix operating system—the _ed_ , _sed_ and _vi_ ( _vim_ ) editors, _grep_ , _AWK_ , among others. But the ways in which regular expressions were implemented were not always so regular.\n\n### Note\n\nThis book takes an inductive approach; in other words, it moves from the specific to the general. So rather than an example after a treatise, you will often get the example first and then a short treatise following that. It's a learn-by-doing book.\n\nRegular expressions have a reputation for being gnarly, but that all depends on how you approach them. There is a natural progression from something as simple as this:\n\n    \\d\n\na _character shorthand_ that matches any digit from 0 to 9, to something a bit more complicated, like:\n\n    ^(\\(\\d{3}\\)|^\\d{3}[.-]?)?\\d{3}[.-]?\\d{4}$\n\nwhich is where we'll wind up at the end of this chapter: a fairly robust regular expression that matches a 10-digit, North American telephone number, with or without parentheses around the area code, or with or without hyphens or dots (periods) to separate the numbers. (The parentheses must be balanced, too; in other words, you can't just have one.)\n\n### Note\n\nChapter 10 shows you a slightly more sophisticated regular expression for a phone number, but the one above is sufficient for the purposes of this chapter.\n\nIf you don't get how that all works yet, don't worry: I'll explain the whole expression a little at a time in this chapter. If you will just follow the examples (and those throughout the book, for that matter), writing regular expressions will soon become second nature to you. Ready to find out for yourself?\n\nI at times represent Unicode characters in this book using their code point—a four-digit, hexadecimal (base 16) number. These code points are shown in the form _U+0000_. U+002E, for example, represents the code point for a full stop or period (.).\n\n# Getting Started with Regexpal\n\nFirst let me introduce you to the Regexpal website at <http://www.regexpal.com>. Open the site up in a browser, such as Google Chrome or Mozilla Firefox. You can see what the site looks like in Figure 1-1.\n\nFigure 1-1. Regexpal in the Google Chrome browser\n\nYou can see that there is a text area near the top, and a larger text area below that. The top text box is for entering regular expressions, and the bottom one holds the subject or target text. The target text is the text or set of strings that you want to match.\n\n### Note\n\nAt the end of this chapter and each following chapter, you'll find a \"Technical Notes\" section. These notes provide additional information about the technology discussed in the chapter and tell you where to get more information about that technology. Placing these notes at the end of the chapters helps keep the flow of the main text moving forward rather than stopping to discuss each detail along the way.\n\n# Matching a North American Phone Number\n\nNow we'll match a North American phone number with a regular expression. Type the phone number shown here into the lower section of Regexpal:\n\n    707-827-7019\n\nDo you recognize it? It's the number for O'Reilly Media.\n\nLet's match that number with a regular expression. There are lots of ways to do this, but to start out, simply enter the number itself in the upper section, exactly as it is written in the lower section (hold on now, don't sigh):\n\n    707-827-7019\n\nWhat you should see is the phone number you entered in the lower box highlighted from beginning to end in yellow. If that is what you see (as shown in Figure 1-2), then you are in business.\n\n### Note\n\nWhen I mention colors in this book, in relation to something you might see in an image or a screenshot, such as the highlighting in Reg\n\n## Entity Definitions\n**BEGINNING OF A LINE OR STRING**: The beginning of a line or string is a boundary that can be matched using the caret symbol in regular expressions.\n**BEGINNING OF A LINE**: Beginning of a Line is a concept related to regular expressions.\n\n## Community Context\n\n**Community 2**: The community is heavily centered around the R programming language, with numerous entities representing R packages, functions, and related tools. Key figures like Michalewicz et al., Rocha, Luke, and Cortez are associated with optimization and machine learning within the R ecosystem. The community also touches upon broader concepts like finance, business intelligence, and scientific computing, all of which leverage R's capabilities for data analysis and modeling. The relationships indicate a strong focus on statistical computing, data manipulation, and the application of various optimization and forecasting techniques.\n**Community 35**: This community is centered around the Perl programming language and its extensive use of regular expressions. Key entities include Perl itself, various tools and resources related to its use (like CPAN, Perldoc), and specific applications of regular expressions such as text transformation, matching patterns, and data manipulation. The community also encompasses related technologies and standards like XML, XSLT, and POSIX, highlighting a broad ecosystem of text processing and data transformation."
      ],
      "latency_s": 1.23,
      "rag_type": "literag",
      "dominio": "LiteRAG_Bench_01",
      "titulo": "",
      "error": ""
    },
    {
      "question": "What term describes a regex quantifier that matches as much text as possible?",
      "ground_truth": "Greedy",
      "answer": "The term that describes a regex quantifier that matches as much text as possible is **greedy match**.",
      "contexts": [
        "## Direct Evidence (Source Text)\n[Direct Result]: testing. First we'll use the Kleene star, named for the man credited as the inventor of regular expressions, Stephen Kleene. If you use the star or asterisk following a dot like this:\n\n    .*\n\nit would match, being greedy, all the characters (digits) in the subject text. As you know from earlier reading, `.*` matches any character zero or more times. All the digits in the lower box should be highlighted by changing color. Of the Kleene star, an early manual said:\n\n> A regular expression followed by \"*\" [Kleene star] is a regular expression which matches any number (including zero) of adjacent occurrences of the text matched by the regular expression.\n\nNow try:\n\n    9*\n\nand the row of nines near the bottom should be highlighted. Now:\n\n    9.*\n\nlights up the row of nines and the row of zeros below it. Because _Multiline_ is checked (at the bottom of the application window), the dot will match the newline character between the rows; normally, it would not.\n\nTo match one or more 9s, try:\n\n    9+\n\nHow is that different? You can't really tell because there are nine 9s in the subject text. The main difference is that + is looking for at least one 9, but `*` is looking for zero or more.\n\nTo match zero or one time (optional), use:\n\n    9?\n\nThis will match the first occurrence of 9 only. That 9 is considered optional, so because it does exist in the subject text, it is matched and highlighted. If you do this:\n\n    99?\n\nthen both the first and second 9 are matched.\n\nTable 7-1 lists the basic quantifiers and some of the possibilities that they have. These quantifiers are by default _greedy_ , meaning that they match as many characters as they possibly can on the first attempt.\n\nTable 7-1. Basic quantifiers\n\nSyntax| Description  \n---|---\n\n`?` | Zero or one (optional)\n\n+ | One or more\n\n`*` | Zero or more\n\n# Matching a Specific Number of Times\n\nWhen you use braces or squiggly brackets, you can match a pattern a specific number of times in a range. Unmodified, these are greedy quantifiers. For example:\n\n    7{1}\n\nwill match the first occurrence of 7. If you wanted to match one _or more_ occurrences of the number 7, all you have to do is add a comma:\n\n    7{1,}\n\nYou've probably realized that both:\n\n    7+\n\nand\n\n    7{1,}\n\nare essentially the same thing, and that:\n\n    7*\n\nand\n\n    7{0,}\n\nare likewise the same. In addition:\n\n    7?\n\nis the same as:\n\n    7{0,1}\n\nTo find a range of matches, that is, to match _m_ to _n_ times:\n\n    7{3,5}\n\nThis will match three, four, or five occurrences of 7.\n\nSo to review, the squiggly bracket or range syntax is the most flexible and precise quantifier. Table 7-2 summarizes these features.\n\nTable 7-2. Summary of range syntax\n\nSyntax| Description  \n---|---\n\n{ _n_ } | Match _n_ times exactly\n\n{ _n_ ,} | Match _n_ or more times\n\n{ _m,n_ } | Match _m_ to _n_ times\n\n{0,1} | Same as `?` (zero or one)\n\n{1,0} | Same as + (one or more)\n\n{0,} | Same as `*` (zero or more)\n\n# Lazy Quantifiers\n\nNow let's set aside greediness and get lazy. The easiest way for you to understand this is by seeing it in action. In Reggy (making sure _Match All_ is unchecked), try to match zero or one 5 using a single question mark (`?`):\n\n    5?\n\nThe first 5 is highlighted. Add an additional `?` to make the quantifier lazy:\n\n    5??\n\nNow it doesn't appear to match anything. The reason why is that the pattern is being lazy, that is, it's not even forced to match that first 5. By nature, the _lazy_ match matches as few characters as it can get away with. It's a slacker.\n\nTry this zero or more times:\n\n    5*?\n\nand it won't match anything either, because you gave it the option to match a minimum of zero times, and that's what it does.\n\nTry it again matching one or more times, à la lazy:\n\n    5+?\n\nAnd there you go. Lazy just got off the couch and matched one 5. That's all it had to do to keep its day job.\n\nThings get a bit more interesting as you apply _m,n_ matching. Try this:\n\n    5{2,5}?\n\nOnly two 5s are matched, not all five of them, as a greedy match would.\n\nTable 7-3 lists the lazy quantifiers. When is lazy matching useful? You can use lazy matching when you want to match the bare minimum of characters, not the maximum possible.\n\nTable 7-3. Lazy quantifiers\n\nSyntax| Description  \n---|---\n\n?? | Lazy zero or one (optional)\n\n+? | Lazy one or more\n\n*? | Lazy zero or more\n\n{ _n_ }? | Lazy _n_\n\n{ _n_ ,}? | Lazy _n_ or more\n\n{ _m,n_ }? | Lazy _m,n_\n\n# Possessive Quantifiers\n\nA possessive match is like a greedy match, it grabs as much\n\n[Direct Result]: .\n\natomic group\n\nA grouping that turns off backtracking when a regular expression inside `(?>...)` fails to match. _See also_ backtracking, groups.\n\nbackreference\n\nRefers to a previous regular expression captured with parentheses using a reference in the form of \\1, \\2, and so forth.\n\nbacktracking\n\nStepping back, character by character, through an attempted match to find a successful match. Used with a greedy match, but not a lazy or possessive match. Catastrophic backtracking occurs when a regex processor makes perhaps thousands of attempts to make a match and consumes a vast amount (read _most_ ) of the computing resources available. One way to avoid catastrophic backtracking is with atomic grouping. _See also_ atomic group, greedy match, lazy match, possessive match.\n\nbasic regular expressions\n\nAn early implementation of regular expressions that is less advanced and considered obsolete by most. Also called _BREs_. BREs required you to escape certain characters in order for them to function as metacharacters, such as braces (\\`{` and `}`\\\\). _See also_ extended regular expressions.\n\nbound\n\n _See_ quantifier.\n\nbracketed expression\n\nA regular expression given in square brackets; for example, _a-f]_ , that is, the range of lowercase letters a through f. _See also_ [character class.\n\nbranch\n\nA concatenation of pieces in a regular expression in POSIX.1 terminology. _See also_ POSIX.\n\nBREs\n\n _See_ basic regular expressions.\n\ncapturing group\n\n _See_ groups.\n\ncatastrophic backtracking\n\n _See_ backtracking.\n\ncharacter class\n\nUsually, a set of characters enclosed in square brackets; for example, _[a-bA-B0-9]_ is a character class for all upper- and lowercase characters plus digits in the ASCII or Low Basic Latin character set.\n\ncharacter escape\n\nA character preceded by a backward slash. Examples are \\t (horizontal tab), \\v (vertical tab), and \\f (form feed).\n\ncharacter set\n\n _See_ character class.\n\ncode point\n\n _See_ Unicode.\n\ncomposability\n\n\"A schema language (or indeed a programming language) provides a number of atomic objects and a number of methods of composition. The methods of composition can be used to combine atomic objects into compound objects which can in turn be composed into further compound objects. The composability of the language is the degree to which the various methods of composition can be applied uniformly to all the various objects of the language, both atomic and compound...Composability improves ease of learning and ease of use. Composability also tends to improve the ratio between complexity and power: for a given amount of complexity, a more composable language will be more powerful than a less composable one.\" From James Clark, \"The Design of RELAX NG,\" <http://www.thaiopensource.com/relaxng/design.html#section:5>.\n\ned\n\nThe Unix line editor created by Ken Thompson in 1971, which implemented regular expressions. It was a precursor to _sed_ and _vi_.\n\nEREs\n\n _See_ extended regular expressions.\n\nextended regular expressions\n\nExtended regular expressions or EREs added additional functionality to basic regular expressions or BREs, such as alternation (\\|) and quantifiers such as ? and +, which work with _egrep_ (extended grep). These new features were delineated in IEEE POSIX standard 1003.2-1992. You can use the _-E_ option with _grep_ (same as using _egrep_ ), which means that you want to use extended regular expressions rather than basic regular expressions. _See also_ alternation, basic regular expressions, grep.\n\nflag\n\n _Seemodifier_.\n\ngreedy match\n\nA greedy match consumes as much of a target string as possible, and then backtracks through the string to attempt to find a match. _See_ backtracking, lazy match, possessive match.\n\ngrep\n\nA Unix command-line utility for searching strings with regular expressions. Invented by Ken Thompson in 1973, _grep_ is said to have grown out of the _ed_ editor command `g/re/p` (global/regular expression/print). Superseded but not retired by _egrep_ (or _grep -E_ —which has additional metacharacters such as |, +, ?, (, and )— _grep_ uses basic regular expressions, whereas _grep -E_ or _egrep_ use extended regular expressions. _fgrep_ ( _grep -F_ ) searches files using literal strings and metacharacters like $, *, and | don't have special meaning. _See also_ basic regular expressions, extended regular expressions.\n\ngroups\n\nGroups combine regular expression atoms within a pair of parentheses, `( )`. In some applications, such as _grep_ or _sed_ (without _-E_), you must precede the parenthesis with a backslash, as in `\\)` or `\\(`. There are capturing groups and non-capturing groups. A capturing group stores the captured group in memory so that it can be reused while a non-capturing group does not. Atomic groups do not backtrack. _See also_ atomic group.\n\nhexadecimal\n\nA base 16 numbering system represented by the digits 0–9 and the letters A–F or a–f. For example, the base 10 number 15 is represented as F in hexadecimal, and 16 is 10.\n\nhold buffer\n\n _See_hold space.\n\nhold space\n\nUsed by _sed_ to store one or more lines for further processing. Also called the _hold buffer_. _See also_ pattern space, _sed_.\n\nlazy match\n\nA lazy match consumes a subject string one character at a time, attempting to find a match. It\n\n[Direct Result]: xxx`_\n\n  * How to match any Unicode character inside of _vim_ using `\\%` _`xxx`_ , `\\%X` _`xx`_ , `\\%u` _`xxxx`_ , or `\\%U` _`xxxx`_\n\n  * How to match characters in the range 0–255 using octal format with `\\000`\n\n  * How to use Unicode character properties with `\\p{` _`x`_`}`\n\n  * How to match control characters with `\\e` or `\\cH`\n\n  * More on how to use Perl on the command line (more Perl one-liners)\n\n# Technical Notes\n\n  * I entered control characters in _ascii.txt_ using _vim_ (<http://www.vim.org>). In _vim_ , you can use Ctrl+V followed by the appropriate control sequence for the character, such as Ctrl+C for the end-of-text character. I also used Ctrl+V followed by _x_ and the two-digit hexadecimal code for the character. You can also use digraphs to enter control codes; in _vim_ enter `:digraph` to see the possible codes. To enter a digraph, use Ctrl+K while in Insert mode, followed by a two-character digraph (for example, _NU_ for null).\n\n  * RegexHero (<http://regexhero.net/tester>) is a .NET regex implementation in a browser written by Steve Wortham. This one is for pay, but you can test it out for free, and if you like it, the prices are reasonable (you can buy it at a standard or a professional level).\n\n  *  _vim_ (<http://www.vim.org>) is an evolution of the _vi_ editor that was created by Bill Joy in 1976. The _vim_ editor was developed primarily by Bram Moolenaar. It seems archaic to the uninitiated, but as I've mentioned, it is incredibly powerful.\n\n  * The _ack_ tool (<http://betterthangrep.com>) is written in Perl. It acts like _grep_ and has many of its command line options, but it outperforms _grep_ in many ways. For example, it uses Perl regular expressions instead of basic regular expressions like _grep_ (without _-E_ ). For installation instructions, see <http://betterthangrep.com/install/>. I used the specific instructions under \"Install the ack executable.\" I didn't use _curl_ but just downloaded _ack_ with the link provided and then copied the script into _/usr/bin_ on both my Mac and a PC running Cygwin (<http://www.cygwin.com>) in Windows 7.\n\n# Chapter 7. Quantifiers\n\nYou have already seen some quantifiers at work earlier in this book, but here I'll talk about them in more detail.\n\nFor our example this time, we'll use a Mac desktop application called Reggy (Figure 7-1), as we did in Chapter 5. Uncheck _Match All_ at the bottom to start.\n\nIf you are not on a Mac, you can try these examples in one of the applications you've seen earlier in the book. Paste the right triangle of digits from the _triangle.txt_. The file is in the archive of examples.\n\nFigure 7-1. Reggy application\n\n# Greedy, Lazy, and Possessive\n\nI'm not talking about your teenager here. I'm talking about quantifiers. These adjectives may not sound like good character qualities, but they are interesting features of quantifiers that you need to understand if you want to use regular expressions with skill.\n\nQuantifiers are, by themselves, greedy. A greedy quantifier first tries to match the whole string. It grabs as much as it can, the whole input, trying to make a match. If the first attempt to match the whole string goes awry, it backs up one character and tries again. This is called _backtracking_. It keeps backing up one character at a time until it finds a match or runs out of characters to try. It also keeps track of what it is doing, so it puts the most load on resources compared with the next two approaches. It takes a mouthful, then spits back a little at a time, chewing on what it just ate. You get the idea.\n\nA lazy (sometimes called _reluctant_ ) quantifier takes a different tack. It starts at the beginning of the target, trying to find a match. It looks at the string one character at a time, trying to find what it is looking for. At last, it will attempt to match the whole string. To get a quantifier to be lazy, you have to append a question mark (`?`) to the regular quantifier. It chews one nibble at a time.\n\nA possessive quantifier grabs the whole target and then tries to find a match, but it makes only one attempt. It does not do any backtracking. A possessive quantifier appends a plus sign (+) to the regular quantifier. It doesn't chew; it just swallows, then wonders what it just ate. I'll demonstrate each of these in the pages that follow.\n\n# Matching with *, +, and ?\n\nIf you have the triangle of digits in Reggy, you can now begin testing. First we'll use the Kleene star, named for the man credited as the inventor of regular expressions, Stephen Kleene. If you use the star or asterisk following a dot like this:\n\n    .*\n\nit would match, being greedy, all the characters (digits) in the subject text. As you know from earlier reading, `.*` matches any character zero or more times. All the digits in the lower box should be highlighted by changing color. Of the Kleene star,\n\n[Direct Result]: 7-3. Lazy quantifiers\n\nSyntax| Description  \n---|---\n\n?? | Lazy zero or one (optional)\n\n+? | Lazy one or more\n\n*? | Lazy zero or more\n\n{ _n_ }? | Lazy _n_\n\n{ _n_ ,}? | Lazy _n_ or more\n\n{ _m,n_ }? | Lazy _m,n_\n\n# Possessive Quantifiers\n\nA possessive match is like a greedy match, it grabs as much as it can get away with. But unlike a greedy match: It does not backtrack. It does not give up anything it finds. It is selfish. That is why it is called _possessive_. Arms folded firmly, it doesn't give up any ground. But the good thing about possessive quantifiers is that they are faster, because they don't do any backtracking, and they also fail in a hurry.\n\n### Note\n\nThe truth is, you can hardly tell the difference between greedy, lazy, and possessive matches with the examples in this book. But as you gain more experience, and performance tuning becomes important, you'll want to be aware of these differences.\n\nTo make sense of this, first we'll try matching the zeroes with a leading zero, then with a trailing zero. In Reggy, make sure _Match All_ is checked, and enter this expression with a leading zero:\n\n    0.*+\n\nWhat happened? All the zeroes are highlighted. There was a match. The possessive match appears to do the same thing as a greedy match, with one subtle difference: There is no backtracking. You can now prove it. Enter this with a trailing zero:\n\n    .*+0\n\nNo match. The reason why is there was no backtracking. It gobbled up the entire input and never looked back. It wasted its inheritance with riotous living. It can't find the trailing zero. It doesn't know where to look. If you remove the plus sign, it would find all the zeroes as it goes back to a greedy match.\n\n    .*0\n\nYou might want to use a possessive quantifier when you are aware of what is in your text, you know where you will find matches. You don't care if it grabs with gusto. A possessive match can help you match with improved performance. Table 7-4 shows the possessive quantifiers.\n\nTable 7-4. Possessive quantifiers\n\nSyntax| Description  \n---|---\n\n?+ | Possessive zero or one (optional)\n\n````++ | Possessive one or more\n\n*+ | Possessive zero or more\n\n{ _n_ }+ | Possessive _n_\n\n{ _n_ ,}+ | Possessive _n_ or more\n\n{ _m,n_ }+ | Possessive _m,n_\n\nYou'll be introduced to lookarounds in the next chapter.\n\n# What You Learned in Chapter 7\n\n  * The differences between greedy, lazy, and possessive matching\n\n  * How to match one or more (+)\n\n  * How to match optionally (zero or one, `?`)\n\n  * How to match zero or one (`*`)\n\n  * How to use { _m,n_ } quantifiers\n\n  * How to use greedy, lazy (reluctant), and possessive quantifiers.\n\n# Technical Notes\n\nThe quote comes from Dennis Ritchie and Ken Thompson, _QED Text Editor_ (Murray Hill, NJ, Bell Labs, 1970) p. 3 (see <http://cm.bell-labs.com/cm/cs/who/dmr/qedman.pdf>).\n\n# Chapter 8. Lookarounds\n\nLookarounds are non-capturing groups that match patterns based on what they find either in front of or behind a pattern. Lookarounds are also considered _zero-width assertions_.\n\nLookarounds include:\n\n  * Positive lookaheads\n\n  * Negative lookaheads\n\n  * Positive lookbehinds\n\n  * Negative lookbehinds\n\nIn this chapter, I'll show you how each of these works. We'll start out using RegExr on the desktop and then move on to Perl and _ack_ ( _grep_ doesn't know about lookarounds). Our text is still Coleridge's well-worn poem.\n\n# Positive Lookaheads\n\nSuppose you want to find every occurrence of the word _ancyent_ that is followed by _marinere_ (I use the archaic spellings because that is what is found in the file). To do this, we could use a positive lookahead.\n\nFirst let's try it in RegExr desktop. The following case-insentitive pattern goes in the text box at the top:\n\n    (?i)ancyent (?=marinere)\n\n### Note\n\nYou can also specify case-insensitivity with RegExr by simply checking the box next to _ignoreCase_ , but both methods work.\n\nBecause you use the case-insensitive option (`?i`), you don't need to worry about what case you use in your pattern. You are looking for every line that has the word _ancyent_ followed hard by _marinere_. The results will be highlighted in the text area below the pattern area (see Figure 8-1); however, only the first part of the pattern will be highlighted ( _ancyent_ ), not the lookahead pattern ( _Marinere_ ).\n\nFigure 8-1. Positive lookahead in RegExr\n\nLet's now use Perl to do a positive lookahead. You can form the command like so:\n\n    perl -ne 'print if /(?i)ancyent (?=marinere)/' rime.txt\n\nand the output should look like this:\n\n    THE RIME OF THE ANCYENT MARINERE, IN SEVEN"
      ],
      "latency_s": 11.48,
      "rag_type": "literag",
      "dominio": "LiteRAG_Bench_01",
      "titulo": "",
      "error": ""
    },
    {
      "question": "In lambda calculus theory, what is the operation of substituting a parameter for an argument called?",
      "ground_truth": "Beta-reduction",
      "answer": "The operation of substituting a parameter for an argument in lambda calculus theory is called **substitution**.\n\nThe text explains this concept in the section \"1.2.5 Substitution\": \"When a substitution is applied to a term, each occurrence of a variable x1, ...,xn in the term is replaced by t1, ...,tn, respectively.\" It further illustrates this with an example: \"if we substitute the variable x by the term 2 *π, at some point we will need to substitute in the term sin (cos (sin x)) the variable x by the term 2 *π.\"",
      "contexts": [
        "## Direct Evidence (Source Text)\n[Direct Result]: is itself of sort s\".\n\nGiven a language—that is, a set of sorts and a set of symbols each with an associated arity—and a family, indexed by sorts, of infinite, pairwise disjoint, sets of variables, we can inductively define terms as follows:\n\n  * variables of sort s are terms of sort s,\n\n  * if f is a symbol of arity (( , ..., , s'1), ..., ( , ..., , s'n), s\"),  , ..., , ..., , ...,  are variables of sort  , ..., , ..., , ...,  and t1, ...,tn are terms of sort s'1, ..., s'n then f(  ... t1, ...,  ...  tn) is a term of sort s\".\n\n### 1.2.4 Free and Bound Variables\n\nThe set of variables of a term is defined by structural induction:\n\n  * Var(x) = {x},\n\n  * Var(f(  ... t1, ...,  ... tn)) = Var(t1) ∪ { , ..., } ∪ ⋅⋅⋅ ∪ Var(tn) ∪ { , ..., }.\n\nWe can also define the set of free variables of a term:\n\n  * FV(x) = {x},\n\n  * FV(f(  ... t1, ...,  ... tn)) = (FV(t1) ∖ { , ..., }) ∪ ⋅⋅⋅ ∪ (FV(tn) ∖ { , ..., })\n\nFor example, Var (fun x -> sin (cos (sin x))) = {x} and FV (fun x -> sin (cos (sin x))) = ∅.\n\nA term without free variables is said to be closed.\n\nThe height of a term is also defined by structural induction:\n\n  * Height(x) = 0,\n\n  * Height(f( ... t1,..., ... tn))=1\\+ max(Height(t1), ..., Height (tn)).\n\n### 1.2.5 Substitution\n\nThe first operation that we need to define is substitution: indeed, the rôle of variables is not only to be bound but also to be substituted. For example, when we apply the function fun x -> sin (cos (sin x)) to the term 2 *π, at some point we will need to substitute in the term sin (cos (sin x)) the variable x by the term 2 *π.\n\nA substitution is simply a mapping from variables to terms, with a finite domain. In other words, a substitution is a finite set of pairs where the first element is a variable and the second a term, and such that each variable occurs at most once as first element in a pair. We can also define a substitution as an association list—θ =t1/x1 ...tn/xn.\n\nWhen a substitution is applied to a term, each occurrence of a variable x1, ...,xn in the term is replaced by t1, ...,tn, respectively.\n\nOf course, this replacement only affects the free variables. For example, if we substitute the variable x by the term 2 in the term x + 3, we should obtain the term 2 + 3. However, if we substitute the variable x by the term 2 in the term fun x -> x which represents the identity function we should obtain the term fun x -> x and not fun x -> 2.\n\nThe first attempt to define the application of a substitution to a term is as follows:\n\n  * 〈θ〉xi =ti,\n\n  * 〈θ〉x = x if x is not in the domain of θ,\n\n  * 〈θ〉f( ... u1,..., ... un)=f( ...  , ...,  ...  )\n\nwhere we use the notation   for the restriction of the substitution θ to the set V ∖ {y1, ...,yk}, that is, the substitution where we have omitted all the pairs where the first element is one of the variables y1, ...,yk.\n\nThis definition is problematic, because substitutions could capture variables. For example, the term fun x -> (x + y) represents the function that adds y to its argument. If we substitute y by 4 in this term, we obtain the term fun x -> (x + 4) representing the function that adds 4 to its argument. If we substitute y by z, we get the term fun x -> (x + z) representing the function that adds z to its argument. But if we substitute y by x, we obtain the function fun x -> (x + x) which doubles its argument, instead of the function that adds x to its argument as expected. We can avoid this problem if we change the name of the bound variable: bound variables are dummies, their name does not matter. In other words, in the term fun x -> (x + y), we can replace the bound variable x by any other variable, except of course y. Similarly, when we substitute in the term u the variables x1, ...,xn by the terms t1, ...,tn, we can change the names of the bound variables in u to make sure that their names do not occur in x1, ...,xn, or in the variables of t1, ...,tn, or in the variables of u, to avoid capture.\n\nWe start by defining an equivalence relation on terms, by induction on the height of terms. This relation is called alphabetic equivalence—or α-equivalence—and it corresponds to variable renaming.\n\n  * x ∼ x,\n\n  * f(  ... t1, ...,  ... tn) ∼ f(  ...  t'1, ...,  ...  t'n) if for all i, and for any sequence of fresh variables z1, ...,  (that is\n\n[Direct Result]: 1930's, we write this function x ↦ sin (cos (sin x)) or λx sin (cos (sin x)), using the symbol ↦ or λ to bind the variable x. By indicating explicitly which variables are bound, we can distinguish the arguments of the function from potential parameters, and we also fix the order of the arguments.\n\nThe symbol ↦ appears to have been introduced by N. Bourbaki around 1930, and the symbol λ by A. Church around the same time. The notation λ is a simplified version of a previous notation   sin (cos (sin x)) used by A.N. Whitehead and B. Russell since the 1900's.\n\nThe definition f = x ↦ sin (cos (sin x)) is sometimes written f x = sin (cos (sin x)). The advantage of writing f = x ↦ sin (cos (sin x)) is that in this way we can distinguish two different operations: the construction of the function x ↦ sin (cos (sin x)) and the definition itself, which gives a name to an object previously constructed. It is often important, in computer science, to have notations that allow us to build objects without necessarily giving them a name.\n\nIn this book, we use the notation fun x -> sin (cos (sin x)) to specify this function.\n\nThe term fun x -> sin (cos (sin x)) specifies a function. However, its subterm sin x does not specify anything: it is not a real number and it is not a function, because it contains a free variable whose value we do not know.\n\nTo bind variables in terms, we need to extend the notion of term to include free variables, which will be bound later. This requires also new symbols, such as fun, which act as binders for the variables in some of their arguments. Other examples of binders are the symbol { | }, the symbol ∂/∂, the symbol ∫d, the symbols ∑ and ∏, the quantifiers ∀ and ∃,... In this book we will use several binders: the symbol fun above, the symbols fix,let,fixfun ....\n\nThe arity of a symbol f will no longer be a number n, instead, we will use a finite sequence of numbers (k1, ...,kn) that will indicate that f binds k1 variables in its first argument, k2 variables in the second,..., kn variables in the nth.\n\nIn this way, when a language is defined—that is, a set of symbols with their arities—and an infinite set of variables is given, we can define the set of terms inductively as follows\n\n  * variables are terms,\n\n  * if f is a symbol with arity (k1, ...,kn), t1, ...,tn are terms and  , ..., , ..., , ...,  are variables, then f(  ... t1, ...,  ... tn) is a term.\n\nThe notation f(  ... t1, ...,  ... tn) denotes the tree\n\nThis definition can be better understood with an example. We build a language in which terms specify real numbers and functions over the reals, and which includes two constants sin and cos to represent the functions sine and cosine, a symbol α, called application, such that α(f,x) is the object obtained by applying the function f to the object x and a symbol fun to build functions. This language includes then four symbols: the constants sin and cos, α with arity (0,0) and fun with arity (1); the set of terms is inductively defined by\n\n  * variables are terms,\n\n  * sin is a term,\n\n  * cos is a term,\n\n  * if t and u are terms then α(t,u) is a term,\n\n  * if t is a term and x is a variable then fun(x t) is a term.\n\nWe will adopt a simplified notation, writing t u for the term α(t,u) and fun x -> t for the term fun(x t).\n\nFor example, fun x -> sin (cos (sin x)) is a term in this language.\n\n### 1.2.3 Many-Sorted Languages\n\nIn this book, we will sometimes use more general languages, called many-sorted languages. For instance, the language that is used to describe vectors with a finite number of constants, addition and scalar multiplication. In this language, there are two sorts of terms: terms describing a vector, and terms describing a scalar. In the definition of the language we indicate that the symbol + has two arguments, that are both vectors and that the symbol . has two arguments, which are a scalar and a vector.\n\nFor this, we introduce a set with two elements {vect, scal}, called sorts, and we associate to the symbol . the arity (scal, vect, vect). This arity indicates that in a term of the form λ.v, the term λ must be of sort scal, the term v of sort vect, and the term λ.v is itself of sort vect.\n\nWhen, in addition, there are bound variables, the arity of a symbol f is a finite sequence (( , ..., , s'1), ..., ( , ..., , s'n), s\") indicating that the symbol has n arguments, the first one of sort s'1 and binding k1 variables of sorts  , ..., , ..., and that the resulting term is itself of sort s\".\n\nGiven a language—that is, a set of sorts and a set of symbols each with an associated arity—and a family, indexed by sorts, of infinite, pairwise disjoint, sets of variables, we can inductively define terms as follows:\n\n  * variables of sort s are terms of sort s,\n\n  * if f is a symbol of arity (( , ..., , s'1), ..., ( , ..., , s'n), s\"),  , ..., , ..., , ...,\n\n[Direct Result]: , to avoid capture.\n\nWe start by defining an equivalence relation on terms, by induction on the height of terms. This relation is called alphabetic equivalence—or α-equivalence—and it corresponds to variable renaming.\n\n  * x ∼ x,\n\n  * f(  ... t1, ...,  ... tn) ∼ f(  ...  t'1, ...,  ...  t'n) if for all i, and for any sequence of fresh variables z1, ...,  (that is, variables that do not occur in ti, t'i), we have  .\n\nFor example, the terms fun x -> x + z and fun y -> y + z are α-equivalent.\n\nIn the rest of the book we will work with terms moduloα-equivalence, that is, we will consider implicitly α-equivalence classes of terms.\n\nWe can now define the operation of substitution by induction on the height of terms:\n\n  * θxi =ti,\n\n  * θx = x if x is not in the domain of θ,\n\n  * θf( ... u1,..., ... un)=f( ...  ) where  , ..., , ..., , ...,  are variables that do not occur in f(  ... u1, ...,  ... un) or in θ.\n\nFor example, if we substitute the variable y by the term 2 * x in the term fun x -> x + y, we obtain the term fun z -> z + (2 * x). The choice of variable z is arbitrary, we could have chosen v or w, and we would have obtained the same term modulo α-equivalence.\n\nThe composition of the substitutions θ =t1/x1 ...tn/xn and σ =u1/y1 ...up/yp is the substitution\n\nWe can prove, by induction on the height of t, that for any term t\n\n## 1.3 Three Ways to Define the Semantics of a Language\n\nThe semantics of a programming language is a binary relation over the set of terms in the language. Since we have already defined the notion of a language and introduced tools to define relations, we are ready to describe the three main techniques used for semantic definitions. The semantics of a language is usually given as a function, as an inductive definition, or as the reflexive-transitive closure of an explicitly defined relation. They are called denotational semantics, big-step operational semantics and small-step operational semantics, respectively.\n\n### 1.3.1 Denotational Semantics\n\nDenotational semantics is useful for deterministic languages. In this case, for each program p, the input-output relation defined by a program is a function, written 〚p〛. The relation ↪ is then defined by\n\nOf course, this simply moves the problem further down: we now need to define the function 〚p〛. For this, we will use two tools: explicit definitions of functions, and the fixed point theorem... but we will leave this for later.\n\n### 1.3.2 Big-Step Operational Semantics\n\nThe big-step operational semantics is also called structural operational semantics (S.O.S.) or natural semantics. It gives an inductive definition of the relation ↪.\n\n### 1.3.3 Small-Step Operational Semantics\n\nThe small-step operational semantics is also called reduction semantics. It defines the relation ↪ by means of another relation   that describes the basic steps to transform the initial term t into the final term s.\n\nFor example, when we run the program fun x -> (x * x) + x with input 4, we obtain the result 20. But the term (fun x -> (x * x) + x) 4 does not become 20 in one step, it is first transformed into (4 * 4) + 4, then 16 + 4, and finally 20.\n\nThe most important relation is not the one that links (fun x -> (x * x) + x) 4 with 20, but  , which relates the term (fun x -> (x * x) + x) 4 with (4 * 4) + 4, then the term (4 * 4) + 4 with 16 + 4 and finally the term 16 + 4 with the term 20.\n\nOnce the relation   is given, ↪ can be derived from the reflexive-transitive closure   of the relation\n\nThe fact that the term s is irreducible implies that there is nothing else to compute in s. For example, the term 20 is irreducible, but the term 16 + 4 is not. A term s is irreducible if there is no term s' such that s s'.\n\n### 1.3.4 Non-termination\n\nThe execution of a program may produce a result, produce an error, or never terminate. Errors can be seen as particular kinds of results. For non-terminating programs, there are several ways to define a semantics. A first alternative is to consider that if the term t does not terminate, then there is no pair (t,s) in the relation ↪. Another alternative is to add a specific element ⊥ to the set of output values, and to state that the relation ↪ contains the pair (t,⊥) when the term t does not terminate.\n\nThe difference may seem superficial: it is easy to delete all the pairs of the form (t,⊥), or to add such a pair if there is no pair of the form (t,s) in the relation. However, readers who are familiar with computability problems will notice that, if we add the pairs (t,⊥), the relation ↪ is no longer recursively enumerable.\nGilles Dowek and Jean-Jacques LévyUndergraduate Topics in Computer\n\n[Direct Result]: the principles of small-step operational semantics, let us try to evaluate this term step by step, to obtain a result: 6 if all goes well. The first step in this simplification process is parameter passing, that is, the replacement of the formal argument x by the actual argument 3. The initial term becomes, after a first small-step transformation, the term 2 * 3. In the second step, the term 2 * 3 is evaluated, resulting in the number 6. The first small step, parameter passing, can be performed each time we have a term of the form (fun x -> t) u where a function fun x -> t is applied to an argument u. As a consequence, we define the following rule, called β-reduction rule\n\nThe relation t ⟶ u should be read \"t reduces—or rewrites—to u \". The second step mentioned above can be generalised as follows\n\nwhere ⊗ is any of the four arithmetic operators included in PCF. We add similar rules for conditionals\n\na rule for fixed points\n\nand a rule for let\n\nA redex is a term t that can be reduced. In other words, a term t is a redex if there exists a term u such that t ⟶ u.\n\n### 2.2.2 Numbers\n\nIt could be said, quite rightly, that the rule p ⊗ q ⟶ n (if p ⊗ q = n), of which 2 * 3 ⟶ 6 is an instance, does not really explain the semantics of the arithmetic operators, since it just replaces the multiplication in PCF by that of Mathematics. This choice is however motivated by the fact that we are not really interested in the semantics of arithmetic operators, instead, our goal is to highlight the semantics of the other constructs in the language.\n\nTo define the semantics of the arithmetic operators in PCF without referring to the mathematical operators, we should consider a variant of PCF without numeric constants, where we introduce just one constant for the number 0 and a symbol S—\"successor\"—with one argument. The number 3, for instance, is represented by the term S(S(S(0))). We then add small-step rules\n\n0 + u ⟶ u\n\nS(t) + u ⟶ S(t + u)\n\n0 - u ⟶ 0\n\nt - 0 ⟶ t\n\nS(t) - S(u) ⟶ t - u\n\n0 * u ⟶ 0\n\nS(t) * u ⟶ t * u + u\n\nt / S(u) ⟶ ifz t - u then 0 else S((t - S(u)) / S(u))\n\nNote that, to be precise, we should add a rule for division by 0, which should raise an exception: error.\n\nExercise 2.4\n\n(Church numerals) Instead of introducing the symbols 0 and S, we can represent the number n by the term fun z -> fun s -> s (s (...(s z)...)) rather than S(S(...(0)...)). Show that addition and multiplication can be programmed on these representations. Show that the function that checks whether a number is 0 can also be programmed.\n\nExercise 2.5\n\n(Position numerals) It could be said that the representations of numbers using the symbols 0 and S, or using Church numerals, are not efficient, since the size of the term representing a number grows linearly with the number—as the representation in unary notation, where to write the number n we need n symbols—and not logarithmically, as it is the case with the usual position-based notation. An alternative could be to use a symbol z for the number 0 and two functions O and I to represent the functions n ↦ 2 * n and n ↦ 2 * n + 1. The number 26 would then be represented by the term O(I(O(I(I(z))))), and reversing it we obtain IIOIO, the binary representation of this number.\n\nWrite a small-step operational semantics for the arithmetic operators in this language.\n\n### 2.2.3 A Congruence\n\nUsing the rules of the small-step semantics we obtain\n\nThus, denoting by ⟶∗ the reflexive-transitive closure of ⟶, we can write (fun x -> 2 * x) 3 ⟶∗6.\n\nHowever, with this definition, the term (2 + 3) + 4 does not reduce to the term 9 according to ⟶∗. Indeed, to reduce a term of the form t + u the terms t and u should be numeric constants, but our first term 2 + 3 is a sum, not a constant. The first step should then be the evaluation of 2 + 3, which produces the number 5. Then, a second step reduces 5 + 4 to 9. The problem is that, with our definition, the term 2 + 3 reduces to 5, but (2 + 3) + 4 does not reduce to 5 + 4.\n\nWe need to define another relation, where rules can be applied to any subterm of a term to be reduced. Let us define inductively the relation   as follows\n\n![\n$$\n\\\\frac{{}}{{{\\\\rm t} \\\\triangleright {\\\\rm u}}}{\\\\rm if t} \\\\to {\\\\rm u}\n$$\n](A978-0-85729-076-2_2_Chapter_TeX2GIF_Equi.gif)\n\n![\n$$\n\\\\frac{{{\\\\rm t} \\\\triangleright {\\\\rm u}}}{{{\\\\rm t v} \\\\triangleright {\\\\rm u v}}}\n$$\n](A978-0-85729-076-2_2_Chapter_T"
      ],
      "latency_s": 1.42,
      "rag_type": "literag",
      "dominio": "LiteRAG_Bench_01",
      "titulo": "",
      "error": ""
    },
    {
      "question": "In the theory of programming languages, which theorem states that if a term has a normal form, it is unique?",
      "ground_truth": "Church-Rosser theorem",
      "answer": "I am sorry, but the provided text does not contain the answer to your question. The text discusses various aspects of the theory of programming languages, including syntax, semantics, formal grammars, inductive definitions, and specific concepts like call by name and call by value. However, it does not mention a theorem about the uniqueness of normal forms for terms.",
      "contexts": [
        "## Direct Evidence (Source Text)\n[Direct Result]: a sorting algorithm is a sorted list.\n\nThe last point that remains to discuss is the rôle of the theory of programming languages, and in particular whether its purpose is to describe the existing programming languages, or to propose new languages.\n\nAstronomers study the galaxies that exist, and do not build new ones, whereas chemists study the existing molecules and build new ones. We know that in the latter case, the order in which theories and production techniques appear may vary: the transformation of mass into energy was achieved long time after the theory of relativity, whereas the steam engine appeared before the principles of thermodynamics were established.\n\nThe theory of programming languages has enabled the development of new features, such as static binding, type inference, polymorphic types, garbage collection,... which are now available in commercial languages. In contrast, other functionalities, such as assignments and objects, were introduced in programming languages wildly, and the theory has been slow to follow. The development of a formal semantics for these constructs led in turn to new proposals, such as the recent extensions of Java with polymorphic types.\n\nThe theory of programming languages has neither an exclusively descriptive rôle nor an exclusively leading rôle. It is this going backwards and forwards between the description of existing features and the design of new ones that gives the theory of programming languages its dynamics.\nGilles Dowek and Jean-Jacques LévyUndergraduate Topics in Computer ScienceIntroduction to the Theory of Programming Languages10.1007/978-0-85729-076-2© Springer-Verlag London Limited 2011\n\nReferences\n\n1.\n\nAbadi, M., Cardelli, L.: A Theory of Objects. Springer, Berlin (1998)\n\n2.\n\nDybvig, R.K.: The Scheme Programming Language, 2nd edn. Prentice Hall, New York (1996). www.scheme.com/tspl2d/\n\n3.\n\nGunter, C.A.: Semantics of Programming Languages: Structures and Techniques. MIT Press, Cambridge (1992)MATH\n\n4.\n\nKahn, G.: Natural semantics. In: Proceedings of the Symp. on Theoretical Aspects of Computer Science, TACS, Passau (1987)\n\n5.\n\nMitchell, J.C.: Foundations for Programming Languages. MIT Press, Cambridge (1996)\n\n6.\n\nMitchell, J.C.: Concepts in Programming Languages. Cambridge University Press, Cambridge (2002)MATHCrossRef\n\n7.\n\nPeyton Jones, S., Lester, D.: Types and Programming Languages. Prentice Hall, New York (1992)\n\n8.\n\nPierce, B.C.: Types and Programming Languages. MIT Press, Cambridge (2002)\n\n9.\n\nPlotkin, G.D.: LCF considered as a programming language. Theor. Comput. Sci. 5 , 223–255 (1977) MathSciNetCrossRef90044-5)\n\n10.\n\nPlotkin, G.D.: A structural approach to operational semantics. Technical Report DAIMI FN–19, Computer Science Department, Aarhus University, Aarhus, Denmark, September 1981\n\n11.\n\nReynolds, J.C.: Theories of Programming Languages. Cambridge University Press, Cambridge (1998)MATHCrossRef\n\n12.\n\nScott, D.: Continuous Lattices. Lecture Notes in Math., vol. 274, pp. 97–136. Springer, Berlin (1972)\n\n13.\n\nWeis, P., Leroy, X.: Le langage Caml, 2nd edn. Dunod, Paris (1999)\n\n14.\n\nWinskel, G.: The Formal Semantics of Programming Languages. MIT Press, Cambridge (1993)MATH\n\nIndex\n\nA\n\nAbstract machine\n\nAlgorithm\n\nDamas and Milner\n\nHindley's\n\nRobinson's\n\nα -equivalence\n\nAlphabetic equivalence\n\nArity\n\nArray\n\nB\n\nβ -reduction\n\nBinding\n\ndynamic\n\nlate\n\nstatic\n\nC\n\nCall by name\n\nCall by value\n\nChurch numeral\n\nClosed set\n\nClosure\n\nrecursive\n\nCompiler\n\nbootstrapping\n\nComposition\n\nConfluence\n\nConstant\n\nContinuous function\n\nD\n\nDe Bruijn index\n\nDefinition\n\nexplicit\n\ninductive\n\nDerivation\n\nDeterministic\n\nE\n\nEnvironment\n\nsemantic\n\ntyping\n\nEvaluate\n\nEvaluator\n\nF\n\nFields\n\nFixed point\n\nCurry\n\nfirst theorem\n\nfunction construction via\n\nin PCF\n\nsecond theorem\n\nFunctionalisation\n\nH\n\nHeight\n\nI\n\nInterpreter\n\nL\n\nLabel\n\nLanguage\n\nLimit\n\nList\n\nM\n\nMethod\n\ndynamic\n\nstatic\n\nModule\n\nN\n\nNumber of arguments\n\nO\n\nObject\n\nOrdering\n\nScott's\n\nstrongly complete\n\nweakly complete\n\nP\n\nPair\n\nPCF ( Programming language for computable functions )\n\nPolymorphism\n\nPosition numerals\n\nR\n\nRecord\n\nin call by name\n\nin call by value\n\nRedex\n\nReduction\n\ncall by name\n\ncall by value\n\nlazy\n\nweak\n\nReference\n\nRegister\n\naccumulator\n\ncode\n\nenvironment\n\nstack\n\nRenaming\n\nResult\n\nRule\n\nS\n\nSemantics\n\nbig-step operational\n\ndenotational\n\nsmall-step operational\n\nSide effect\n\nSolution\n\nprincipal\n\nSort\n\nStrategy\n\nSubject reduction\n\nSubstitution\n\nSystem\n\nF\n\nT\n\nT\n\nTerm\n\nclosed\n\nirreducible\n\nstuck\n\nThunk\n\nTree\n\nType\n\nchecking\n\ninference\n\nprincipal\n\nType preservation\n\nby interpretation\n\nType scheme\n\nU\n\nUnification\n\nV\n\nValue\n\nextended\n\nrational\n\nVariable\n\ncapture\n\nenvironment\n\nmutable\n\n[Direct Result]: Title: Introduction to the Theory of Programming Languages\nAuthors: Gilles Dowek\nDomain: cs\n================================================================================\n\n \nGilles Dowek and Jean-Jacques LévyUndergraduate Topics in Computer ScienceIntroduction to the Theory of Programming Languages10.1007/978-0-85729-076-2© Springer-Verlag London Limited 2011\n\nUndergraduate Topics in Computer Science\n\nSeries EditorIan Mackie\n\nAdvisory EditorsSamson Abramsky, Chris Hankin, Dexter Kozen, Andrew Pitts, Hanne Riis Nielson, Steven Skiena and Iain Stewart\n\nUndergraduate Topics in Computer Science (UTiCS) delivers high-quality instructional content for undergraduates studying in all areas of computing and information science. From core foundational and theoretical material to final-year topics and applications, UTiCS books take a fresh, concise, and modern approach and are ideal for self-study or for a one- or two-semester course. The texts are all authored by established experts in their fields, reviewed by an international advisory board, and contain numerous examples and problems. Many include fully worked solutions.\n\nFor other volumes: http://www.springer.com/series/7592\n\nGilles Dowek and Jean-Jacques Lévy\n\nIntroduction to the Theory of Programming Languages\n\nGilles Dowek\n\nLabo. d'Informatique, École polytechnique, Palaiseau, France\n\nJean-Jacques Lévy\n\nCentre de Recherche Commun, INRIA-Microsoft Research, Parc Orsay Université, Orsay Cedex, France\n\nISSN 1863-7310\n\nISBN 978-0-85729-075-5e-ISBN 978-0-85729-076-2\n\nSpringer London Dordrecht Heidelberg New York\n\nBritish Library Cataloguing in Publication Data A catalogue record for this book is available from the British Library\n\n© Springer-Verlag London Limited 2011\n\nThe work was first published in 2006 by Les editions de l'École polytechnique with the following title: 'Introduction à la théorie des langages de programmation'. The translator of the work is Maribel Fernandez.\n\nApart from any fair dealing for the purposes of research or private study, or criticism or review, as permitted under the Copyright, Designs and Patents Act 1988, this publication may only be reproduced, stored or transmitted, in any form or by any means, with the prior permission in writing of the publishers, or in the case of reprographic reproduction in accordance with the terms of licenses issued by the Copyright Licensing Agency. Enquiries concerning reproduction outside those terms should be sent to the publishers.\n\nThe use of registered names, trademarks, etc., in this publication does not imply, even in the absence of a specific statement, that such names are exempt from the relevant laws and regulations and therefore free for general use.\n\nThe publisher makes no representation, express or implied, with regard to the accuracy of the information contained in this book and cannot accept any legal responsibility or liability for any errors or omissions that may be made.\n\nPrinted on acid-free paper\n\nSpringer is part of Springer Science+Business Media (www.springer.com)\n\nWhat Is the Theory of Programming Languages?\n\nThe ultimate, definitive programming language has not been created yet, far from it. Almost every day a new language is created, and new functionalities are added to existing languages. Improvements in programming languages contribute to making programs more reliable, shorten the development time, and make programs easier to maintain. Improvements are also needed to satisfy new requirements, such as the development of parallel, distributed or mobile programs.\n\nThe first thing that we need to describe, when defining a programming language, is its syntax . Should we write x := 1 or x = 1 ? Should we put brackets after an if or not? More generally, what are the strings of symbols that can be used as a program? There is a useful tool for this: the notion of a formal grammar . Using a grammar, we can describe the syntax of the language in a precise way, and this makes it possible to build programs to check the syntactical correctness of programs.\n\nBut it is not sufficient to know what a syntactically correct program is in order to know what is going to happen when we run the program. When defining a programming language, it is also necessary to describe its semantics , that is, the expected behaviour of the program when it is executed. Two languages may have the same syntax but different semantics.\n\nThe following is an example of what is meant (informally) by semantics. Function evaluation is often explained as follows. \" The resultVof the evaluation of an expression of the formfe1...en , where the symbolfis a function defined by the expressionfx1...xn= e' , is obtained in the following way. First, the argumentse1, ...,enare evaluated, returning valuesW1, ...,Wn . Then, these values are associated to the variablesx1, ...,xn , and finally the expressione'is evaluated. The valueVis the result of this evaluation .\"\n\nThis explanation of the semantics of the language, expressed in a natural language (English), allows us to understand what happens when a program is executed, but is it precise? Consider, for example, the program\n\nDepending on the way we interpret the explanation given above, we can deduce that the program will result in the value 2 or in the value 9 . This is because the natural language explanation does not indicate whether we have to evaluate g 2 before or after g 7 , and the order in which we evaluate these expressions is important in this case. Instead, the explanation should have said: \"the arguments e1, ...,en are evaluated starting frome1 \" or else \" starting fromen \".\n\nIf two different programmers read an ambiguous\n\n[Direct Result]: .2 Call by Value 29\n\n2.5 Evaluation of PCF Programs 31\n\n3 From Evaluation to Interpretation 33\n\n3.1 Call by Name 33\n\n3.2 Call by Value 35\n\n3.3 An Optimisation: de Bruijn Indices 36\n\n3.4 Construction of Functions via Fixed Points 38\n\n3.4.1 First Variation: Recursive Closures 38\n\n3.4.2 Second Variation: Rational Values 40\n\n4 Compilation 43\n\n4.1 An Interpreter Written in a Language Without Functions 44\n\n4.2 From Interpretation to Compilation 44\n\n4.3 An Abstract Machine for PCF 45\n\n4.3.1 The Environment 45\n\n4.3.2 Closures 46\n\n4.3.3 PCF Constructs 46\n\n4.3.4 Using de Bruijn Indices 47\n\n4.3.5 Small-Step Operational Semantics 48\n\n4.4 Compilation of PCF 48\n\n5 PCF with Types 51\n\n5.1 Types 51\n\n5.1.1 PCF with Types 52\n\n5.1.2 The Typing Relation 53\n\n5.2 No Errors at Run Time 54\n\n5.2.1 Using Small-Step Operational Semantics 55\n\n5.2.2 Using Big-Step Operational Semantics 55\n\n5.3 Denotational Semantics for Typed PCF 56\n\n5.3.1 A Trivial Semantics 56\n\n5.3.2 Termination 57\n\n5.3.3 Scott's Ordering Relation 58\n\n5.3.4 Semantics of Fixed Points 59\n\n6 Type Inference 63\n\n6.1 Inferring Monomorphic Types 63\n\n6.1.1 Assigning Types to Untyped Terms 63\n\n6.1.2 Hindley's Algorithm 64\n\n6.1.3 Hindley's Algorithm with Immediate Resolution 66\n\n6.2 Polymorphism 68\n\n6.2.1 PCF with Polymorphic Types 68\n\n6.2.2 The Algorithm of Damas and Milner 70\n\n7 References and Assignment 73\n\n7.1 An Extension of PCF 74\n\n7.2 Semantics of PCF with References 75\n\n8 Records and Objects 81\n\n8.1 Records 81\n\n8.1.1 Labelled Fields 81\n\n8.1.2 An Extension of PCF with Records 82\n\n8.2 Objects 85\n\n8.2.1 Methods and Functional Fields 85\n\n8.2.2 What Is \"Self\"? 86\n\n8.2.3 Objects and References 88\n\n9 Epilogue 89\n\nReferences93\n\nIndex95\nGilles Dowek and Jean-Jacques LévyUndergraduate Topics in Computer ScienceIntroduction to the Theory of Programming Languages10.1007/978-0-85729-076-2_1© Springer-Verlag London Limited 2011\n\n# 1. Terms and Relations\n\nGilles Dowek1  and Jean-Jacques Lévy2\n\n(1)\n\nLabo. d'Informatique, École polytechnique, route de Saclay, 91128 Palaiseau, France\n\n(2)\n\nCentre de Recherche Commun, INRIA-Microsoft Research, Parc Orsay Université, 28 rue Jean Rostand, 91893 Orsay Cedex, France\n\nGilles Dowek (Corresponding author)\n\nEmail: gilles.dowek@polytechnique.edu\n\nJean-Jacques Lévy\n\nEmail: jean-jacques.levy@inria.fr\n\nAbstract\n\nFor the book to be really self contained, this chapter introduces all the basic notions about inductive definitions and formal languages in general (variables, expressions, substitution, bound and free variables, sorts,...). Then it introduces to three ways to define the semantics of a programming language: denotational semantics, big-step and small-step operational semantics. This chapter start from scratch and gives many examples.\n\n## 1.1 Inductive Definitions\n\nSince the semantics of a programming language is a relation, we will start by introducing some tools to define sets and relations.\n\nThe most basic tool is the notion of an explicit definition. We can, for example, define explicitly the function that multiplies its argument by 2: x ↦ 2 * x, the set of even numbers: {n ∈ ℕ | ∃p ∈ ℕ n = 2 * p}, or the divisibility relation: {(n,m) ∈ ℕ2 | ∃p ∈ ℕ n = m * p}. However, these explicit definitions are not sufficient to define all the objects we need. A second tool to define sets and relations is the notion of an inductive definition. This notion is based on a simple theorem: the fixed point theorem.\n\n### 1.1.1 The Fixed Point Theorem\n\nLet ≤ be an ordering relation—that is, a reflexive, antisymmetric and transitive relation—over a set E, and let u0,u1,u2, ... be an increasing sequence, that is, a sequence such that u0 ≤ u1 ≤ u2 ≤ ... The element l of E is called limit of the sequence u0,u1,u2, ... if it is a least upper bound of the set {u0,u1,u2, ...}, that is, if\n\n  * for all i, ui ≤ l\n\n  * if, for all i, ui ≤ l', then l ≤ l'.\n\nIf it exists, the limit of a sequence (ui)i is unique, and we denote it by limiui.\n\nThe ordering relation ≤ is said to be weakly complete if all"
      ],
      "latency_s": 4.4,
      "rag_type": "literag",
      "dominio": "LiteRAG_Bench_01",
      "titulo": "",
      "error": ""
    },
    {
      "question": "Which specific algorithm is used by default in Spark MLlib for collaborative filtering?",
      "ground_truth": "ALS",
      "answer": "The specific algorithm used by default in Spark MLlib for collaborative filtering is **Alternating Least Squares (ALS)**. The text states: \"At the time of writing this book, it is the only recommendation model implemented in MLlib.\"",
      "contexts": [
        "## Direct Evidence (Source Text)\n[Direct Result]: can use the factor vectors directly by computing the similarity between two item-factor vectors, as illustrated in the following diagram:\n\nComputing similarity with item-factor vectors\n\nThe benefit of factorization models is the relative ease of computing recommendations once the model is created. However, for very large user and itemsets, this can become a challenge as it requires storage and computation across potentially many millions of user- and item-factor vectors. Another advantage, as mentioned earlier, is that they tend to offer very good performance.\n\n### Note\n\nProjects such as Oryx (<https://github.com/OryxProject/oryx>) and Prediction.io (<https://github.com/PredictionIO/PredictionIO>) focus on model serving for large-scale models, including recommenders based on matrix factorization.\n\nOn the down side, factorization models are relatively more complex to understand and interpret compared to nearest-neighbor models and are often more computationally intensive during the model's training phase.\n\n#### Implicit matrix factorization\n\nSo far, we have dealt with explicit preferences such as ratings. However, much of the preference data that we might be able to collect is implicit feedback, where the preferences between a user and item are not given to us, but are, instead, implied from the interactions they might have with an item. Examples include binary data (such as whether a user viewed a movie, whether they purchased a product, and so on) as well as count data (such as the number of times a user watched a movie).\n\nThere are many different approaches to deal with implicit data. MLlib implements a particular approach that treats the input rating matrix as two matrices: a binary preference matrix, **P** , and a matrix of confidence weights, **C**.\n\nFor example, let's assume that the user-movie ratings we saw previously were, in fact, the number of times each user had viewed that movie. The two matrices would look something like ones shown in the following screenshot. Here, the matrix **P** informs us that a movie was viewed by a user, and the matrix **C** represents the confidence weighting, in the form of the view counts--generally, the more a user has watched a movie, the higher the confidence that they actually like it.\n\nRepresentation of an implicit preference and confidence matrix\n\nThe implicit model still creates a user- and item-factor matrix. In this case, however, the matrix that the model is attempting to approximate is not the overall ratings matrix but the preference matrix P. If we compute a recommendation by calculating the dot product of a user- and item-factor vector, the score will not be an estimate of a rating directly. It will rather be an estimate of the preference of a user for an item (though not strictly between 0 and 1, these scores will generally be fairly close to a scale of 0 to 1).\n\n#### Alternating least squares\n\n **Alternating Least Squares** ( **ALS** ) is an optimization technique to solve matrix factorization problems; this technique is powerful, achieves good performance, and has proven to be relatively easy to implement in a parallel fashion. Hence, it is well suited for platforms such as Spark. At the time of writing this book, it is the only recommendation model implemented in MLlib.\n\nALS works by iteratively solving a series of least squares regression problems. In each iteration, one of the user- or item-factor matrices is treated as fixed, while the other one is updated using the fixed factor and the rating data. Then, the factor matrix that was solved for is, in turn, treated as fixed, while the other one is updated. This process continues until the model has converged (or for a fixed number of iterations).\n\n### Note\n\nSpark's documentation for collaborative filtering contains references to the papers that underlie the ALS algorithms implemented each component of explicit and implicit data. You can view the documentation at <http://spark.apache.org/docs/latest/mllib-collaborative-filtering.html>.\n\n# Extracting the right features from your data\n\nIn this section, we will use explicit rating data, without additional user or item metadata or other information related to the user-item interactions. Hence, the features that we need as inputs are simply the user IDs, movie IDs, and the ratings assigned to each user and movie pair.\n\n## Extracting features from the MovieLens 100k dataset\n\nStart the Spark shell in the Spark base directory, ensuring that you provide enough memory via the `-driver-memory` option:\n\n    **>./bin/spark-shell -driver-memory 4g**\n\nIn this example, we will use the same MovieLens dataset that we used in the previous chapter. Use the directory in which you placed the MovieLens 100k dataset as the input path in the following code.\n\nFirst, let's inspect the raw ratings dataset:\n\n    val rawData = sc.textFile(\"/ **PATH** /ml-100k/u.data\")\n    rawData.first()\n\nYou will see output similar to these lines of code:\n\n    **14/03/30 11:42:41 WARN NativeCodeLoader: Unable to load native-hadoop library for your platform... using builtin-java classes where applicable**\n    **14/03/30 11:42:41 WARN LoadSnappy: Snappy native library not loaded**\n    **14/03/30 11:42:41 INFO FileInputFormat: Total input paths to process : 1**\n    **14/03/30 11:42:41 INFO SparkContext: Starting job: first at <console>:15**\n    **14/03/30 11:42:41 INFO DAGScheduler: Got job 0 (first at <console>:15) with 1 output partitions (allowLocal=true)**\n    **14/03/30 11:42:41 INFO DAGScheduler: Final stage: Stage 0 (first at <console>:15)**\n    **14/03/30\n\n[Direct Result]: user and item factors in the form of an RDD of `(id, factor)` pairs. These are called `userFeatures` and `productFeatures`, respectively. For example:\n\n    model.userFeatures\n\nYou will see the output as:\n\n    **res14: org.apache.spark.rdd.RDD[(Int, Array[Double])] = FlatMappedRDD[659] at flatMap at ALS.scala:231**\n\nWe can see that the factors are in the form of an `Array[Double]`.\n\nNote that the operations used in MLlib's `ALS` implementation are lazy transformations, so the actual computation will only be performed once we call some sort of action on the resulting `RDDs` of the user and item factors. We can force the computation using a Spark action such as `count`:\n\n    **model.userFeatures.count**\n\nThis will trigger the computation, and we will see a quite a bit of output text similar to the following lines of code:\n\n    **14/03/30 13:10:40 INFO SparkContext: Starting job: count at <console>:26**\n    **14/03/30 13:10:40 INFO DAGScheduler: Registering RDD 665 (map at ALS.scala:147)**\n    **14/03/30 13:10:40 INFO DAGScheduler: Registering RDD 664 (map at ALS.scala:146)**\n    **14/03/30 13:10:40 INFO DAGScheduler: Registering RDD 674 (mapPartitionsWithIndex at ALS.scala:164)**\n    **...**\n    **14/03/30 13:10:45 INFO SparkContext: Job finished: count at <console>:26, took 5.068255 s**\n    **res16: Long = 943**\n\nIf we call `count` for the movie factors, we will see the following output:\n\n    **model.productFeatures.count**\n    **14/03/30 13:15:21 INFO SparkContext: Starting job: count at <console>:26**\n    **14/03/30 13:15:21 INFO DAGScheduler: Got job 10 (count at <console>:26) with 1 output partitions (allowLocal=false)**\n    **14/03/30 13:15:21 INFO DAGScheduler: Final stage: Stage 165 (count at <console>:26)**\n    **14/03/30 13:15:21 INFO DAGScheduler: Parents of final stage: List(Stage 169, Stage 166)**\n    **14/03/30 13:15:21 INFO DAGScheduler: Missing parents: List()**\n    **14/03/30 13:15:21 INFO DAGScheduler: Submitting Stage 165 (FlatMappedRDD[883] at flatMap at ALS.scala:231), which has no missing parents**\n    **14/03/30 13:15:21 INFO DAGScheduler: Submitting 1 missing tasks from Stage 165 (FlatMappedRDD[883] at flatMap at ALS.scala:231)**\n    **...**\n    **14/03/30 13:15:21 INFO SparkContext: Job finished: count at <console>:26, took 0.030044 s**\n    **res21: Long = 1682**\n\nAs expected, we have a factor array for each user (`943` factors) and movie (`1682` factors).\n\n### Training a model using implicit feedback data\n\nThe standard matrix factorization approach in MLlib deals with explicit ratings. To work with implicit data, you can use the `trainImplicit` method. It is called in a manner similar to the standard `train` method. There is an additional parameter, `alpha`, that can be set (and in the same way, the regularization parameter, `lambda`, should be selected via testing and cross-validation methods).\n\nThe `alpha` parameter controls the baseline level of confidence weighting applied. A higher level of `alpha` tends to make the model more confident about the fact that missing data equates to no preference for the relevant user-item pair.\n\n### Note\n\nAs an exercise, try to take the existing MovieLens dataset and convert it into an implicit dataset. One possible approach is to convert it to binary feedback (0s and 1s) by applying a threshold on the ratings at some level.\n\nAnother approach could be to convert the ratings' values into confidence weights (for example, perhaps, low ratings could imply zero weights, or even negative weights, which are supported by MLlib's implementation).\n\nTrain a model on this dataset and compare the results of the following section with those generated by your implicit model.\n\n# Using the recommendation model\n\nNow that we have our trained model, we're ready to use it to make predictions. These predictions typically take one of two forms: recommendations for a given user and related or similar items for a given item.\n\n## User recommendations\n\nIn this case, we would like to generate recommended items for a given user. This usually takes the form of a _top-K_ list, that is, the _K_ items that our model predicts will have the highest probability of the user liking them. This is done by computing the predicted score for each item and ranking the list based on this score.\n\nThe exact method to perform this computation depends on the model involved. For example, in user-based approaches, the ratings of similar users on items are used to compute the recommendations for a user, while in an item-based approach, the computation is based on the similarity of items the user has rated to the candidate items.\n\nIn matrix factorization, because we are modeling the ratings matrix directly, the predicted score can be computed as the vector dot product between a user-factor vector and an item-factor vector.\n\n### Generating movie recommendations from the MovieLens 100k dataset\n\nAs MLlib's recommendation model is\n\n[Direct Result]: vectors. A few examples of packages for feature extraction include scikit-learn, gensim, scikit-image, matplotlib, and NLTK in Python; OpenNLP in Java; and Breeze and Chalk in Scala. In fact, Breeze has been part of Spark MLlib since version 1.0, and we will see how to use some Breeze functionality for linear algebra in the later chapters.\n\n# Summary\n\nIn this chapter, we saw how to find common, publicly-available datasets that can be used to test various machine learning models. You learned how to load, process, and clean data, as well as how to apply common techniques to transform raw data into feature vectors that can be used as training examples for our models.\n\nIn the next chapter, you will learn the basics of recommender systems and explore how to create a recommendation model, use the model to make predictions, and evaluate the model.\n\n# Chapter 4. Building a Recommendation Engine with Spark\n\nNow that you have learned the basics of data processing and feature extraction, we will move on to explore individual machine learning models in detail, starting with recommendation engines.\n\nRecommendation engines are probably among the best types of machine learning model known to the general public. Even if people do not know exactly what a recommendation engine is, they have most likely experienced one through the use of popular websites such as Amazon, Netflix, YouTube, Twitter, LinkedIn, and Facebook. Recommendations are a core part of all these businesses, and in some cases, they drive significant percentages of their revenue.\n\nThe idea behind recommendation engines is to predict what people might like and to uncover relationships between items to aid in the discovery process (in this way, it is similar and, in fact, often complementary to search engines, which also play a role in discovery). However, unlike search engines, recommendation engines try to present people with relevant content that they did not necessarily search for or that they might not even have heard of.\n\nTypically, a recommendation engine tries to model the connections between users and some type of item. In our MovieStream scenario from Chapter 2, _Designing a Machine Learning System_ , for example, we could use a recommendation engine to show our users movies that they might enjoy. If we can do this well, we could keep our users engaged using our service, which is good for both our users and us. Similarly, if we can do a good job of showing our users movies related to a given movie, we could aid in discovery and navigation on our site, again improving our users' experience, engagement, and the relevance of our content to them.\n\nHowever, recommendation engines are not limited to movies, books, or products. The techniques we will explore in this chapter can be applied to just about any user-to-item relationship as well as user-to-user connections, such as those found on social networks, allowing us to make recommendations such as people you may know or who to follow.\n\nRecommendation engines are most effective in two general scenarios (which are not mutually exclusive). They are explained here:\n\n  *  **Large number of available options for users** : When there are a very large number of available items, it becomes increasingly difficult for the user to find something they want. Searching can help when the user knows what they are looking for, but often, the right item might be something previously unknown to them. In this case, being recommended relevant items, that the user may not already know about, can help them discover new items.\n  *  **A significant degree of personal taste involved** : When personal taste plays a large role in selection, recommendation models, which often utilize a wisdom of the crowd approach, can be helpful in discovering items based on the behavior of others that have similar taste profiles.\n\nIn this chapter, we will:\n\n  * Introduce the various types of recommendation engines\n  * Build a recommendation model using data about user preferences\n  * Use the trained model to compute recommendations for a given user as well compute similar items for a given item (that is, related items)\n  * Apply standard evaluation metrics to the model that we created to measure how well it performs in terms of predictive capability\n\n# Types of recommendation models\n\nRecommender systems are widely studied, and there are many approaches used, but there are two that are probably most prevalent: content-based filtering and collaborative filtering. Recently, other approaches such as ranking models have also gained in popularity. In practice, many approaches are hybrids, incorporating elements of many different methods into a model or combination of models.\n\n## Content-based filtering\n\nContent-based methods try to use the content or attributes of an item, together with some notion of similarity between two pieces of content, to generate items similar to a given item. These attributes are often textual content (such as titles, names, tags, and other metadata attached to an item), or in the case of media, they could include other features of the item, such as attributes extracted from audio and video content.\n\nIn a similar manner, user recommendations can be generated based on attributes of users or user profiles, which are then matched to item attributes using the same measure of similarity. For example, a user can be represented by the combined attributes of the items they have interacted with. This becomes their user profile, which is then compared to item attributes to find items that match the user profile.\n\n## Collaborative filtering\n\nCollaborative filtering is a form of wisdom of the crowd approach where the set of preferences of many users with respect to items is used to generate estimated preferences of users for items with which they have not yet interacted. The idea behind this is the notion of similarity.\n\nIn a user-based approach, if two users have exhibited similar preferences (that is, patterns of interacting with the same items in broadly the same way), then we would assume that they are similar to each other in terms of taste. To generate recommendations for unknown items for a given user, we can use the"
      ],
      "latency_s": 8.29,
      "rag_type": "literag",
      "dominio": "LiteRAG_Bench_01",
      "titulo": "",
      "error": ""
    },
    {
      "question": "What is the Spark class that represents a distributed and strongly typed collection of data?",
      "ground_truth": "Dataset",
      "answer": "The Spark class that represents a distributed and strongly typed collection of data is the **Resilient Distributed Dataset** ( **RDD** ).",
      "contexts": [
        "## Direct Evidence (Source Text)\n[Direct Result]: ub.com>. If you purchased this book elsewhere, you can visit <http://www.packtpub.com/support> and register to have the files e-mailed directly to you.\n\n## The Spark shell\n\nSpark supports writing programs interactively using either the Scala or Python REPL (that is, the **Read-Eval-Print-Loop** , or interactive shell). The shell provides instant feedback as we enter code, as this code is immediately evaluated. In the Scala shell, the return result and type is also displayed after a piece of code is run.\n\nTo use the Spark shell with Scala, simply run `./bin/spark-shell` from the Spark base directory. This will launch the Scala shell and initialize `SparkContext`, which is available to us as the Scala value, `sc`. Your console output should look similar to the following screenshot:\n\nTo use the Python shell with Spark, simply run the `./bin/pyspark` command. Like the Scala shell, the Python `SparkContext` object should be available as the Python variable `sc`. You should see an output similar to the one shown in this screenshot:\n\n## Resilient Distributed Datasets\n\nThe core of Spark is a concept called the **Resilient Distributed Dataset** ( **RDD** ). An RDD is a collection of \"records\" (strictly speaking, objects of some type) that is distributed or partitioned across many nodes in a cluster (for the purposes of the Spark local mode, the single multithreaded process can be thought of in the same way). An RDD in Spark is fault-tolerant; this means that if a given node or task fails (for some reason other than erroneous user code, such as hardware failure, loss of communication, and so on), the RDD can be reconstructed automatically on the remaining nodes and the job will still complete.\n\n### Creating RDDs\n\nRDDs can be created from existing collections, for example, in the Scala Spark shell that you launched earlier:\n\n    val collection = List(\"a\", \"b\", \"c\", \"d\", \"e\")\n    val rddFromCollection = sc.parallelize(collection)\n\nRDDs can also be created from Hadoop-based input sources, including the local filesystem, HDFS, and Amazon S3. A Hadoop-based RDD can utilize any input format that implements the Hadoop `InputFormat` interface, including text files, other standard Hadoop formats, HBase, Cassandra, and many more. The following code is an example of creating an RDD from a text file located on the local filesystem:\n\n    val rddFromTextFile = sc.textFile(\"LICENSE\")\n\nThe preceding `textFile` method returns an RDD where each record is a `String` object that represents one line of the text file.\n\n### Spark operations\n\nOnce we have created an RDD, we have a distributed collection of records that we can manipulate. In Spark's programming model, operations are split into transformations and actions. Generally speaking, a transformation operation applies some function to all the records in the dataset, changing the records in some way. An action typically runs some computation or aggregation operation and returns the result to the driver program where `SparkContext` is running.\n\nSpark operations are functional in style. For programmers familiar with functional programming in Scala or Python, these operations should seem natural. For those without experience in functional programming, don't worry; the Spark API is relatively easy to learn.\n\nOne of the most common transformations that you will use in Spark programs is the `map` operator. This applies a function to each record of an RDD, thus _mapping_ the input to some new output. For example, the following code fragment takes the RDD we created from a local text file and applies the `size` function to each record in the RDD. Remember that we created an RDD of `Strings`. Using `map`, we can transform each string to an integer, thus returning an RDD of `Ints`:\n\n    val intsFromStringsRDD = rddFromTextFile.map( **line = > line.size**)\n\nYou should see output similar to the following line in your shell; this indicates the type of the RDD:\n\n    **intsFromStringsRDD: org.apache.spark.rdd.RDD[Int] = MappedRDD[5] at map at <console>:14**\n\nIn the preceding code, we saw the `=>` syntax used. This is the Scala syntax for an anonymous function, which is a function that is not a named method (that is, one defined using the `def` keyword in Scala or Python, for example).\n\n### Note\n\nWhile a detailed treatment of anonymous functions is beyond the scope of this book, they are used extensively in Spark code in Scala and Python, as well as in Java 8 (both in examples and real-world applications), so it is useful to cover a few practicalities.\n\nThe `line => line.size` syntax means that we are applying a function where the input variable is to the left of the `=>` operator, and the output is the result of the code to the right of the `=>` operator. In this case, the input is `line`, and the output is the result of calling `line.size`. In Scala, this function that maps a string to an integer is expressed as `String => Int`.\n\nThis syntax saves us from having to separately define functions every time we use methods such as `map`; this is useful when the function is simple and will only be used once, as in this example.\n\nNow, we can apply a common action operation, `count`, to return the number of records in our RDD:\n\n    intsFromStringsRDD.count\n\nThe result should look something like the following console output:\n\n    **14/01/29 23:28:28 INFO SparkContext: Starting job: count at <console>:17**\n    **...**\n    **14/01/29 23:28:28 INFO SparkContext\n\n[Direct Result]: rdd_2_0 stored as values to memory (estimated size 62.0 KB, free 296.9 MB)**\n    **14/01/30 06:59:27 INFO BlockManagerMasterActor$BlockManagerInfo: Added rdd_2_0 in memory on 10.0.0.3:55089 (size: 62.0 KB, free: 296.9 MB)**\n    **...**\n\nNow, we will call the same function again:\n\n    val aveLengthOfRecordChainedFromCached = rddFromTextFile.map(line => line.size).sum / rddFromTextFile.count\n\nWe will see from the console output that the cached data is read directly from memory:\n\n    **...**\n    **14/01/30 06:59:34 INFO BlockManager: Found block rdd_2_0 locally**\n    **...**\n\n### Tip\n\nSpark also allows more fine-grained control over caching behavior. You can use the `persist` method to specify what approach Spark uses to cache data. More information on `RDD` caching can be found here: <http://spark.apache.org/docs/latest/programming-guide.html#rdd-persistence>.\n\n## Broadcast variables and accumulators\n\nAnother core feature of Spark is the ability to create two special types of variables: broadcast variables and accumulators.\n\nA **broadcast variable** is a _read-only_ variable that is made available from the driver program that runs the `SparkContext` object to the nodes that will execute the computation. This is very useful in applications that need to make the same data available to the worker nodes in an efficient manner, such as machine learning algorithms. Spark makes creating broadcast variables as simple as calling a method on `SparkContext` as follows:\n\n    val broadcastAList = sc.broadcast(List(\"a\", \"b\", \"c\", \"d\", \"e\"))\n\nThe console output shows that the broadcast variable was stored in memory, taking up approximately 488 bytes, and it also shows that we still have 270 MB available to us:\n\n    **14/01/30 07:13:32 INFO MemoryStore: ensureFreeSpace(488) called with curMem=96414, maxMem=311387750**\n    **14/01/30 07:13:32 INFO MemoryStore: Block broadcast_1 stored as values to memory (estimated size 488.0 B, free 296.9 MB)**\n    **broadCastAList: org.apache.spark.broadcast.Broadcast[List[String]] = Broadcast(1)**\n\nA broadcast variable can be accessed from nodes other than the driver program that created it (that is, the worker nodes) by calling `value` on the variable:\n\n    sc.parallelize(List(\"1\", \"2\", \"3\")).map(x => broadcastAList. **value** ++ x).collect\n\nThis code creates a new RDD with three records from a collection (in this case, a Scala `List`) of `(\"1\", \"2\", \"3\")`. In the `map` function, it returns a new collection with the relevant record from our new RDD appended to the `broadcastAList` that is our broadcast variable.\n\nNotice that we used the `collect` method in the preceding code. This is a Spark _action_ that returns the entire RDD to the driver as a Scala (or Python or Java) collection.\n\nWe will often use `collect` when we wish to apply further processing to our results locally within the driver program.\n\n### Note\n\nNote that `collect` should generally only be used in cases where we really want to return the full result set to the driver and perform further processing. If we try to call `collect` on a very large dataset, we might run out of memory on the driver and crash our program.\n\nIt is preferable to perform as much heavy-duty processing on our Spark cluster as possible, preventing the driver from becoming a bottleneck. In many cases, however, collecting results to the driver is necessary, such as during iterations in many machine learning models.\n\nOn inspecting the result, we will see that for each of the three records in our new RDD, we now have a record that is our original broadcasted `List`, with the new element appended to it (that is, there is now either `\"1\"`, `\"2\"`, or `\"3\"` at the end):\n\n    **...**\n    **14/01/31 10:15:39 INFO SparkContext: Job finished: collect at <console>:15, took 0.025806 s**\n    **res6: Array[List[Any]] = Array(List(a, b, c, d, e, 1), List(a, b, c, d, e, 2), List(a, b, c, d, e, 3))**\n\nAn **accumulator** is also a variable that is broadcasted to the worker nodes. The key difference between a broadcast variable and an accumulator is that while the broadcast variable is read-only, the accumulator can be added to. There are limitations to this, that is, in particular, the addition must be an associative operation so that the global accumulated value can be correctly computed in parallel and returned to the driver program. Each worker node can only access and add to its own local accumulator value, and only the driver program can access the global value. Accumulators are also accessed within the Spark code using the `value` method.\n\n### Tip\n\nFor more details on broadcast variables and accumulators, see the _Shared Variables_ section of the _Spark Programming Guide_ : <http://spark.apache.org/docs/latest/programming-guide.html#shared-variables>.\n\n# The first step to a Spark program in Scala\n\nWe will now use the ideas we introduced in the previous section to write a basic Spark program to manipulate a dataset. We will start with Scala and then write the\n\n[Direct Result]: the book, and we will do our best to address it.\n\n# Chapter 1. Getting Up and Running with Spark\n\nApache Spark is a framework for distributed computing; this framework aims to make it simpler to write programs that run in parallel across many nodes in a cluster of computers. It tries to abstract the tasks of resource scheduling, job submission, execution, tracking, and communication between nodes, as well as the low-level operations that are inherent in parallel data processing. It also provides a higher level API to work with distributed data. In this way, it is similar to other distributed processing frameworks such as Apache Hadoop; however, the underlying architecture is somewhat different.\n\nSpark began as a research project at the University of California, Berkeley. The university was focused on the use case of distributed machine learning algorithms. Hence, it is designed from the ground up for high performance in applications of an iterative nature, where the same data is accessed multiple times. This performance is achieved primarily through caching datasets in memory, combined with low latency and overhead to launch parallel computation tasks. Together with other features such as fault tolerance, flexible distributed-memory data structures, and a powerful functional API, Spark has proved to be broadly useful for a wide range of large-scale data processing tasks, over and above machine learning and iterative analytics.\n\n### Note\n\nFor more background on Spark, including the research papers underlying Spark's development, see the project's history page at <http://spark.apache.org/community.html#history>.\n\nSpark runs in four modes:\n\n  * The standalone local mode, where all Spark processes are run within the same **Java Virtual Machine** ( **JVM** ) process\n  * The standalone cluster mode, using Spark's own built-in job-scheduling framework\n  * Using Mesos, a popular open source cluster-computing framework\n  * Using YARN (commonly referred to as NextGen MapReduce), a Hadoop-related cluster-computing and resource-scheduling framework\n\nIn this chapter, we will:\n\n  * Download the Spark binaries and set up a development environment that runs in Spark's standalone local mode. This environment will be used throughout the rest of the book to run the example code.\n  * Explore Spark's programming model and API using Spark's interactive console.\n  * Write our first Spark program in Scala, Java, and Python.\n  * Set up a Spark cluster using Amazon's **Elastic Cloud Compute** ( **EC2** ) platform, which can be used for large-sized data and heavier computational requirements, rather than running in the local mode.\n\n### Tip\n\nSpark can also be run on Amazon's Elastic MapReduce service using custom bootstrap action scripts, but this is beyond the scope of this book. The following article is a good reference guide: <http://aws.amazon.com/articles/Elastic-MapReduce/4926593393724923>.\n\nAt the time of writing this book, the article covers running Spark Version 1.1.0.\n\nIf you have previous experience in setting up Spark and are familiar with the basics of writing a Spark program, feel free to skip this chapter.\n\n# Installing and setting up Spark locally\n\nSpark can be run using the built-in standalone cluster scheduler in the local mode. This means that all the Spark processes are run within the same JVM--effectively, a single, multithreaded instance of Spark. The local mode is very useful for prototyping, development, debugging, and testing. However, this mode can also be useful in real-world scenarios to perform parallel computation across multiple cores on a single computer.\n\nAs Spark's local mode is fully compatible with the cluster mode, programs written and tested locally can be run on a cluster with just a few additional steps.\n\nThe first step in setting up Spark locally is to download the latest version (at the time of writing this book, the version is 1.2.0). The download page of the Spark project website, found at <http://spark.apache.org/downloads.html>, contains links to download various versions as well as to obtain the latest source code via GitHub.\n\n### Tip\n\nThe Spark project documentation website at <http://spark.apache.org/docs/latest/> is a comprehensive resource to learn more about Spark. We highly recommend that you explore it!\n\nSpark needs to be built against a specific version of Hadoop in order to access **Hadoop Distributed File System** ( **HDFS** ) as well as standard and custom Hadoop input sources. The download page provides prebuilt binary packages for Hadoop 1, CDH4 (Cloudera's Hadoop Distribution), MapR's Hadoop distribution, and Hadoop 2 (YARN). Unless you wish to build Spark against a specific Hadoop version, we recommend that you download the prebuilt Hadoop 2.4 package from an Apache mirror using this link: <http://www.apache.org/dyn/closer.cgi/spark/spark-1.2.0/spark-1.2.0-bin-hadoop2.4.tgz>.\n\nSpark requires the Scala programming language (version 2.10.4 at the time of writing this book) in order to run. Fortunately, the prebuilt binary package comes with the Scala runtime packages included, so you don't need to install Scala separately in order to get started. However, you will need to have a **Java Runtime Environment** ( **JRE** ) or **Java Development Kit** ( **JDK** ) installed (see the software and hardware list in this book's code bundle for installation instructions).\n\nOnce you have downloaded the Spark binary package, unpack the contents of the package and change into the newly created directory by running the following commands:\n\n    **> tar xfvz spark-1.2.0-bin-hadoop2.4.tgz**\n    **> cd spark-1.2.0-bin-hadoop2.4**\n\nSpark places user scripts to run Spark in the `bin` directory"
      ],
      "latency_s": 22.83,
      "rag_type": "literag",
      "dominio": "LiteRAG_Bench_01",
      "titulo": "",
      "error": ""
    },
    {
      "question": "Which SQL Server command or hint forces the query optimizer to use a specific index?",
      "ground_truth": "INDEX hint",
      "answer": "The provided context does not contain information about a SQL Server command or hint that forces the query optimizer to use a specific index.",
      "contexts": [
        "## Direct Evidence (Source Text)\n[Direct Result]: entially by orders of magnitude). This is the sort of thing you want to test on an offline system first to have an idea how long it's going to take, and then schedule to run in off hours (preferably with someone monitoring it to be sure it's back online when peak hours come along).\n\nThis one can have major side effects while it runs, and thus it falls squarely in the domain of the database administrator in my not so humble opinion.\n\nDISABLE\n\nThis one does what it says, only in somewhat drastic fashion. It would be nice if all this command did was take your index offline until you decided further what you want to do, but instead it essentially marks the index as unusable. Once an index has been disabled, it must be rebuilt (not reorganized, but rebuilt) before it will be active again.\n\nThis is one you're very, very rarely going to do yourself (you would more likely just drop the index)—it is far more likely to happen during a SQL Server upgrade or some other oddball situation.\n\nYet another BE CAREFUL!!! warning on this one. If you disable the clustered index for your table, it has the effect of disabling the table. The data will remain, but will be inaccessible by all indexes (since they all depend on the clustered index) until you rebuild the clustered index.\n\nREORGANIZE\n\nBINGO!!! from the developer perspective. With REORGANIZE you hit much more of a happy medium in life. When you reorganize your index, you get a slightly less complete optimization than you get with a full rebuild, but one that occurs online. (Users can still utilize the index.)\n\nThis should, if you're paying attention, bring about the question \"What exactly do you mean by 'slightly less complete'?\" Well, REORGANIZE works only on the leaf level of your index; non-leaf levels of the index go untouched. This means that you're not quite getting a full optimization, but, for the lion's share of indexes, that is not where your real cost of fragmentation is (though it can happen and your mileage may vary).\n\nGiven its much lower impact on users, this is usually the tool you'll want to use as part of your regular maintenance plan. We'll look into this a bit more later when talking fragmentation.\n\nDROP INDEX\n\nThis one returns to most of the simplicity of prior DROP statements. The only real trick to it is that, since an index is not a standalone object (it is essentially contained within the definition of a table), you must name not only the index but also the table that is belongs to. The syntax looks like this:\n\nDROP INDEX <table name>.<index name>\n\nAs you can see, there's not really much to it. You can use full four-part naming (I guess it turns into five part if you include the index) if you need to.\n\nChoosing Wisely: Deciding What Index Goes Where and When\n\nBy now, you're probably thinking to yourself, \"Gee, I'm always going to create clustered indexes!\" There are plenty of good reasons to think that way. Just keep in mind that there are also some reasons not to.\n\nChoosing which indexes to include and which not to include can be a tough process, and, in case that wasn't enough, you have to make some decisions about what type you want them to be. The latter decision is made simultaneously easier and harder by the fact that you can only have one clustered index. It means that you have to choose wisely to get the most out of it.\n\nSelectivity\n\nIndexes, particularly non-clustered indexes, are primarily beneficial when there is a reasonably high level of selectivity within the index. By selectivity, I'm referring to the percentage of values in the column that are unique. The higher the percentage of unique values within a column, the higher the selectivity is said to be, and the greater the benefit of indexing.\n\nIf you think back to the sections on non-clustered indexes—particularly the section on non-clustered indexes over a clustered index—you will recall that the lookup in the non-clustered index is really only the beginning. You still need to make another loop through the clustered index to find the real data. Even with the non-clustered index on a heap, you still end up with multiple physically separate reads to perform.\n\nIf one lookup in your non-clustered index is going to generate multiple additional lookups in a clustered index, then you are probably better off with the table scan. The exponential effect that's possible here is actually quite amazing. Consider that the looping process created by the non-clustered index is not worth it if you don't have somewhere in the area of 90–95 percent uniqueness in the indexed column.\n\nClustered indexes are substantially less affected by this because, once you're at the start of your range of data—unique or not—you're there. There are no additional index pages to read. Still, more than likely, your clustered index has other things that it could be put to greater use on.\n\nOne other exception to the rule of selectivity has to do with foreign keys. If your table has a column that is a foreign key, then, in all likelihood, you're going to benefit from having an index on that column. Why foreign keys and not other columns? Well, foreign keys are frequently the target of joins with the table they reference. Indexes, regardless of selectivity, can be very instrumental in join performance because they allow what is called a merge join. A merge join obtains a row from each table and compares them to see if they match the join criteria (what you're joining on). Since there are indexes on the related columns in both tables, the seek for both rows is very fast.\n\nThe point here is that selectivity is not everything, but it is a big issue to consider. If the column in question is not in a foreign key\n\n[Direct Result]: indexes\n\nlogin\n\nrules\n\nsemicolon\n\nBalanced Tree (B-Tree)\n\nclustered indexes\n\nindexes\n\npage splits\n\nbandwidth, replication\n\nbatches\n\nDROP\n\nerrors\n\nGO\n\nBATCH = nn\n\nBCM. See Bulk Changed Map\n\nbcp. See Bulk Copy Program\n\nBCP.fmt\n\nBEGIN\n\ntransactions\n\nBEGIN TRAN\n\nBEGIN TRANSACTION\n\nBEGIN...END\n\nBETWEEN\n\nBI. See Business Intelligence\n\nBIDS. See Business Intelligence Development Studio\n\nBigint\n\nBinary\n\nBINARY BASE64\n\nbinary collation\n\nBinary large objects (BLOBs)\n\nADO.NET\n\nbackward compatibility\n\npages\n\nsecurity\n\ntransactional replication\n\nBit\n\nbkp.Initialize\n\nBLOBs. See Binary large objects\n\nblocks\n\ncode\n\nsprocs\n\ntransactions\n\nBLOCKSIZE\n\nBOL. See Books Online\n\nBooks Online (BOL)\n\nBoolean\n\nCOLUMNS_UPDATED()\n\nCONTAINS\n\n@enabled\n\n.exist\n\nFTS\n\nkeywords\n\nbound connections\n\nBoyce-Codd\n\nbranching rules\n\nbreadth-first index\n\nBREAK\n\nbreakpoints\n\nB-Tree. See Balanced Tree\n\nBU. See bulk update lock\n\nBuffer Hit Cache Ratio\n\nBuffer Manager\n\nBulk Changed Map (BCM)\n\nBulk Copy Program (bcp)\n\nASCII\n\ncolumns\n\nexporting\n\nformat files\n\nforward slash\n\nhyphen\n\nimporting\n\nlogged\n\n.NET\n\nsyntax\n\ntransaction log\n\nunlogged\n\nBULK INSERT\n\nbulkadmin\n\nT-SQL\n\nBulk Insert Task\n\nbulk update lock (BU)\n\nbulkadmin\n\nbulkadminserver\n\nBulkImport\n\nbulkinsert\n\nBulk-Logged\n\nbulk-logged recovery\n\nBusiness Intelligence (BI)\n\nBusiness Intelligence Development Studio (BIDS)\n\nReporting Services\n\nBy Ref\n\nC\n\nC\n\nDLL\n\nC#\n\nC + +\n\n-c\n\nCA. See certificate authority\n\nCache Manager\n\nCalc\n\nCall Stack window\n\ncandidate keys\n\ncardinality\n\ncarte blanche\n\nCASCADE, WITH GRANT OPTION\n\nCASE\n\nCAST\n\n@category_ID\n\n@category_id\n\n@category_name\n\n-C < code page >\n\nCDATA\n\ncdata\n\nCEILING\n\nCert_ID\n\nCERTIFICATE\n\ncertificate authority (CA)\n\ncertificates, security\n\nCertProperty\n\nchange tracking, population\n\nCHANGETABLE\n\nCHANGE_TRACKING\n\nCHAR\n\nChar\n\nchar\n\ncharacter data. See cdata\n\nCHARINDEdi\n\nCHARINDEX\n\ncharts, Reporting Services\n\nCHECK\n\nnon-repeatable reads\n\ntriggers\n\nCHECK_CONSTRAINTS\n\nCHECK_EXPIRATION\n\ncheckpoint\n\nCHECKPOINT\n\nCheckpoint on Recovery\n\nCHECK_POLICY\n\nCHECKSUM\n\nCHECKSUM_AGG\n\nChildTable\n\nclient installations\n\n.NET\n\nsprocs\n\nClient Network Configuration\n\nClient Protocols\n\nClient Statistics\n\nclient-side vs. server-side\n\nADO.NET\n\nfilters\n\nLINQ\n\nresorting\n\nCLR. See Common Language Runtime\n\nclustered indexes\n\nB-Tree\n\nprimary keys\n\nCMDEXEC\n\ncmdExec\n\n@cmdexec_success_code\n\ncmdlets\n\nCOALESCE\n\nCOBOL\n\ncode\n\nblocks\n\nDELETE\n\nINSERT\n\nMERGE\n\nSMO\n\nUPDATE\n\nupdates\n\ncodeplex.com\n\ncollation\n\nCOLLATIONPROPERTY\n\ncollection sets\n\ncollections\n\nCOL_LENGTH\n\nCOL_NAME\n\nColumn Filters\n\nCOLUMNPROPERTY\n\ncolumns\n\nbcp\n\ndate\n\nfilters\n\nfull-text indexes\n\nindexes\n\njoins\n\nnamed\n\nnaming\n\nParentTable\n\nprimary key\n\nSELECT\n\nSQL Server Management Studio\n\nUNION\n\nunnamed\n\nCOLUMNS_UPDATED()\n\nBoolean\n\nCOM, DMO\n\ncomma delimited\n\n@command\n\nCommand Files, packages\n\nCommand Line, packages\n\nCommand window\n\ncommas\n\nCOMMIT TRAN\n\nCOMMIT, transactions\n\nCommon Language Runtime (CLR)\n\nassemblies\n\nCommon Table Expressions (CTEs)\n\nWITH\n\nrecursive queries\n\nCOMPRESSION\n\ncompression, tables\n\nCOMPUTE BY, CTEs\n\nCOMPUTER, CTEs\n\nconcatenation, EXEC\n\nconcurrency\n\ncursors\n\ntriggers\n\ncondition flags, triggers\n\nconfiguration functions\n\nConfiguration Manager\n\nReporting Services\n\nConfigurations, packages\n\nconflict management\n\npublishers\n\nreplication\n\nsubscribers\n\nConnection Managers, packages\n\n@@CONNECTIONS\n\nconstraints\n\nDiagram\n\nindexes\n\nlogical design\n\nSMO\n\ntriggers\n\nXML\n\nCONTAINS\n\nBoolean\n\nphrases\n\nWHERE\n\nCONTAINS FILESTREAM\n\nCONTAINSTABLE\n\nKEY\n\nContinue\n\nCONTINUE\n\nControl Flow\n\nControl Flow Items\n\ncontrol-of-flow statements\n\nCONVERT\n\n@cookie\n\nCOPY_ONLY\n\ncorrelated subqueries\n\naliases\n\njoins\n\nSELECT\n\nWHERE\n\nCOS\n\nCOT\n\nCOUNT\n\nCOUNT_BIG\n\ncovered queries\n\nCPU\n\njoins\n\nProfiler\n\nTEXT|ALL\n\n@@CPU_BUSY\n\nCREATE\n\nALTER INDEX\n\nEXISTS\n\nXML\n\nXML schema collections\n\nCreate()\n\nCREATE APPLICATION ROLE\n\nCREATE ASSEMBLY\n\nCREATE ASYMMETRIC KEY\n\nCREATE CERTIFICATE\n\nCREATE DATABASE\n\nfilestreams\n\nsecurityadmin\n\nuser permissions\n\nCREATE DEFAULT\n\nuser permissions\n\nCREATE FULLTEXT CATALOG\n\nCREATE FULLTEXT INDEX\n\nCREATE FULLTEXT INDEX ON < table name >\n\nCREATE FULLTEXT STOPLIST\n\nCREATE FUNCTION\n\nCREATE INDEX\n\nCREATE LOGIN\n\nCREATE PROCEDURE\n\nT-SQL\n\nuser permissions\n\nCREATE ROLE\n\nCREATE RULE\n\nuser permissions\n\nCREATE SCHEMA\n\nCREATE TABLE\n\nSMO\n\nuser permissions\n\nCREATE TRIGGER\n\nCREATE TYPE\n\nCREATE USER\n\nCREATE VIEW\n\nuser permissions\n\nCREATE VIEW < view name >\n\nCreateImportText.vbs\n\nCREATE < object type > < object name >\n\nCREATE<object> < object type >\n\nCreateTable\n\nCREDENTIAL\n\ncredentials\n\nReporting Services\n\nSQL Server Agent\n\nCROSS APPLY.nodes\n\nCROSS JOIN\n\ncryptographic functions\n\nCrystal Reports\n\n.csv\n\nCTEs. See Common Table Expressions\n\ncubes\n\naccessing\n\nanalysis\n\ndata\n\nAnalysis Services\n\nOLE DB\n\nExcel\n\ncurrent execution line\n\nCURRENT_TIMESTAMP\n\nCURRENT_USER\n\nCursor\n\ncursor\n\ncursor functions\n\n@@CURSOR_ROWS\n\ncursors\n\nADO\n\nADO.NET\n\navoiding\n\n[Direct Result]: isolation level\n\nleast restrictive\n\nISP. See Internet server provider\n\nisql\n\nIsRowGuid\n\nIS_SRVROLEMEMBER\n\nJ\n\nJDBC, cursors\n\nJOBID\n\n@job_id\n\nDatabase Mail\n\nGUID\n\nuniqueidentifier\n\n@job_name\n\njobs\n\ncreating\n\ndeleting\n\nDMO\n\nmaintaining\n\nmsdb database\n\nscheduling\n\nSQL Server Management Studio\n\nT-SQL\n\nUSE\n\nJOIN\n\nindexes\n\njoins\n\nalternative syntax\n\ncolumns\n\ncorrelated subqueries\n\nCPU\n\nFULL\n\ninner\n\nouter\n\nsubqueries\n\ntables\n\nK\n\n-k\n\nKEY, CONTAINSTABLE\n\nKEY INDEX\n\nkey value\n\nKey_GUID\n\nKey_ID\n\nkeys\n\nasymmetric, security\n\ncandidate\n\nforeign\n\nlockable resources\n\nprimary\n\nclustered indexes\n\ncolumns\n\ntables\n\nKEYSET\n\nkeyset-driven cursors\n\nkeywords\n\nBoolean\n\nFTS\n\nQuery Analyzer\n\nKILOBYTES_PER_BATCH = nn\n\nL\n\n-L last row\n\n@lang\n\n@@LANGID\n\nLANGUAGE\n\n@@LANGUAGE\n\nlatency\n\nmerge replication\n\nreplication\n\nLDAP. See lightweight directory access protocol\n\n.LDF\n\nleaf level nodes\n\nREORGANIZE\n\nLEFT\n\nlegacy systems\n\nLEN\n\nlightweight directory access protocol (LDAP)\n\nLIKE\n\nLIMITED\n\nlines\n\nLINESTRING\n\nlinking, Reporting Services\n\nLINQ\n\nclient-side vs. server-side\n\nfilters\n\n.NET\n\nresorting\n\nSMO\n\nLOCAL, cursors\n\nlocal subscribers\n\nLocals window\n\nlock manager\n\nlock modes\n\nlockable resources\n\nlocks\n\nBU\n\ncompatibility\n\nescalation\n\nexclusive\n\nintent exclusive\n\nintent shared\n\nranged\n\nSch-M\n\nSch-S\n\nshared\n\nSQL Server Management Studio\n\nupdate\n\n@@LOCK_TIMEOUT\n\nlog\n\nLOG\n\nLog Reader Agent, transactional replication\n\nLOG10\n\nLogging, packages\n\nlogical design\n\nconstraints\n\nrules\n\nstructure\n\nLogical Reads\n\nLogical Scan Fragmentation\n\nLogin\n\nnumber of tries\n\nroles\n\nsecurity\n\nsprocs\n\nstorage\n\nlogin\n\nFROM\n\nWITH\n\naltering\n\nbackward compatibility\n\ncreating\n\nData Collector\n\ndropping\n\nimporting\n\nSMO\n\nSQL Server Management Studio\n\nWindows Authentication\n\nWMI\n\nLOGIN\n\nLogin Name\n\n@loginame\n\nLOGREADER\n\nlogs, mirroring\n\nLong/Short\n\nlooping, WHILE\n\nlost data\n\nlost updates\n\nLOWER\n\nLTRIM\n\nM\n\nMACH\n\nmaintenance\n\nhardware\n\nindexes\n\nperformance\n\nMaintenance Plan\n\nmaintenance planning, indexes\n\nMaintenance Tasks\n\nManagement Studio. See SQL Server Management Studio\n\nMANUAL\n\nmany-to-many\n\nmaster database\n\nfull-text indexes\n\nMaterial Safety Data Sheets (MSDS)\n\nmathematical functions\n\nMAX\n\nmax text repl size\n\n@@MAX_CONNECTIONS\n\nMAXDOP\n\n@@MAX_PRECISION\n\n*.mdf\n\n.MDF\n\nMDX. See Multi-Dimensional Expressions\n\nmedia set\n\nMEDIADESCRIPTION\n\nMEDIANAME\n\nmemory\n\nMemory Manager\n\nMERGE\n\ncode\n\nDELETE\n\nDML\n\nINSERT\n\nMultiple Statements\n\nSELECT\n\nsemicolon\n\nTVPs\n\nUPDATE\n\nMerge\n\nMerge Agent\n\nmerge replication\n\nautonomy\n\nlatency\n\ntriggers\n\nMergePublication\n\nmessage ID\n\nMessage Queue Task\n\nmessage string\n\nmetadata\n\nmetadata\n\nmetadata functions\n\nMicrosoft Distributed Transaction Coordinator (MS DTC)\n\nMicrosoft Office SharePoint Services (MOSS)\n\nMicrosoft.SqlServer.ConnectionInfo\n\nMicrosoft.SqlServer.Management.Sdk.Sfc\n\nMicrosoft.SqlServer.RMO\n\nMicrosoft.SqlServer.Smo\n\nMicrosoft.SqlServer.Smo.dll\n\nMicrosoft.SqlServer.SmoExtended\n\nMicrosoft.SqlServer.SmoExtended.dll\n\nMicrosoft.SqlServer.SqlEnum\n\nMIN\n\nminipumps\n\nmirroring\n\nlogs\n\nMixed Authentication\n\n-m < maximum errors >\n\nmobile devices, replication\n\nmodel database\n\n.modify\n\nMonday\n\nMoney\n\nMONTH\n\nMOSS. See Microsoft Office SharePoint Services\n\nMOVE\n\n@mp:id\n\n@mp:localname\n\n@mp:namespacerui\n\n@mp:parentid\n\n@mp:prefix\n\n@mp:prev\n\n@mp:xmltext\n\nMS DTC. See Microsoft Distributed Transaction Coordinator\n\nmsdb database\n\njobs\n\ntasks\n\nMSDS. See Material Safety Data Sheets\n\nMSFTESQL\n\nMSSA\n\nMulti-Dimensional Expressions (MDX)\n\nsp_add_jobstep\n\nmultiple instances\n\nmultiple publishers\n\nmultiple solutions\n\nMultiple Statements, MERGE\n\nmultiple subscribers\n\nmultiprocessors\n\nMust Declare\n\nMUST_CHANGED\n\nN\n\n-N\n\n-n\n\nNAME\n\nname, transactions\n\nNamed Pipes\n\nTCP/IP\n\nname_in_db\n\nnames\n\nnamespace\n\nURL\n\nnaming, rules\n\nNative Client\n\ncursors\n\nNCHAR\n\nNChar\n\n*.ndf\n\nNEAR\n\nnested query\n\nmultiple values\n\nSELECT\n\nnested subquery\n\nnested triggers\n\n@@NESTLEVEL\n\n.NET\n\nADO.NET\n\nbcp\n\nclient installations\n\nDLL\n\nerror handling\n\nfilestreams\n\nIEnumerable\n\nLINQ\n\nPowerShell\n\nRMO\n\nSMO\n\nSSIS\n\nUDTs\n\nNET STOP MSSQLSERVER\n\nNet-Libraries (NetLibs)\n\nNetLibs. See Net-Libraries\n\nNetwork Configuration\n\nNew Job\n\nNEWID\n\nnewsgroups\n\nNO CREDENTIAL\n\nNO POPULATION\n\nNO RECOVERY\n\n.nodes\n\nCROSS APPLY\n\nXQuery\n\nNOEXEC\n\nNOFORMAT\n\nNO_INFOMSGS\n\nNOINIT\n\nnoise words\n\nnon-clustered indexes\n\non a clustered table\n\non a heap\n\nnon-exclusive subcategories\n\nnon-identifying relationships\n\nnon-leaf level nodes\n\nnon-repeatable reads\n\nNORECOMPUTE\n\nNORECOVERY\n\nnormalization. See also de-normalization\n\nOLTP\n\nNorthwind\n\nNorthwindSecure.sql\n\nNOT\n\nNOT EXISTS\n\nEXCEPT\n\nINTERSECT\n\nNOT FOR REPLICATION\n\nNOT IN\n\nNotification Services\n\n@notify_level_eventlog\n\nNOUNLOAD\n\nNOWAIT\n\nNT authentication. See Windows Authentication\n\nNT File System (NTFS)\n\nsecurity\n\nNT User Name\n\nNtext\n\nntext\n\nNT\n\n[Direct Result]: creating\n\ndropping\n\nmaster database\n\npopulation\n\nstop lists\n\nFull-Text Search (FTS)\n\nAcrobat\n\nAdventureWorks\n\narchitecture\n\nBoolean\n\ndatabases\n\nExcel\n\nindexes\n\nkeywords\n\nphrases\n\nproximity\n\nqueries\n\nWEIGHT\n\nWord\n\nFULLTEXTCATALOGPROPERTY\n\nFULLTEXTSERVICEPROPERTY\n\nG\n\nGAM. See Global Allocation Map\n\nGeneral Statistics\n\nGenerateImportFile\n\ngeodetic data\n\nGEOGRAPHY\n\nGEOGRAPHY\n\ngeodetic data\n\nGeography Markup Language (GML)\n\nGEOMETRY\n\nplanar data\n\nGetAncester()\n\nHierarchyID\n\nGETANSINULL\n\nGETDATE()\n\nGetDescendant\n\nGetDescendant( < child1 > , < child2 > )\n\nGetLevel\n\nGetLevel()\n\nGetReparentedValue( < old root > , < new root > )\n\nGetReparentedValue(), UPDATE\n\nGetRoot()\n\ngetting direct reports\n\nGETUTCDATE\n\nGlobal Allocation Map (GAM)\n\nGLOBAL, cursors\n\nglobal subscribers\n\nGlobal Variables\n\nGlobally Unique Identifier (GUID)\n\n@job_id\n\nGML. See Geography Markup Language\n\nGO\n\nADO\n\nADO.NET\n\nbatches\n\nODBC\n\nOLE DB\n\nT-SQL\n\nGOTO\n\ngrafting\n\nGRANT\n\nbulkadmin\n\nDENY\n\ngranularity\n\ngraphical showplan\n\nactual\n\nestimated\n\nhierarchy\n\nQuery Optimizer\n\nGROUP BY\n\nGROUPING\n\nguest accounts, security\n\nGUID. See Globally Unique Identifier\n\nH\n\nhardware\n\nbeing down\n\nCPU\n\ndriver support\n\nexclusive server\n\nideal\n\nI/O\n\nlost data\n\nmaintenance\n\nOLTP vs. OLAP\n\non-site vs. off-site\n\nRAID\n\nsecurity\n\nHAS_DBACCESS\n\nHASHED\n\nHAVING\n\n@hdoc\n\nheaps\n\n-h\"hint[,...]\"\n\nhide\n\nhierarchical data\n\nhorizontal indexing\n\nvertical indexing\n\nXML\n\nhierarchy\n\nEXPLICIT\n\ngraphical showplan\n\nhorizontal indexes\n\nlockable resources\n\nrecursive queries\n\nvertical indexes\n\nHierarchyID\n\nGetAncester()\n\nmethods\n\nstructure\n\nvalues\n\n-HINT\n\nHOLDLOCK, client-side vs. server-side\n\nhorizontal filtering\n\nhorizontal indexes, hierarchy\n\nhorizontal partitioning\n\nWHERE\n\nHOST_ID\n\nHOST_NAME\n\nhyhen, bcp\n\nI\n\nid\n\nXMLDATA\n\nIDEF1X\n\nIDENT_CURRENT\n\nidentifiers, objects\n\nidentifying relationship\n\nIDENT_INCR\n\nIDENTITY\n\n@@IDENTITY\n\nIDENTITY_INSERT ON\n\nIDENT_SEED\n\n@@IDLE\n\nidref\n\nXMLDATA\n\nidrefs\n\nUNION\n\nXMLDATA\n\nIE. See Information Engineering\n\nIEnumerable, .NET\n\nIF\n\nnon-repeatable reads\n\nIF EXISTS\n\nIF...ELSE\n\nsprocs\n\niFilter\n\nIGNORE_DUP_KEY\n\n-i < input file >\n\nIIS. See Internet Information Services\n\nImage\n\nimage\n\nimage functions\n\nimmediate-updating subscribers\n\nsnapshot replication\n\ntransactional replication\n\nimplicit transactions\n\nSET\n\nIMPLICIT_TRANSACTIONS\n\nImport/Export Wizard\n\nimporting\n\nbcp\n\nINSERT\n\nlogin\n\nSELECT\n\nimports\n\nin\n\nIN PATH\n\nINCLUDE\n\ninclude\n\nINCREMENTAL\n\nincremental population\n\nINDE\n\nIndex Tuning Wizard\n\nINDEX_COL\n\nindex_depth\n\nindexed view\n\nindexes\n\nbackward compatibility\n\nbreadth-first\n\nB-Tree\n\nchoices\n\nclustered\n\nB-Tree\n\nprimary keys\n\ncolumns\n\nconstraints\n\ndeletes\n\nfragmentation\n\nFTS\n\nfull-text\n\naltering\n\nbackward compatibility\n\ncolumns\n\ncreating\n\ndropping\n\nmaster database\n\npopulation\n\nstop lists\n\nhorizontal, hierarchy\n\ninserts\n\nJOIN\n\nmaintenance\n\nmaintenance planning\n\nnames\n\nnavigation\n\nnon-clustered\n\non a clustered table\n\non a heap\n\nORDER BY\n\npages\n\nselectivity\n\nSMO\n\nSQL Server Management Studio\n\nstorage\n\ntemporary tables\n\ntoken-based structure\n\ntriggers\n\nT-SQL\n\ntypes\n\nupdates\n\nvertical, hierarchy\n\nWHERE\n\nXML\n\ncreating\n\nPATH\n\nprimary\n\nPROPERTY\n\nsecondary\n\nVALUE\n\nINDEXKEY_PROPERTY\n\nIndexKeyType\n\nindex_level\n\nINDEXPROPERTY\n\nindex_type_desc\n\n[IN|EXISTS|ANY|ALL]\n\nINFECTIONAL, FREETEXT\n\nInformation Engineering (IE)\n\nentity box\n\ninformation_schema\n\nINIT\n\nInit\n\ninline errors\n\ninner joins\n\nINSERT\n\nbulkadmin\n\ncode\n\ndb_denydatawriter\n\nimporting\n\nMERGE\n\nobject permissions\n\nscripts\n\ntransactional replication\n\ntransactions\n\ntriggers\n\ninsert(s)\n\ndata warehousing\n\nindexes\n\nOLAP\n\nOLTP\n\nINSERT INTO\n\nINSERT INTO...SELECT\n\ninsert, XQuery\n\nINSERTED\n\nInserted\n\nINSERT..SELECT\n\nINST\n\n< instance of xml data type > .<method>\n\nINSTEAD OF\n\nSELECT\n\ntriggers\n\nINSTEAD OF DELETE, triggers\n\nINSTEAD OF INSERT, triggers\n\nINSTEAD OF UPDATE, triggers\n\nInt\n\nint\n\nIntegration Services. See SQL Server Integration Services\n\nintent exclusive lock\n\nintent locks\n\nintent shared lock\n\nInternet Information Services (IIS)\n\nInternet server provider (ISP)\n\nINTERSECT\n\nEXISTS\n\nNOT EXISTS\n\nINTO, CTEs\n\nInversion Entry\n\nInvoke-Sqlcmd\n\nI/O\n\nTEXT|ALL\n\n@@IO_BUSY\n\nIP addresses\n\nISABOUT()\n\nISAM\n\ncursors\n\nISDATE\n\nIsDescendantOf( < node > )\n\nIS_MEMBER\n\nISNULL\n\nISNUMERIC\n\nISOLATION LEVEL\n\nisolation levels\n\ntransaction isolation level\n\nleast restrictive\n\nISP. See Internet server provider\n\nisql\n\nIsRowGuid\n\nIS_SRVROLEMEMBER\n\nJ\n\nJDBC, cursors\n\nJOBID\n\n@job_id\n\nDatabase Mail\n\nGUID\n\nuniqueidentifier\n\n@job_name\n\njobs\n\ncreating\n\ndeleting\n\nDMO\n\nmaintaining\n\nmsdb database\n\nscheduling\n\nSQL Server Management Studio\n\nT-SQL\n\nUSE\n\nJOIN\n\nindexes\n\njoins\n\nalternative syntax\n\ncolumns\n\ncorrelated subqueries"
      ],
      "latency_s": 1.03,
      "rag_type": "literag",
      "dominio": "LiteRAG_Bench_01",
      "titulo": "",
      "error": ""
    },
    {
      "question": "What is the default transaction isolation level for Microsoft SQL Server 2008?",
      "ground_truth": "READ COMMITTED",
      "answer": "The default transaction isolation level for Microsoft SQL Server 2008 is **READ COMMITTED**.",
      "contexts": [
        "## Direct Evidence (Source Text)\n[Direct Result]: COMMITTED by adding the NOLOCK optimizer hint in your query. The advantage to setting the isolation level is that you don't have to use a hint for every table in your query, or use it in multiple queries. The advantage to using the NOLOCK optimizer hint is that you don't need to remember to set the isolation level back to the default for the connection. (With READ UNCOMMITTED you do.)\n\nREPEATABLE READ\n\nThe REPEATABLE READ escalates your isolation level somewhat, and provides an extra level of concurrency protection by preventing not only dirty reads (the default already does that) but also preventing non-repeatable reads.\n\nThat prevention of non-repeatable reads is a big upside, but holding even shared locks until the end of the transaction can block users' access to objects, and therefore hurt productivity. Personally, I prefer to use other data integrity options (such as a CHECK constraint together with error handling) rather than this choice, but it remains an available option.\n\nThe equivalent optimizer hint for the REPEATABLE READ isolation level is REPEATABLEREAD (these are the same, only no space).\n\nSERIALIZABLE\n\nSERIALIZABLE is something of the fortress of isolation levels. It prevents all forms of concurrency issues except for a lost update. Even phantoms are prevented.\n\nWhen you set your isolation to SERIALIZABLE, you're saying that any UPDATE, DELETE, or INSERT to the table or tables used by your transaction must not meet the WHERE clause of any statement in that transaction. Essentially, if the user was going to do something that your transaction would be interested in, then it must wait until your transaction has been completed.\n\nThe SERIALIZABLE isolation level can also be simulated by using the SERIALIZABLE or HOLDLOCK optimizer hint in your query. Again, as with the READ UNCOMMITTED and NOLOCK debate, the option of not having to set it every time versus not having to remember to change the isolation level back is the big issue.\n\nGoing with an isolation level of SERIALIZABLE would, on the surface, appear to be the way you want to do everything. Indeed, it does provide your database with the highest level of what is called consistency—that is, the update process works the same for multiple users as it would if all your users did one transaction at a time (processed things serially).\n\nAs with most things in life, however, there is a trade-off. Consistency and concurrency can, in a practical sense, be thought of as polar opposites. Making things SERIALIZABLE can prevent other users from getting to the objects they need; that equates to lower concurrency. The reverse is also true: Increasing concurrency (by going to a REPEATABLE READ for example) reduces the consistency of your database.\n\nMy personal recommendation on this is to stick with the default (READ COMMITTED) unless you have a specific reason not to.\n\nSNAPSHOT\n\nNote that the SNAPSHOT transaction isolation level is not available by default. To utilize it, you must enable the ALLOW_SNAPSHOT_ISOLATION option for your database utilizing the ALTER DATABASE command.\n\nThis was first added in SQL Server 2005, and was not particularly well publicized (and still isn't well documented if you ask me!). SNAPSHOT utilizes what is referred to as \"row versioning.\" Transactions that would have been blocked from a given record are instead allowed read access to that record in its last known good state, which is to say, the way it was before whatever transaction is blocking began its modifications to the row.\n\nSNAPSHOT is something of a mixed blessing. On one hand, concurrency is increased as read transactions are allowed to continue forward unabated with a value that is technically the correct value for that moment in time (at least in terms of what data has been truly committed). The down side, however, is that those transactions are being allowed to continue with data that has a significant chance of being inaccurate soon.\n\nWhich should you use? Well, as you can imagine, my answer would be \"It depends.\" The safer answer is to stick with the default of READ COMMITTED. Sometimes, however, we don't need that safety, and higher concurrency is the better choice.\n\nThe default isolation level of READ COMMITTED can be switched over to a version that utilizes row versioning, effectively the same as SNAPSHOT, by enabling the READ_COMMITTED_SNAPSHOT database option with the ALTER DATABASE command. Make certain however, that you know what you fully understand the differences between the two READ COMMITTED implementations before making such a change.\n\nDealing with Deadlocks (a.k.a. \"A 1205\")\n\nOkay. So now you've seen locks, and you've also seen transactions. Now that you've got both, we can move on to the rather pesky problem of dealing with deadlocks.\n\nAs we've already mentioned, a deadlock is not a type of lock in itself, but rather a situation where a paradox has been formed by other locks. Like it or not, you'll bump into these on a regular basis (particularly when you're just starting out), and you'll be greeted with an error number 1205. So prolific is this particular problem that you'll hear many a database developer refer to them simply by the number.\n\nDeadlocks are caused when one lock can't do what it needs to do in order to clear because a second lock is holding that resource, and vice versa. When this happens, somebody has to win the battle, so SQL Server chooses a deadlock victim. The deadlock victim's transaction is then rolled back and is notified that this happened through the 1205 error. The other transaction can continue normally. (Indeed, it will be entirely unaware that there was a problem, other than seeing an increased execution time.)\n\nHow SQL Server Figures Out There's a Deadlock\n\nEvery 5 seconds SQL Server checks all the current transactions for what locks they are waiting for but haven't yet been granted. As it\n\n[Direct Result]: —by utilizing the Activity Monitor.\n\nTo make use of Management Studio's lock display, just navigate to the Server and right-click, then choose Activity Monitor. You should come up with a new window that looks something like Figure 11.3 (I've expanded the Processes frame).\n\nFigure 11.3\n\nJust expand the node that you're interested in (either the Process ID or the Object), and you'll see various locks.\n\nPerhaps the coolest feature in Management Studio shows itself when you double-click a specific lock in the right-hand side of the window. A dialog box will come up and tell you the last statement that was run by that process ID. This can be very handy when you are troubleshooting deadlock situations.\n\nSetting the Isolation Level\n\nWe've seen that several different kinds of problems can be prevented by different locking strategies. We've also seen what kinds of locks are available and how they have an impact on the availability of resources. Now it's time to take a closer look at how these process management pieces work together to ensure overall data integrity and to make certain that you can get the results you expect.\n\nThe first thing to understand about the relationship between transactions and locks is that they are inextricably linked with each other. By default, any lock that is data modification related will, once created, be held for the duration of the transaction. If you have a long transaction, this means that your locks may be preventing other processes from accessing the objects you have a lock on for a long time. It probably goes without saying that this can be rather problematic.\n\nHowever, that's only the default. In fact, there are actually five different isolation levels that you can set at the transaction level:\n\n  * READ COMMITTED (the default)\n  * READ UNCOMMITTED\n  * REPEATABLE READ\n  * SERIALIZABLE\n  * SNAPSHOT\n\nThe syntax for switching between them is pretty straightforward:\n\nSET TRANSACTION ISOLATION LEVEL <READ COMMITTED|READ UNCOMMITTED\n\n|REPEATABLE READ|SERIALIZABLE|SNAPSHOT>\n\nThe change in isolation level will affect only the current connection. So you don't need to worry about adversely affecting other users (or them affecting you).\n\nLet's start by looking at the default situation (READ COMMITTED) a little more closely.\n\nREAD COMMITTED\n\nWith READ COMMITTED, any shared locks you create will be automatically released as soon as the statement that created them is complete. That is, if you start a transaction, run several statements, run a SELECT statement, and then run several more statements, the locks associated with the SELECT statement are freed as soon as the SELECT statement is complete. SQL Server doesn't wait for the end of the transaction.\n\nAction queries (UPDATE, DELETE, and INSERT) are a little different. If your transaction performs a query that modifies data, then those locks will be held for the duration of the transaction (in case you need to roll back).\n\nBy keeping this level of default, with READ COMMITTED, you can be sure that you have enough data integrity to prevent dirty reads. However, non-repeatable reads and phantoms can still occur.\n\nREAD UNCOMMITTED\n\nREAD UNCOMMITTED is the most dangerous of all isolation level choices but also has the highest performance in terms of speed.\n\nSetting the isolation level to READ UNCOMMITTED tells SQL Server not to set any locks, and not to honor any locks. With this isolation level, it is possible to experience any of the various concurrency issues we discussed earlier in the chapter (most notably a dirty read).\n\nWhy would one ever want to risk a dirty read? When I watch the newsgroups on Usenet, I see the question come up on a regular basis. It's surprising to a fair number of people, but there are actually good reasons to have this isolation level, and they are almost always to do with reporting.\n\nIn an OLTP environment, locks are both your protector and your enemy. They prevent data integrity problems, but they also often prevent, or block, you from getting at the data you want. It is extremely commonplace to see a situation where the management wants to run reports regularly, but the data entry people are often prevented from or delayed in entering data because of locks held by the manager's reports.\n\nBy using READ UNCOMMITTED, you can often get around this problem—at least for reports where the numbers don't have to be exact. For example, let's say that a sales manager wants to know just how much has been done in sales so far today. Indeed, we'll say he's a micro-manager and asks this same question (in the form of re-running the report) several times a day.\n\nIf the report happened to be a long-running one, then there's a high chance that his running it would damage the productivity of other users due to locking considerations. What's nice about this report though, is that it is a truly nebulous report. The exact values are probably meaningless. The manager is really just looking for ballpark numbers.\n\nBy having an isolation level of READ UNCOMMITTED, we do not set any locks, so we don't block any other transactions. Our numbers will be somewhat suspect (because of the risk of dirty reads), but we don't need exact numbers anyway, and we know that the numbers are still going to be close even on the off chance that a dirty read is rolled back.\n\nYou can get the same effect as READ UNCOMMITTED by adding the NOLOCK optimizer hint in your query. The advantage to setting the isolation level is that you don't have to use a hint for every table in your query, or use it in multiple queries. The advantage to using the NOLOCK optimizer hint is that you don't need to remember to set the isolation level back to the default for the connection. (With READ UNCOMMITTED you do.)\n\nREPEATABLE READ\n\nThe REPEATABLE READ escalates your isolation level somewhat,\n\n[Direct Result]: isolation level\n\nleast restrictive\n\nISP. See Internet server provider\n\nisql\n\nIsRowGuid\n\nIS_SRVROLEMEMBER\n\nJ\n\nJDBC, cursors\n\nJOBID\n\n@job_id\n\nDatabase Mail\n\nGUID\n\nuniqueidentifier\n\n@job_name\n\njobs\n\ncreating\n\ndeleting\n\nDMO\n\nmaintaining\n\nmsdb database\n\nscheduling\n\nSQL Server Management Studio\n\nT-SQL\n\nUSE\n\nJOIN\n\nindexes\n\njoins\n\nalternative syntax\n\ncolumns\n\ncorrelated subqueries\n\nCPU\n\nFULL\n\ninner\n\nouter\n\nsubqueries\n\ntables\n\nK\n\n-k\n\nKEY, CONTAINSTABLE\n\nKEY INDEX\n\nkey value\n\nKey_GUID\n\nKey_ID\n\nkeys\n\nasymmetric, security\n\ncandidate\n\nforeign\n\nlockable resources\n\nprimary\n\nclustered indexes\n\ncolumns\n\ntables\n\nKEYSET\n\nkeyset-driven cursors\n\nkeywords\n\nBoolean\n\nFTS\n\nQuery Analyzer\n\nKILOBYTES_PER_BATCH = nn\n\nL\n\n-L last row\n\n@lang\n\n@@LANGID\n\nLANGUAGE\n\n@@LANGUAGE\n\nlatency\n\nmerge replication\n\nreplication\n\nLDAP. See lightweight directory access protocol\n\n.LDF\n\nleaf level nodes\n\nREORGANIZE\n\nLEFT\n\nlegacy systems\n\nLEN\n\nlightweight directory access protocol (LDAP)\n\nLIKE\n\nLIMITED\n\nlines\n\nLINESTRING\n\nlinking, Reporting Services\n\nLINQ\n\nclient-side vs. server-side\n\nfilters\n\n.NET\n\nresorting\n\nSMO\n\nLOCAL, cursors\n\nlocal subscribers\n\nLocals window\n\nlock manager\n\nlock modes\n\nlockable resources\n\nlocks\n\nBU\n\ncompatibility\n\nescalation\n\nexclusive\n\nintent exclusive\n\nintent shared\n\nranged\n\nSch-M\n\nSch-S\n\nshared\n\nSQL Server Management Studio\n\nupdate\n\n@@LOCK_TIMEOUT\n\nlog\n\nLOG\n\nLog Reader Agent, transactional replication\n\nLOG10\n\nLogging, packages\n\nlogical design\n\nconstraints\n\nrules\n\nstructure\n\nLogical Reads\n\nLogical Scan Fragmentation\n\nLogin\n\nnumber of tries\n\nroles\n\nsecurity\n\nsprocs\n\nstorage\n\nlogin\n\nFROM\n\nWITH\n\naltering\n\nbackward compatibility\n\ncreating\n\nData Collector\n\ndropping\n\nimporting\n\nSMO\n\nSQL Server Management Studio\n\nWindows Authentication\n\nWMI\n\nLOGIN\n\nLogin Name\n\n@loginame\n\nLOGREADER\n\nlogs, mirroring\n\nLong/Short\n\nlooping, WHILE\n\nlost data\n\nlost updates\n\nLOWER\n\nLTRIM\n\nM\n\nMACH\n\nmaintenance\n\nhardware\n\nindexes\n\nperformance\n\nMaintenance Plan\n\nmaintenance planning, indexes\n\nMaintenance Tasks\n\nManagement Studio. See SQL Server Management Studio\n\nMANUAL\n\nmany-to-many\n\nmaster database\n\nfull-text indexes\n\nMaterial Safety Data Sheets (MSDS)\n\nmathematical functions\n\nMAX\n\nmax text repl size\n\n@@MAX_CONNECTIONS\n\nMAXDOP\n\n@@MAX_PRECISION\n\n*.mdf\n\n.MDF\n\nMDX. See Multi-Dimensional Expressions\n\nmedia set\n\nMEDIADESCRIPTION\n\nMEDIANAME\n\nmemory\n\nMemory Manager\n\nMERGE\n\ncode\n\nDELETE\n\nDML\n\nINSERT\n\nMultiple Statements\n\nSELECT\n\nsemicolon\n\nTVPs\n\nUPDATE\n\nMerge\n\nMerge Agent\n\nmerge replication\n\nautonomy\n\nlatency\n\ntriggers\n\nMergePublication\n\nmessage ID\n\nMessage Queue Task\n\nmessage string\n\nmetadata\n\nmetadata\n\nmetadata functions\n\nMicrosoft Distributed Transaction Coordinator (MS DTC)\n\nMicrosoft Office SharePoint Services (MOSS)\n\nMicrosoft.SqlServer.ConnectionInfo\n\nMicrosoft.SqlServer.Management.Sdk.Sfc\n\nMicrosoft.SqlServer.RMO\n\nMicrosoft.SqlServer.Smo\n\nMicrosoft.SqlServer.Smo.dll\n\nMicrosoft.SqlServer.SmoExtended\n\nMicrosoft.SqlServer.SmoExtended.dll\n\nMicrosoft.SqlServer.SqlEnum\n\nMIN\n\nminipumps\n\nmirroring\n\nlogs\n\nMixed Authentication\n\n-m < maximum errors >\n\nmobile devices, replication\n\nmodel database\n\n.modify\n\nMonday\n\nMoney\n\nMONTH\n\nMOSS. See Microsoft Office SharePoint Services\n\nMOVE\n\n@mp:id\n\n@mp:localname\n\n@mp:namespacerui\n\n@mp:parentid\n\n@mp:prefix\n\n@mp:prev\n\n@mp:xmltext\n\nMS DTC. See Microsoft Distributed Transaction Coordinator\n\nmsdb database\n\njobs\n\ntasks\n\nMSDS. See Material Safety Data Sheets\n\nMSFTESQL\n\nMSSA\n\nMulti-Dimensional Expressions (MDX)\n\nsp_add_jobstep\n\nmultiple instances\n\nmultiple publishers\n\nmultiple solutions\n\nMultiple Statements, MERGE\n\nmultiple subscribers\n\nmultiprocessors\n\nMust Declare\n\nMUST_CHANGED\n\nN\n\n-N\n\n-n\n\nNAME\n\nname, transactions\n\nNamed Pipes\n\nTCP/IP\n\nname_in_db\n\nnames\n\nnamespace\n\nURL\n\nnaming, rules\n\nNative Client\n\ncursors\n\nNCHAR\n\nNChar\n\n*.ndf\n\nNEAR\n\nnested query\n\nmultiple values\n\nSELECT\n\nnested subquery\n\nnested triggers\n\n@@NESTLEVEL\n\n.NET\n\nADO.NET\n\nbcp\n\nclient installations\n\nDLL\n\nerror handling\n\nfilestreams\n\nIEnumerable\n\nLINQ\n\nPowerShell\n\nRMO\n\nSMO\n\nSSIS\n\nUDTs\n\nNET STOP MSSQLSERVER\n\nNet-Libraries (NetLibs)\n\nNetLibs. See Net-Libraries\n\nNetwork Configuration\n\nNew Job\n\nNEWID\n\nnewsgroups\n\nNO CREDENTIAL\n\nNO POPULATION\n\nNO RECOVERY\n\n.nodes\n\nCROSS APPLY\n\nXQuery\n\nNOEXEC\n\nNOFORMAT\n\nNO_INFOMSGS\n\nNOINIT\n\nnoise words\n\nnon-clustered indexes\n\non a clustered table\n\non a heap\n\nnon-exclusive subcategories\n\nnon-identifying relationships\n\nnon-leaf level nodes\n\nnon-repeatable reads\n\nNORECOMPUTE\n\nNORECOVERY\n\nnormalization. See also de-normalization\n\nOLTP\n\nNorthwind\n\nNorthwindSecure.sql\n\nNOT\n\nNOT EXISTS\n\nEXCEPT\n\nINTERSECT\n\nNOT FOR REPLICATION\n\nNOT IN\n\nNotification Services\n\n@notify_level_eventlog\n\nNOUNLOAD\n\nNOWAIT\n\nNT authentication. See Windows Authentication\n\nNT File System (NTFS)\n\nsecurity\n\nNT User Name\n\nNtext\n\nntext\n\nNT"
      ],
      "latency_s": 11.8,
      "rag_type": "literag",
      "dominio": "LiteRAG_Bench_01",
      "titulo": "",
      "error": ""
    },
    {
      "question": "Which Java keyword prevents a class from being extended through inheritance?",
      "ground_truth": "final",
      "answer": "The provided text does not explicitly state which Java keyword prevents a class from being extended through inheritance. However, it does mention the concept of an \"abstract class\" which prevents an instance of the class from being created, but not necessarily from being extended. The text also discusses \"protected\" access modifiers which limit where methods and variables can be accessed, but not inheritance itself.",
      "contexts": [
        "## Direct Evidence (Source Text)\n[Direct Result]: of an object.\n\nObject\n\nAn instance of a class.\n\nOOP\n\nObject-Oriented Programming.\n\nOverloading\n\nA method in the same class that has the same name but a different number of parameters, different types of parameters, or parameters of different types in a different order.\n\nOverriding\n\nA method in a subclass that has the same name and also the same number and type of parameters as the one in the superclass.\n\nPolymorphism\n\nThe type of an object referenced by a superclass variable determined at runtime.\n\nPseudocode\n\nA design tool consisting of a combination of English and a programming language that helps one concentrate on logic instead of syntax when developing a program.\n\nRAM\n\nRandom Access Memory.\n\nRecursion\n\nA definition that is defined in terms of itself and includes a base or terminal case.\n\nSelection structure s\n\nAllows a program to follow one of more paths, sometimes called decision structures.\n\nSemantics\n\nThe meaning of what each instruction does in a programming language.\n\nSyntax\n\nThe grammar of a programming language.\n\nUML\n\nUniversal Modeling Language.\n\nVariables\n\nNamed memory locations used to store data in a program.\n\n## Appendix E: Answers to Selected Exercises\n\n### Chapter 1\n\n1.B.\n\nCorrect.\n\n1.D.\n\nIncorrect, a double number cannot be assigned to a variable of integer type.\n\n2.A.\n\n0\n\n3.B.\n\n5.34\n\n4.B.\n\nfinal double EULER_NUMBER = 2.7182 ;\n\n6.\n\nSystem.out.println(\"** **\");\n\nSystem.out.println(\"** **\");\n\nSystem.out.println(\" ****\");\n\nSystem.out.println(\" ****\");\n\nSystem.out.println(\" ****\");\n\nSystem.out.println(\" ****\");\n\nSystem.out.println(\"** **\");\n\nSystem.out.println(\"** **\");\n\n7.\n\nAfter execution, value1 is 9 , value2 is 4 , and value3 is 9 .\n\n8.B.\n\ns = r * Math.PI * Math.sqrt(Math.pow(r,2) + Math.pow(h,2));\n\n### Chapter 2\n\n1.A.\n\nIncorrect, it should be Circle circle = new Circle();\n\n1.C.\n\nCorrect.\n\n4.A.\n\nCircle innerCircle;\n\ninnerCircle = new Circle();\n\n4.C.\n\nSystem.out.println(\"The value of radius is \"\n\n\\+ innerCircle.getRadius());\n\n6.\n\nAnswers to A. and D. of the Cone class\n\n### Chapter 3\n\n1.A.\n\n40\n\n2.B.\n\n50\n\n3.C.\n\n3\n\n5.A.\n\ntrue || false → true\n\n5.C.\n\ntrue || flag1 && flag2 → true || false → true\n\n5.E.\n\n(true || false) && false → true && false → false\n\n8.\n\n9.\n\n### Chapter 4\n\n2.\n\n, in the for statement\n\n3.\n\nsum = 1\n\ncount = 2\n\nsum = 3\n\ncount = 3\n\nsum = 6\n\ncount = 4\n\nsum = 10\n\ncount = 5\n\nsum = 10\n\ncount = 5\n\n6.\n\n**\n\n****\n\n******\n\n********\n\n**********\n\n7.B.\n\nint total, count\n\ntotal = 0;\n\ncount = 1;\n\ndo {\n\ntotal += count;\n\ncount += 3;\n\n} while (count <= 40);\n\n8.A.\n\nint total, count, n;\n\ntotal = 0;\n\nn = 5;\n\nfor(count = 0; count < n; count++) {\n\ntotal += count;\n\n}\n\n### Chapter 5\n\n1.\n\nconstructor 1 : valid\n\nconstructor 3 : invalid\n\n2.\n\nmethod 2 : invalid\n\nmethod 6: valid\n\nmethod 10 : valid\n\n6.\n\nanswers to A., B., C., and F. of the Cone class\n\n### Chapter 6\n\n1.B.\n\nThe second line should be text2 = new String(\"Shedding blade\");\n\n2.B.\n\n34\n\n2.D.\n\nHose_\n\n7.\n\n### Chapter 7\n\n1.B.\n\nIncorrect, the size has to be specified.\n\n1.C.\n\nIncorrect, the braces have to be used instead of the square brackets.\n\n1.E.\n\nIncorrect, the size should not be specified.\n\n2.\n\nint total = 0;\n\nfor(int i=0; i<intArray.length; i++)\n\nif(i%2 == 0)\n\ntotal = total + intArray[i];\n\n5.\n\n3\n\n4\n\n3\n\n7.\n\n### Chapter 8\n\n7.\n\npublic static String reverseStr(String str) {\n\nif(str.length() <= 1)\n\nreturn str;\n\nreturn reverseStr(str.substring(1)) + str.charAt(0);\n\n}\n\n9.\n\npublic static int factorial(int n) {\n\nif(n == 0)\n\nreturn 1;\n\nelse\n\nreturn n * factorial(n-1);\n\n}\n\n### Chapter 9\n\n1.B.\n\nIncorrect, a variable of a subclass type cannot reference an object of a superclass type.\n\n1.C.\n\nCorrect.\n\n2.B.\n\ncalcRegPolyArea and toString .\n\n2.D.\n\nYes.\n\n3.\n\n### Chapter 10\n\n1.B.\n\nIncorrect, there is no constructor in the File Class which takes the FileReader object as a parameter.\n\n1.D.\n\nCorrect.\n\n3.\n\nReferences and Useful Websites\n\nReferences\n\n1.\n\nJohnson JB (1971) The contour model of block structured processes. SIGPLAN Notices 6(2):55–72\n\n2.\n\nOrganick EI, Forsythe AI, Plummer RP (1978) Programming language structures. Academic Press, New York\n\n3.\n\nStreib JT, Soma T (2010) Using contour diagrams and JIVE to illustrate object-oriented semantics in the Java programming language. In: SIGCSE '10: Proceedings of the 41st ACM technical symposium on computer science education. Milwaukee, WI, USA, pp 510–514\n\n4.\n\nStreib JT (2011) Guide to assembly language: a concise introduction. Springer, London\n\nUseful Websites\n\n\"Class File,\" information on File class discussed in Chapter 10: http://​docs.​oracle.​com/​javase/​7\n\n[Direct Result]: Is there a way that this can be accomplished? Again, as might be suspected, just as variables can be made accessible only by a subclass, this can also be true for methods. This is accomplished again using protected instead of public as shown in the following headings:\n\nprotected RegPolygon(int lenSide) {\n\nprotected double calcRegPolyArea() {\n\nThis corresponds to the previous suggestion that variables should remain private and only accessed through methods. Further, these methods can only be accessed from other methods within the class or any subclasses, and not from the main program.\n\n## 9.3 Abstract Classes\n\nGiven the program in Fig. 9.5, there is nothing preventing the main program from creating an instance of the RegPolygon class. Although not very useful, even if the variable lenSide is private and the methods are protected, an instance could be created. Is there a way to make it so that an instance of the class cannot be created? Yes, and it is known as an abstract class. The result is that subclasses can still be defined, yet an instance of the superclass cannot be created. The following first line of the RegPolygon class shows how this is accomplished:\n\nabstract class RegPolygon {\n\nIf it is possible to create an abstract class, is it also possible to create an abstract method? The answer again is yes. When creating an abstract method, the heading is declared in the superclass, but the body of the method is not defined as in the following:\n\npublic abstract double calcArea();\n\nAgain, note that there is no body to the method and the first line of the method ends in a semicolon. If the heading is in the superclass and there is no body to the method, where is the body defined? The complete method is defined in the subclass as it was before and as shown below:\n\npublic double calcArea() {\n\ndouble area;\n\narea = Math.sqrt(3.0) * calcRegPolyArea() / 4.0;\n\nreturn area;\n\n}\n\nIf the above method is the same as before, what is the advantage of doing this? The advantage is that it allows different subclasses to have different methods using the same heading to meet the needs of each subclass. For example, instead of a triangle, consider an octagon:\n\nThe name for this new class could be Octagon. Further, since the equation for an octagon is  , it could also be a subclass of the RegPolygon class. Since the formula s 2 is the same, the calcRegPolyArea method of the RegPolygon class could be invoked, but unlike the calculation for the area of the triangle, it would not need to be multiplied by   but rather multiplied by  . There is no change to the Triangle class and the new Octogon class is as follows:\n\nclass Octagon extends RegPolygon {\n\npublic Octagon(int lenSide) {\n\nsuper(lenSide);\n\n}\n\npublic double calcArea()\n\ndouble area;\n\narea = 2.0 * (1.0 + Math.sqrt(2.0)) * calcRegPolyArea();\n\nreturn area;\n\n}\n\n}\n\nNote in the first line that the Octagon class extends the RegPolygon class. Next, notice in the calcArea method that calcRegPolyArea() is not multiplied by   but rather by   as mentioned above.\n\nNote that an abstract class does not have to have any abstract methods, but if a class has abstract methods, the class needs to be declared as an abstract class. Using an abstract method in the superclass forces both subclasses to define different calcArea methods, and if the methods were not declared, a syntax error would occur. This is a handy feature to have when there are some differences in various subclasses, yet it is desired to retain some commonality among the subclasses.\n\n## 9.4 Polymorphism\n\nAnother important feature of object-oriented programming is polymorphism, where the type of an object that is referenced by a superclass variable is determined at runtime instead of at compile time. This concept will be illustrated with the help of examples below.\n\nIn Java, a variable of a superclass type can reference an object of any of its subclasses. In other words, both an object of the superclass and an object of a subclass can be referenced by a variable of the superclass type. Consider the definition of the class RegPolygon shown in Fig. 9.1 which is repeated below for convenience:\n\nclass RegPolygon {\n\nprivate int lenSide;\n\npublic RegPolygon(int lenSide) {\n\nthis.lenSide = lenSide;\n\n}\n\npublic double calcRegPolyArea() {\n\ndouble a;\n\na = Math.pow(lenSide, 2);\n\nreturn a;\n\n}\n\n}\n\nFurther, the class Triangle from Fig. 9.3, with the modification described in Fig. 9.13 with the method calcArea renamed to calcRegPolyArea, is shown below:\n\nclass Triangle extends RegPolygon {\n\npublic Triangle(int lenSide) {\n\nsuper(lenSide);\n\n}\n\npublic double calcRegPolyArea() {\n\ndouble area;\n\narea = Math.sqrt(3.0) / 4.0 * super.calcRegPolyArea();\n\nreturn area;\n\n}\n\n}\n\nThe class Triangle is a subclass of the class RegPolygon, and the method calcRegPolyArea in the Triangle class is overriding the method calcRegPolyArea in the RegPolygon class. Suppose two variables of type RegPolygon are declared in the main method as follows:\n\nRegPolygon shape1, shape2;\n\nNaturally, a reference to an object of the class RegPolygon can be assigned to these variables. For example, the following statement assigns an object of the RegPolygon class to the variable shape1.\n\nshape1 = new RegPolygon(5);\n\nIn addition, a reference to an object of the class Triangle can also be assigned to these variables. The following statement assigns an object of the Triangle class to the variable shape2.\n\nshape2 = new Triangle(2);\n\nNext, using the method calcRegPolyArea defined in both the class RegPolygon and the class Triangle, the square of\n\n[Direct Result]: 1  and Takako Soma1\n\n(1)\n\nDepartment of Computer Science, Illinois College, Jacksonville, IL, USA\n\nAbstract\n\nThis chapter returns to objects and explores the concepts of inheritance. Contours are used to explain how a subclass is extended and inherits data members and methods from a superclass. Further, protected variables and methods along with abstract classes are discussed. Another object-oriented programming concept, polymorphism, which is a useful tool for developing software, is introduced. A complete program implementing inheritance and polymorphism is included.\n\nObjects were introduced in Chap.​ 2, and topics such as passing objects, method overloading, and class methods were discussed in Chap.​ 5. In this chapter the concepts of inheritance, overriding methods, abstract classes, and polymorphism will be illustrated. At first these concepts might sound a little bit intimidating, but introducing them with simple programs and contour diagrams makes the concepts easier to understand.\n\n## 9.1 Inheritance\n\nAn important concept in object-oriented programming is software reuse. Writing a program when the same code needs to be written and rewritten with minor variations can be time-consuming and can also waste memory. Further, if the code has already been written for one situation, rewriting it not only wastes time and memory, but the chance of making a logic error in subsequent versions also increases. Instead, it makes sense to reuse software that has already been written and tested. A further advantage of software reuse is with the maintaining of code. When a segment needs to be changed, it only needs to be changed in one place, and again the chance of introducing logic errors decreases. An important way of maximizing software reuse is through inheritance.\n\nWhen a new class is created using inheritance, the new class can inherit data members and methods from an already existing class. The existing class is known as the parent class and the new class is called the child class. Also, the parent class is sometimes called the base class and the child class is called the derived class. An even more common name for the base class is the superclass, and the derived class is then called the subclass.\n\nAs an example, a regular polygon has equal length sides. Further, a three-sided regular polygon is an equilateral triangle, a four-sided regular polygon is a square, a six-sided regular polygon is a hexagon, and an eight-sided regular polygon is an octagon. Although there exists a generic formula for the area for an n-sided regular polygon, this text will use the specific algebraic formulas for each of the regular polygons to help illustrate the concepts of inheritance, overriding methods, abstract classes, and polymorphism.\n\nThe specific equations for the area of each of these polygons share a common part: the length of one of its sides squared or s 2. One might recognize this is also the equation for a square, and because a square is such a simple example, it is not included in subsequent examples. Since this equation is shared by all the other equations, it can be made local to the class for a regular polygon. As a result, a regular polygon can be thought of as the superclass, and the triangle, hexagon, and octagon can be thought of as subclasses.\n\nUsing a simple example, consider the RegPoygon class as shown in Fig. 9.1. Given the previous chapters on classes, the RegPoygon class should look fairly familiar. Notice the local private variable lenSide which is for the length of a side. The constructor initializes the variable with the value sent via the parameter. Further, there is one method that squares the length of the side using the pow method from the Math class. Lastly, as before, there is a local variable in the method that helps when using contour diagrams, but if memory were an issue, it could be eliminated and the expression could be used in the return statement.\n\nFig. 9.1\n\nRegPolygon class\n\nA main program segment that tests this class is shown in Fig. 9.2. Again, the statements in this program should be fairly familiar. A value is input from the user and a new instance of the RegPolygon class is created using the value that was input. Then the method is invoked and the value returned is output.\n\nFig. 9.2\n\nMain program segment using the RegPolygon class\n\nHowever, what if one wanted to write a new class for a triangle with a method to calculate the area of a triangle? One could just write the necessary expression and be done with it.\n\nHowever, as mentioned previously, isn't a triangle a regular polygon? The equation for the area of an equilateral triangle is   which includes s 2. If the RegPolygon class already exists, then couldn't methods of that class be used? The answer as one might suspect is yes. The RegPolygon class would then be the superclass and the Triangle class would be a subclass, and the Triangle class could inherit methods from the RegPolygon class. Another way of saying this is that the Triangle class is an extension of the RegPolygon class.\n\nHow is this accomplished in a program? The first line in the Triangle class would indicate that it extends the RegPolygon class as follows:\n\nclass Triangle extends RegPolygon {\n\nBy doing so, the Triangle class now has access to the data member, method, and constructor in the RegPolygon class. So instead of having to rewrite code segments, it can now reuse these code segments. How is this accomplished?\n\nFirst, it helps to look at the constructor for the Triangle class. Since the RegPolygon class already contains the variable lenSide and a Triangle is an extension of a RegPolygon, instead of declaring a local private variable, the variable in the RegPolygon class could be reused. And instead of initializing it in the Triangle class, the constructor in the RegPolygon class can also be reused. The constructor in the superclass RegPolygon is invoked by using super(lenSide) as shown in the following constructor:\n\npublic Triangle(int lenSide"
      ],
      "latency_s": 20.35,
      "rag_type": "literag",
      "dominio": "LiteRAG_Bench_01",
      "titulo": "",
      "error": ""
    },
    {
      "question": "What is the mechanism in Java where a subclass provides a specific implementation of a method already defined in its superclass?",
      "ground_truth": "Overriding",
      "answer": "The mechanism in Java where a subclass provides a specific implementation of a method already defined in its superclass is called **overriding**.\n\nThe context states: \"A method in a subclass that has the same name, the same number of parameters, and the same type of parameters as another method in the superclass is known as an **overriding method**.\"",
      "contexts": [
        "## Direct Evidence (Source Text)\n[Direct Result]: previously. Then as Line 24 is executed, the method calcRegPolyArea is invoked, and the value for the variable a is calculated as shown just prior to Line 36 in Fig. 9.10.\n\nFig. 9.10\n\nContour just prior to the execution of Line 36 in calcRegPolyArea\n\nUpon return from the method calcRegPolyArea, the state of execution just prior to Line 25 is shown in Fig. 9.11. Lastly, control is returned to the main program as shown just prior to output of the area on Line 14 in Fig. 9.12.\n\nFig. 9.11\n\nContour prior to the execution of Line 25 in calcArea\n\nFig. 9.12\n\nContour prior to the execution of Line 14 in the main program\n\nHowever, what if the name of the calcArea method in the Triangle class was changed to calcRegPolyArea? Would this cause a problem with the method calcRegPolyArea in the RegPolygon class? The answer is yes, because calcRegPolyArea in the Triangle class would have the same number and type of parameters as the calcRegPolyArea method in the RegPolygon class. A method in a subclass that has the same name, the same number of parameters, and the same type of parameters as another method in the superclass is known as an overriding method. Does this mean that there cannot be two methods of the same name, the same number of parameters, and same type of parameters, one in the superclass and one in the subclass? The answer is no, but if there is an overriding method, how does one access the method in the superclass? If calcRegPolyArea is invoked in the subclass, the method in the subclass would be used, and in this case it would recursively call itself which is not what is intended. As mentioned earlier, there are instances where the word super must be used and this is one of those instances. So, should one want to access the calcRegPolyArea method in the superclass, then the word super is no longer optional and must be used as shown in the segment in Fig. 9.13.\n\nFig. 9.13\n\nOverriding the calcRegPolyArea() method\n\nFirst, note that the name of the method has been changed from calcArea to calcRegPolyArea. Further, by including the word super prior to the call to calcRegPolyArea, the method in the superclass RegPolygon is invoked instead of recursively calling the calcRegPolyArea method in the subclass. Again, in this case the word super is not optional. Using the word super only when it is needed helps alert other programmers reading the code that there are two methods of the same name. For now, instead of changing the method name to calcRegPolyArea, the program in Fig. 9.5 will retain the method name calcArea.\n\n## 9.2 Protected Variables and Methods\n\nIn the program in Fig. 9.5, what would happen if a method in the Triangle class tried to access the variable in the RegPolygon class? Specifically, what if the constructor in the Triangle class tried to access the variable lenSide in the RegPolygon class? The answer is the same as if trying to access the variable from the main program. If a variable is private, then it can only be accessed by methods in the RegPolygon class; thus the variable lenSide is initialized using the constructor.\n\nHowever, if a variable were made public, then the methods of the subclass could access it. Unfortunately, the variable would also be accessible from the main program as well. Is there a way that would allow only methods in the subclass to access a variable in the superclass, but still not allow the variable to be accessed from the main program? The answer is yes. Instead of private or public access, protected access can be used as shown in the following:\n\nprotected int lenSide;\n\nNow instead of initializing the variables via the RegPolygon constructor, the variables can be accessed directly as in the following modified Triangle constructor:\n\npublic Cylinder(int lenSide) {\n\nsuper.lenSide = lenSide;\n\n}\n\nTo access the variable lenSide in the RegPolygon class, notice the use of the word super. Also note that this could have been used instead of super, but the use of the word super is preferred because it alerts programmers who might subsequently read the code that the variable is not located in the current class but rather in the superclass.\n\nSince the RegPolygon constructor would no longer be invoked, it could be deleted. However, if it was retained, but not invoked, a default constructor would need to be added to the RegPolygon class as follows:\n\npublic RegPolygon() {\n\n}\n\nAlthough accessing a variable in this manner works and is better than declaring a variable as public, it can still suffer from some of the same problems as being declared public when there are a large number of subclasses. As a result, given a choice between accessing a protected variable or accessing a private variable via a method, this text will generally choose the latter as shown previously in Fig. 9.5.\n\nHowever, notice in Fig. 9.5 that although the variables in the RegPolygon class are private, the methods are public. While this is acceptable when access to the method is needed by both the main program and a subclass, what if access is only needed via the subclass and not from the main program? Is there a way that this can be accomplished? Again, as might be suspected, just as variables can be made accessible only by a subclass, this can also be true for methods. This is accomplished again using protected instead of public as shown in the following headings:\n\nprotected RegPolygon(int lenSide) {\n\nprotected double calcRegPolyArea() {\n\nThis corresponds to the previous suggestion that variables should remain private and only accessed through methods. Further, these methods can only be accessed from other methods within the class\n\n[Direct Result]: Is there a way that this can be accomplished? Again, as might be suspected, just as variables can be made accessible only by a subclass, this can also be true for methods. This is accomplished again using protected instead of public as shown in the following headings:\n\nprotected RegPolygon(int lenSide) {\n\nprotected double calcRegPolyArea() {\n\nThis corresponds to the previous suggestion that variables should remain private and only accessed through methods. Further, these methods can only be accessed from other methods within the class or any subclasses, and not from the main program.\n\n## 9.3 Abstract Classes\n\nGiven the program in Fig. 9.5, there is nothing preventing the main program from creating an instance of the RegPolygon class. Although not very useful, even if the variable lenSide is private and the methods are protected, an instance could be created. Is there a way to make it so that an instance of the class cannot be created? Yes, and it is known as an abstract class. The result is that subclasses can still be defined, yet an instance of the superclass cannot be created. The following first line of the RegPolygon class shows how this is accomplished:\n\nabstract class RegPolygon {\n\nIf it is possible to create an abstract class, is it also possible to create an abstract method? The answer again is yes. When creating an abstract method, the heading is declared in the superclass, but the body of the method is not defined as in the following:\n\npublic abstract double calcArea();\n\nAgain, note that there is no body to the method and the first line of the method ends in a semicolon. If the heading is in the superclass and there is no body to the method, where is the body defined? The complete method is defined in the subclass as it was before and as shown below:\n\npublic double calcArea() {\n\ndouble area;\n\narea = Math.sqrt(3.0) * calcRegPolyArea() / 4.0;\n\nreturn area;\n\n}\n\nIf the above method is the same as before, what is the advantage of doing this? The advantage is that it allows different subclasses to have different methods using the same heading to meet the needs of each subclass. For example, instead of a triangle, consider an octagon:\n\nThe name for this new class could be Octagon. Further, since the equation for an octagon is  , it could also be a subclass of the RegPolygon class. Since the formula s 2 is the same, the calcRegPolyArea method of the RegPolygon class could be invoked, but unlike the calculation for the area of the triangle, it would not need to be multiplied by   but rather multiplied by  . There is no change to the Triangle class and the new Octogon class is as follows:\n\nclass Octagon extends RegPolygon {\n\npublic Octagon(int lenSide) {\n\nsuper(lenSide);\n\n}\n\npublic double calcArea()\n\ndouble area;\n\narea = 2.0 * (1.0 + Math.sqrt(2.0)) * calcRegPolyArea();\n\nreturn area;\n\n}\n\n}\n\nNote in the first line that the Octagon class extends the RegPolygon class. Next, notice in the calcArea method that calcRegPolyArea() is not multiplied by   but rather by   as mentioned above.\n\nNote that an abstract class does not have to have any abstract methods, but if a class has abstract methods, the class needs to be declared as an abstract class. Using an abstract method in the superclass forces both subclasses to define different calcArea methods, and if the methods were not declared, a syntax error would occur. This is a handy feature to have when there are some differences in various subclasses, yet it is desired to retain some commonality among the subclasses.\n\n## 9.4 Polymorphism\n\nAnother important feature of object-oriented programming is polymorphism, where the type of an object that is referenced by a superclass variable is determined at runtime instead of at compile time. This concept will be illustrated with the help of examples below.\n\nIn Java, a variable of a superclass type can reference an object of any of its subclasses. In other words, both an object of the superclass and an object of a subclass can be referenced by a variable of the superclass type. Consider the definition of the class RegPolygon shown in Fig. 9.1 which is repeated below for convenience:\n\nclass RegPolygon {\n\nprivate int lenSide;\n\npublic RegPolygon(int lenSide) {\n\nthis.lenSide = lenSide;\n\n}\n\npublic double calcRegPolyArea() {\n\ndouble a;\n\na = Math.pow(lenSide, 2);\n\nreturn a;\n\n}\n\n}\n\nFurther, the class Triangle from Fig. 9.3, with the modification described in Fig. 9.13 with the method calcArea renamed to calcRegPolyArea, is shown below:\n\nclass Triangle extends RegPolygon {\n\npublic Triangle(int lenSide) {\n\nsuper(lenSide);\n\n}\n\npublic double calcRegPolyArea() {\n\ndouble area;\n\narea = Math.sqrt(3.0) / 4.0 * super.calcRegPolyArea();\n\nreturn area;\n\n}\n\n}\n\nThe class Triangle is a subclass of the class RegPolygon, and the method calcRegPolyArea in the Triangle class is overriding the method calcRegPolyArea in the RegPolygon class. Suppose two variables of type RegPolygon are declared in the main method as follows:\n\nRegPolygon shape1, shape2;\n\nNaturally, a reference to an object of the class RegPolygon can be assigned to these variables. For example, the following statement assigns an object of the RegPolygon class to the variable shape1.\n\nshape1 = new RegPolygon(5);\n\nIn addition, a reference to an object of the class Triangle can also be assigned to these variables. The following statement assigns an object of the Triangle class to the variable shape2.\n\nshape2 = new Triangle(2);\n\nNext, using the method calcRegPolyArea defined in both the class RegPolygon and the class Triangle, the square of\n\n[Direct Result]: of an object.\n\nObject\n\nAn instance of a class.\n\nOOP\n\nObject-Oriented Programming.\n\nOverloading\n\nA method in the same class that has the same name but a different number of parameters, different types of parameters, or parameters of different types in a different order.\n\nOverriding\n\nA method in a subclass that has the same name and also the same number and type of parameters as the one in the superclass.\n\nPolymorphism\n\nThe type of an object referenced by a superclass variable determined at runtime.\n\nPseudocode\n\nA design tool consisting of a combination of English and a programming language that helps one concentrate on logic instead of syntax when developing a program.\n\nRAM\n\nRandom Access Memory.\n\nRecursion\n\nA definition that is defined in terms of itself and includes a base or terminal case.\n\nSelection structure s\n\nAllows a program to follow one of more paths, sometimes called decision structures.\n\nSemantics\n\nThe meaning of what each instruction does in a programming language.\n\nSyntax\n\nThe grammar of a programming language.\n\nUML\n\nUniversal Modeling Language.\n\nVariables\n\nNamed memory locations used to store data in a program.\n\n## Appendix E: Answers to Selected Exercises\n\n### Chapter 1\n\n1.B.\n\nCorrect.\n\n1.D.\n\nIncorrect, a double number cannot be assigned to a variable of integer type.\n\n2.A.\n\n0\n\n3.B.\n\n5.34\n\n4.B.\n\nfinal double EULER_NUMBER = 2.7182 ;\n\n6.\n\nSystem.out.println(\"** **\");\n\nSystem.out.println(\"** **\");\n\nSystem.out.println(\" ****\");\n\nSystem.out.println(\" ****\");\n\nSystem.out.println(\" ****\");\n\nSystem.out.println(\" ****\");\n\nSystem.out.println(\"** **\");\n\nSystem.out.println(\"** **\");\n\n7.\n\nAfter execution, value1 is 9 , value2 is 4 , and value3 is 9 .\n\n8.B.\n\ns = r * Math.PI * Math.sqrt(Math.pow(r,2) + Math.pow(h,2));\n\n### Chapter 2\n\n1.A.\n\nIncorrect, it should be Circle circle = new Circle();\n\n1.C.\n\nCorrect.\n\n4.A.\n\nCircle innerCircle;\n\ninnerCircle = new Circle();\n\n4.C.\n\nSystem.out.println(\"The value of radius is \"\n\n\\+ innerCircle.getRadius());\n\n6.\n\nAnswers to A. and D. of the Cone class\n\n### Chapter 3\n\n1.A.\n\n40\n\n2.B.\n\n50\n\n3.C.\n\n3\n\n5.A.\n\ntrue || false → true\n\n5.C.\n\ntrue || flag1 && flag2 → true || false → true\n\n5.E.\n\n(true || false) && false → true && false → false\n\n8.\n\n9.\n\n### Chapter 4\n\n2.\n\n, in the for statement\n\n3.\n\nsum = 1\n\ncount = 2\n\nsum = 3\n\ncount = 3\n\nsum = 6\n\ncount = 4\n\nsum = 10\n\ncount = 5\n\nsum = 10\n\ncount = 5\n\n6.\n\n**\n\n****\n\n******\n\n********\n\n**********\n\n7.B.\n\nint total, count\n\ntotal = 0;\n\ncount = 1;\n\ndo {\n\ntotal += count;\n\ncount += 3;\n\n} while (count <= 40);\n\n8.A.\n\nint total, count, n;\n\ntotal = 0;\n\nn = 5;\n\nfor(count = 0; count < n; count++) {\n\ntotal += count;\n\n}\n\n### Chapter 5\n\n1.\n\nconstructor 1 : valid\n\nconstructor 3 : invalid\n\n2.\n\nmethod 2 : invalid\n\nmethod 6: valid\n\nmethod 10 : valid\n\n6.\n\nanswers to A., B., C., and F. of the Cone class\n\n### Chapter 6\n\n1.B.\n\nThe second line should be text2 = new String(\"Shedding blade\");\n\n2.B.\n\n34\n\n2.D.\n\nHose_\n\n7.\n\n### Chapter 7\n\n1.B.\n\nIncorrect, the size has to be specified.\n\n1.C.\n\nIncorrect, the braces have to be used instead of the square brackets.\n\n1.E.\n\nIncorrect, the size should not be specified.\n\n2.\n\nint total = 0;\n\nfor(int i=0; i<intArray.length; i++)\n\nif(i%2 == 0)\n\ntotal = total + intArray[i];\n\n5.\n\n3\n\n4\n\n3\n\n7.\n\n### Chapter 8\n\n7.\n\npublic static String reverseStr(String str) {\n\nif(str.length() <= 1)\n\nreturn str;\n\nreturn reverseStr(str.substring(1)) + str.charAt(0);\n\n}\n\n9.\n\npublic static int factorial(int n) {\n\nif(n == 0)\n\nreturn 1;\n\nelse\n\nreturn n * factorial(n-1);\n\n}\n\n### Chapter 9\n\n1.B.\n\nIncorrect, a variable of a subclass type cannot reference an object of a superclass type.\n\n1.C.\n\nCorrect.\n\n2.B.\n\ncalcRegPolyArea and toString .\n\n2.D.\n\nYes.\n\n3.\n\n### Chapter 10\n\n1.B.\n\nIncorrect, there is no constructor in the File Class which takes the FileReader object as a parameter.\n\n1.D.\n\nCorrect.\n\n3.\n\nReferences and Useful Websites\n\nReferences\n\n1.\n\nJohnson JB (1971) The contour model of block structured processes. SIGPLAN Notices 6(2):55–72\n\n2.\n\nOrganick EI, Forsythe AI, Plummer RP (1978) Programming language structures. Academic Press, New York\n\n3.\n\nStreib JT, Soma T (2010) Using contour diagrams and JIVE to illustrate object-oriented semantics in the Java programming language. In: SIGCSE '10: Proceedings of the 41st ACM technical symposium on computer science education. Milwaukee, WI, USA, pp 510–514\n\n4.\n\nStreib JT (2011) Guide to assembly language: a concise introduction. Springer, London\n\nUseful Websites\n\n\"Class File,\" information on File class discussed in Chapter 10: http://​docs.​oracle.​com/​javase/​7"
      ],
      "latency_s": 1.15,
      "rag_type": "literag",
      "dominio": "LiteRAG_Bench_01",
      "titulo": "",
      "error": ""
    },
    {
      "question": "What derogatory term does Joe Celko use for the practice of adding prefixes like 'tbl_' to table names?",
      "ground_truth": "Tibbling",
      "answer": "Joe Celko uses the derogatory term \"silly and dangerous\" to describe the practice of adding prefixes like 'tbl_' to table names.",
      "contexts": [
        "## Direct Evidence (Source Text)\n[Direct Result]: second table using the base table name as a prefix in the foreign key or non-foreign-key references. The queries fill up with code like \"Orders.ID = OrderID,\" which quickly becomes a game of looking for the period and trying to figure out what a thousand different \"ID\" columns mean in the data dictionary.\n\nAffixes like \"vw\" for views tell you how the virtual table is implemented in the schema, but this has nothing to do with the data model. If I later decide to replace the view with a base table, do I change the name? The bad news is that a table often already exists with the same root name, which makes for more confusion.\n\nEqually silly and dangerous are column names that are prefixed with the data type. This is how it is physically represented and not what it means in the data model. The data dictionary will be trashed, because you have no idea if there are \"intorder_nbr,\" \"strorder_nbr,\" and perhaps even \"forder_nbr,\" all trying to be the simple \"order_nbr\" at the same time. The user can also look at the data declaration language (DDL) and see the data type, defaults, and constraints if he or she does not remember them.\n\nThe final affix problem is telling us that something is the primary key with a \"PK_\" or a foreign key with an \"FK_\" affix. That is how it is used in that particular table; it is not a part of its fundamental nature. The user can also look at the DDL and see the words \"PRIMARY KEY\" or \"FOREIGN KEY .. REFERENCES..\" in the column declarations.\n\nThe strangest version of this is a rule on a Web site for a company that specializes in Oracle programming. It advocated \"<table name>_CK_<column name>\" for CHECK() constraints. This not only gives you no help in determining the errors that caused the violation, but it also limits you to one and only one constraint per column per table, and it leaves you to ask about constraints that use two or more columns.\n\nThe same rules and warnings about affixes apply to all schema objects. You will see \"usp_\" for user-defined stored procedures, \"trig_\" for triggers, and so forth. In MS SQL Server, this is a serious problem, because the prefix \"sp_\" is used for system procedures and has special meaning in the architecture.\n\nIf the schema object does something (triggers, procedures), then use a <verb><object> format for the name; the subject of the sentence is understood to be the procedure. We will go into more details on this topic in Chapter 8.\n\n#### Exceptions:\n\nYou can find other opinions at:\n\n<http://www.craigsmullins.com/dbt_0999.htm>\n\nThere was also a series of articles at:\n\nhttp://www.sqlservercentral.com/​columnists/​sjones/​codingstandardspart2formatting.asp\n\nhttp://www.sqlservercentral.com/​columnists/​sjones/​codingstandardspart1formatting.asp\n\n## 1.2.4 Develop Standardized Postfixes\n\nThis list of postfixes is built on Teradata's internal standards and common usage. The Teradata standards are given in the Appendix.\n\n\"_id\" = identifier. It is unique in the schema and refers to one entity anywhere it appears in the schema. Never use \"<table name>_id\"; that is a name based on location and tells you this is probably not a real key at all. Just plain \"id\" is too vague to be useful to anyone and will screw up your data dictionary when you have to find a zillion of them, all different, but with the same data element name and perhaps the same oversized data type.\n\n\"_date\" or \"dt\" = date, temporal dimension. It is the date of something—employment, birth, termination, and so forth; there is no such column name as just a date by itself.\n\n\"_nbr\" or \"num\" = tag number. This is a string of digits that names something. Do not use \"_no\" because it looks like the Boolean yes/no value. I prefer \"nbr\" to \"num\" because it is used as a common abbreviation in several European languages.\n\n\"_name\" or \"nm\" = alphabetic name. This explains itself. It is also called a nominal scale.\n\n\"_code\" or \"_cd\" = a code is a standard maintained by a trusted source, usually outside of the enterprise. For example, the ZIP code is maintained by the U.S. Postal Service. A code is well understood in its context, so you might not have to translate it for humans.\n\n\"_size\" = an industry standard or company scale for a commodity, such as clothing, shoes, envelopes, or machine screws. There is usually a prototype that defines the sizes kept with a trusted source.\n\n\"_tot\" = a sum, an aggregated dimension that is logically different from its parts.\n\n\"_seq\" = sequence, ordinal numbering. This is not the same thing as a tag number, because it cannot have gaps.\n\n\"_tally\" = a count of values. Also called an absolute scale.\n\n\"_cat\" = category, an encoding that has an external source that has distinct groups of entities. There should be strong, formal criteria for establishing the category. The classification of Kingdom in Biology is an example.\n\n\"_class\" = an internal encoding that does not have an external source that reflects a subclassification of the entity. There should be strong formal criteria for the classification. The classification of plants in Biology is an example.\n\n\"_type\" = an encoding that has a common meaning both internally and externally. Types are usually less formal than a class and might overlap. For example, a driver's license might be typed for motorcycles, automobiles, taxis, trucks, and so forth.\n\nThe differences among type, class, and category are\n\n[Direct Result]: Delimited identifiers,\n\nDerived units, 79–80,\n\nDescriptive prefixes, 10–12\n\nDewey Decimal Classification (DDC) system, 89–90\n\nDisplay,\n\nDomain-Key Normal Form (DKNF), 62–63\n\nDROP TABLE statement,\n\nDynamic SQL, 168–70\n\npurpose,\n\nin stored procedures,\n\n# E\n\nElectronic data interchange (EDI) files,8,\n\nEncoding schemes, 83–97\n\nabbreviation, 87–88\n\nalgorithmic,\n\nambiguous,\n\nbad, 84–86\n\ncodes in database, 96–97\n\ncode translation, 93–96\n\nconcatenation,\n\ndesign guidelines, 92–97\n\nenumeration, 86–87\n\nexpansion and,\n\nexplicit missing values, 92–93\n\nhierarchical, 89–90\n\nmeasurement,\n\nstandards,\n\ntypes, 86–91\n\nvector, 90–91\n\nEntity-Attribute-Value (EAV) design,68\n\nEnumeration encoding, 86–87\n\nEXISTS() predicate,\n\nExtended equality, 103–5\n\n# F\n\nFields, 53–54\n\ncolumns as, 189–91\n\nexistence,\n\nlength,\n\nFiles\n\nEDI, ,\n\nrecords,\n\ntables vs., 53–54\n\nFirst attempts, 177–79\n\nDDL, 177–78\n\nDML, 178–79\n\nFlexibility,\n\nFLOAT data type,\n\nFROM clause, ,\n\nFunctional cohesion,\n\n# G\n\nGranularity, 71–72,\n\n# H\n\nHeuristics, 171–81\n\nactive verb removal,\n\ncircles and set diagrams,\n\nclear statements, 172–73\n\ndata display, 176–77\n\ndialect,\n\nfirst attempts, handling, 177–79\n\nnewsgroups and Internet use,\n\n\"Set of All . . .,\"\n\nstubs use, 174–76\n\nHierarchical encoding schemes, 89–90\n\nDewey Decimal system example, 89–90\n\nuses,\n\nZIP code example,\n\n_See also_ Encoding schemes\n\n# I\n\nIBM\n\ncase sensitivity rules, ,\n\nidentifier character sets,\n\nidentifier length,\n\nquoted identifiers,\n\nIdentifiers\n\ncharacter sets,\n\ndelimited,\n\nlengths,\n\nquoted, 4–6\n\nINCITS H2 Database Standards\n\nCommittee,\n\nIndentation, 38–39\n\nactions, 45–46\n\nreferential constraints, 45–46\n\nInformational cohesion,\n\nINNER JOIN syntax, 105–7\n\nIN() predicate, 115–17\n\nintroduction,\n\nNOT,\n\nNULLs and,\n\nINSERT INTO statement, ,\n\nIntegrity constraints, 140–42\n\nIntelligent keys,\n\nInternet,\n\nInterval scales,\n\nconversion,\n\ndefined,\n\nproperties,\n\n_See also_ Scales\n\nISO-3166, ,\n\nISO-11179 standards, ,\n\ncorrelation names, 15–17\n\ndescriptive prefixes, 10–12\n\nlevels of abstraction, 9–10\n\nmetadata schema access objects,18\n\nnaming conventions, 7–18\n\npostfixes, 12–14\n\nrelationship table names,\n\nscalar data elements,\n\nsections, 7–8\n\ntable and view names, 14–15\n\nISO temporal syntax, 107–8\n\nIteration,\n\n# J\n\nJustified text,\n\n# K\n\nKeys, 51–62\n\nartificial, 51–52\n\nexposed locator,\n\nfamiliarity,\n\nintelligent,\n\nnatural,\n\nproperties, 54–57\n\nsimplicity,\n\nstability, 55–56\n\nsurrogate,\n\ntypes of,\n\nuniqueness, 54–55\n\nvalidation,\n\nverifiability, 56–57\n\nKeywords,\n\n# L\n\nLevels of abstraction, 9–10\n\nLIKE constraint,\n\nLine spacing, 39–40\n\nLogical cohesion,\n\nLogical data elements,\n\nLogical model implementation,\n\nLookup tables, 94–96\n\n# M\n\nMaintenance, ,\n\nMaterialized VIEWs, 149–50\n\nMeasurement encoding,\n\nMeasurement theory, 69–73\n\naccuracy, ,\n\ndefined,\n\ngranularity, 71–72,\n\nprecision, ,\n\nproperties,\n\nrange, 71–72\n\nscale conversion,\n\nMetadata schema access objects,\n\nModularity,\n\nMoh's Scale for Hardness (MSH),\n\nMS SQL\n\ncase-sensitivity rules, ,\n\nidentifier character sets,\n\nidentifier length,\n\nquoted identifiers,\n\nMultiple character sets,\n\n# N\n\nNames, 2–7\n\ncapitalization rules, 6–7\n\nchanging from place to place, 19–20\n\ncolumn, 25–26,\n\nconstraint,\n\ncorrelation, 15–17\n\ndata elements, 18–21\n\nISO-11179 standards conventions, 7–18\n\nlength, 2–3\n\nletters, digits, underscores for,\n\nquoted identifiers and, 4–6\n\nrelationship table,\n\nschema object, ,\n\nspecial characters in, 3–4\n\ntable, 14–15\n\nvague, 18–19\n\nVIEW, 14–15\n\nNatural keys\n\nauto-numbers and,\n\ncompound,\n\ndefined,\n\n_See also_ Keys\n\nNCITS L8 Metadata Standards\n\nCommittee rules,\n\nNetwork traffic,\n\nNewsgroups,\n\nNominal scales,\n\nNormalization, 94–95\n\nNorth American Industry Classification\n\nSystem (NAICS),\n\nNULLs, , ,\n\navoiding, 92–93\n\nIN() predicate and,\n\nsorting,\n\ntesting combinations of,\n\n# O\n\nObject instances, 66–68\n\nObject-oriented design, 66–68\n\nOne True Lookup Table (OTLT), ,95,\n\nOptimizer hints,\n\nOracle\n\ncase-sensitivity rules, ,\n\nidentifier character sets,\n\nidentifier length,\n\nquoted identifiers,\n\nORDER BY clause,\n\nOrders problem, 171–72\n\nOrdinal scales, 74–75\n\nconversion,\n\ndefined,\n\nproperties,\n\ntransitivity,\n\n_See also_ Scales\n\nOUTER JOIN syntax, 101–5\n\nextended equality,\n\nillustrated,\n\n# P\n\nParentheses\n\n[Direct Result]: it like a ZIP code? It is drawn from a domain of values that is not unique. If it is a type, then what is the taxonomy towhich it belongs? Why not go all the way and call it \"type_code_id_value\" instead?\n\nWhy did we not find a mere \"customer_type\" that would have been understood on sight?\n\n#### Exceptions:\n\nNone\n\nImproperly formed data element names seem to be the result of ignorance and object-oriented (OO) programming. In particular, OO programmers put \"_id\" on every primary key in every table and have problems understanding that SQL is a strongly typed language in which things do not change their data types in programs. The names get absurd at times. Consider a lookup table for colors:\n\nBut what does \"_value_id\" mean? Names like this are generated without thought or research. Assume that we are using the Pantone color system in the database, so we have a trusted source and a precise description—we did the research! This might have been written as follows:\n\n## 1.3.2 Avoid Names That Change from Place to Place\n\n#### Rationale:\n\nThe worst possible design flaw is changing the name of an attribute on the fly, from table to table. As an example, consider this slightly cleaned-up piece of actual code from a SQL newsgroup:\n\nThose full table names are difficult to read, but the newbie who wrote this code thinks that the table name must _always_ be part of the column name. That is the way that a file worked in early COBOL programs.\n\nThis means that if you have hundreds of tables, each appearance of the same attribute gets a new name, so you can never build a proper data dictionary. Did you also notice that it is not easy to see underscores, commas, and periods?\n\nTry this cleaned-up version, which clearly shows a simple star schema centered on the IPC table.\n\nI have no idea what a URN is, but it looks like a standard identifier of some kind. Look at all of the kinds of \"URNs\" (i.e., URN, IPCURN, and OffenseURN) in the original version of the query. It gives you the feeling of being in a crematorium gift shop.\n\nAs you walk from room to room in your house, do you also change your name, based on your physical location? Of course not! The name we seek identifies the entity, not the location.\n\n#### Exceptions:\n\nAliases inside a query can temporarily give a new name to an occurrence of a data element. These are temporary and disappear at the end of the statement. We discuss rules for this in another section 1.2.6.\n\n## 1.3.3 Do Not Use Proprietary Exposed Physical Locators\n\n#### Rationale:\n\nThe most basic idea of modern data modeling is to separate the logical model and the physical implementation from each other. This allows us to reuse the model on different platforms and not be tied to just one platform.\n\nIn the old days, the logical and physical implementations were fused together. I will explain this in more detail in the next chapter, but for now the rule is to never use proprietary physical locators. We want to have portable code. But the real problem is that the proprietary physical locator violates the basic idea of a key in the relational model.\n\nWhen new SQL programmers use IDENTITY, GUID, ROWID, or other auto-numbering vendor extensions to get a key that can be used for locating a given row, they are imitating a magnetic tape's sequential access. It lets them know the order in which a row was added to the table—just like individual records went onto the end of the magnetic tape!\n\nWe will spend more time discussing this flaw in Chapter 3.\n\n#### Exceptions:\n\nYou might want to fake a sequential file when you are using a SQL table structure for some purpose other than a relational database management system (RDBMS). For example, staging and scrubbing data outside the \"Real Schema\" that do not have any data integrity issues.\nCHAPTER 2 Fonts, Punctuation, and Spacing\n\nCODE IS USUALLY set in a monospace font. After more than a century of manual typewriters and decades of punchcards, we find that it is actually easier to read code in a monospace font than a proportional font. Punctuation marks get the same spacing as a letter in a monospace font, but would be lost in a proportional font.\n\n# 2.1 Typography and Code\n\nYour brain and eyes do not follow code the same way that they follow text, process mathematics, read maps, or look at pictures. In fact, there are a lot of individual differences in human brains.\n\nSome people like text editors that use colors for various syntax elements in a programming language. Other people get headaches from colored program editors and want to see black-and-white text. Likewise, a newspaper that put nouns in red, verbs in green, and other such things would simply not work. Yet black-and-white maps are much more difficult to read than those with colors. Why? This has to do with color perception and how fast you can switch between the left and right halves of your brain.\n\nThere is a test for brain damage in which the examiner flashes cards with words printed in various colored inks (e.g., the word \"RED\" written in green ink). The examiner asks the subject for the word orthe color and times the responses. The rate is fairly constant over the subject's lifetime, so a change is a symptom of some physical or chemical change. Now, try reading this phrase:\n\nAlmost nobody reading this for the first time catches the fact that the word \"the\" appears twice. The point is that there is a vertical component to how we read text in chunks of words.\n\nCode on a page is read from left to right and from top to bottom, with a lot of vertical eye movement that you would not have if"
      ],
      "latency_s": 1.3,
      "rag_type": "literag",
      "dominio": "LiteRAG_Bench_01",
      "titulo": "",
      "error": ""
    },
    {
      "question": "According to SQL programming best practices, what name is given to tables used to resolve many-to-many relationships?",
      "ground_truth": "Associative tables",
      "answer": "Relationship tables are used to resolve many-to-many relationships.",
      "contexts": [
        "## Direct Evidence (Source Text)\n[Direct Result]: 68\n\nrelationship,\n\nrenaming,\n\nsequence, 163–66\n\nsplitting attributes into,\n\nstar schema,\n\nsynchronizing VIEWs with, 145–46\n\ntemporary,\n\ntranslation, 93–95\n\nTemporal cohesion,\n\nTemporal syntax, 107–8\n\nTemporal values,\n\nTemporary tables,\n\nTeradata standards,\n\nTesting SQL, 130–31\n\ncharacter columns,\n\nCHECK() constraints, 130–31\n\nNULL combinations,\n\nfor size,\n\nTranslation, 93–96\n\nTranslation tables, 93–94\n\nTriggers\n\nANSI version,\n\navoiding, 120–22\n\nINSTEAD OF, ,\n\nlength,\n\nstored procedures vs., 121–22\n\n# U\n\nUNIONs, 127–30\n\nUnits\n\nderived, 79–80,\n\ndisplay,\n\nprimary,\n\nstandard, 80–81\n\nUpdatable VIEWs, 143–44\n\nINSTEAD OF triggers,\n\nWITH CHECK OPTION clause, 143–44\n\nSee _also_ VIEWs\n\nUPDATE statement, ,\n\nUser-defined functions, 123–24\n\nmultiple language problems,\n\noptimization problems,\n\nportability problems,\n\n# V\n\nValidation, 95–96\n\nVALUES() list,\n\nVector encoding, 90–91\n\nadvantages,\n\ndefined,\n\ndisadvantages, 90–91\n\nSee _also_ Encoding schemes\n\nVerbs, active,\n\nVertical spacing,\n\nVery Large Database (VLDB),\n\nVIEWs, 133–50\n\napplication/business requirements, 144–45\n\ncolumn-level security, 136–37\n\ncolumns,\n\ndata derivation, 139–40\n\ndefined,\n\nfor domain support, 146–47\n\nefficient access paths,\n\nimproper use, 146–49\n\nintegrity constraints enforcement, 140–42\n\ninvocation,\n\nmasking complexity, 138–39\n\nmaterialized, 149–50\n\nnames, 14–15\n\nproliferation, avoiding,\n\nreasons for, 144–45\n\nrename tables/columns,\n\nrow-level security, 136–37\n\nrows,\n\nsingle-solution, 147–48\n\nsynchronizing, 145–46\n\nupdatable, 143–44\n\nuses,\n\n# W\n\nWeinberg, Jerry, 99–100\n\nWHERE clause,\n\nWITH CHECK OPTION clause, 143–44\n\nWord spacing, \nABOUT THE AUTHOR\n\n**Joe Celko** is a noted consultant and lecturer, and one of the most-read SQL authors in the world. He is well known for his 10 years of service on the ANSI SQL standards committee, his column in _Intelligent Enterprise_ magazine (which won several Reader's Choice Awards), and the war stories he tells to provide real-world insights into SQL programming. His best-selling books include _Joe Celko's SQL for Smarties: Advanced SQL Programming, second edition; Joe Celko's SQL Puzzles and Answers;_ and _Joe Celko's Trees and Hierarchies in SQL for Smarties._\nInstructions for online access\n\nThank you for your purchase. Please note that your purchase of this Elsevier eBook also includes access to an online version. Please click here (or go to http://ebooks.elsevier.com) to request an activation code and registration instructions in order to gain access to the web version.\n\n[Direct Result]: common and makes maintaining the code much more difficult. Consider looking at several statements where the table \"Personnel\" is aliased as \"A\" in one, \"D\" in another, and \"Q\" in a third because of its position in a FROM clause.\n\nColumn correlation names for a computed data element should name the computed data element in the same way that you would name a declared column. That is, try to find a common term for the computation. For example, \"salary + COALESCE(commission, 0.00)) AS total_pay\" makes sense to the reader.\n\nA simple table or view correlation name should have a short, simple name derived from the base table name or descriptive of the role that copy of the table is playing in the statement (e.g., \"SELECT .. FROM Personnel AS Management, Personnel AS Workers\" as the two uses of the table in the query).\n\nNow to explain the \"almost\" part of this section's title. In the case of multiple correlation names on the same table, you may find it handy to postfix abbreviated names with a number (e.g., \"SELECT .. FROM Personnel AS PI, Personnel AS P2\"). The digit is to tell the reader how many correlation names are used in the statement for that table.\n\nIn effect, these are \"correlation pronouns\"—a shorthand that makes sense in a local context. They are used for the same reason as pronouns in a natural language: to make the statement shorter and easier to read.\n\nA table expression alias should have a short, simple name derived from the logical meaning of the table expression.\n\nAlthough not required, the correlation name on a table expression can be followed by a list of new column names in parentheses. If this list is missing, the correlation name inherits the names from the base tables or views in the table expression. In the case of a simple table correlation name, such a list would probably be redundant because we usually want to use the original column names.\n\nIn the case of a table expression correlation name, such a list would probably be a good idea to avoid ambiguous column names. It also forces the programmer to trim the expression of extraneous columns that were not actually needed in the query.\n\n#### Exceptions:\n\nIf there is no obvious, clear, simple name for the table correlation name, then use an invented name, such as a single letter like X. Likewise, if a computation has no immediate name, then you might use an invented name.\n\n## 1.2.7 Relationship Table Names Should Be Common Descriptive Terms\n\n#### Rationale:\n\nTables and views can model relationships, usually one-to-many or many-to-many, as well as entities. If the relationship has a common name that is understood in the context, then use it. There is a tendency for newbies to concatenate the names of the tables involved to build a nounce word. For example, they name a table \"Marriages\" because that is the common term for that relationship rather than \"ManWoman,\" \"HusbandsWives,\" or something really weird. Likewise, \"Enrollment\" makes more sense than \"Students_Courses\"; once you start looking for the names, they come easily.\n\nThis concatenation falls apart when the relationship is not a simple binary one, such as an escrow on a house that has a buyer, a seller, and a lender.\n\n#### Exceptions:\n\nIf there is no common term for the relationship, you will need to invent something, and it might well be a concatenation of table names.\n\n## 1.2.8 Metadata Schema Access Objects Can Have Names That Include Structure Information\n\nThis rule does not apply to the schema information tables, which come with standardized names. It is meant for naming indexes and other things that deal directly with storage and access. The postfix \"_idx\" is acceptable.\n\n#### Rationale:\n\nThis is simply following the principle that a name should tell you what something is. In the case of indexes and other things that deal directly with storage and access, that is what they are. They have nothing to do with the data model.\n\n#### Exceptions:\n\nThis does not apply to schema objects that are seen by the user. Look for the rules for the other schema objects as we go along.\n\n# 1.3 Problems in Naming Data Elements\n\nNow that we have talked about how to do it right, let's spend some time on common errors in names that violate the rules we set up.\n\n## 1.3.1 Avoid Vague Names\n\n#### Rationale:\n\n_\"That sounds vaguely obscene to me! I can't stand vagueness!\"_\n\n—Groucho Marx.\n\nAt one extreme the name is so general that it tells us nothing. The column is a reserved word such as \"date\" or it is a general word like \"id,\" \"amount,\" \"date,\" and so forth. Given a column called \"date,\" you have to ask, \"date of what?\" An appointment? Birth? Hire? Termination? Death? The name begs the question on the face of it.\n\nAt another extreme, the name is made useless by telling us a string of qualifiers that contradict each other. Consider the typical newbie column name like \"type_code_id\" as an example. If it is an identifier, then it is unique for every entity that has it, like the vehicle identification number (VIN) on a automobile. If it is a code, then what is the trusted source that maintains it like a ZIP code? It is drawn from a domain of values that is not unique. If it is a type, then what is the taxonomy towhich it belongs? Why not go all the way and call it \"type_code_id_value\" instead?\n\nWhy did we not find a mere \"customer_type\" that would have been understood on sight?\n\n#### Exceptions:\n\nNone\n\nImproperly formed data element names seem to be the result of ignorance and object-oriented (OO) programming. In particular\n\n[Direct Result]: Object-oriented design, 66–68\n\nOne True Lookup Table (OTLT), ,95,\n\nOptimizer hints,\n\nOracle\n\ncase-sensitivity rules, ,\n\nidentifier character sets,\n\nidentifier length,\n\nquoted identifiers,\n\nORDER BY clause,\n\nOrders problem, 171–72\n\nOrdinal scales, 74–75\n\nconversion,\n\ndefined,\n\nproperties,\n\ntransitivity,\n\n_See also_ Scales\n\nOUTER JOIN syntax, 101–5\n\nextended equality,\n\nillustrated,\n\n# P\n\nParentheses\n\nextra, avoiding, 109–10\n\nin moderation,\n\nPhysical locators,\n\nPortable functions,\n\nPostfixes, 12–14\n\ncategory,\n\nclass,\n\nTeradata standards, 12–13\n\ntype, 13–14\n\nPrecision, ,\n\nPRIMARY KEY declaration,\n\nPrimary units, storing,\n\nProcedural cohesion,\n\nProcesses, thinking in, 191–93\n\nProprietary data types, 42–44\n\nProprietary exposed physical locators,21\n\nProprietary reserved words,\n\navoiding, 33–34\n\ndisadvantages,\n\nProprietary statements, 34–37\n\n_Psychology of Computer Programming,_ 99\n\nPunchcards, ,\n\nPunctuation\n\nrules, 31–32\n\nstandard units and, 80–81\n\nstorage and,\n\nunits display and,\n\nQueries,\n\naliases inside,\n\nbad,\n\nQuery data elements,\n\nQuoted identifiers, 4–6\n\n# R\n\nRange, 71–72\n\nRange constraints,\n\nRank scales, 75–76\n\nconversion,\n\ndefined,\n\nproperties,\n\ntransitivity, 75–76\n\n_See also_ Scales\n\nRatio scales,\n\nconversion,\n\ndefined,\n\nproperties,\n\n_See also_ Scales\n\nREAL data type,\n\nRecords,\n\nRedundant expressions, 113–14\n\nReferential constraints, 45–46\n\nRelational database management system (RDBMS), ,\n\nEAV design and,\n\nobject-oriented design for, 66–68\n\nRelationship tables,\n\nReserved words\n\nfull,\n\nproprietary, , 33–34\n\nuppercase, 26–29\n\nRivers,\n\nRows\n\nconstraints,\n\ndefined,\n\nsplitting attributes into, 65–66\n\nVIEW,\n\n_See also_ Columns\n\n# S\n\nScalar data elements,\n\nScalar parameters, 167–68\n\nScales, 73–82\n\nabsolute,\n\ncategorical, 73–74\n\nconversion, 77–79\n\nderived units, 79–80\n\ninformation mixing,\n\ninterval,\n\nnominal,\n\nordinal, 74–75\n\nproperties, ,\n\nrank, 75–76\n\nratio,\n\ntypes of, 73–76\n\nunrestricted permissible\n\ntransformations,\n\nuse guidelines, 81–82\n\nusing,\n\nSchema object names, ,\n\nSearched CASE expression,\n\nSecondary indexes, 124–25\n\nSecurity, ,\n\ncolumn-level, 136–37\n\nrow-level, 136–37\n\nSelection,\n\nSELECT statement, , ,\n\nSequence tables, 163–66\n\nSet diagrams,\n\nSet-oriented constructs, 161–67\n\nSI measurements, 79–80\n\nSIMILAR TO constraint,\n\nSimple CASE expression, 111–12\n\nSingle-solution VIEWs, 147–48\n\nSoftware engineering, 153–56\n\ncohesion, 153–55\n\ncoupling, 155–56\n\nSpacing\n\nline, 39–40\n\nvertical,\n\nword,\n\nSplitting attributes, 62–66\n\ninto columns, 63–65\n\ninto rows, 65–66\n\ninto tables,\n\nSQL\n\n4GLs, ,\n\nbad programming in, 184–89\n\nas declarative language,\n\nDynamic, 168–70\n\ninjection, 169–70\n\nStandard, , , , ,\n\ntesting, 130–31\n\nthinking in, 183–95\n\nSQL-92\n\nCASE expressions,\n\nDEFAULT value,\n\nidentifier ending,\n\nmaximum identifier length, ,\n\nquoted identifiers,\n\nstring operators,\n\nSQL-99,\n\nStamp coupling,\n\nStandard functions,\n\nStandard Industrial Classification\n\n(SIC),\n\nStandard SQL\n\ncase-sensitivity rules, ,\n\ncomments,\n\nidentifier character sets,\n\nquoted identifiers,\n\nStandard syntax\n\nCROSS JOIN, 105–7\n\nimplementation, 100–101\n\nINNER JOIN, 105–7\n\nISO temporal, 107–8\n\nOUTER JOIN, 101–5\n\nStandard units, 80–81\n\nStatements\n\nclear, 172–73\n\ngrouping, 39–40\n\nproprietary, 34–37\n\n_See also specific statements_\n\nStored procedures,\n\nadvantages,\n\nDynamic SQL and, 168–70\n\nperformance,\n\nportability problems, 158–67\n\nscalar vs. structure parameters, 167–68\n\nsoftware engineering and, 153–56\n\nstructured programming, 156–57\n\ntriggers vs., 121–22\n\nusing, 122–23\n\nwriting, 151–70\n\nStrong metric properties,\n\nStructured parameters, 167–68\n\nStructured programming, 156–57\n\ncontrol structures, 156–57\n\ncyclomatic complexity,\n\nStub modules, 174–76\n\nSurrogate keys,\n\nSynchronization, VIEWs, 145–46\n\n# T\n\nTables\n\nauxiliary,\n\ncalendar,\n\ndeclarations,\n\nexpression correlation names,\n\nfiles vs., 53–54\n\nkeys, 51–62\n\nlogical,\n\nlookup, 94–96\n\nnames, 14–15\n\nnewbie designs,\n\nobject instances vs., 66–68\n\nrelationship,\n\nrenaming,\n\nsequence, 163–66\n\nsplitting attributes into,\n\nstar schema,\n\nsynchronizing VIEWs with, 145–46\n\ntemporary,\n\ntranslation, 93–95\n\nTemporal cohesion,\n\nTemporal syntax, 107–8\n\nTemporal values,\n\nTemporary tables,\n\nTeradata standards,\n\nTesting SQL, 130–31\n\ncharacter columns,\n\nCHECK() constraints, 130–31\n\nNULL combinations,\n\nfor size,\n\nTranslation, 93–96\n\nTranslation tables,\n\n[Direct Result]: Big VIEW Myth,\" 148–49\n\nBits, ,\n\nBlock puzzle, ,\n\nBouma,\n\nBytes,\n\n# C\n\n**C** Calendar tables,\n\nCamelCase\n\nproblems,\n\nuse avoidance, 29–30\n\nuse exceptions,\n\nCapitalization rules, 6–7\n\nCASE expressions, 110–13\n\nCOALESCE() function, 112–13\n\nfor complex predicate,\n\ndefined,\n\nreplacing IF-THEN-ELSE control flow statements, 162–63\n\nsearched,\n\nsimple, 111–12\n\nusing, 117–18\n\nCase-sensitivity rules, 6–7\n\nCategorical scales, 73–74\n\ncategories,\n\ndefined, 73–74\n\nproperties,\n\n_See also_ Scales\n\nCharacter columns,\n\nCharacter sets,\n\nCHECK() constraints, 46–48\n\napplying to table as whole,\n\ninspecting/testing, 130–31\n\nsingle-purposed,\n\non table declarations,\n\ntable-level,\n\nSee _also_ Constraints\n\nCOALESCE() function, 112–13\n\nCodd, Dr., , , ,\n\nCode\n\nclusters,\n\nindentation, 38–39\n\nline spacing, 39–40\n\nlowercase scalars usage, 25–26\n\nname usage,\n\npunctuation rules, 31–33\n\nreading,\n\nreserved word use, 33–34\n\nstatements, 34–37\n\ntypography and, 23–30\n\nupper-/lowercase letter usage,\n\nword spacing,\n\nCode Museum Effect, ,\n\nCoding\n\nchoices, 99–131\n\ncomments, 118–19\n\ncompact constructions, 109–18\n\ncorrelated subqueries, 125–27\n\noptimizer hints avoidance,\n\nsecondary index avoidance, 124–25\n\nstandard constructions, 100–108\n\nstored procedures, 122–23\n\ntriggers avoidance, 120–22\n\nUNIONs, 127–30\n\nuser-defined functions, 123–24\n\nCohesion, 153–55\n\ncoincidental, 153–54\n\ncommunicational,\n\ndefined,\n\nfunctional,\n\ninformational,\n\nlogical,\n\nprocedural,\n\ntemporal,\n\ntypes,\n\nCoincidental cohesion, 153–54\n\nColumns\n\nadded after schema,\n\ncharacter,\n\nclustering, 44–45\n\nconstraints, 48–49,\n\nas fields, 189–91\n\nnames,\n\nordering, 44–45\n\nrenaming,\n\nsplitting attributes into, 63–65\n\nVIEW,\n\n_See also_ Rows\n\nComma-separated lists, ,\n\nComments\n\non clause,\n\ncontrol statement,\n\nstored procedures,\n\nusing, 118–19\n\nCommon coupling,\n\nCommon language runtime (CLR),\n\nCommunicational cohesion,\n\nCompact constructions, 109–18\n\nCASE family expressions, 110–13\n\nparentheses and, 109–10\n\nredundant expressions and, —14\n\nseeking, 114–18\n\nComplexity, masking, 138–39\n\nConcatenation,\n\nConcatenation encoding,\n\nConsistency,\n\nConstraints\n\nCHECKO, 46–48\n\ncolumn,\n\nintegrity, 140–42\n\nLIKE,\n\nmultiple column, 48–49\n\nmulti-table, 49–50\n\nnames,\n\nin narrative specification,\n\nrange,\n\nreferential,\n\nrows,\n\nSIMILAR TO,\n\nContent coupling, 155–56\n\nControl coupling,\n\nControl statement comments,\n\nControl structures, 156–57\n\nconcatenation,\n\niteration,\n\nselection,\n\nCorrelation names, 15–17\n\ncolumn,\n\nderivation, 15–16\n\nin queries,\n\non table expression,\n\nCoupling, 155–56\n\ncommon,\n\ncontent, 155–56\n\ncontrol,\n\ndata,\n\ndefined,\n\nstamp,\n\ntypes of,\n\nCREATE ASSERTION statement, 49–50,\n\nCREATE PROCEDURE statement,\n\nCREATE TABLE statement, , ,\n\nCROSS JOIN syntax, 105–7,\n\nCursors\n\nporting,\n\nuse avoidance, 159–61\n\nuses, 159–60\n\nCyclomatic complexity,\n\n# D\n\n**D** Data abstraction,\n\nDatabase management system (DBMS),3\n\nDatabases\n\ncodes in, 96–97\n\ncodes storage, 96–97\n\nrelational, , , 66–68\n\nData coupling,\n\nData declaration language (DDL), 41–68\n\nattribute splitting, 62–66\n\nCHECK() constraint placement, 46–48\n\ncolumn ordering, 44–45\n\nconstraint names,\n\nCREATE ASSERTION use, 49–50\n\nDEFAULT value, 41–42\n\nfirst attempts, 177–78\n\nindentation, 45–46\n\nmultiple column constraints, 48–49\n\nobject-oriented design use, 66–68\n\nPRIMARY KEY declaration,\n\nproprietary data types and, 42–44\n\nsingle-purposed CHECKO\n\nconstraints,\n\ntable keys, 51–62\n\ntable-level CHECK() constraints,49\n\nData derivation, 139–40\n\nData elements\n\naffixes,\n\ndescriptive prefixes, 10–12\n\nlogical,\n\nnames in registry,\n\nnaming problems, 18–21\n\npostfixes, 12–14\n\nquery,\n\nscalar,\n\nData encoding schemes, 83–97\n\nData manipulation language (DML),\n\nbad,\n\nfirst attempts, 178–79\n\nData types,\n\nFLOAT,\n\nproprietary, 42–44\n\nREAL,\n\nDecimal places, declaring, 81–82\n\nDEFAULT value, 41–42\n\nDelimited identifiers,\n\nDerived units, 79–80,\n\nDescriptive prefixes, 10–12\n\nDewey Decimal Classification (DDC) system, 89–90\n\nDisplay,\n\nDomain-Key Normal Form (DKNF), 62–63\n\nDROP TABLE statement,\n\nDynamic SQL, 168–70\n\npurpose,\n\nin stored procedures,\n\n# E\n\nElectronic data interchange (EDI) files,8,\n\nEncoding schemes, 83–97\n\nabbreviation, 87–88\n\nalgorithm"
      ],
      "latency_s": 0.85,
      "rag_type": "literag",
      "dominio": "LiteRAG_Bench_01",
      "titulo": "",
      "error": ""
    },
    {
      "question": "What is the name of the primary data structure that represents a network packet in the Linux kernel?",
      "ground_truth": "sk_buff",
      "answer": "The primary data structure that represents a network packet in the Linux kernel is the **sk_buff** structure. It is defined in `include/linux/skbuff.h`.",
      "contexts": [
        "## Direct Evidence (Source Text)\n[Direct Result]: on the netdev_chain, by calling the raw_notifier_call_chain() method.\n\n#### int blocking_notifier_call_chain(struct blocking_notifier_head *nh, unsigned long val, void *v);\n\nThis method is for generating notification events; eventually, after using locking mechanism, it invokes the notifier_call_chain() method.\n\n#### int __atomic_notifier_call_chain(struct atomic_notifier_head *nh,unsigned long val, void *v, int nr_to_call, int *nr_calls);\n\nThis method is for generating notification events. Eventually, after using locking mechanism, it invokes the notifier_call_chain() method.\n\n### Macros\n\nHere you'll find a description of the macro that was covered in this chapter.\n\n#### pci_register_driver()\n\nThis macro registers a PCI driver in the PCI subsystem. It gets a pci_driver object as a parameter. It is usually called in the network driver module_init() method.\nRami RosenLinux Kernel NetworkingImplementation and Theory10.1007/978-1-4302-6197-1_15\n\n© Rami Rosen 2014\n\n# Linux API\n\nRami Rosen1\n\n(1)\n\nHaifa, Israel\n\nAbstract\n\nIn this appendix I cover the two most fundamental data structures in the Linux Kernel Networking stack: the sk_buff and the net_device. This is reference material that can help when reading the rest of this book, as you will probably encounter these two structures in almost every chapter. Becoming familiar with and learning about these two data structures is essential for understanding the Linux Kernel Networking stack. Subsequently, there is a section about remote DMA (RDMA), which is further reference material for Chapter 13. It describes in detail the main methods and the main data structures that are used by RDMA. This appendix is a good place to always return to, especially when looking for definitions of the basic terms.\n\nIn this appendix I cover the two most fundamental data structures in the Linux Kernel Networking stack: the sk_buff and the net_device. This is reference material that can help when reading the rest of this book, as you will probably encounter these two structures in almost every chapter. Becoming familiar with and learning about these two data structures is essential for understanding the Linux Kernel Networking stack. Subsequently, there is a section about remote DMA (RDMA), which is further reference material for Chapter 13. It describes in detail the main methods and the main data structures that are used by RDMA. This appendix is a good place to always return to, especially when looking for definitions of the basic terms.\n\n## The sk_buff Structure\n\nThe sk_buff structure represents a packet. SKB stands for socket buffer. A packet can be generated by a local socket in the local machine, which was created by a userspace application; the packet can be sent outside or to another socket in the same machine. A packet can also be created by a kernel socket; and you can receive a physical frame from a network device (Layer 2) and attach it to an sk_buff and pass it on to Layer 3. When the packet destination is your local machine, it will continue to Layer 4. If the packet is not for your machine, it will be forwarded according to your routing tables rules, if your machine supports forwarding. If the packet is damaged for any reason, it will be dropped. The sk_buff is a very large structure; I mention most of its members in this section. The sk_buff structure is defined in include/linux/skbuff.h . Here is a description of most of its members:\n\n  * ktime_t tstamp\n\nTimestamp of the arrival of the packet. Timestamps are stored in the SKB as offsets to a base timestamp. Note: do not confuse tstamp of the SKB with hardware timestamping, which is implemented with the hwtstamps of skb_shared_info. I describe the skb_shared_info object later in this appenidx.\n\nHelper methods:\n\n  * skb_get_ktime(const struct sk_buff *skb): Returns the tstamp of the specified skb.\n\n  * skb_get_timestamp(const struct sk_buff *skb, struct timeval *stamp): Converts the offset back to a struct timeval.\n\n  * net_timestamp_set(struct sk_buff *skb): Sets the timestamp for the specified skb. The timestamp calculation is done with the ktime_get_real() method, which returns the time in ktime_t format.\n\n  * net_enable_timestamp(): This method should be called to enable SKB timestamping.\n\n  * net_disable_timestamp(): This method should be called to disable SKB timestamping.\n\n  * struct sock *sk\n\nThe socket that owns the SKB, for local generated traffic and for traffic that is destined for the local host. For packets that are being forwarded, sk is NULL. Usually when talking about sockets you deal with sockets which are created by calling the socket() system call from userspace. It should be mentioned that there are also kernel sockets, which are created by calling the sock_create_kern() method. See for example in vxlan_init_net() in the VXLAN driver, drivers/net/vxlan.c.\n\nHelper method:\n\n  * skb_orphan(struct sk_buff *skb): If the specified skb has a destructor, call this destructor; set the sock object (sk) of the specified skb to NULL, and set the destructor of the specified skb to NULL.\n\n  * struct net_device *dev\n\nThe dev member is a net_device object which represents the network interface device associated to the SKB; you will sometimes encounter the term NIC (Network Interface Card) for such a network device. It can be the network device on which the packet arrives, or the network device on which the packet will be sent. The net_device structure will be discussed in depth in the next section.\n\n  * char cb[48]\n\nThis is the control buffer. It is free to use by any layer. This is an opaque area used to store private information. For example, the TCP protocol uses it\n\n[Direct Result]: original buffer is returned. If the buffer is shared, the buffer is cloned, and the old copy drops a reference. A new clone with a single reference is returned. When being called from interrupt context or with spinlocks held, the pri parameter (priority) must be GFP_ATOMIC. If memory allocation fails, NULL is returned.\n\n  * consume_skb(struct sk_buff *skb): Decrements the users reference counter and frees the SKB if the users reference counter is zero.\n\n### struct skb_shared_info\n\nThe skb_shared_info struct is located at the end of the data block (skb_end_pointer(SKB)). It consists of only a few fields. Let's take a look at it:\n\nstruct skb_shared_info {\n\nunsigned char nr_frags;\n\n__u8 tx_flags;\n\nunsigned short gso_size;\n\nunsigned short gso_segs;\n\nunsigned short gso_type;\n\nstruct sk_buff *frag_list;\n\nstruct skb_shared_hwtstamps hwtstamps;\n\n__be32 ip6_frag_id;\n\natomic_t dataref;\n\nvoid * destructor_arg;\n\nskb_frag_t frags[MAX_SKB_FRAGS];\n\n};\n\nThe following is a description of some of the important members of the skb_shared_info structure:\n\n  * nr_frags: Represents the number of elements in the frags array.\n\n  * tx_flags can be:\n\n    * SKBTX_HW_TSTAMP: Generate a hardware time stamp.\n\n    * SKBTX_SW_TSTAMP: Generate a software time stamp.\n\n    * SKBTX_IN_PROGRESS: Device driver is going to provide a hardware timestamp.\n\n    * SKBTX_DEV_ZEROCOPY: Device driver supports Tx zero-copy buffers.\n\n    * SKBTX_WIFI_STATUS: Generate WiFi status information.\n\n    * SKBTX_SHARED_FRAG: Indication that at least one fragment might be overwritten.\n\n  * When working with fragmentation, there are cases when you work with a list of sk_buffs (frag_list), and there are cases when you work with the frags array. It depends mostly on whether the Scatter/Gather mode is set.\n\nHelper methods:\n\n  * skb_is_gso(const struct sk_buff *skb): Returns true if the gso_size of the skb_shared_info associated with the specified skb is not 0.\n\n  * skb_is_gso_v6(const struct sk_buff *skb): Returns true if the gso_type of the skb_shared_info associated with the skb is SKB_GSO_TCPV6.\n\n  * skb_shinfo(skb): A macro that returns the skb_shinfo associated with the specified skb.\n\n  * skb_has_frag_list(const struct sk_buff *skb): Returns true if the frag_list of the skb_shared_info of the specified skb is not NULL.\n\n  * dataref: A reference counter of the skb_shared_info struct. It is set to 1 in the method, which allocates the skb and initializes skb_shared_info (The __alloc_skb() method).\n\n## The net_device structure\n\nThe net_device struct represents the network device. It can be a physical device, like an Ethernet device, or it can be a software device, like a bridge device or a VLAN device. As with the sk_buff structure, I will list its important members. The net_device struct is defined in include/linux/netdevice.h:\n\n  * char name[IFNAMSIZ]\n\nThe name of the network device. This is the name that you see with ifconfig or ip commands (for example eth0, eth1, and so on). The maximum length of the interface name is 16 characters. In newer distributions with biosdevname support, the naming scheme corresponds to the physical location of the network device. So PCI network devices are named p<slot>p<port>, according to the chassis labels, and embedded ports (on motherboard interfaces) are named em<port>—for example, em1, em2, and so on. There is a special suffix for SR-IOV devices and Network Partitioning (NPAR)–enabled devices. Biosdevname is developed by Dell:  http://linux.dell.com/biosdevname . See also this white paper:  http://linux.dell.com/files/whitepapers/consistent_network_device_naming_in_linux.pdf .\n\nHelper method:\n\n  * dev_valid_name(const char *name): Checks the validity of the specified network device name. A network device name must obey certain restrictions in order to enable creating corresponding sysfs entries. For example, it cannot be \". \" or \".. \"; its length should not exceed 16 characters. Changing the interface name can be done like this, for example: ip link set <oldDeviceName> p2p1 <newDeviceName>. So, for example, ip link set p2p1 name a12345678901234567 will fail with this message: Error: argument \"a12345678901234567\" is wrong: \"name\" too long. The reason is that you tried to set a device name that is longer than 16 characters. And running ip link set p2p1 name. will fail with RTNETLINK answers: Invalid argument, since you tried to set the device name to be \".\", which is an invalid value. See dev_valid_name() in net/core/dev.c.\n\n  * struct hlist_node name_hlist\n\nThis is a hash table of network devices, indexed by the network device name. A lookup in this hash table is performed by dev_get_by_name(). Insertion into this hash table is performed by the list_netdevice() method, and removal from this hash table is done with the unlist_netdevice() method.\n\n  * char *ifalias\n\nSNMP alias interface name. Its length can be up to 256 (IFALIASZ).\n\nYou can create an alias to a network device using this command line:\n\nip link set <devName> alias myalias\n\nThe ifalias name is exported via sysfs by /sys/class/net\n\n[Direct Result]: Linksys router, which runs Linux. There is also an open source, Linux-based operating system that can run on this device (and on some other devices), named OpenWrt, with a large and active community of developers (see  https://openwrt.org/ ). Learning about how the various protocols are implemented by the Linux Kernel Networking stack and becoming familiar with the main data structures and the main paths of a packet in it are essential to understanding it better.\n\n## The Linux Network Stack\n\nThere are seven logical networking layers according to the Open Systems Interconnection (OSI) model. The lowest layer is the physical layer, which is the hardware, and the highest layer is the application layer, where userspace software processes are running. Let's describe these seven layers:\n\n1.\n\nThe physical layer: Handles electrical signals and the low level details.\n\n2.\n\nThe data link layer: Handles data transfer between endpoints. The most common data link layer is Ethernet. The Linux Ethernet network device drivers reside in this layer.\n\n3.\n\nThe network layer: Handles packet forwarding and host addressing. In this book I discuss the most common network layers of the Linux Kernel Networking subsystem: IPv4 or IPv6. There are other, less common network layers which Linux implements, like DECnet, but they are not discussed.\n\n4.\n\nThe protocol layer/transport layer: Handles data sending between nodes. The TCP and UDP protocols are the best-known protocols.\n\n5.\n\nThe session layer: Handles sessions between endpoints.\n\n6.\n\nThe presentation layer: Handles delivery and formatting.\n\n7.\n\nThe application layer: Provides network services to end-user applications.\n\nFigure 1-1 shows the seven layers according to the OSI model.\n\nFigure 1-1.\n\nThe OSI seven-layer model\n\nFigure 1-2 shows the three layers that the Linux Kernel Networking stack handles. The L2, L3, and L4 layers in this figure correspond to the data link layer, the network layer, and the transport layer in the seven-layer model, respectively. The essence of the Linux kernel stack is passing incoming packets from L2 (the network device drivers) to L3 (the network layer, usually IPv4 or IPv6) and then to L4 (the transport layer, where you have, for example, TCP or UDP listening sockets) if they are for local delivery, or back to L2 for transmission when the packets should be forwarded. Outgoing packets that were locally generated are passed from L4 to L3 and then to L2 for actual transmission by the network device driver. Along this way there are many stages, and many things can happen. For example:\n\n  * The packet can be changed due to protocol rules (for example, due to an IPsec rule or to a NAT rule).\n\n  * The packet can be discarded.\n\n  * The packet can cause an error message to be sent.\n\n  * The packet can be fragmented.\n\n  * The packet can be defragmented.\n\n  * A checksum should be calculated for the packet.\n\nThe kernel does not handle any layer above L4; those layers (the session, presentation, and application layers) are handled solely by userspace applications. The physical layer (L1) is also not handled by the Linux kernel.\n\nIf you feel overwhelmed, don't worry. You will learn a lot more about everything described here in a lot more depth in the following chapters.\n\nFigure 1-2.\n\nThe Linux Kernel Networking layers\n\n## The Network Device\n\nThe lower layer, Layer 2 (L2), as seen in Figure 1-2, is the link layer. The network device drivers reside in this layer. This book is not about network device driver development, because it focuses on the Linux kernel networking stack. I will briefly describe here the net_device structure, which represents a network device, and some of the concepts that are related to it. You should have a basic familiarity with the network device structure in order to better understand the network stack. Parameters of the device—like the size of MTU, which is typically 1,500 bytes for Ethernet devices—determine whether a packet should be fragmented. The net_device is a very large structure, consisting of device parameters like these:\n\n  * The IRQ number of the device.\n\n  * The MTU of the device.\n\n  * The MAC address of the device.\n\n  * The name of the device (like eth0 or eth1).\n\n  * The flags of the device (for example, whether it is up or down).\n\n  * A list of multicast addresses associated with the device.\n\n  * The promiscuity counter (discussed later in this section).\n\n  * The features that the device supports (like GSO or GRO offloading).\n\n  * An object of network device callbacks (net_device_ops object), which consists of function pointers, such as for opening and stopping a device, starting to transmit, changing the MTU of the network device, and more.\n\n  * An object of ethtool callbacks, which supports getting information about the device by running the command-line ethtool utility.\n\n  * The number of Tx and Rx queues, when the device supports multiqueues.\n\n  * The timestamp of the last transmit of a packet on this device.\n\n  * The timestamp of the last reception of a packet on this device.\n\nThe following is the definition of some of the members of the net_device structure to give you a first impression:\n\nstruct net_device {\n\nunsigned int irq; /* device IRQ number */\n\n...\n\nconst struct net_device_ops *netdev_ops;\n\n...\n\nunsigned int mtu;\n\n...\n\nunsigned int promiscuity;\n\n...\n\nunsigned char *dev_addr;\n\n...\n\n};\n\n(include/linux/netdevice.h)\n\nAppendix A of the book includes a very detailed description of the net_device structure and most of its members. In that appendix you can see the irq, mtu, and other members mentioned earlier in this chapter.\n\nWhen the promiscuity counter is larger"
      ],
      "latency_s": 10.72,
      "rag_type": "literag",
      "dominio": "LiteRAG_Bench_01",
      "titulo": "",
      "error": ""
    },
    {
      "question": "Which Linux kernel macro is used to iterate over the system's list of network devices?",
      "ground_truth": "for_each_netdev",
      "answer": "The provided text does not explicitly mention a Linux kernel macro used to iterate over the system's list of network devices. However, it does state that the `net_device` structure has a `dev_list` member, which is a `struct list_head`. The text mentions that \"Insertion to the list is done with the list_netdevice() method, when the network device is registered. Removal from the list is done with the unlist_netdevice() method, when the network device is unregistered.\" This suggests that the `dev_list` is a global list of network devices, and standard list traversal techniques in the Linux kernel would be used to iterate over it.",
      "contexts": [
        "## Direct Evidence (Source Text)\n[Direct Result]: on the netdev_chain, by calling the raw_notifier_call_chain() method.\n\n#### int blocking_notifier_call_chain(struct blocking_notifier_head *nh, unsigned long val, void *v);\n\nThis method is for generating notification events; eventually, after using locking mechanism, it invokes the notifier_call_chain() method.\n\n#### int __atomic_notifier_call_chain(struct atomic_notifier_head *nh,unsigned long val, void *v, int nr_to_call, int *nr_calls);\n\nThis method is for generating notification events. Eventually, after using locking mechanism, it invokes the notifier_call_chain() method.\n\n### Macros\n\nHere you'll find a description of the macro that was covered in this chapter.\n\n#### pci_register_driver()\n\nThis macro registers a PCI driver in the PCI subsystem. It gets a pci_driver object as a parameter. It is usually called in the network driver module_init() method.\nRami RosenLinux Kernel NetworkingImplementation and Theory10.1007/978-1-4302-6197-1_15\n\n© Rami Rosen 2014\n\n# Linux API\n\nRami Rosen1\n\n(1)\n\nHaifa, Israel\n\nAbstract\n\nIn this appendix I cover the two most fundamental data structures in the Linux Kernel Networking stack: the sk_buff and the net_device. This is reference material that can help when reading the rest of this book, as you will probably encounter these two structures in almost every chapter. Becoming familiar with and learning about these two data structures is essential for understanding the Linux Kernel Networking stack. Subsequently, there is a section about remote DMA (RDMA), which is further reference material for Chapter 13. It describes in detail the main methods and the main data structures that are used by RDMA. This appendix is a good place to always return to, especially when looking for definitions of the basic terms.\n\nIn this appendix I cover the two most fundamental data structures in the Linux Kernel Networking stack: the sk_buff and the net_device. This is reference material that can help when reading the rest of this book, as you will probably encounter these two structures in almost every chapter. Becoming familiar with and learning about these two data structures is essential for understanding the Linux Kernel Networking stack. Subsequently, there is a section about remote DMA (RDMA), which is further reference material for Chapter 13. It describes in detail the main methods and the main data structures that are used by RDMA. This appendix is a good place to always return to, especially when looking for definitions of the basic terms.\n\n## The sk_buff Structure\n\nThe sk_buff structure represents a packet. SKB stands for socket buffer. A packet can be generated by a local socket in the local machine, which was created by a userspace application; the packet can be sent outside or to another socket in the same machine. A packet can also be created by a kernel socket; and you can receive a physical frame from a network device (Layer 2) and attach it to an sk_buff and pass it on to Layer 3. When the packet destination is your local machine, it will continue to Layer 4. If the packet is not for your machine, it will be forwarded according to your routing tables rules, if your machine supports forwarding. If the packet is damaged for any reason, it will be dropped. The sk_buff is a very large structure; I mention most of its members in this section. The sk_buff structure is defined in include/linux/skbuff.h . Here is a description of most of its members:\n\n  * ktime_t tstamp\n\nTimestamp of the arrival of the packet. Timestamps are stored in the SKB as offsets to a base timestamp. Note: do not confuse tstamp of the SKB with hardware timestamping, which is implemented with the hwtstamps of skb_shared_info. I describe the skb_shared_info object later in this appenidx.\n\nHelper methods:\n\n  * skb_get_ktime(const struct sk_buff *skb): Returns the tstamp of the specified skb.\n\n  * skb_get_timestamp(const struct sk_buff *skb, struct timeval *stamp): Converts the offset back to a struct timeval.\n\n  * net_timestamp_set(struct sk_buff *skb): Sets the timestamp for the specified skb. The timestamp calculation is done with the ktime_get_real() method, which returns the time in ktime_t format.\n\n  * net_enable_timestamp(): This method should be called to enable SKB timestamping.\n\n  * net_disable_timestamp(): This method should be called to disable SKB timestamping.\n\n  * struct sock *sk\n\nThe socket that owns the SKB, for local generated traffic and for traffic that is destined for the local host. For packets that are being forwarded, sk is NULL. Usually when talking about sockets you deal with sockets which are created by calling the socket() system call from userspace. It should be mentioned that there are also kernel sockets, which are created by calling the sock_create_kern() method. See for example in vxlan_init_net() in the VXLAN driver, drivers/net/vxlan.c.\n\nHelper method:\n\n  * skb_orphan(struct sk_buff *skb): If the specified skb has a destructor, call this destructor; set the sock object (sk) of the specified skb to NULL, and set the destructor of the specified skb to NULL.\n\n  * struct net_device *dev\n\nThe dev member is a net_device object which represents the network interface device associated to the SKB; you will sometimes encounter the term NIC (Network Interface Card) for such a network device. It can be the network device on which the packet arrives, or the network device on which the packet will be sent. The net_device structure will be discussed in depth in the next section.\n\n  * char cb[48]\n\nThis is the control buffer. It is free to use by any layer. This is an opaque area used to store private information. For example, the TCP protocol uses it\n\n[Direct Result]: _hw_addr_list uc\n\nUnicast MAC addresses list, initialized by the dev_uc_init() method. There are three types of packets in Ethernet: unicast, multicast, and broadcast. Unicast is destined for one machine, multicast is destined for a group of machines, and broadcast is destined for all the machines in the LAN.\n\nHelper methods:\n\n  * netdev_uc_empty(dev): Returns 1 if the unicast list of the specified device is empty (its count field is 0).\n\n  * dev_uc_flush(struct net_device *dev): Flushes the unicast addresses of the specified network device and zeroes count.\n\n  * struct netdev_hw_addr_list mc\n\nMulticast MAC addresses list, initialized by the dev_mc_init() method.\n\nHelper methods:\n\n  * netdev_mc_empty(dev): Returns 1 if the multicast list of the specified device is empty (its count field is 0).\n\n  * dev_mc_flush(struct net_device *dev): Flushes the multicast addresses of the specified network device and zeroes the count field.\n\n  * unsigned int promiscuity\n\nA counter of the times a network interface card is told to work in promiscuous mode. With promiscuous mode, packets with MAC destination address which is different than the interface MAC address are not rejected. The promiscuity counter is used, for example, to enable more than one sniffing client; so when opening some sniffing clients (like wireshark), this counter is incremented by 1 for each client you open, and closing that client will decrement the promiscuity counter. When the last instance of the sniffing client is closed, promiscuity will be set to 0, and the device will exit from working in promiscuous mode. It is used also in the bridging subsystem, as the bridge interface needs to work in promiscuous mode. So when adding a bridge interface, the network interface card is set to work in promiscuous mode. See the call to the dev_set_promiscuity() method in br_add_if(), net/bridge/br_if.c.\n\nHelper method:\n\n  * dev_set_promiscuity(struct net_device *dev, int inc): Increments/decrements the promiscuity counter of the specified network device according to the specified increment. The dev_set_promiscuity() method can get a positive increment or a negative increment parameter. As long as the promiscuity counter remains above zero, the interface remains in promiscuous mode. Once it reaches zero, the device reverts back to normal filtering operation. Because promiscuity is an integer, the dev_set_promiscuity() method takes into account cyclic overflow of integer, which means it handles the case when the promiscuity counter is incremented when it reaches the maximum positive value an unsigned integer can reach.\n\n  * unsigned int allmulti\n\nThe allmulti counter of the network device enables or disables the allmulticast mode. When selected, all multicast packets on the network will be received by the interface. You can set a network device to work in allmulticast mode by ifconfig eth0 allmulti. You disable the allmulti flag by ifconfig eth0 –allmulti.\n\nEnabling/disabling the allmulticast mode can also be performed with the ip command:\n\nip link set p2p1 allmulticast on\n\nip link set p2p1 allmulticast off\n\nYou can also see the allmulticast state by inspecting the flags that are shown by the ip command:\n\nip addr show\n\nflags=4610<BROADCAST,ALLMULTI,MULTICAST> mtu 1500\n\nHelper method:\n\n  * dev_set_allmulti(struct net_device *dev, int inc): Increments/decrements the allmulti counter of the specified network device according to the specified increment (which can be a positive or a negative integer). The dev_set_allmulti() method also sets the IFF_ALLMULTI flag of the network device when setting the allmulticast mode and removes this flag when disabling the allmulticast mode.\n\nThe next three fields are protocol-specific pointers:\n\n  * struct in_device __rcu *ip_ptr\n\nThis pointer is assigned to a pointer to struct in_device, which represents IPv4 specific data, in inetdev_init(), net/ipv4/devinet.c.\n\n  * struct inet6_dev __rcu *ip6_ptr\n\nThis pointer is assigned to a pointer to struct inet6_dev, which represents IPv6 specific data, in ipv6_add_dev(), net/ipv6/addrconf.c.\n\n  * struct wireless_dev *ieee80211_ptr\n\nThis is a pointer for the wireless device, assigned in the ieee80211_if_add() method, net/mac80211/iface.c.\n\n  * unsigned long last_rx\n\nTime of last Rx. It should not be set by network device drivers, unless really needed. Used, for example, in the bonding driver code.\n\n  * struct list_head dev_list\n\nThe global list of network devices. Insertion to the list is done with the list_netdevice() method, when the network device is registered. Removal from the list is done with the unlist_netdevice() method, when the network device is unregistered.\n\n  * struct list_head napi_list\n\nNAPI stands for New API, a technique by which the network driver works in polling mode, and not in interrupt-driven mode, when it is under high traffic. Using NAPI under high traffic has been proven to improve performance. When working with NAPI, instead of getting an interrupt for each received packet, the network stack buffers the packets and from time to time triggers the poll method the driver registered with the netif_napi_add() method. When working with polling mode, the driver starts to work in interrupt-driven mode. When there is an interrupt for the first received packet, you reach the interrupt service routine (ISR), which is the method that was registered with request\n\n[Direct Result]: {\n\nunsigned int irq; /* device IRQ number */\n\n...\n\nconst struct net_device_ops *netdev_ops;\n\n...\n\nunsigned int mtu;\n\n...\n\nunsigned int promiscuity;\n\n...\n\nunsigned char *dev_addr;\n\n...\n\n};\n\n(include/linux/netdevice.h)\n\nAppendix A of the book includes a very detailed description of the net_device structure and most of its members. In that appendix you can see the irq, mtu, and other members mentioned earlier in this chapter.\n\nWhen the promiscuity counter is larger than 0, the network stack does not discard packets that are not destined to the local host. This is used, for example, by packet analyzers (\"sniffers\") like tcpdump and wireshark, which open raw sockets in userspace and want to receive also this type of traffic. It is a counter and not a Boolean in order to enable opening several sniffers concurrently: opening each such sniffer increments the counter by 1. When a sniffer is closed, the promiscuity counter is decremented by 1; and if it reaches 0, there are no more sniffers running, and the device exits the promiscuous mode.\n\nWhen browsing kernel networking core source code, in various places you will probably encounter the term NAPI (New API), which is a feature that most network device drivers implement nowadays. You should know what it is and why network device drivers use it.\n\n### New API (NAPI) in Network Devices\n\nThe old network device drivers worked in interrupt-driven mode, which means that for every received packet, there was an interrupt. This proved to be inefficient in terms of performance under high load traffic. A new software technique was developed, called New API (NAPI), which is now supported on almost all Linux network device drivers. NAPI was first introduced in the 2.5/2.6 kernel and was backported to the 2.4.20 kernel. With NAPI, under high load, the network device driver works in polling mode and not in interrupt-driven mode. This means that each received packet does not trigger an interrupt. Instead the packets are buffered in the driver, and the kernel polls the driver from time to time to fetch the packets. Using NAPI improves performance under high load. For sockets applications that need the lowest possible latency and are willing to pay a cost of higher CPU utilization, Linux has added a capability for Busy Polling on Sockets from kernel 3.11 and later. This technology is discussed in Chapter 14, in the \"Busy Poll Sockets\" section.\n\nWith your new knowledge about network devices under your belt, it is time to learn about the traversal of a packet inside the Linux Kernel Networking stack.\n\n### Receiving and Transmitting Packets\n\nThe main tasks of the network device driver are these:\n\n  * To receive packets destined to the local host and to pass them to the network layer (L3), and from there to the transport layer (L4)\n\n  * To transmit outgoing packets generated on the local host and sent outside, or to forward packets that were received on the local host\n\nFor each packet, incoming or outgoing, a lookup in the routing subsystem is performed. The decision about whether a packet should be forwarded and on which interface it should be sent is done based on the result of the lookup in the routing subsystem, which I describe in depth in Chapters 5 and . The lookup in the routing subsystem is not the only factor that determines the traversal of a packet in the network stack. For example, there are five points in the network stack where callbacks of the netfilter subsystem (often referred to as netfilter hooks) can be registered. The first netfilter hook point of a received packet is NF_INET_PRE_ROUTING, before a routing lookup was performed. When a packet is handled by such a callback, which is invoked by a macro named NF_HOOK(), it will continue its traversal in the networking stack according to the result of this callback (also called verdict). For example, if the verdict is NF_DROP, the packet will be discarded, and if the verdict is NF_ACCEPT, the packet will continue its traversal as usual. Netfilter hooks callbacks are registered by the nf_register_hook() method or by the nf_register_hooks() method, and you will encounter these invocations, for example, in various netfilter kernel modules. The kernel netfilter subsystem is the infrastructure for the well-known iptables userspace package. Chapter 9 describes the netfilter subsystem and the netfilter hooks, along with the connection tracking layer of netfilter.\n\nBesides the netfilter hooks, the packet traversal can be influenced by the IPsec subsystem—for example, when it matches a configured IPsec policy. IPsec provides a network layer security solution, and it uses the ESP and the AH protocols. IPsec is mandatory according to IPv6 specification and optional in IPv4, though most operating systems, including Linux, implemented IPsec also in IPv4. IPsec has two modes of operation: transport mode and tunnel mode. It is used as a basis for many virtual private network (VPN) solutions, though there are also non-IPsec VPN solutions. You learn about the IPsec subsystem and about IPsec policies in Chapter 10, which also discusses the problems that occur when working with IPsec through a NAT, and the IPsec NAT traversal solution.\n\nStill other factors can influence the traversal of the packet—for example, the value of the ttl field in the IPv4 header of a packet being forwarded. This ttl is decremented by 1 in each forwarding device. When it reaches 0, the packet is discarded, and an ICMPv4 message of \"Time Exceeded\" with \"TTL Count Exceeded\" code is sent back. This is done to avoid an endless journey of a forwarded packet because of some error. Moreover, each time a packet is forwarded successfully and the ttl is decremented by 1, the checksum of the"
      ],
      "latency_s": 26.73,
      "rag_type": "literag",
      "dominio": "LiteRAG_Bench_01",
      "titulo": "",
      "error": ""
    },
    {
      "question": "What is the name of the standard R function used to perform Nelder-Mead optimization?",
      "ground_truth": "optim()",
      "answer": "The `optim()` function in R can be used to perform Nelder-Mead optimization.",
      "contexts": [
        "## Direct Evidence (Source Text)\n[Direct Result]: :\n\n  * meanint (from package rminer )—computes the mean and t-student confidence intervals;\n\n  * segments —draws a segment;\n\n  * par —sets graphical parameters used by plot; and\n\n  * lines —joints points into line segments.\n\nThe result execution of file compare.R is presented in Fig. 4.4. Initially, all methods present a fast and similar convergence. However, after around 1,000 evaluations, the hill climbing and simulated annealing methods start to outperform the random search (Monte Carlo). The confidence interval bars show that after around 4,000 evaluations, the local search methods are statistically better when compared with Monte Carlo. In this experiment, simulated annealing produces only a slight best average result and the differences are not statistically significant when compared with hill climbing (since confidence intervals overlap).\n\nFig. 4.4\n\nLocal search comparison example for the rastrigin task (D = 20)\n\n## 4.6 Command Summary\n\nceiling() | returns the closest upper integer\n\n---|---\n\nhchange() | slight random change of a vector (chapter file \"hill.R\")\n\nhclimbing() | standard hill climbing search (chapter file \"hill.R\")\n\nifelse() | conditional element selection\n\nlines() | joints points into line segments\n\nmeanint | computes the mean and t-student confidence intervals (package rminer)\n\noptim() | general-purpose optimization (includes simulated annealing)\n\npar() | set or query graphical parameters used by plot()\n\nrminer | package for simpler use of data mining (classification and regression) methods\n\nsegments | draws a segment line\n\ntabuSearch | package for tabu search\n\ntabuSearch() | tabu search for binary string maximization (package tabuSearch)\n\n## 4.7 Exercises\n\n4.1.\n\nAdapt the function hclimbing function to accept an additional control parameter (N). When N = 0, the function should execute the standard hill climbing, while when N > 0, the function should implement the steepest ascent hill climbing method. This last variant works by searching first N neighbor solutions within each iteration, in order to select the best new solution to be compared with current search point.\n\n4.2.\n\nExplore the optimization of the binary max sin task with a higher dimension (D = 16), under hill climbing, simulated annealing, and tabu search methods. Use the zero vector as the starting point and a maximum of 20 iterations. Show the optimized solutions and evaluation values.\n\n4.3.\n\nExecute the optimization of the rastrigin function (D = 8) with the tabuSearch function. Adopt a binary representation such that each dimension value is encoded into 8 bits, denoting any of the 256 regular levels within the range [−5. 2, 5. 2]. Use the control parameters: maxit = 500, N = 8, L = 8 and nRestarts=1 and a randomly generated initial point.\n\nReferences\n\nBélisle CJ (1992) Convergence theorems for a class of simulated annealing algorithms on R d. J Appl Probab 29:885–895CrossRefMATHMathSciNet\n\nBrownlee J (2011) Clever algorithms: nature-inspired programming recipes, Lulu\n\nGlover F (1986) Future paths for integer programming and links to artificial intelligence. Comput Oper Res 13(5):533–549CrossRef90048-1)MATHMathSciNet\n\nGlover F (1990) Tabu search: a tutorial. Interfaces 20(4):74–94CrossRef\n\nLuke S (2012) Essentials of metaheuristics. Lulu.com, online version at http://​cs.​gmu.​edu/​~sean/​book/​metaheuristics\n\nMendes R (2004) Population topologies and their influence in particle swarm performance. Ph.D. thesis, Universidade do Minho\n\nMichalewicz Z, Schmidt M, Michalewicz M, Chiriac C (2006) Adaptive business intelligence. Springer, Berlin\n\nMichalewicz Z, Schmidt M, Michalewicz M, Chiriac C (2007) Adaptive business intelligence: three case studies. In: Evolutionary computation in dynamic and uncertain environments. Springer, Berlin, pp 179–196\n\nWolpert DH, Macready WG (1997) No free lunch theorems for optimization. IEEE Trans Evol Comput 1(1):67–82CrossRef\n© Springer International Publishing Switzerland 2014\n\nPaulo CortezModern Optimization with RUse R!10.1007/978-3-319-08263-9_5\n\n# 5. Population Based Search\n\nPaulo Cortez1\n\n(1)\n\nDepartment of Information Systems, University of Minho, Guimarães, Portugal\n\n## 5.1 Introduction\n\nIn previous chapter, several local based search methods were presented, such as hill climbing, simulated annealing, and tabu search. All these methods are single-state, thus operating their effort around the neighborhood of a current solution. This type of search is simple and quite often efficient (Michalewicz et al. 2006). However, there is another interesting class of search methods, known as population based search , that use a pool of candidate solutions rather than a single search point. Thus, population based methods tend to require more computation when compared with simpler local methods, although they tend to work better as global optimization methods, quickly finding interesting regions of the search space (Michalewicz and Fogel 2004).\n\nAs shown in Fig. 5.1, population based methods tend to explore more distinct regions of the search space, when compared with single-state methods\n\n[Direct Result]: haf W, Nordin P, Keller R, Francone F (1998) Genetic programming. An introduction. Morgan Kaufmann, San FranciscoCrossRefMATH\n\nBoyd S, Vandenberghe L (2004) Convex optimization. Cambridge University Press, CambridgeCrossRefMATH\n\nChen WN, Zhang J, Chung HS, Zhong WL, Wu WG, Shi YH (2010) A novel set-based particle swarm optimization method for discrete optimization problems. IEEE Trans Evol Comput 14(2):278–300CrossRef\n\nCortez P (2010) Data mining with neural networks and support vector machines using the R/rminer tool. In: Perner P (ed) Advances in data mining: applications and theoretical aspects. 10th industrial conference on data mining. Lecture notes in artificial intelligence, vol 6171. Springer, Berlin, pp 572–583\n\nCortez P, Rocha M, Neves J (2004) Evolving time series forecasting ARMA models. J Heuristics 10(4):415–429CrossRef\n\nEberhart R, Kennedy J, Shi Y (2001) Swarm intelligence. Morgan Kaufmann, San Francisco\n\nEberhart RC, Shi Y (2011) Computational intelligence: concepts to implementations. Morgan Kaufmann, San Francisco\n\nGlover F, Laguna M (1998) Tabu search. Springer, Heidelberg\n\nHolland J (1975) Adaptation in natural and artificial systems. Ph.D. thesis, University of Michigan\n\nLuke S (2012) Essentials of metaheuristics. Lulu.com, online version at http://​cs.​gmu.​edu/​~sean/​book/​metaheuristics\n\nMichalewicz Z (2008) Adaptive Business Intelligence, Computer Science Course 7005 Handouts\n\nMichalewicz Z, Fogel D (2004) How to solve it: modern heuristics. Springer, BerlinCrossRef\n\nMichalewicz Z, Schmidt M, Michalewicz M, Chiriac C (2006) Adaptive business intelligence. Springer, Berlin\n\nMuenchen RA (2013) The popularity of data analysis software. http://​r4stats.​com/​articles/​popularity/​\n\nR Core Team (2013) R: a language and environment for statistical computing. R Foundation for Statistical Computing, Vienna. http://​www.​R-project.​org/​\n\nRocha M, Cortez P, Neves J (2000) The Relationship between learning and evolution in static and in dynamic environments. In: Fyfe C (ed) Proceedings of the 2nd ICSC symposium on engineering of intelligent systems (EIS'2000). ICSC Academic Press, Paisley, pp 377–383\n\nRocha M, Mendes R, Cortez P, Neves J (2001) Sitting guest at a wedding party: experiments on genetic and evolutionary constrained optimization. In: Proceedings of the 2001 congress on evolutionary computation (CEC2001), vol 1. IEEE Computer Society, Seoul, pp 671–678\n\nRocha M, Cortez P, Neves J (2007) Evolution of neural networks for classification and regression. Neurocomputing 70:2809–2816CrossRef\n\nRocha M, Sousa P, Cortez P, Rio M (2011) Quality of service constrained routing optimization using evolutionary computation. Appl Soft Comput 11(1):356–364CrossRef\n\nSchrijver A (1998) Theory of linear and integer programming. Wiley, ChichesterMATH\n\nTang K, Li X, Suganthan P, Yang Z, Weise T (2009) Benchmark functions for the cec'2010 special session and competition on large-scale global optimization. Tech. rep., Technical report, University of Science and Technology of China\n\nVance A (2009) R You Ready for R? http://​bits.​blogs.​nytimes.​com/​2009/​01/​08/​r-you-ready-for-r/​\n© Springer International Publishing Switzerland 2014\n\nPaulo CortezModern Optimization with RUse R!10.1007/978-3-319-08263-9_2\n\n# 2. R Basics\n\nPaulo Cortez1\n\n(1)\n\nDepartment of Information Systems, University of Minho, Guimarães, Portugal\n\n## 2.1 Introduction\n\nAs explained in the preface of this book, the goal of this chapter is to briefly present the most relevant R tool aspects that need to be learned by non-experts in order to understand the examples discussed in this book. For a more detailed introduction to the tool, please consult (Paradis 2002; Zuur et al. 2009; Venables et al. 2013).\n\nR is language and a computational environment for statistical analysis that was created by Ihaka and Gentleman in 1991 and that was influenced by the S and Scheme languages (Ihaka and Gentleman 1996). R uses a high-level language, based in objects, that is flexible and extensible (e.g., by the development of packages) and allows a natural integration of statistics, graphics, and programming. The R system offers an integrated suite with a large and coherent collection of tools for data manipulation, analysis, and graphical display.\n\nThe tool is freely distributed under a GNU general public license and can be easily installed from the official web page (http://​www.​r-project.​org) , with several binary versions available for most commonly adopted operating systems (e.g., Windows, MacOS). R can be run under the console (e.g., common in\n\n[Direct Result]: igin,\"min\")\n\ncat(label,\"D:\",D[i],\"s:\",S$sol[1:2],\"f:\",S$eval,\"\\n\")\n\n}\n\nTo simplify the analysis of the obtained results, the code only shows the optimized values for the first two variables (x 1 and x 2). Given that Monte Carlo is a stochastic method, each run will present a different result. An example execution (one run) is:\n\n> source(\"test-mc.R\")\n\nmonte carlo search (N: 10000 )\n\nbag prices:s: 349.7477 369.1669 396.1959 320.5007 302.3327 f: 42508\n\nsphere D: 2 s: -0.01755296 0.0350427 f: 0.001536097\n\nsphere D: 30 s: -0.09818928 -1.883463 f: 113.7578\n\nrastrigin D: 2 s: -0.0124561 0.02947438 f: 0.2026272\n\nrastrigin D: 30 s: 0.6508581 -3.043595 f: 347.1969\n\nUnder the tested setup (N = 10, 000), interesting results were achieved for the sphere and rastrigin tasks when D = 2. However, when the dimension increases (D = 30) the optimized solutions are further away from the optimum value (f = 0). For demonstration purposes, Fig. 3.3 shows two examples of Monte Carlo searches for sphere and D = 2 (left plot with N = 100 and right graph with N = 1, 000).\n\nFig. 3.3\n\nExample of Monte Carlo search using N = 100 (left) and N = 1, 000 (right) samples for sphere and D = 2\n\n## 3.5 Command Summary\n\ndfsearch() | Depth-first blind search (chapter file \"blind.R\")\n\n---|---\n\nfsearch() | Full blind search (chapter file \"blind.R\")\n\ngsearch() | Grid search (chapter file \"grid.R\")\n\nmcsearch() | Monte Carlo search (chapter file \"montecarlo.R\")\n\nngsearch() | Nested-grid search (chapter file \"grid.R\")\n\nproc.time() | Time elapsed by the running process\n\nrev() | Reversed version of an object\n\nscatterplot3d | Package that implements scatterplot3d()\n\nscatterplot3d() | Plot a 3D point cloud (package scatterplot3d)\n\nstrsplit() | Split elements of character vector\n\nt() | Matrix transpose\n\nunlist() | Convert list to vector\n\n## 3.6 Exercises\n\n3.1.\n\nExplore the optimization of the binary max sin task with a higher dimension (D = 16), under pure blind, grid, and Monte Carlo methods. Show the optimized solutions, evaluation values, and time elapsed (in seconds). For the grid and Monte Carlo methods, use directly the fsearch function, by changing only the integer space (object x of the file \"binary-blind.R\") with a maximum of N = 1, 000 searches. Tip: use seq() for setting the grid search integer space and sample() for Monte Carlo.\n\n3.2.\n\nConsider the bag prices (D = 5). Adapt the file \"bag-grid.R\" such that two grid searches are performed over the range [350, 450] with a step size of 11$ in order to show the solution and evaluation values. The first search should be executed using gsearch function, while the second search should be implemented using the depth-first method (dfsearch function). Tip: use the seq function to set the domain of values used by dfsearch.\n\n3.3.\n\nConsider the rastrigin task with a dimension of D = 30. Using the Monte Carlo method, explore different N values within the range {100,1,000,10,000}. Execute 30 runs for each N value and compare if the average differences are statistically significant at the 95 % confidence level under a pairwise t-student test. Also, plot the boxplots for the results due to each N value.\n\nReferences\n\nCaflisch RE (1998) Monte carlo and quasi-monte carlo methods. Acta Numer 1998:1–49CrossRefMathSciNet\n\nHsu CH, Chang CC, Lin CJ (2003) A practical guide to support vector classification. Tech. rep., National Taiwan University\n\nHuang CM, Lee YJ, Lin DK, Huang SY (2007) Model selection for support vector machines via uniform design. Comput Stat Data Anal 52(1):335–346CrossRefMATHMathSciNet\n\nRobert C, Casella G (2009) Introducing Monte Carlo methods with R. Springer, New York\n\nFootnotes\n\n1\n\nSlightly different execution times can be achieved by executing distinct runs under the same code and machine.\n© Springer International Publishing Switzerland 2014\n\nPaulo CortezModern Optimization with RUse R!10.1007/978-3-319-08263-9_4\n\n# 4. Local Search\n\nPaulo Cortez1\n\n(1)\n\nDepartment of Information Systems, University of Minho, Guimarães, Portugal\n\n## 4.1 Introduction\n\nIn contrast with the blind search methods presented in Chap. , modern optimization techniques are based on a guided search, where new solutions are generated from existing solutions. Local search , often termed single-state search, includes several methods that focus their attention within a local neighborhood of a given initial solution, as shown in Fig. 4.1. A priori knowledge, such as problem domain heuristics, can be used to set the initial solution. A more common\n\n[Direct Result]: hchange\n\nsource(\"blind.R\") # get fsearch\n\nsource(\"montecarlo.R\") # get mcsearch\n\nlibrary(rminer) # get meanint\n\n# comparison setup:\n\ncrastrigin=function(x)\n\n{ f=10*length(x)+sum(x^2-10*cos(2*pi*x))\n\n# global assignment code: <<-\n\nEV<<-EV+1 # increase evaluations\n\nif(f<BEST) BEST<<-f\n\nif(EV<=MAXIT) F[EV]<<-BEST\n\nreturn(f)\n\n}\n\nRuns=50; D=20; MAXIT=10000\n\nlower=rep(-5.2,D);upper=rep(5.2,D)\n\nrchange1=function(par,lower,upper) # change for hclimbing\n\n{ hchange(par,lower=lower,upper=upper,rnorm,\n\nmean=0,sd=0.5,round=FALSE) }\n\nrchange2=function(par) # change for optim\n\n{ hchange(par,lower=lower,upper=upper,rnorm,\n\nmean=0,sd=0.5,round=FALSE) }\n\nCHILL=list(maxit=MAXIT,REPORT=0)\n\nCSANN=list(maxit=MAXIT,temp=10,trace=FALSE)\n\nMethods=c(\"monte carlo\",\"hill climbing\",\"simulated annealing\")\n\n# run all optimizations and store results:\n\nRES=vector(\"list\",length(Methods)) # all results\n\nfor(m in 1:length(Methods))\n\nRES[[m]]=matrix(nrow=MAXIT,ncol=Runs)\n\nfor(R in 1:Runs) # cycle all runs\n\n{ s=runif(D,-5.2,5.2) # initial search point\n\nEV=0; BEST=Inf; F=rep(NA,MAXIT) # reset these vars.\n\n# monte carlo:\n\nmcsearch(MAXIT,lower=lower,upper=upper,FUN=crastrigin)\n\nRES[[1]][,R]=F\n\n# hill climbing:\n\nEV=0; BEST=Inf; F=rep(NA,MAXIT)\n\nhclimbing(s,crastrigin,change=rchange1,lower=lower,\n\nupper=upper,control=CHILL,type=\"min\")\n\nRES[[2]][,R]=F\n\n# SANN:\n\nEV=0; BEST=Inf; F=rep(NA,MAXIT)\n\noptim(s,crastrigin,method=\"SANN\",gr=rchange2,control=CSANN)\n\nRES[[3]][,R]=F\n\n}\n\n# aggregate (average and confidence interval) results:\n\nAV=matrix(nrow=MAXIT,ncol=length(Methods))\n\nCI=AV\n\nfor(m in 1:length(Methods))\n\n{\n\nfor(i in 1:MAXIT)\n\n{\n\nmi=meanint(RES[[m]][i,])\n\nAV[i,m]=mi$mean;CI[i,m]=mi$int\n\n}\n\n}\n\n# show comparative PDF graph:\n\n# plot a nice confidence interval bar:\n\nconfbar=function(x,ylower,yupper,K=100)\n\n{ segments(x-K,yupper,x+K)\n\nsegments(x-K,ylower,x+K)\n\nsegments(g2,ylower,g2,yupper)\n\n}\n\npdf(\"comp-rastrigin.pdf\",width=5,height=5)\n\npar(mar=c(4.0,4.0,0.1,0.6)) # reduce default plot margin\n\nMIN=min(AV-CI);MAX=max(AV+CI)\n\n# 10.000 are too much points, thus two grids are used\n\n# to improve clarity:\n\ng1=seq(1,MAXIT,length.out=1000) # grid for lines\n\ng2=seq(1,MAXIT,length.out=11) # grid for confbar\n\nplot(g1,AV[g1,3],ylim=c(MIN,MAX),type=\"l\",lwd=2,\n\nylab=\"average best\",xlab=\"number of evaluations\")\n\nconfbar(g2,AV[g2,3]-CI[g2,3],AV[g2,3]+CI[g2,3])\n\nlines(g1,AV[g1,2],lwd=2,lty=2)\n\nconfbar(g2,AV[g2,2]-CI[g2,2],AV[g2,2]+CI[g2,2])\n\nlines(g1,AV[g1,1],lwd=2,lty=3)\n\nconfbar(g2,AV[g2,1]-CI[g2,1],AV[g2,1]+CI[g2,1])\n\nlegend(\"topright\",legend=rev(Methods),lwd=2,lty=1:3)\n\ndev.off() # close the PDF device\n\nGiven that some optimization functions (e.g., optim) are restrictive in terms of the parameters that can be used as inputs, the evaluation function is adapted to perform global assignments (operator <​​​ <-, Sect. 2.​3) to the number of evaluations (EV), best value (BEST), and vector of best function values (F). The results are stored in a vector list of size 3, each element with a matrix maxit × runs. Two similar change functions are defined, since optim does not allow the definition of additional arguments to be passed to gr. The code introduces some new R functions:\n\n  * meanint (from package rminer )—computes the mean and t-student confidence intervals;\n\n  * segments —draws a segment;\n\n  * par —sets graphical parameters used by plot; and\n\n  * lines —joints points into line segments.\n\nThe result execution of file compare.R is presented in Fig. 4.4. Initially, all methods present a fast and similar convergence. However, after around 1,000 evaluations, the hill climbing and simulated anne\n\n## Entity Definitions\n**NELDER-MEAD**: Nelder-Mead, also known as the downhill simplex method, is an optimization method available through the optim R function.\n\n## Community Context\n\n**Community 2**: The community is heavily centered around the R programming language, with numerous entities representing R packages, functions, and related tools. Key figures like Michalewicz et al., Rocha, Luke, and Cortez are associated with optimization and machine learning within the R ecosystem. The community also touches upon broader concepts like finance, business intelligence, and scientific computing, all of which leverage R's capabilities for data analysis and modeling. The relationships indicate a strong focus on statistical computing, data manipulation, and the application of various optimization and forecasting techniques."
      ],
      "latency_s": 10.45,
      "rag_type": "literag",
      "dominio": "LiteRAG_Bench_01",
      "titulo": "",
      "error": ""
    },
    {
      "question": "Which heuristic search algorithm for optimization is inspired by the cooling process in metallurgy?",
      "ground_truth": "Simulated Annealing",
      "answer": "The heuristic search algorithm inspired by the cooling process in metallurgy is **Simulated Annealing**.",
      "contexts": [
        "## Direct Evidence (Source Text)\n[Direct Result]: ),control=C,type=\"max\")\n\n# hill climbing for sphere, one run:\n\nsphere=function(x) sum(x^2)\n\nD=2; C=list(maxit=10000,REPORT=10000)\n\nrchange=function(par,lower,upper) # real value change\n\n{ hchange(par,lower,upper,rnorm,mean=0,sd=0.5,round=FALSE) }\n\ns=runif(D,-5.2,5.2) # initial search\n\nhclimbing(s,sphere,change=rchange,lower=rep(-5.2,D),\n\nupper=rep(5.2,D),control=C,type=\"min\")\n\nAn execution example is:\n\n> source(\"bs-hill.R\")\n\ni: 1 s: 136 332 716 748 781 f: 28946 s' 135 332 716 749 781 f: 28890\n\ni: 10000 s: 188 338 743 770 812 f: 31570 s' 189 336 742 769 812 f: 31387\n\nbest: 188 338 743 770 812 f: 31570\n\ni: 1 s: 1.884003 4.549536 f: 24.24775 s' 2.142131 4.349898 f: 23.51034\n\ni: 10000 s: 0.001860534 0.009182373 f: 8.777755e-05 s' 0.5428469 -0.304862 f: 0.3876236\n\nbest: 0.001860534 0.009182373 f: 8.777755e-05\n\nUsing 10,000 iterations, the hill climbing search improved the solution from 28,890 to 31,570 (bag prices) and from 23.51 to 0.00 (sphere). For demonstrative purposes, Fig. 4.2 shows the searched \"down the hill\" (best) points for the sphere task.\n\nFig. 4.2\n\nExample of hill climbing search (only best \"down the hill\" points are shown) for sphere and D = 2\n\n## 4.3 Simulated Annealing\n\nSimulated annealing is a variation of the hill climbing technique that was proposed in the 1980s and that is inspired in the annealing phenomenon of metallurgy, which involves first heating a particular metal and then perform a controlled cooling (Luke 2012). This single-state method differs from the hill climbing search by adopting a control temperature parameter (T) that is used to compute the probability of accepting inferior solutions. In contrast with the stochastic hill climbing, which adopts a fixed value for T, the simulated annealing uses a variable temperature value during the search. The method starts with a high temperature and then gradually decreases (cooling process) the control parameter until a small value is achieved (similar to the hill climbing). Given that simulated annealing is a single-state method, it is described in this chapter. However, it should be noted that for high temperatures the method is almost equivalent to Monte Carlo search, thus behaving more like a global search method (in particular if the change function is set to perform high changes), while for low temperatures the method is similar to the hill climbing local search (Michalewicz et al. 2006).\n\nThis book adopts the simulated annealing implementation of the optim R function, which only performs minimization tasks and that executes several optimization methods by setting argument method, such as:\n\n  * \"Nelder-Mead\"—Nelder and Mead or downhill simplex method;\n\n  * \"BFGS\"—a quasi-Newton method ;\n\n  * \"CG\"—conjugate gradients method ;\n\n  * \"L-BFGS-B\"—modification of the BFGS method with lower and upper bounds; and\n\n  * \"SANN\"—simulated annealing.\n\nAlgorithm 3 presents the pseudo-code of the simulated annealing implementation, which is based on the variant proposed by Bélisle (1992). This implementation includes three search parameters: maxit—the maximum number of iterations; temp (T)—the initial temperature; and tmax—the number of evaluations at each temperature. By default, the values for the control parameters are maxit = 10, 000, T = 10, and tmax = 10. Also, new search points are generated using a Gaussian Markov kernel with a scale proportional to the temperature. Nevertheless, these defaults can be changed by setting two optim arguments: the control list and gr (change) function. The last argument is useful for solving combinatorial problems, i.e., when the representation of the solution includes discrete values. The optim function returns a list with several components, such as $par—the optimized values and $value—the evaluation of the best solution.\n\nAlgorithm 3 Simulated annealing search as implemented by the optim function\n\nSimilarly to the hill climbing demonstration, the sumbits-sann.R file executes ten iterations of the simulated annealing for the sum of bits task:\n\n### sumbits-sann.R file ###\n\nsource(\"hill.R\") # get hchange function\n\n# sum a raw binary object x (evaluation function):\n\nminsumbin=function(x) (length(x)-sum(x)) # optim only minimizes!\n\n# SANN for sum of bits, one run:\n\nD=8 # dimension\n\ns=rep(0,D) # c(0,0,0,0,...)\n\nC=list(maxit=10,temp=10,tmax=1,trace=TRUE,REPORT=1)\n\nbchange=function(par) # binary change\n\n{ D=length(par)\n\nhchange(par,lower=rep(0,D),upper=rep(1,D),rnorm,mean=0,s\n\n[Direct Result]: minimizes!\n\n# SANN for sum of bits, one run:\n\nD=8 # dimension\n\ns=rep(0,D) # c(0,0,0,0,...)\n\nC=list(maxit=10,temp=10,tmax=1,trace=TRUE,REPORT=1)\n\nbchange=function(par) # binary change\n\n{ D=length(par)\n\nhchange(par,lower=rep(0,D),upper=rep(1,D),rnorm,mean=0,sd=1)\n\n}\n\ns=optim(s,minsumbin,gr=bchange,method=\"SANN\",control=C)\n\ncat(\"best:\",s$par,\"f:\",s$value,\"(max: fs:\",sum(s$par),\")\\n\")\n\nGiven that optim only performs minimization, the evaluation function needs to be adapted (as discussed in Sect. 1.​3). In this example, it was set to have a minimum of zero. Also, given that method=\"SANN\" does not include lower and upper bonds, it is the responsibility of the change function (gr) to not generate unfeasible solutions. In this case, the auxiliary binary change function (bchange) uses the hchange function (from file hill.R) to set the 0 and 1 bounds for all D values. An execution example of file sumbits-sann.R is:\n\n> source(\"sumbits-sann.R\")\n\nsann objective function values\n\ninitial value 8.000000\n\niter 1 value 7.000000\n\niter 2 value 2.000000\n\niter 3 value 2.000000\n\niter 4 value 1.000000\n\niter 5 value 1.000000\n\niter 6 value 1.000000\n\niter 7 value 1.000000\n\niter 8 value 1.000000\n\niter 9 value 1.000000\n\nfinal value 1.000000\n\nsann stopped after 9 iterations\n\nbest: 1 1 1 1 1 1 1 0 f: 1 (max: fs: 7 )\n\nThe simulated annealing search is also adapted for bag prices (D = 5) and sphere tasks (D = 2), by setting maxit = 10, 000, T = 1, 000 and tmax = 10 (file bs-sann.R):\n\n### bs-sann.R file ###\n\nsource(\"hill.R\") # load the hchange method\n\nsource(\"functions.R\") # load the profit function\n\neval=function(x) -profit(x) # optim minimizes!\n\n# hill climbing for all bag prices, one run:\n\nD=5; C=list(maxit=10000,temp=1000,trace=TRUE,REPORT=10000)\n\ns=sample(1:1000,D,replace=TRUE) # initial search\n\nichange=function(par) # integer value change\n\n{ D=length(par)\n\nhchange(par,lower=rep(1,D),upper=rep(1000,D),rnorm,mean=0,\n\nsd=1)\n\n}\n\ns=optim(s,eval,gr=ichange,method=\"SANN\",control=C)\n\ncat(\"best:\",s$par,\"profit:\",abs(s$value),\"\\n\")\n\n# hill climbing for sphere, one run:\n\nsphere=function(x) sum(x^2)\n\nD=2; C=list(maxit=10000,temp=1000,trace=TRUE,REPORT=10000)\n\ns=runif(D,-5.2,5.2) # initial search\n\n# SANN with default change (gr) function:\n\ns=optim(s,sphere,method=\"SANN\",control=C)\n\ncat(\"best:\",s$par,\"f:\",s$value,\"\\n\")\n\nAn example execution of file bs-sann.R is:\n\n> source(\"bs-sann.R\")\n\nsann objective function values\n\ninitial value -35982.000000\n\nfinal value -39449.000000\n\nsann stopped after 9999 iterations\n\nbest: 293 570 634 606 474 profit: 39449\n\nsann objective function values\n\ninitial value 21.733662\n\nfinal value 1.243649\n\nsann stopped after 9999 iterations\n\nbest: -0.6856747 -0.8794882 f: 1.243649\n\nIn this execution, the initial solution was improved $3,467 (bag prices) and 20.49 (sphere). For the last task execution, Fig. 4.3 shows the evolution of the temperature values (left) and points searched (right). While the initial point is within the [−5. 2, 5. 2] range, the default and unbounded Gaussian Markov change function searches for several solutions outside the initial range. However, as the search proceeds, more solutions tend to converge to the origin point, which is the optimum.\n\nFig. 4.3\n\nExample of the temperature cooling (left) and simulated annealing search (right) for sphere and D = 2\n\n## 4.4 Tabu Search\n\nTabu search was created by Glover (1986) and uses the concept of \"memory\" to force the search into new areas. The algorithm is a variation of the hill climbing method that includes in a tabu list of length L, which stores the most recent solutions that become \"tabu\" and thus cannot be used when selecting a new solution. The intention is to keep a short-term memory of recent changes, preventing future moves from deleting these changes (Brownlee 2011). Similarly to the hill climbing method, the search of solutions within the neighborhood of the current solution (function change) can be deterministic, including the entire neighborhood, or stochastic (e.g., small random perturbation). Also, the\n\n[Direct Result]: ( bottom ) tasks 87\n\nFig.5.9 Comparison of repair and death penalty strategies for bag prices task with constraint 92\n\nFig.5.10 Example of a genetic programming random subtree crossover93\n\nFig.5.11 Comparison of rastrigin function and best solution given by the genetic programming 97\n\nFig.6.1 Example of the FES1 f 1 ( left ) and f 2 ( right ) task landscapes ( D = 2) 100\n\nFig.6.2 Examples of convex ( left ) and non-convex ( right ) Pareto fronts, where the goal is to minimize both objectives 1 and 2 102\n\nFig.6.3 NSGA-II results for bag prices ( top graphs ) and FES1 ( bottom graphs ) tasks ( left graphs show the Pareto front evolution, while right graphs compare the best Pareto front with the weighted-formula results) 116\n\nFig.7.1 Example of three order mutation operators120\n\nFig.7.2 Example of PMX and OX crossover operators121\n\nFig.7.3 Comparison of simulated annealing (SANN) and evolutionary algorithm (EA) approaches for the Qatar TSP130\n\nFig.7.4 Optimized tour obtained using evolutionary algorithm ( left ), Lamarckian evolution ( middle ), and 2-opt ( right ) approaches for the Qatar TSP 131\n\nFig.7.5 Area of Qatar tour given by 2-opt ( left ) and optimized by the evolutionary approach ( right ) 133\n\nFig.7.6 Sunspot one-step ahead forecasts using ARIMA and genetic programming (gp) methods138\n\nFig.7.7 The optimized Pareto front ( left ) and ROC curve for the SVM with four inputs ( right ) for the white wine quality task 145\n\nList of Algorithms\n\n1 Generic modern optimization method7\n\n2 Pure hill climbing optimization method46\n\n3 Simulated annealing search as implemented by the optim function 51\n\n4 Tabu search54\n\n5 Genetic/evolutionary algorithm as implemented by the genalg package 65\n\n6 Differential evolution algorithm as implemented by the DEoptim package 71\n\n7 Particle swarm optimization pseudo-code for SPSO 2007 and 201175\n\n8 Generic EDA pseudo-code implemented in copulaedas package, adapted from Gonzalez-Fernandez and Soto (2012) 80\n© Springer International Publishing Switzerland 2014\n\nPaulo CortezModern Optimization with RUse R!10.1007/978-3-319-08263-9_1\n\n# 1. Introduction\n\nPaulo Cortez1\n\n(1)\n\nDepartment of Information Systems, University of Minho, Guimarães, Portugal\n\n## 1.1 Motivation\n\nA vast number of real-world (often complex) tasks can be viewed as an optimization problem, where the goal is to minimize or maximize a given goal. In effect, optimization is quite useful in distinct application domains, such as Agriculture, Banking, Control, Engineering, Finance, Marketing, Production and Science. Moreover, due to advances in Information Technology, nowadays it is easy to store and process data. Since the 1970s, and following the Moore's law, the number of transistors in computer processors has doubled every 2 years, resulting in more computational power at a reasonable price. And it is estimated that the amount of data storage doubles at a higher rate. Furthermore, organizations and individual users are currently pressured to increase efficiency and reduce costs. Rather than taking decisions based on human experience and intuition, there is an increasing trend for adopting computational tools, based on optimization methods, to analyze real-world data in order to make better informed decisions.\n\nOptimization is a core topic of the Operations Research field, which developed several classical techniques, such as linear programming (proposed in the 1940s) and branch and bound (developed in the 1960s) (Schrijver 1998). More recently, in the last decades, there has been an emergence of new optimization algorithms, often termed \"modern optimization\" (Michalewicz et al. 2006), \"modern heuristics\" (Michalewicz and Fogel 2004), or \"metaheuristics\" (Luke 2012). In this book, we adopt the first term, modern optimization, to describe these algorithms.\n\nIn contrast with classical methods, modern optimization methods are general purpose solvers, i.e., applicable to a wide range of distinct problems, since few domain knowledge is required. For instance, the optimization problem does not need to be differentiable, which is required by classical methods such as gradient descent. There are only two main issues that need to be specified by the user when adopting modern heuristic methods (Michalewicz et al. 2006): the representation of the solution, which defines the search space and its size; and the evaluation function, which defines how good a particular solution is, allowing to compare different solutions. In particular, modern methods are useful for solving complex problems for which no specialized optimization algorithm has been developed (Luke 2012). For instance, problems with discontinuities, dynamic changes, multiple objectives or hard and soft restrictions, which are more difficult to be handled by classical methods (Michalewicz et al. 2006). Also in contrast with classical methods, modern optimization does not warranty that the optimal solution is always found. However, often modern methods achieve high quality solutions with a much more reasonable use of computational resources (e.g., memory and processing effort) (Michalewicz and Fogel 2004).\n\nThere is a vast number of successful real-world applications based on modern optimization methods. Examples studied by the author of this book include (among others): sitting guests at a wedding party (Rocha et al. 2001); time series\n\n[Direct Result]: .1), local methods can easily get stuck. In such cases, multiple runs, with different initial solutions, can be executed to improve convergence. Although population based algorithms tend to require more computation than local methods, they perform a simultaneous search in distinct regions of the search space, thus working better as global optimization methods.\n\nThe distinct search types can even be combined. For instance, a two-phase search can be set, where a global method is employed at a first step, to quickly identify interesting search space regions, and then, as the second step, the best solutions are improved by employing a local search method. Another alternative is to perform a tight integration of both approaches, such as under a Lamarckian evolution or Baldwin effect (Rocha et al. 2000). In both cases, within each cycle of the population based method, each new solution is used as the initial point of a local search and the evaluation function is computed over the improved solution. Lamarckian evolution replaces the population original solution by its improved value (Sect. 7.​2 presents a Lamarckian evolution example), while the Baldwinian strategy keeps the original point (as set by the population based method).\n\nSeveral modern methods employ some degree of randomness, thus belonging to the family of stochastic optimization methods, such as simulated annealing and genetic algorithms (Luke 2012). Also, several of these methods are naturally inspired (e.g., genetic algorithms, particle swarm optimization ) (Holland 1975; Eberhart et al. 2001). Figure 1.2 shows the full taxonomy of the optimization methods presented in this book (with respective R packages).\n\nFig. 1.2\n\nClassification of the optimization methods presented in this book (related R packages are in brackets)\n\nThe distinct modern optimization methods share some common features. Algorithm 1 shows (in pseudo-code) a generic modern optimization method that is applicable to all methods discussed in this book. This global algorithm receives two inputs, the evaluation function (f) and a set of control parameters (C), which includes not only the method's internal parameters (e.g., initial temperature, population size) but it is also related with the representation of the solution (e.g., lower and upper bounds, representation type, and length). In all modern optimization methods, there is an initial setup followed by a main loop cycle that ends once a given termination criterian is met. Distinct criteria can be adopted (or even combined):\n\n  * maximum computational measures—such as number of iterations, evaluation function calculations, time elapsed;\n\n  * target measures—such as to stop if best value is higher or equal to a given threshold;\n\n  * convergence measures—such as number of iterations without any improvement in the solution or average enhancement achieved in the last iterations; and\n\n  * distribution measures—such as measuring how spread are the last tested solutions in the search space and stop if the dispersion is smaller than a threshold.\n\nWhat distinguishes the methods is related with two main aspects. First, if in each iteration there is a single-state (local based) or a population of solutions. Second, the way new solutions are created (function change) and used to guide in the search (function select). In the generic pseudo-code, the number of iterations (i) is also included as an input of the change, best, and select functions because it is assumed that the behavior of these functions can be dynamic, changing as the search method evolves.\n\nAlgorithm 1 Generic modern optimization method\n\n## 1.7 Demonstrative Problems\n\nThis section includes examples of simple optimization tasks that were selected mainly from a tutorial perspective, where the aim is to easily show the capabilities of the optimization methods. The selected demonstrative problems include 2 binary, 1 integer and 2 real value tasks. More optimization tasks are presented and explored in Chaps.  (multi-optimization tasks) and 7 (real-world tasks).\n\nThe binary problems are termed here sum of bits and max sin. The former, also known as max ones, is a simple binary maximization \"toy\" problem, defined as (Luke 2012):\n\n![\n$$\\\\displaystyle{ f_{\\\\text{sum of bits}}\\(\\\\mathbf{x}\\) =\\\\sum _{ i=1}^{D}x_{ i} }$$\n](A317276_1_En_1_Chapter_Equ1.gif)\n\n(1.1)\n\nwhere x = (x 1,..., x D ) is a boolean vector (x i ∈ { 0, 1}) with a dimension (or length) of D. The latter problem is another simple binary task, where the goal is to maximize (Eberhart and Shi 2011):\n\n![\n$$\\\\displaystyle{ \\\\begin{array}{rl} x^{{\\\\prime}}& =\\\\sum _{ i=1}^{D}x_{i}2^{i-1} \\\\\\\\ f_{\\\\text{max sin}}\\(\\\\mathbf{x}\\)& =\\\\sin \\(\\\\pi \\\\frac{x^{{\\\\prime}}} {2^{D}}\\)\\\\\\\\ \\\\end{array} }$$\n](A317276_1_En_1_Chapter_Equ2.gif)\n\n(1.2)\n\nwhere x ′ is the integer representation of x.\n\nA visualization for both binary problems is given in top of Fig. 1.3, assuming a dimension of D = 8. In the top left graph, x-axis denotes x ′ , the integer representation of x for sum of bits. In the example, the optimum solution for the sum of bits is x = (1, 1, 1, 1, 1, 1, 1, 1) (f(x) = 8), while the best solution for max sin is x = (1, 0, 0, 0"
      ],
      "latency_s": 10.44,
      "rag_type": "literag",
      "dominio": "LiteRAG_Bench_01",
      "titulo": "",
      "error": ""
    }
  ],
  "ragas_scores": {
    "faithfulness": 0.8873,
    "answer_relevancy": 0.9301,
    "context_precision": 0.65,
    "context_recall": 0.8
  },
  "avg_latency_s": 10.14,
  "n_errors": 0
}