{
  "rag_type": "literag",
  "dominio": "LiteRAG_Multihop_01",
  "n_libros": 0,
  "timestamp": "2026-05-04T15:44:17.017431",
  "qa_results": [
    {
      "question": "Both the SQL Server book and the Linux Kernel Networking book deal with data at scale. What is the primary data unit used to represent a row in SQL Server, and what is the primary data unit used to represent a network packet in the Linux kernel?",
      "ground_truth": "A row or record in SQL Server; sk_buff (socket buffer) in the Linux kernel",
      "answer": "The provided text does not contain information about the primary data unit used to represent a row in SQL Server.\n\nHowever, the primary data unit used to represent a network packet in the Linux kernel is simply referred to as a \"packet\". The text discusses the traversal of a \"packet\" within the Linux Kernel Networking stack and its interaction with various layers and subsystems.",
      "contexts": [
        "## Direct Evidence (Source Text)\n[Direct Result]: Index599\nRami RosenLinux Kernel NetworkingImplementation and Theory10.1007/978-1-4302-6197-1_1\n\n© Rami Rosen 2014\n\n# 1. Introduction\n\nRami Rosen1\n\n(1)\n\nHaifa, Israel\n\nAbstract\n\nThis book deals with the implementation of the Linux Kernel Networking stack and the theory behind it. You will find in the following pages an in-depth and detailed analysis of the networking subsystem and its architecture. I will not burden you with topics not directly related to networking, which you may encounter while reading kernel networking code (for example, locking and synchronization, SMP, atomic operations, and so on). There are plenty of resources about such topics. On the other hand, there are very few up-to-date resources that focus on kernel networking proper. By this I mean primarily describing the traversal of the packet in the Linux Kernel Networking stack and its interaction with various networking layers and subsystems—and how various networking protocols are implemented.\n\nThis book deals with the implementation of the Linux Kernel Networking stack and the theory behind it. You will find in the following pages an in-depth and detailed analysis of the networking subsystem and its architecture. I will not burden you with topics not directly related to networking, which you may encounter while reading kernel networking code (for example, locking and synchronization, SMP, atomic operations, and so on). There are plenty of resources about such topics. On the other hand, there are very few up-to-date resources that focus on kernel networking proper. By this I mean primarily describing the traversal of the packet in the Linux Kernel Networking stack and its interaction with various networking layers and subsystems—and how various networking protocols are implemented.\n\nThis book is also not a cumbersome, line-by-line code walkthrough. I focus on the essence of the implementation of each network layer and the theory guidelines and principles that led to this implementation. The Linux operating system has proved itself in recent years as a successful, reliable, stable, and popular operating system. And it seems that its popularity is growing steadily, in a wide variety of flavors, from mainframes, data centers, core routers, and web servers to embedded devices like wireless routers, set-top boxes, medical instruments, navigation equipment (like GPS devices), and consumer electronics devices. Many semiconductor vendors use Linux as the basis for their Board Support Packages (BSPs). The Linux operating system, which started as a project of a Finnish student named Linus Torvalds back in 1991, based on the UNIX operating system, proved to be a serious and reliable operating system and a rival for veteran proprietary operating systems.\n\nLinux began as an Intel x86-based operating system but has been ported to a very wide range of processors, including ARM, PowerPC, MIPS, SPARC, and more. The Android operating system, based upon the Linux kernel, is common today in tablets and smartphones, and seems likely to gain popularity in the future in smart TVs. Apart from Android, Google has also contributed some kernel networking features that were merged into the mainline kernel.\n\nLinux is an open source project, and as such it has an advantage over other proprietary operating systems: its source code is freely available under the General Public License (GPL). Other open source operating systems, like the different types of BSD, have much less popularity. I should also mention in this context the OpenSolaris project, based on the Common Development and Distribution License (CDDL). This project, started by Sun Microsystems, has not achieved the popularity that Linux has. Among the large community of active Linux developers, some contribute code on behalf of the companies they work for, and some contribute code voluntarily. All of the kernel development process is accessible via the kernel mailing lists. There is one central mailing list, the Linux Kernel Mailing List (LKML), and many subsystems have their own mailing lists. Contributing code is done via sending patches to the appropriate kernel mailing lists and to the maintainers, and these patches are discussed over the mailing lists.\n\nThe Linux Kernel Networking stack is a very important subsystem of the Linux kernel. It is quite difficult to find a Linux-based system, whether it is a desktop, a server, a mobile device or any other embedded device, that does not use any kind of networking. Even in the rare case when a machine doesn't have any hardware network devices, you will still be using networking (maybe unconsciously) when you use X-Windows, as X-Windows itself is based upon client-server networking. A wide range of projects are related to the Linux Networking stack, from core routers to small embedded devices. Some of these projects deal with adding vendor-specific features. For example, some hardware vendors implement Generic Segmentation Offload (GSO) in some network devices. GSO is a networking feature of the kernel network stack that divides a large packet into smaller ones in the Tx path. Many hardware vendors implement checksumming in hardware in their network devices. Checksum is a mechanism to verify that a packet was not damaged on transit by calculating some hash from the packet and attaching it to the packet. Many projects provide some security enhancements for Linux. Sometimes these enhancements require some changes in the networking subsystem, as you will see, for example, in Chapter 3, when discussing the Openwall GNU/*/Linux project. In the embedded device arena there are, for example, many wireless routers that are Linux based; one example is the WRT54GL Linksys router, which runs Linux. There is also an open source, Linux-based operating system that can run on this device (and on some other devices), named OpenWrt, with a large and active community of developers (see  https://openwrt.org/ ). Learning about how the various protocols are implemented by the Linux Kernel Networking stack and becoming familiar with the main data structures and the main paths of a packet in it are essential to understanding it better.\n\n## The Linux Network Stack\n\n[Direct Result]: Linksys router, which runs Linux. There is also an open source, Linux-based operating system that can run on this device (and on some other devices), named OpenWrt, with a large and active community of developers (see  https://openwrt.org/ ). Learning about how the various protocols are implemented by the Linux Kernel Networking stack and becoming familiar with the main data structures and the main paths of a packet in it are essential to understanding it better.\n\n## The Linux Network Stack\n\nThere are seven logical networking layers according to the Open Systems Interconnection (OSI) model. The lowest layer is the physical layer, which is the hardware, and the highest layer is the application layer, where userspace software processes are running. Let's describe these seven layers:\n\n1.\n\nThe physical layer: Handles electrical signals and the low level details.\n\n2.\n\nThe data link layer: Handles data transfer between endpoints. The most common data link layer is Ethernet. The Linux Ethernet network device drivers reside in this layer.\n\n3.\n\nThe network layer: Handles packet forwarding and host addressing. In this book I discuss the most common network layers of the Linux Kernel Networking subsystem: IPv4 or IPv6. There are other, less common network layers which Linux implements, like DECnet, but they are not discussed.\n\n4.\n\nThe protocol layer/transport layer: Handles data sending between nodes. The TCP and UDP protocols are the best-known protocols.\n\n5.\n\nThe session layer: Handles sessions between endpoints.\n\n6.\n\nThe presentation layer: Handles delivery and formatting.\n\n7.\n\nThe application layer: Provides network services to end-user applications.\n\nFigure 1-1 shows the seven layers according to the OSI model.\n\nFigure 1-1.\n\nThe OSI seven-layer model\n\nFigure 1-2 shows the three layers that the Linux Kernel Networking stack handles. The L2, L3, and L4 layers in this figure correspond to the data link layer, the network layer, and the transport layer in the seven-layer model, respectively. The essence of the Linux kernel stack is passing incoming packets from L2 (the network device drivers) to L3 (the network layer, usually IPv4 or IPv6) and then to L4 (the transport layer, where you have, for example, TCP or UDP listening sockets) if they are for local delivery, or back to L2 for transmission when the packets should be forwarded. Outgoing packets that were locally generated are passed from L4 to L3 and then to L2 for actual transmission by the network device driver. Along this way there are many stages, and many things can happen. For example:\n\n  * The packet can be changed due to protocol rules (for example, due to an IPsec rule or to a NAT rule).\n\n  * The packet can be discarded.\n\n  * The packet can cause an error message to be sent.\n\n  * The packet can be fragmented.\n\n  * The packet can be defragmented.\n\n  * A checksum should be calculated for the packet.\n\nThe kernel does not handle any layer above L4; those layers (the session, presentation, and application layers) are handled solely by userspace applications. The physical layer (L1) is also not handled by the Linux kernel.\n\nIf you feel overwhelmed, don't worry. You will learn a lot more about everything described here in a lot more depth in the following chapters.\n\nFigure 1-2.\n\nThe Linux Kernel Networking layers\n\n## The Network Device\n\nThe lower layer, Layer 2 (L2), as seen in Figure 1-2, is the link layer. The network device drivers reside in this layer. This book is not about network device driver development, because it focuses on the Linux kernel networking stack. I will briefly describe here the net_device structure, which represents a network device, and some of the concepts that are related to it. You should have a basic familiarity with the network device structure in order to better understand the network stack. Parameters of the device—like the size of MTU, which is typically 1,500 bytes for Ethernet devices—determine whether a packet should be fragmented. The net_device is a very large structure, consisting of device parameters like these:\n\n  * The IRQ number of the device.\n\n  * The MTU of the device.\n\n  * The MAC address of the device.\n\n  * The name of the device (like eth0 or eth1).\n\n  * The flags of the device (for example, whether it is up or down).\n\n  * A list of multicast addresses associated with the device.\n\n  * The promiscuity counter (discussed later in this section).\n\n  * The features that the device supports (like GSO or GRO offloading).\n\n  * An object of network device callbacks (net_device_ops object), which consists of function pointers, such as for opening and stopping a device, starting to transmit, changing the MTU of the network device, and more.\n\n  * An object of ethtool callbacks, which supports getting information about the device by running the command-line ethtool utility.\n\n  * The number of Tx and Rx queues, when the device supports multiqueues.\n\n  * The timestamp of the last transmit of a packet on this device.\n\n  * The timestamp of the last reception of a packet on this device.\n\nThe following is the definition of some of the members of the net_device structure to give you a first impression:\n\nstruct net_device {\n\nunsigned int irq; /* device IRQ number */\n\n...\n\nconst struct net_device_ops *netdev_ops;\n\n...\n\nunsigned int mtu;\n\n...\n\nunsigned int promiscuity;\n\n...\n\nunsigned char *dev_addr;\n\n...\n\n};\n\n(include/linux/netdevice.h)\n\nAppendix A of the book includes a very detailed description of the net_device structure and most of its members. In that appendix you can see the irq, mtu, and other members mentioned earlier in this chapter.\n\nWhen the promiscuity counter is larger\n\n[Direct Result]: -pages/booklist.shtml.\n\nIf you don't spot \"your\" error on the Book Errata page, go to www.wrox.com/contact/techsupport.shtml and complete the form there to send us the error you have found. We'll check the information and, if appropriate, post a message to the book's errata page and fix the problem in subsequent editions of the book.\n\np2p.wrox.com\n\nFor author and peer discussion, join the P2P forums at p2p.wrox.com. The forums are a Web-based system for you to post messages relating to Wrox books and related technologies and interact with other readers and technology users. The forums offer a subscription feature to e-mail you topics of interest of your choosing when new posts are made to the forums. Wrox authors, editors, other industry experts, and your fellow readers are present on these forums.\n\nAt <http://p2p.wrox.com> you will find a number of different forums that will help you not only as you read this book, but also as you develop your own applications. To join the forums, just follow these steps:\n\n1. Go to p2p.wrox.com and click the Register link.\n\n2. Read the terms of use and click Agree.\n\n3. Complete the required information to join as well as any optional information you wish to provide and click Submit.\n\n4. You will receive an e-mail with information describing how to verify your account and complete the joining process.\n\nYou can read messages in the forums without joining P2P but in order to post your own messages, you must join.\n\nOnce you join, you can post new messages and respond to messages other users post. You can read messages at any time on the Web. If you would like to have new messages from a particular forum e-mailed to you, click the Subscribe to this Forum icon by the forum name in the forum listing.\n\nFor more information about how to use the Wrox P2P, be sure to read the P2P FAQs for answers to questions about how the forum software works as well as many common questions specific to P2P and Wrox books. To read the FAQs, click the FAQ link on any P2P page.\n\nwww.professionalsql.com\n\nLimited support for the book and occasional blog entries can also be found at <http://www.professionalsql.com>. While formal support requests should be sent through the p2p.wrox.com website, professionalsql.com provides a mirror of the key downloads as well as occasional commentary from the author on the general state of the development world. You can contact me at robv@professionalsql.com; my sole requests for questions or contacts are:\n\n  * Please don't send me the questions from your take home mid-term or other school quizzes/tests (and yes, people really have done that).\n  * Focus questions to those not readily answered from general sources (Google, the p2p.wrox.com website, the many popular SQL Server websites, or a simple Books Online query).\n  * Understand that, while I try, I cannot always respond to every request for help, advice, or other questions.\n  * Recognize that the exposure of my e-mail address in this book represents a certain degree of trust in you, the reader, that you will not abuse that openness.\n\nI am always happy to hear about people's SQL experiences, so please feel free to drop me a line and brag about the wonderful things you've managed to do with SQL Server.\n1\n\nBeing Objective: Re-Examining Objects in SQL Server\n\nIf you're someone who's read my Professional level titles before, you'll find we're continuing the path we started in Professional SQL Server 2005 Programming and have the \"Professional\" become a little bit more \"Pro\" in level. That said, I still want to touch on all the basic objects and also address some things like new data types and additional objects that are new with SQL Server 2008.\n\nSo, What Exactly Do We Have Here?\n\nSeems like sort of a silly question doesn't it? If you're here reading this title, you obviously know we have a database, but what makes up a database? It is my hope that, by now (meaning by the time you're ready for a professional level title), you've come to realize that a Relational Database Management System (RDBMS) is actually much more than data. Today's advanced RDBMSs not only store your data, they also manage that data for you, restricting what kind of data can go into the system, and also facilitating getting data out of the system. If all you want is to tuck the data away somewhere safe, you can use just about any data storage system. RDBMSs allow you to go beyond the storage of the data into the realm of defining what that data should look like—this has never been more true than with SQL Server 2008. Improved support for hierarchies means that you can store hierarchical data in a far more native way, and still access it very efficiently. The new Policy Based Management feature allows you to control many elements of how your data is administrated using a rules-driven approach. SQL Server also provides services that help automate how your data interacts with data from other systems through such powerful features as the SQL Server Agent, Integration Services, Notification Services, the increasingly popular Reporting Services, and more.\n\nThis chapter provides an overview to the core objects used in SQL Server. Much of what is discussed in this chapter may be old news for you at this stage of your database learning, so this is the only point in the book where we will call them out in broad terms of how they relate to each other. I will assume that you are already somewhat familiar with most of the objects discussed here, but the goal is to fill in any holes and fully prepare you for the more advanced discussions to come.\n\nIn"
      ],
      "latency_s": 13.43,
      "rag_type": "literag",
      "dominio": "LiteRAG_Multihop_01",
      "titulo": "",
      "error": ""
    },
    {
      "question": "The Spark MLlib book and the Modern Optimization With R book both cover metaheuristic techniques. Which specific algorithm appears in both books as an example of population-based optimization?",
      "ground_truth": "Genetic algorithms",
      "answer": "The provided text does not contain information about the Spark MLlib book. Therefore, I cannot determine which specific algorithm appears in both books as an example of population-based optimization.\n\nHowever, the \"Modern Optimization With R\" book mentions the following as population-based search methods in Chapter 5:\n* Genetic and evolutionary algorithms\n* Differential evolution\n* Particle swarm optimization\n* Estimation of distribution algorithm",
      "contexts": [
        "## Direct Evidence (Source Text)\n[Direct Result]: ( bottom ) tasks 87\n\nFig.5.9 Comparison of repair and death penalty strategies for bag prices task with constraint 92\n\nFig.5.10 Example of a genetic programming random subtree crossover93\n\nFig.5.11 Comparison of rastrigin function and best solution given by the genetic programming 97\n\nFig.6.1 Example of the FES1 f 1 ( left ) and f 2 ( right ) task landscapes ( D = 2) 100\n\nFig.6.2 Examples of convex ( left ) and non-convex ( right ) Pareto fronts, where the goal is to minimize both objectives 1 and 2 102\n\nFig.6.3 NSGA-II results for bag prices ( top graphs ) and FES1 ( bottom graphs ) tasks ( left graphs show the Pareto front evolution, while right graphs compare the best Pareto front with the weighted-formula results) 116\n\nFig.7.1 Example of three order mutation operators120\n\nFig.7.2 Example of PMX and OX crossover operators121\n\nFig.7.3 Comparison of simulated annealing (SANN) and evolutionary algorithm (EA) approaches for the Qatar TSP130\n\nFig.7.4 Optimized tour obtained using evolutionary algorithm ( left ), Lamarckian evolution ( middle ), and 2-opt ( right ) approaches for the Qatar TSP 131\n\nFig.7.5 Area of Qatar tour given by 2-opt ( left ) and optimized by the evolutionary approach ( right ) 133\n\nFig.7.6 Sunspot one-step ahead forecasts using ARIMA and genetic programming (gp) methods138\n\nFig.7.7 The optimized Pareto front ( left ) and ROC curve for the SVM with four inputs ( right ) for the white wine quality task 145\n\nList of Algorithms\n\n1 Generic modern optimization method7\n\n2 Pure hill climbing optimization method46\n\n3 Simulated annealing search as implemented by the optim function 51\n\n4 Tabu search54\n\n5 Genetic/evolutionary algorithm as implemented by the genalg package 65\n\n6 Differential evolution algorithm as implemented by the DEoptim package 71\n\n7 Particle swarm optimization pseudo-code for SPSO 2007 and 201175\n\n8 Generic EDA pseudo-code implemented in copulaedas package, adapted from Gonzalez-Fernandez and Soto (2012) 80\n© Springer International Publishing Switzerland 2014\n\nPaulo CortezModern Optimization with RUse R!10.1007/978-3-319-08263-9_1\n\n# 1. Introduction\n\nPaulo Cortez1\n\n(1)\n\nDepartment of Information Systems, University of Minho, Guimarães, Portugal\n\n## 1.1 Motivation\n\nA vast number of real-world (often complex) tasks can be viewed as an optimization problem, where the goal is to minimize or maximize a given goal. In effect, optimization is quite useful in distinct application domains, such as Agriculture, Banking, Control, Engineering, Finance, Marketing, Production and Science. Moreover, due to advances in Information Technology, nowadays it is easy to store and process data. Since the 1970s, and following the Moore's law, the number of transistors in computer processors has doubled every 2 years, resulting in more computational power at a reasonable price. And it is estimated that the amount of data storage doubles at a higher rate. Furthermore, organizations and individual users are currently pressured to increase efficiency and reduce costs. Rather than taking decisions based on human experience and intuition, there is an increasing trend for adopting computational tools, based on optimization methods, to analyze real-world data in order to make better informed decisions.\n\nOptimization is a core topic of the Operations Research field, which developed several classical techniques, such as linear programming (proposed in the 1940s) and branch and bound (developed in the 1960s) (Schrijver 1998). More recently, in the last decades, there has been an emergence of new optimization algorithms, often termed \"modern optimization\" (Michalewicz et al. 2006), \"modern heuristics\" (Michalewicz and Fogel 2004), or \"metaheuristics\" (Luke 2012). In this book, we adopt the first term, modern optimization, to describe these algorithms.\n\nIn contrast with classical methods, modern optimization methods are general purpose solvers, i.e., applicable to a wide range of distinct problems, since few domain knowledge is required. For instance, the optimization problem does not need to be differentiable, which is required by classical methods such as gradient descent. There are only two main issues that need to be specified by the user when adopting modern heuristic methods (Michalewicz et al. 2006): the representation of the solution, which defines the search space and its size; and the evaluation function, which defines how good a particular solution is, allowing to compare different solutions. In particular, modern methods are useful for solving complex problems for which no specialized optimization algorithm has been developed (Luke 2012). For instance, problems with discontinuities, dynamic changes, multiple objectives or hard and soft restrictions, which are more difficult to be handled by classical methods (Michalewicz et al. 2006). Also in contrast with classical methods, modern optimization does not warranty that the optimal solution is always found. However, often modern methods achieve high quality solutions with a much more reasonable use of computational resources (e.g., memory and processing effort) (Michalewicz and Fogel 2004).\n\nThere is a vast number of successful real-world applications based on modern optimization methods. Examples studied by the author of this book include (among others): sitting guests at a wedding party (Rocha et al. 2001); time series\n\n[Direct Result]: know the real number of R users (e.g., it may range from 250,000 to 2 million), several estimates show a clear growth in the R popularity. In effect, the R community is very active and new packages are being continuously created, with more than 5800 packages available, thus enhancing the tool capabilities. In particular, several of these packages implement modern optimization methods.\n\nThere are several books that discuss either modern optimization methods or the R tool. However, within the author's knowledge, there is no book that integrates both subjects and under a practical point of view, with several application R code examples that can be easily tested by the readers. Hence, the goal of this book is to gather in a single document (self-contained) the most relevant concepts related with modern optimization methods, showing how such concepts and methods can be addressed using the R tool.\n\nThis book is addressed for several target audience groups. Given that the R tool is free, this book can be easily adopted in several bachelor or master level courses in areas such as \"Operations Research\", \"Decision Support\", \"Business Intelligence\", \"Soft Computing\", or \"Evolutionary Computation\". Thus, this book should be appealing for bachelor's or master's students in Computer Science, Information Technology, or related areas (e.g., Engineering or Science). The book should also be of interest for two types of practitioners: R users interested in applying modern optimization methods and non R expert data analysts or optimization practitioners who want to test the R capabilities for optimizing real-world tasks.\n\n## How to Read This Book\n\nThis book is organized as follows:\n\n  * Chapter   1  introduces the motivation for modern optimization methods and why the R tool should be used to explore such methods. Also, this chapter discusses key modern optimization topics, namely the representation of a solution, the evaluation function, constraints, and an overall view of modern optimization methods. This chapter ends with the description of the optimization tasks that are used for tutorial purposes in the next chapters.\n\n  * Chapter   2  presents basic concepts about the R tool. This chapter is particularly addressed for non R experts, including the necessary knowledge that is required to understand and test the book examples. R experts should skip this chapter.\n\n  * Chapter   3  is about how blind search can be implemented in R. This chapter details in particular three approaches: pure blind, grid, and Monte Carlo search.\n\n  * Chapter   4  introduces local search methods, namely hill climbing, simulated annealing, and tabu search. Then, an example comparison between several local search methods is shown.\n\n  * Chapter   5  presents population-based search methods, namely genetic and evolutionary algorithms, differential evolution, particle swarm optimization and estimation of distribution algorithm. Then, two additional examples are discussed, showing a comparison between population-based methods and how to handle constraints.\n\n  * Chapter   6  is dedicated to multi-objective optimization. This chapter first presents three demonstrative multi-objective tasks and then discusses three multi-objective optimization approaches: weighted-formula, lexicographic, and Pareto (e.g., NSGA-II algorithm).\n\n  * Chapter   7  presents three real-world applications of previously discussed methods, namely traveling salesman problem, time series forecasting, and wine quality classification.\n\nEach chapter starts with an introduction, followed by several chapter topic related sections and ends with an R command summary and exercise sections. Throughout the book, several examples of R code are shown. The code was run using a 64 bit R (version 3.0.2) under on a MacOS laptop. Nevertheless, these examples should be easily reproduced by the readers on other systems, possibly resulting in slight numerical (32 bit version) or graphical differences for deterministic examples. Also, given that a large portion of the discussed methods are stochastic, it is natural that different executions of the same code and under the same system will lead to small differences in the results.\n\nIt is particularly recommended that students should execute the R code and try to solve the proposed exercises. Examples of solutions are presented at the end of this book. All these code files and data examples are available at: http://​www3.​dsi.​uminho.​pt/​pcortez/​mor .\n\n## Production\n\nSeveral contents of this book were taught by the author in the last 5 years in distinct course units of master and doctoral programs. At the master's level, it included the courses \"Adaptive Business Intelligence\" (Masters in Information Technology, University of Minho, Portugal) and \"Business Intelligence\" (Masters in Information Systems Management, Lisbon University Institute, Portugal). The doctoral course was \"Adaptive Business Intelligence\" (Doctoral Program in Computer Science, Universities of Minho, Aveiro and Porto, Portugal). Also, some material was lectured at a tutorial given in the European Simulation and Modelling Conference (ESM 2011), held at Guimarães.\n\nThis book was written in LaTeX, using the texstudio editor ( http://​texstudio.​sourceforge.​net ) and its US English spell checker. Most figures were made in R, while some of the figures were designed using xfig ( http://​www.​xfig.​org ), an open source vector graphical tool.\n\nPaulo Cortez\n\nGuimarães, Portugal\n\nContents\n\n1 Introduction 1\n\n1.​1 Motivation 1\n\n1.​2 Why R?​ 2\n\n1.​3 Representation of a Solution 3\n\n1.​4 Evaluation Function 3\n\n1.​5 Constraints 4\n\n1.​6 Optimization Methods 5\n\n1.​7 Demonstrative Problems 7\n\n2 R Basics 11\n\n2.​1 Introduction 11\n\n2.​2 Basic Objects and Functions 13\n\n2.​3 Controlling Execution and Writing Functions 20\n\n2.​\n\n[Direct Result]: M (2012) copulaedas: an R package for estimation of distribution algorithms based on Copulas. arXiv preprint arXiv:12095429\n\nHolland J (1975) Adaptation in natural and artificial systems. Ph.D. thesis, University of Michigan\n\nJoe H (1997) Multivariate models and dependence concepts, vol 73. CRC Press, Boca RatonCrossRefMATH\n\nKennedy J, Eberhart R (1995) Particle swarm optimization. In: ICNN'95 - IEEE international conference on neural networks proceedings. IEEE Computer Society, Perth, pp 1942–1948\n\nLarrañaga P, Lozano JA (2002) Estimation of distribution algorithms: a new tool for evolutionary computation, vol 2. Kluwer Academic, Boston\n\nLucasius CB, Kateman G (1993) Understanding and using genetic algorithms part 1. Concepts, properties and context. Chemom Intell Lab Syst 19(1):1–33CrossRef80079-W)\n\nLuke S (2012) Essentials of metaheuristics. Lulu.com, online version at http://​cs.​gmu.​edu/​~sean/​book/​metaheuristics\n\nMendes R, Cortez P, Rocha M, Neves J (2002) Particle swarms for feedforward neural network training. In: Proceedings of the 2002 international joint conference on neural networks (IJCNN 2002). IEEE Computer Society, Honolulu, pp 1895–1899\n\nMichalewicz Z (1996) Genetic algorithms + data structures = evolution programs. Springer, BerlinCrossRefMATH\n\nMichalewicz Z, Fogel D (2004) How to solve it: modern heuristics. Springer, BerlinCrossRef\n\nMichalewicz Z, Schmidt M, Michalewicz M, Chiriac C (2006) Adaptive business intelligence. Springer, Berlin\n\nMühlenbein H (1997) The equation for response to selection and its use for prediction. Evol Comput 5(3):303–346CrossRef\n\nMullen K, Ardia D, Gil D, Windover D, Cline J (2011) Deoptim: an r package for global optimization by differential evolution. J Stat Softw 40(6):1–26\n\nPrice KV, Storn RM, Lampinen JA (2005) Differential evolution a practical approach to global optimization. Springer, BerlinMATH\n\nStorn R, Price K (1997) Differential evolution–a simple and efficient heuristic for global optimization over continuous spaces. J Glob Optim 11(4):341–359CrossRefMATHMathSciNet\n\nFootnotes\n\n1\n\nThese results were achieved with rgp version 0.3-4 and later rgp versions might produce different results.\n© Springer International Publishing Switzerland 2014\n\nPaulo CortezModern Optimization with RUse R!10.1007/978-3-319-08263-9_6\n\n# 6. Multi-Objective Optimization\n\nPaulo Cortez1\n\n(1)\n\nDepartment of Information Systems, University of Minho, Guimarães, Portugal\n\n## 6.1 Introduction\n\nIn previous chapters, only single objective tasks were addressed. However, multiple goals are common in real-world domains. For instance, a company typically desires to increase sales while reducing production costs. Within its marketing department, the goal might include maximizing target audiences while minimizing the marketing budget. Also, within the production department, the same company might want to maximize the manufactured items, in terms of both quality and production numbers, while minimizing production time, costs, and waste of material. Often, the various objectives can conflict, where gaining in one goal involves losing in another one. Thus, there is a need to set the right trade-offs.\n\nTo handle multi-objective tasks, there are three main approaches (Freitas 2004): weighted-formula, lexicographic and Pareto front, whose R implementation details are discussed in the next sections, after presenting the demonstrative tasks selected for this chapter.\n\n## 6.2 Multi-Objective Demonstrative Problems\n\nThis section includes three examples of simple multi-objective tasks that were selected to demonstrate the methods presented in this chapter. Given an D-dimensional variable vector x = { x 1,..., x D } the goal is to optimize a set of m objective functions ![\n$$\\\\{f_{1}\\(x_{1},\\\\ldots,x_{D}\\),\\\\ldots,f_{m}\\(x_{1},\\\\ldots,x_{D}\\)\\\\}$$\n](A317276_1_En_6_Chapter_IEq1.gif). To simplify the demonstrations, only two m = 2 objective functions are adopted for each task (an m = 3 example is shown in Sect. 7.​6).\n\nThe binary multi-objective goal consists in maximizing both functions of the set ![\n$$\\\\{f_{\\\\text{sum of bits}}\\(x_{1},\\\\ldots,x_{D}\\),f_{\\\\text{max sin}}\\(x_{1},\\\\ldots,x_{D}\\)\\\\}$$\n](A317276_1_En_6_Chapter_IEq2.gif), where x i ∈ { 0, 1} and the functions are defined in Eqs. (1.​1) and (1.​2). As explained in Sect. 1.​7 (see also Fig. 1.​3), when D = 8 the optimum solutions are set at different points of the search space (x=(1,1,1,1,1,1,1,1) for f 1 and"
      ],
      "latency_s": 1.33,
      "rag_type": "literag",
      "dominio": "LiteRAG_Multihop_01",
      "titulo": "",
      "error": ""
    },
    {
      "question": "The VBA book teaches automation of Microsoft Office applications. If a developer wanted to use Spark to process data exported from Excel using VBA, which Spark data abstraction would they use to load the resulting CSV file?",
      "ground_truth": "A DataFrame (or Dataset) loaded via SparkSession",
      "answer": "The provided text does not contain information about using Spark to process data exported from Excel using VBA, nor does it mention specific Spark data abstractions for loading CSV files. Therefore, I cannot answer your question based on the given context.",
      "contexts": [
        "## Direct Evidence (Source Text)\n[Direct Result]: the words _efficient, straightforward_ , and _sensible_ do not come to mind.\n\nVBA isn't built into OneNote, but you can access OneNote from VBA in other Office applications.\n\nThe following example gets the metadata (data about data) from your OneNote notebooks.\n\nBefore you try this code, choose Tools ⇒ References in Excel's VBA Editor and ensure that both Microsoft OneNote 15.0 Object Library and Microsoft XML v6.0 are selected (checked) in the References dialog box.\n\n    1.  Sub GetMetaData()\n    2.  \n    3.  'If it's not currently running, OneNote will be launched\n    4.  Dim ONote As oneNote.Application\n    5.  Set ONote = New oneNote.Application\n    6.  \n    7.  Dim strXML As String\n    8.  \n    9.  ONote.GetHierarchy \"\", hsNotebooks, strXML, xs2010 'don't use xs2013\n    10. \n    11. MsgBox strXML\n    12. End Sub\n\nLines 4 and 5 create an instance of OneNote and assign it to the ONote object variable. Next we create a string variable in line 7 to hold the metadata. Line 9 uses the GetHierarchy method to fill strXML with the metadata. hsNotebooks represents the collection of notebooks in OneNote. The message box displays the results.\n\n# The Bottom Line\n\n**Work with workbooks.**\n\nYou often need to create a new, blank workbook in a macro (mimicking a user clicking the File tab on the Ribbon, then clicking the New button). And writing code that accomplishes this is not difficult. It requires only two words.\n\n**Master It**\n\nWhat code would you write to create a new, blank notebook?\n\n**Work with worksheets.**\n\nMost workbooks you access via VBA will contain one or more worksheets, so most procedures will need to work with worksheets—inserting, deleting, copying, or moving them, or simply printing the appropriate range from them.\n\n**Master It**\n\nName the object you use in VBA code to represent a worksheet.\n\n**Work with the active cell or selection.**\n\nIn a procedure that manipulates a selection that the user has made, you'll typically work with either the active cell or the current selection.\n\n**Master It**\n\nWhat is the difference between the active cell and a selection?\n\n**Work with ranges.**\n\nWithin a worksheet, you'll often need to manipulate ranges of cells. Excel includes a special kind of range—represented by the UsedRange property.\n\n**Master It**\n\nWhat is unique about UsedRange?\n\n**Set options.**\n\nWord employs an Options object to contain most of the options that you find in the Word Options dialog box (click the File tab on the Ribbon, then click Options). Excel uses a different object to contain its options.\n\n**Master It**\n\nFrom which object do you access most of Excel's options?\nChapter 23\n\nWorking with Widely Used Objects in Excel\n\nIn the previous chapter, you learned to work with some of the main objects in the Excel object model, such as Workbook objects, the ActiveCell object, Range objects, and the Options object. This chapter shows you how to expand your programming facility with VBA in Excel by working with charts, windows, and Find and Replace.\n\nIn this chapter you will learn to do the following:\n\n  * Work with charts\n  * Work with windows\n  * Work with Find and Replace\n\n# Working with Charts\n\nThe following sections show you how to use VBA to create and format charts, either as entire chart sheets in a workbook or as objects on an existing worksheet.\n\n## Creating a Chart\n\nVBA uses the Chart object to represent a chart on a chart sheet and a ChartObject object to represent an embedded chart on a worksheet. The ChartObject object contains a Chart object, which you can manipulate by accessing it through the ChartObject object. Confused? Object classification schemes can be a bit bewildering.\n\nWhen writing a macro, you create a chart or chart object in a different order than when working interactively and doing things by hand within Excel. Here are the steps you take when creating charts _programmatically_ (via code rather than interactively via a mouse and keyboard):\n\n1. Create a Chart object variable.\n\n2. Instantiate (bring into existence) the Chart object using the Set command.\n\n3. Specify the source range for its data using the SetSourceData method.\n\n4. Specify the chart type using the ChartType property.\n\n5. Specify any other items you need to.\n\n### Creating a Chart on a New Chart Sheet\n\nTo create a chart on a new chart sheet, use the Add method with the Charts collection. The syntax is as follows:\n\n    _expression_.Add(Before, After, Count, Type)\n\nHere are the components of this syntax:\n\n  * _expression_ is a required expression that returns a Charts collection.\n  * Before is an optional Variant argument that you can use to specify the sheet before which to add the new chart sheet. After is an optional Variant argument that you can use to specify the sheet after which to add the new sheet. Typically, you'll use either Before or After. If you omit both arguments, VBA adds the new chart sheet before the active sheet.\n  * Count is an optional Variant argument that you can use to specify how many chart sheets to add. The default is one.\n  * Type is an optional Variant argument that you can use to specify which kind of chart you want displayed. The choices are xlWorksheet, xlChart, xlExcel4MacroSheet, and xlExcel4IntlMacroSheet. The default value is xlWorksheet, so you have to specify xlChart in the following code example because it adds a chart, not an ordinary worksheet.\n\n[Direct Result]: characteristics of the content catalogue, and drivers of revenue for the business\n\n## Practical exercise\n\nImagine that you now need to provide input to the frontend and infrastructure engineering team about the data that your machine learning system will need. Consider a brief for them on how they should structure the data-collection mechanisms. Write down some examples of what the raw data might look like (for example, web logs, event logs, and so on) and how it should flow through the system. Take into account the following aspects:\n\n  * What data sources will be required\n  * What format should the data be in\n  * How often should data be collected, processed, potentially aggregated, and stored\n  * What data storage will you use to ensure scalability\n\n# Summary\n\nIn this chapter, you learned about the components inherent in a data-driven, automated machine learning system. We also outlined how a possible high-level architecture for such a system might look in a real-world situation.\n\nIn the next chapter, we will discuss how to obtain publicly-available datasets for common machine learning tasks. We will also explore general concepts related to processing, cleaning, and transforming data so that they can be used to train a machine learning model.\n\n# Chapter 3. Obtaining, Processing, and Preparing Data with Spark\n\nMachine learning is an extremely broad field, and these days, applications can be found across areas that include web and mobile applications, Internet of Things and sensor networks, financial services, healthcare, and various scientific fields, to name just a few.\n\nTherefore, the range of data available for potential use in machine learning is enormous. In this book, we will focus mostly on business applications. In this context, the data available often consists of data internal to an organization (such as transactional data for a financial services company) as well as external data sources (such as financial asset price data for the same financial services company).\n\nFor example, recall from Chapter 2, _Designing a Machine Learning System_ , that the main internal source of data for our hypothetical Internet business, MovieStream, consists of data on the movies available on the site, the users of the service, and their behavior. This includes data about movies and other content (for example, title, categories, description, images, actors, and directors), user information (for example, demographics, location, and so on), and user activity data (for example, web page views, title previews and views, ratings, reviews, and social data such as _likes_ , _shares_ , and social network profiles on services including Facebook and Twitter).\n\nExternal data sources in this example might include weather and geolocation services, third-party movie ratings and review sites such as _IMDB_ and _Rotten Tomatoes_ , and so on.\n\nGenerally speaking, it is quite difficult to obtain data of an internal nature for real-world services and businesses, as it is commercially sensitive (in particular, data on purchasing activity, user or customer behavior, and revenue) and of great potential value to the organization concerned. This is why it is also often the most useful and interesting data on which to apply machine learning--a good machine learning model that can make accurate predictions can be highly valuable (witness the success of machine learning competitions such as the _Netflix Prize_ and _Kaggle_ ).\n\nIn this book, we will make use of datasets that are publicly available to illustrate concepts around data processing and training of machine learning models.\n\nIn this chapter, we will:\n\n  * Briefly cover the types of data typically used in machine learning.\n  * Provide examples of where to obtain interesting datasets, often publicly available on the Internet. We will use some of these datasets throughout the book to illustrate the use of the models we introduce.\n  * Discover how to process, clean, explore, and visualize our data.\n  * Introduce various techniques to transform our raw data into features that can be used as input to machine learning algorithms.\n  * Learn how to normalize input features using external libraries as well as Spark's built-in functionality.\n\n# Accessing publicly available datasets\n\nFortunately, while commercially-sensitive data can be hard to come by, there are still a number of useful datasets available publicly. Many of these are often used as benchmark datasets for specific types of machine learning problems. Examples of common data sources include:\n\n  *  **UCI Machine Learning Repository** : This is a collection of almost 300 datasets of various types and sizes for tasks including classification, regression, clustering, and recommender systems. The list is available at <http://archive.ics.uci.edu/ml/>.\n  *  **Amazon AWS public datasets** : This is a set of often very large datasets that can be accessed via Amazon S3. These datasets include the Human Genome Project, the Common Crawl web corpus, Wikipedia data, and Google Books Ngrams. Information on these datasets can be found at <http://aws.amazon.com/publicdatasets/>.\n  *  **Kaggle** : This is a collection of datasets used in machine learning competitions run by Kaggle. Areas include classification, regression, ranking, recommender systems, and image analysis. These datasets can be found under the _Competitions_ section at <http://www.kaggle.com/competitions>.\n  *  **KDnuggets** : This has a detailed list of public datasets, including some of those mentioned earlier. The list is available at <http://www.kdnuggets.com/datasets/index.html>.\n\n### Tip\n\nThere are many other resources to find public datasets depending on the specific domain and machine learning task. Hopefully, you might also have exposure to some interesting academic or commercial data of your own!\n\nTo illustrate a few key concepts related to data processing, transformation, and feature extraction in Spark, we will download a commonly-used dataset for movie recommendations; this dataset is known as the **MovieLens** dataset. As it is applicable to recommender systems as well as potentially\n\n[Direct Result]: In other words, you want to remove the web-page table definitions but leave the data in a usable format within Word.\n\nThe following macro does just that:\n\n    Sub Untable()\n\n    On Error Resume Next\n\n       Selection.Rows.ConvertToText Separator:=wdSeparateByCommas, NestedTables:= _\n         True\n       Selection.MoveDown Unit:=wdLine, Count:=1\n\n    If Err Then MsgBox \"No table was detected, dude.\"\n\n    End Sub\n\nTo use this macro, click somewhere within the text you've pasted from the Internet to put the insertion cursor in a table (or a suspected table; they often don't look like tables, merely like an area of bizarre formatting), then execute the macro. You may need to execute this macro more than once to completely eliminate all the tabular formatting debris left over from the original HTML. The macro tells you when all table structures have been destroyed, and not only that—it calls you \"dude.\"\n\n# The Bottom Line\n\n**Use Find and Replace via VBA.**\n\nWord's Find and Replace utilities are frequently valuable to the VBA programmer. You'll want to master them and also some subtleties associated with their use.\n\nMaster It\n\nSometimes when replacing, you need to go through a document more than once—using a loop structure. Why would you ever need to repeatedly search and replace the same document? Doesn't the Replace All setting in fact _replace all_?\n\n**Work with headers, footers, and page numbers.**\n\nAll Word documents contain headers and footers, even if they are empty. In addition, you can insert various types of headers and footers.\n\nMaster It\n\nName two types of headers you can use in a Word document.\n\n**Manage sections, page setup, windows, and views.**\n\nAmong the various ways you can view a document, you sometimes want to have the document automatically scroll to a particular table, graphic, or other target.\n\nMaster It\n\nWhat method of the Window object can be used to easily accomplish this task?\n\n**Manipulate tables.**\n\nWhen you need to manage tables in Word documents, you can employ VBA to work with the Table object to represent a single table. If there is more than one table, they are referenced by a collection of Table objects.\n\nMaster It\n\nName two important and useful objects within the Tables collection or the Table object.\nChapter 22\n\nUnderstanding the Excel Object Model and Key Objects\n\nThis chapter shows you how to start working with the Excel object model, the architecture underlying Excel. It also shows you how to perform common actions with the most immediately useful Excel objects. These objects include the Workbooks collection and the Workbook object, the ActiveCell object, and Range objects. You'll also see how to set options in Excel.\n\nIn this chapter you will learn to do the following:\n\n  * Work with workbooks\n  * Work with worksheets\n  * Work with the active cell or selection\n  * Work with ranges\n  * Set options\n\n# Getting an Overview of the Excel Object Model\n\nAs with the other Office applications, it's not necessary (or even possible for most people) to understand how the entire Excel object model fits together in order to work with VBA in Excel, but most people find that knowing the main objects in the object model is helpful. And often the code examples in the Help system's object-model reference are invaluable—showing you how and where to employ objects in your own programming.\n\nTo see the Excel object-model reference, follow these steps:\n\n1. Launch or activate Excel, and then press Alt+F11 to launch or activate the VBA Editor.\n\n2. Move your cursor to a blank space in the code window (to avoid context-sensitive help).\n\n3. Press F1 in the Editor to launch the web page for the VBA language reference for Office 2013.\n\n4. In the Bing search field, type **excel 2013 object model** and press Enter.\n\n5. Click the link _Object Model Reference_ ( _Excel 2013 Developer Reference_ ). You'll now have access to the whole collection of syntax specifications, useful descriptions, and code examples, as shown in Figure 22.1.\n\nFigure 22.1 The entries in the Excel object model reference will help you write your own VBA code.\n\n* * *\n\nHelp When Migrating Legacy Code from Earlier Office Projects\n\nIf you've inherited VBA code written in earlier versions of Office, those procedures might contain objects, methods, and properties that have been changed in Office 2013. Though modifications to object models are generally few, some incompatibilities can crop up and \"break\" the code so it won't run correctly. Fortunately, you can download a free utility, the Office Code Compatibility Inspector, that will flag objects and their members that have changed. It does a text comparison of the Office 2013 object model against VBA code written in earlier versions of Office. You can download the Compatibility Inspector from this web page:\n\nwww.microsoft.com/en-us/download/details.aspx?id=15001\n\n* * *\n\n# Understanding Excel's Creatable Objects\n\nExcel _exposes_ (makes available for your use in code) various _creatable_ objects, meaning that you can employ most of the important objects in its object model without explicitly going through (mentioning) the Application object. For most programming purposes, these creatable objects are the most commonly used objects. Here's a list:\n\n  * The Workbooks collection contains the Workbook objects that represent all the open workbooks. Within a workbook, the Sheets collection contains the Worksheet objects that represent the worksheets and the Chart objects that represent chart sheets. On a sheet, the Range object gives you access to ranges, which can be anything from an individual cell to a complete worksheet. Remember that, because the workbooks object is creatable, you need not write Application.Workbooks in your code. You can leave off the"
      ],
      "latency_s": 1.29,
      "rag_type": "literag",
      "dominio": "LiteRAG_Multihop_01",
      "titulo": "",
      "error": ""
    },
    {
      "question": "The Java book and the programming languages theory book both touch on type systems. What concept from lambda calculus theory in Dowek's book corresponds to Java's method overriding described in Streib's book?",
      "ground_truth": "Dynamic dispatch, related to the substitution principle formalized as beta-reduction in lambda calculus",
      "answer": "I am sorry, but I cannot answer your question. The provided text does not contain information about Java's method overriding as described in Streib's book. The text does mention Java in relation to \"polymorphic types\" and \"extensions of Java with polymorphic types,\" but it does not detail specific features like method overriding or relate them to concepts from lambda calculus theory in Dowek's book.",
      "contexts": [
        "## Direct Evidence (Source Text)\n[Direct Result]: a sorting algorithm is a sorted list.\n\nThe last point that remains to discuss is the rôle of the theory of programming languages, and in particular whether its purpose is to describe the existing programming languages, or to propose new languages.\n\nAstronomers study the galaxies that exist, and do not build new ones, whereas chemists study the existing molecules and build new ones. We know that in the latter case, the order in which theories and production techniques appear may vary: the transformation of mass into energy was achieved long time after the theory of relativity, whereas the steam engine appeared before the principles of thermodynamics were established.\n\nThe theory of programming languages has enabled the development of new features, such as static binding, type inference, polymorphic types, garbage collection,... which are now available in commercial languages. In contrast, other functionalities, such as assignments and objects, were introduced in programming languages wildly, and the theory has been slow to follow. The development of a formal semantics for these constructs led in turn to new proposals, such as the recent extensions of Java with polymorphic types.\n\nThe theory of programming languages has neither an exclusively descriptive rôle nor an exclusively leading rôle. It is this going backwards and forwards between the description of existing features and the design of new ones that gives the theory of programming languages its dynamics.\nGilles Dowek and Jean-Jacques LévyUndergraduate Topics in Computer ScienceIntroduction to the Theory of Programming Languages10.1007/978-0-85729-076-2© Springer-Verlag London Limited 2011\n\nReferences\n\n1.\n\nAbadi, M., Cardelli, L.: A Theory of Objects. Springer, Berlin (1998)\n\n2.\n\nDybvig, R.K.: The Scheme Programming Language, 2nd edn. Prentice Hall, New York (1996). www.scheme.com/tspl2d/\n\n3.\n\nGunter, C.A.: Semantics of Programming Languages: Structures and Techniques. MIT Press, Cambridge (1992)MATH\n\n4.\n\nKahn, G.: Natural semantics. In: Proceedings of the Symp. on Theoretical Aspects of Computer Science, TACS, Passau (1987)\n\n5.\n\nMitchell, J.C.: Foundations for Programming Languages. MIT Press, Cambridge (1996)\n\n6.\n\nMitchell, J.C.: Concepts in Programming Languages. Cambridge University Press, Cambridge (2002)MATHCrossRef\n\n7.\n\nPeyton Jones, S., Lester, D.: Types and Programming Languages. Prentice Hall, New York (1992)\n\n8.\n\nPierce, B.C.: Types and Programming Languages. MIT Press, Cambridge (2002)\n\n9.\n\nPlotkin, G.D.: LCF considered as a programming language. Theor. Comput. Sci. 5 , 223–255 (1977) MathSciNetCrossRef90044-5)\n\n10.\n\nPlotkin, G.D.: A structural approach to operational semantics. Technical Report DAIMI FN–19, Computer Science Department, Aarhus University, Aarhus, Denmark, September 1981\n\n11.\n\nReynolds, J.C.: Theories of Programming Languages. Cambridge University Press, Cambridge (1998)MATHCrossRef\n\n12.\n\nScott, D.: Continuous Lattices. Lecture Notes in Math., vol. 274, pp. 97–136. Springer, Berlin (1972)\n\n13.\n\nWeis, P., Leroy, X.: Le langage Caml, 2nd edn. Dunod, Paris (1999)\n\n14.\n\nWinskel, G.: The Formal Semantics of Programming Languages. MIT Press, Cambridge (1993)MATH\n\nIndex\n\nA\n\nAbstract machine\n\nAlgorithm\n\nDamas and Milner\n\nHindley's\n\nRobinson's\n\nα -equivalence\n\nAlphabetic equivalence\n\nArity\n\nArray\n\nB\n\nβ -reduction\n\nBinding\n\ndynamic\n\nlate\n\nstatic\n\nC\n\nCall by name\n\nCall by value\n\nChurch numeral\n\nClosed set\n\nClosure\n\nrecursive\n\nCompiler\n\nbootstrapping\n\nComposition\n\nConfluence\n\nConstant\n\nContinuous function\n\nD\n\nDe Bruijn index\n\nDefinition\n\nexplicit\n\ninductive\n\nDerivation\n\nDeterministic\n\nE\n\nEnvironment\n\nsemantic\n\ntyping\n\nEvaluate\n\nEvaluator\n\nF\n\nFields\n\nFixed point\n\nCurry\n\nfirst theorem\n\nfunction construction via\n\nin PCF\n\nsecond theorem\n\nFunctionalisation\n\nH\n\nHeight\n\nI\n\nInterpreter\n\nL\n\nLabel\n\nLanguage\n\nLimit\n\nList\n\nM\n\nMethod\n\ndynamic\n\nstatic\n\nModule\n\nN\n\nNumber of arguments\n\nO\n\nObject\n\nOrdering\n\nScott's\n\nstrongly complete\n\nweakly complete\n\nP\n\nPair\n\nPCF ( Programming language for computable functions )\n\nPolymorphism\n\nPosition numerals\n\nR\n\nRecord\n\nin call by name\n\nin call by value\n\nRedex\n\nReduction\n\ncall by name\n\ncall by value\n\nlazy\n\nweak\n\nReference\n\nRegister\n\naccumulator\n\ncode\n\nenvironment\n\nstack\n\nRenaming\n\nResult\n\nRule\n\nS\n\nSemantics\n\nbig-step operational\n\ndenotational\n\nsmall-step operational\n\nSide effect\n\nSolution\n\nprincipal\n\nSort\n\nStrategy\n\nSubject reduction\n\nSubstitution\n\nSystem\n\nF\n\nT\n\nT\n\nTerm\n\nclosed\n\nirreducible\n\nstuck\n\nThunk\n\nTree\n\nType\n\nchecking\n\ninference\n\nprincipal\n\nType preservation\n\nby interpretation\n\nType scheme\n\nU\n\nUnification\n\nV\n\nValue\n\nextended\n\nrational\n\nVariable\n\ncapture\n\nenvironment\n\nmutable\n\n[Direct Result]: A -> B is strictly greater than that of A. The equation A = (nat ref) × (nat ref) × (A -> nat -> nat) × (A -> nat -> nat) does not have a solution either. As with the construction fix in PCF, it is not trivial to give a denotational semantics for the fixed point operator on types.\n\n### 8.2.2 What Is \"Self\"?\n\nIf t is the object built in Exercise 8.6, to know whether the booking is closed or there are still orchestra tickets, we need to interpret the term t.free t 0. Indeed, the function t.free takes an object u and a natural number n and indicates whether the field associated to n in u—orchestra if n = 0, balcony if n = 1—is zero or not. In other words, the method free is static, as defined for example in Java.\n\nWe now want the method free of the object t to apply to the object t itself, that is, we want to invoke it by interpreting the term t#free 0 instead of t.free t 0. In other words, we want this method to be dynamic.\n\nOne way to achieve this is to consider the term t#l as an abbreviation for t.l t. The difficulty here is that if t is an object and l a label in this object, we can only use the term t#l if the field l is a function of type A -> ... where A is the type of t itself. In other words, we can only use the term t#l if l is the label of a method. If l is the label of a field that is not a method, we still need to write t.l.\n\nTo avoid this distinction, we can state that all fields are functions. If a field a of an object t has the value 3, we transform it into a field with functional value fun s -> 3. Thus, the term t#a, that is, t.a t or (fun s -> 3) t, is interpreted as the value 3.\n\nThe first argument of each method in the object is then a bound variable, which is usually called self or this. In fact, most programming languages use a special variable self or this which is implicitly bound in the object, and which denotes the object itself.\n\nWhen all methods in a record are terms of the form fun x -> ..., they can be interpreted as themselves, and we can simplify the rule\n\nby using\n\nSimilarly, the rule\n\nspecialises to\n\nand finally the rule\n\ncan be replaced by\n\nTo force all fields to be functions, we can modify the language of records, passing from a record language to an object-oriented language. The symbol {} now binds a variable in each even argument—terms—, the symbol . is replaced by the symbol #, the symbol <- now binds a variable in the third argument.\n\nThe term {}(l1,s1t1, ...,ln,sntn) is written {l1 =ςs1t1, ...,ln =ςsntn}, the term #(t,l) is written t#l and the term <-(t,l,s u) is written t(l <-ςs u). The rules of the big-step operational semantics are now\n\nExercise 8.7\n\nWrite an interpreter for the language PCF with objects.\n\nExercise 8.8\n\n(Late binding) Consider the term\n\nIs the value of this term 10 or 11? Compare this result with that of Exercise 2.8.\n\n### 8.2.3 Objects and References\n\nThe standard definition of object includes a notion of internal state, which evolves in time. Thus, it combines the notion of object and reference, which are clearly separate in the definition of functional object given above.\n\nIn a language with objects and references, when a non-functional field a = u is transformed into a = fun x -> u, the interpretation of fun x -> u does not produce the side effects produced by the interpretation of u. It is only when we access the field that the side effects will be visible. Thus, the behaviour is similar to that of records under call by name. The term\n\nis interpreted as the value 0 and not 1 as the term\n\nin call by value. We need to rewrite this term as follows\n\nif we want the interpretation to be the value 1.\n\nExercise 8.9\n\nWhen we interpret a term of the form t#l, how many times is the term t interpreted? If the interpretation of t includes side effects, how many times will they take place? How can we force the term t to be interpreted only once?\nGilles Dowek and Jean-Jacques LévyUndergraduate Topics in Computer ScienceIntroduction to the Theory of Programming Languages10.1007/978-0-85729-076-2_9© Springer-Verlag London Limited 2011\n\n# 9. Epilogue\n\nGilles Dowek1  and Jean-Jacques Lévy2\n\n(1)\n\nLabo. d'Informatique, École polytechnique, route de Saclay, 91128 Palaiseau, France\n\n(2)\n\nCentre de Recherche Commun, INRIA-Microsoft Research, Parc Orsay Université, 28 rue Jean Rostand, 91893 Orsay Cedex, France\n\nGilles Dowek (Corresponding author)\n\nEmail: gilles.dowek@polytechnique.edu\n\nJean-Jacques Lévy\n\nEmail: jean-jacques.levy@inria.fr\n\nAbstract\n\nThe Epilogue discusses the goals of the theory of programming languages: building tools to describe existing languages or to define new ones?\n\nThe first goal of this book was to present the main tools to define the semantics of a programming\n\n[Direct Result]: 91893 Orsay Cedex, France\n\nGilles Dowek (Corresponding author)\n\nEmail: gilles.dowek@polytechnique.edu\n\nJean-Jacques Lévy\n\nEmail: jean-jacques.levy@inria.fr\n\nAbstract\n\nThe Epilogue discusses the goals of the theory of programming languages: building tools to describe existing languages or to define new ones?\n\nThe first goal of this book was to present the main tools to define the semantics of a programming language: small-step operational semantics, big-step operational semantics, and denotational semantics.\n\nWe have stressed the fact that these three tools have the same purpose. In the three cases, the goal is to define a relation ↪ between a program, an input value and an output value. Since the goal is to define a relation, the question that arises naturally is: how do we define relations in mathematical language?\n\nThe answer is the same in the three cases: the means to achieve the goal is the fixed point theorem. However, the similarity is superficial, because the fixed point theorems are used in different ways in the three semantics. By giving rise to inductive definitions, and hence reflexive-transitive closures, the fixed point theorem plays a major rôle in operational semantics. In contrast, it plays a minor rôle in denotational semantics, because it is only used to give the meaning of the construction fix. The denotational semantics of a language without fixed point, such as Gödel's System T—see Exercise 5.13—can be defined without using the fixed point theorem.\n\nTo highlight the differences, we can look at the rôle of derivations. To establish that a term t has the value V in operational semantics, it is sufficient to show a derivation, or a sequence of reductions, that is, finite objects. In contrast, in denotational semantics the meaning of a term of the form fix is given as the least fixed point of a function, that is, a limit. For this reason, to establish that the value of a term t is V we sometimes need to compute the limit of a sequence, that is, we sometimes need to deal with an infinite object.\n\nOperational semantics have an advantage over denotational ones, because the relation ↪ can be defined in a more concrete way operationally. But on the other hand, operationally we can only define relations that are recursively enumerable, whereas denotationally we can define arbitrary relations. For this reason, in operational semantics we cannot complete the definition of the relation ↪ by adding a value ⊥ for the terms that do not terminate, because the resulting relation is not recursive, it cannot be effectively defined by induction. In contrast, denotationally it is not a problem to add such a value.\n\nWe see here the dilemma that arises from the undecidability of the halting problem: we cannot complete the relation ↪ by adding ⊥ for the non-terminating terms, and at the same time define it inductively. We have to choose between completing the relation or defining it inductively, which leads to two different semantics. The readers who have followed logic courses before will recognise here the same issues that distinguish the truth judgements that are inductively defined, by the existence of a proof, from those that are defined by their validity in a model.\n\nThe second goal of this book was to give the semantics of some programming language features: explicit definitions of functions, functions defined by fixed points, assignment, records, objects.... Here again, since the goal is to define functions, it is useful to start by looking at the ways in which functions are defined in Mathematics. In general, the comparison between the mathematical language and programming languages is fruitful, since the mathematical language is the closest we have to programming languages. This comparison shows some common points, but also some differences.\n\nThe purpose of the study of programming language features is not to be exhaustive, but to show some informative examples. The point to remember is that, in the same way that Zoology is not the study of all the animal species one after the other, the study of programming languages should not consist of studying all languages one after the other. They should be organised according to their main features.\n\nWe could continue this study by defining data types and exceptions. The study of data types would give us the opportunity to use again the fixed point theorem, and Robinson's unification algorithm, of which matching is a particular case. Going forward in this direction we could study the notion of backtracking which leads to Prolog. Other important points that we have left aside are the polymorphic typing of references, the notion of array, imperative objects, modules, type systems for records and objects (and in particular the notion of sub-type), concurrency....\n\nThe final goal of this book was to present a number of applications of these tools, in particular for the design and implementation of interpreters and compilers, and also the implementation of type inference systems. The main point here is that the structure of a compiler is derived directly from the operational semantics of the language to be compiled. The next step would be the study of implementation techniques for abstract machines, and this would lead us to the study of memory management and garbage collection. We could also study program analysis, and design systems to deduce in an automatic or interactive way properties of programs, for instance, the property that states that the value returned by a sorting algorithm is a sorted list.\n\nThe last point that remains to discuss is the rôle of the theory of programming languages, and in particular whether its purpose is to describe the existing programming languages, or to propose new languages.\n\nAstronomers study the galaxies that exist, and do not build new ones, whereas chemists study the existing molecules and build new ones. We know that in the latter case, the order in which theories and production techniques appear may vary: the transformation of mass into"
      ],
      "latency_s": 1.69,
      "rag_type": "literag",
      "dominio": "LiteRAG_Multihop_01",
      "titulo": "",
      "error": ""
    },
    {
      "question": "Joe Celko emphasizes naming conventions in SQL. If the Linux kernel naming convention for network device iteration macros like for_each_netdev were applied to SQL, what anti-pattern would Celko likely criticize?",
      "ground_truth": "Hungarian notation or tibbling — adding type prefixes to identifiers",
      "answer": "Joe Celko would likely criticize the anti-pattern of **names that change from place to place** (Section 1.3.2).\n\nThe rationale for this anti-pattern is that changing the name of an attribute from table to table makes it impossible to build a proper data dictionary and leads to code that is difficult to read. The example given is when a table name is always included as part of the column name, which is reminiscent of how files worked in early COBOL programs.\n\nIf the Linux kernel's `for_each_netdev` macro were applied to SQL in a similar fashion, it would imply that the \"device\" part of the name (analogous to the table name) would be prepended or appended to the iteration macro itself, leading to variations like `for_each_eth0_netdev`, `for_each_wlan0_netdev`, etc. This would mean that the fundamental concept of iterating over network devices would have a name that changes depending on the specific device, violating Celko's principle that an attribute's name should identify the entity, not its location.",
      "contexts": [
        "## Direct Evidence (Source Text)\n[Direct Result]: BOL paragraph names: one program might use countries, another might use flowers, and so forth. This is obviously weird behavior even for a programmer, but many programmers had personal systems that made sense to themselves but not to other people.\n\nFor example, the first FORTRAN I used allowed only six-letter names, so I became adept at using and inventing six-letter names. Programmers who started with weakly typed or typeless languages like to use Hungarian notation (see Leszynski and Reddick). Old habits are hard to give up.\n\nWhen software engineering became the norm, every shop developed its own naming conventions and enforced them with some kind of data dictionary. Perhaps the most widespread set of rules was MIL STD 8320.1, set up by the U.S. Department of Defense, but it never became popular outside of the federal government. This was a definite improvement over the prior nonsystem, but each shop varied quite a bit; some had formal rules for name construction, whereas others simply registered whatever the first name given to a data element was.\n\nToday, we have ISO-11179 standards, which are becoming increasingly widespread, required for certain government work, and being put into data repository products. Tools and repositories of standardized encoding schemes are being built to this standard. Given this and XML as a standard exchange format, ISO-11179 will be the way that metadata is referenced in the future.\n\n## 1.1.1 Watch the Length of Names\n\n#### Rationale:\n\nThe SQL-92 standards have a maximum identifier length of 18 characters. This length came from the older COBOL standards. These days, SQL implementations allow longer names, but if you cannot say it in 18 characters, then you have a problem. Table 1.1 shows the maximum length for names of the most important SQL schema objects according to ISO and several popular SQL products.\n\nTable 1.1 I _dentifier lengths_\n\nThe numbers in the table are either bytes or characters. A maximum character length can be smaller than a maximum byte length if you use a multibyte character set.\n\nDo not use super-long names. People have to read them, type them, and print them out. They also have to be able to understand those names when they look at the code, search for them in the data dictionary, and so forth. Finally, the names need to be shared in host programs that might not allow the same maximum length.\n\nBut do not go to the other extreme of highly condensed names that are impossible to read without weeks of study. The old Bachman design tool was used to build DB2 databases back when column length was limited to 18 bytes. Sometimes the tool would change the logical attribute name to a physical column name by removing all of the vowels. Craig Mullins referred to this as \"Bachman having a vowel movement on my DDL.\" This is a bad approach to getting the name to fit within a smaller number of characters.\n\n#### Exceptions:\n\nThese exceptions would be on a case-by-case basis and probably the result of legacy systems that had different naming restrictions.\n\n## 1.1.2 Avoid All Special Characters in Names\n\n#### Rationale:\n\nSpecial characters in a name make it difficult or impossible to use the same name in the database and the host language programs or even to move a schema to another SQL product.\n\nTable 1.2 shows the characters allowed in names by the standards and popular SQL products.\n\nTable 1.2 _Identifier character sets_\n\nGenerally, the first character of a name must be a letter, whereas subsequent characters may be letters, digits, or _ (underscore). Any database management system (DBMS) might also allow $, #, or @, but no DBMS allows all three, and in any case the special characters are not usable everywhere (Microsoft attaches special meaning to names that begin with @ or # and Oracle discourages special characters in the names of certain objects).\n\nBut what is a letter? In the original SQL, all letters had to be uppercase Latin, so there were only 26 choices. Nowadays the repertoire is more extensive, but be wary of characters outside the Latin-1 character set for the following reasons:\n\n1. _IBM cannot always recognize a letter._ It just accepts that any multibyte character except space is a letter and will not attempt to determine whether it's uppercase or lowercase.\n\n2. _IBM and Oracle use the database's character set and so could have a migration problem with exotic letters._ Microsoft uses Unicode and so does not have this problem.\n\nIntermediate SQL-92 does not allow an identifier to end in an underscore. It is also not a good idea to put multiple underscores together; modern printers make it difficult to count the number of underscores in a chain.\n\n#### Exceptions:\n\nNone\n\n## 1.1.3 Avoid Quoted Identifiers\n\n#### Rationale:\n\n####\n\nThis feature was added to SQL-92. Its main use has been to alias column names to make printouts look like reports. This kludge defeats the purpose of a tiered architecture. Instead, it destroys portability of the code and invites poorly constructed names. Table 1.3 shows the characteristics of delimited identifiers.\n\nTable 1.3 _Quoted identifier character sets_\n\nIf you find the character-set restrictions of names onerous, you can avoid them by putting identifiers inside double quotes. The result is a delimited identifier (or quoted identifier in Oracle terminology). Delimited identifiers may start with, and contain, any character. It is a bit uncertain how one can include the double quote (\") character. The standard way is to double it, as in \"Empl\" \"oyees\" but that's not always documented.\n\nSupport for delimited names is nearly universal, with only two major exceptions: (1) IBM will not allow nonalphanumeric characters for labels and variable names inside stored procedures, and (2) Microsoft will not allow quoted identifiers if\n\n[Direct Result]: it like a ZIP code? It is drawn from a domain of values that is not unique. If it is a type, then what is the taxonomy towhich it belongs? Why not go all the way and call it \"type_code_id_value\" instead?\n\nWhy did we not find a mere \"customer_type\" that would have been understood on sight?\n\n#### Exceptions:\n\nNone\n\nImproperly formed data element names seem to be the result of ignorance and object-oriented (OO) programming. In particular, OO programmers put \"_id\" on every primary key in every table and have problems understanding that SQL is a strongly typed language in which things do not change their data types in programs. The names get absurd at times. Consider a lookup table for colors:\n\nBut what does \"_value_id\" mean? Names like this are generated without thought or research. Assume that we are using the Pantone color system in the database, so we have a trusted source and a precise description—we did the research! This might have been written as follows:\n\n## 1.3.2 Avoid Names That Change from Place to Place\n\n#### Rationale:\n\nThe worst possible design flaw is changing the name of an attribute on the fly, from table to table. As an example, consider this slightly cleaned-up piece of actual code from a SQL newsgroup:\n\nThose full table names are difficult to read, but the newbie who wrote this code thinks that the table name must _always_ be part of the column name. That is the way that a file worked in early COBOL programs.\n\nThis means that if you have hundreds of tables, each appearance of the same attribute gets a new name, so you can never build a proper data dictionary. Did you also notice that it is not easy to see underscores, commas, and periods?\n\nTry this cleaned-up version, which clearly shows a simple star schema centered on the IPC table.\n\nI have no idea what a URN is, but it looks like a standard identifier of some kind. Look at all of the kinds of \"URNs\" (i.e., URN, IPCURN, and OffenseURN) in the original version of the query. It gives you the feeling of being in a crematorium gift shop.\n\nAs you walk from room to room in your house, do you also change your name, based on your physical location? Of course not! The name we seek identifies the entity, not the location.\n\n#### Exceptions:\n\nAliases inside a query can temporarily give a new name to an occurrence of a data element. These are temporary and disappear at the end of the statement. We discuss rules for this in another section 1.2.6.\n\n## 1.3.3 Do Not Use Proprietary Exposed Physical Locators\n\n#### Rationale:\n\nThe most basic idea of modern data modeling is to separate the logical model and the physical implementation from each other. This allows us to reuse the model on different platforms and not be tied to just one platform.\n\nIn the old days, the logical and physical implementations were fused together. I will explain this in more detail in the next chapter, but for now the rule is to never use proprietary physical locators. We want to have portable code. But the real problem is that the proprietary physical locator violates the basic idea of a key in the relational model.\n\nWhen new SQL programmers use IDENTITY, GUID, ROWID, or other auto-numbering vendor extensions to get a key that can be used for locating a given row, they are imitating a magnetic tape's sequential access. It lets them know the order in which a row was added to the table—just like individual records went onto the end of the magnetic tape!\n\nWe will spend more time discussing this flaw in Chapter 3.\n\n#### Exceptions:\n\nYou might want to fake a sequential file when you are using a SQL table structure for some purpose other than a relational database management system (RDBMS). For example, staging and scrubbing data outside the \"Real Schema\" that do not have any data integrity issues.\nCHAPTER 2 Fonts, Punctuation, and Spacing\n\nCODE IS USUALLY set in a monospace font. After more than a century of manual typewriters and decades of punchcards, we find that it is actually easier to read code in a monospace font than a proportional font. Punctuation marks get the same spacing as a letter in a monospace font, but would be lost in a proportional font.\n\n# 2.1 Typography and Code\n\nYour brain and eyes do not follow code the same way that they follow text, process mathematics, read maps, or look at pictures. In fact, there are a lot of individual differences in human brains.\n\nSome people like text editors that use colors for various syntax elements in a programming language. Other people get headaches from colored program editors and want to see black-and-white text. Likewise, a newspaper that put nouns in red, verbs in green, and other such things would simply not work. Yet black-and-white maps are much more difficult to read than those with colors. Why? This has to do with color perception and how fast you can switch between the left and right halves of your brain.\n\nThere is a test for brain damage in which the examiner flashes cards with words printed in various colored inks (e.g., the word \"RED\" written in green ink). The examiner asks the subject for the word orthe color and times the responses. The rate is fairly constant over the subject's lifetime, so a change is a symptom of some physical or chemical change. Now, try reading this phrase:\n\nAlmost nobody reading this for the first time catches the fact that the word \"the\" appears twice. The point is that there is a vertical component to how we read text in chunks of words.\n\nCode on a page is read from left to right and from top to bottom, with a lot of vertical eye movement that you would not have if\n\n[Direct Result]: programming revolution came along was a series of books entitled \"[Pascal | FORTRAN | COBOL | BASIC] with Style: Programming Proverbs\" by Henry Ledgard and some of his colleagues at MIT. The covers were done like a Victorian novel with angels, scrolls, and old-style typographical elements. And like a Victorian novel, the books were subtitled \"Principles of Good Programming with Numerous Examples to Improve Programming Style and Proficiency.\" These books and others made a big difference for most of us because they taught us how to think like good programmers.\n\nMy goals in this book are to improve SQL programming style and proficiency. To be more exact:\n\n1. To _help an individual programmer write Standard SQL without an accent or a dialect._ It is difficult to unlearn old habits but not impossible, and it is best to learn the right way from the start. Amateurs write code for themselves. A professional writes codeto be maintained and used by other people. My rule of thumb has been that you need to have a full year of SQL programming before you have your epiphany and suddenly see the world in three: valued logic, data models, and sets.\n\n2. _To give an SQL shop a coding standard for internal use._ I have tried carefully to give a rationale for each of my rules, and I have given exceptions to those rules when I could think of them. You may disagree with some of my choices, but you will have to provide research and examples to defend your position. It is not good enough to simply declare: \"Well, that's the way we wrote code in FooTran, so it must be the will of God!\" as an argument.\n\nIf you are the team leader, you now have a book (and author) that you can hold up and blame for anything that your people do not like. Even if I am later shown to be wrong about something, you will have been consistent. It is much easier to repair errors if they were made consistently.\n\n3. _To give programmers the mental tools to approach a new problem with SQL as their tool._ I tell people it takes about a year to \"get it\" and drop your procedural programming habits.\n\n# 1.2 Acknowledgments\n\nCraig Mullins provided the structure of the chapter on VIEWs in an article in www.DBAzine.com. The formatting style is taken from a house style I have used in CMP magazines and other publications for more than a decade. Peter Gulutzan provided the data for the naming conventions in actual products from an article inwww.DBAzine.com. The affix conventions in Chapter 1 are based on internal standards from Teradata Corporation. The scales and measurements and the encoding schemes material appeared in several of my old magazine columns in _DBMS_ and _Database Programming & Design_ before they were collected into a chapter in my book _Data & Database_ (Morgan-Kaufmann Publishers). I have tried to give credit in the text, but so many people have participated in the newsgroups over the years that I know I am forgetting someone.\n\nAnd, obviously, thanks to Henry Ledgard and his \"Programming Proverbs\" series for the inspiration.\n\nI would also like to thank all of the newbie programmers who wrote bad code. It sounds a bit sarcastic, but it is not meant to be. Many of thenewbies are programmers who were thrown into a DBA or SQL programmer job by management without training or an experienced mentor. I do not want to blame the victims unless they are really not working on getting better. Your errors in syntax, semantics, and style showed me how you were thinking. Diagnosis is the first step to treatment.\n\n# 1.3 Corrections, Comments, and Future Editions\n\nCorrections and additions for future editions can be sent to Morgan-Kaufmann publishers directly or to me at my e-mail address, jcelko212@earthlink.net.\nCHAPTER 1 Names and Data Elements\n\nThis is the old joke:\n\n\"When I was a kid, we had three cats.\"\n\n\"What were their names?\"\n\n\"Cat, cat, and cat.\"\n\n\"That sounds screwed up. How did you tell them apart?\"\n\n\"Who cares? Cats don't come when you call them anyway!\"\n\nYOUR DATA WILL not come when it is called either if you do not give it a name that is always distinct and recognizable. This is an important part of any database project. Bad names for the data elements make the code difficult, or even impossible, to read.\n\nI am not kidding about impossible to read. In the old days, software companies used to deliberately scramble source code names and remove formatting to hide the algorithm from the buyers. The tradition seems to linger on, even if not by intent. In August 2004, a SQL newsgroup had a posting in which all of the names were one letter and a long string of digits.\n\nThere are now ISO-11179 metadata standards that describe rules for naming data elements and for registering standards. Because they are an ISO standard, they are what you should be using in SQL as well as everywhere else.\n\nThat standard, a bit of typography, and some common sense will give you the rules you need to get started.\n\n# 1.1 Names\n\nIn the early days, every programmer had his or her own personal naming conventions. Unfortunately, they were often highly creative. My favorite was a guy who picked a theme for his COBOL paragraph names: one program might use countries, another might use flowers, and so forth. This is obviously weird behavior even for a programmer, but many programmers had personal systems that made sense to themselves but not to other people.\n\nFor example, the first FORTRAN I used allowed only six-letter names, so I became adept at using and inventing six-letter names. Programmers who started with weakly typed or typeless languages like to use Hungarian notation (see Leszynski and Red"
      ],
      "latency_s": 9.62,
      "rag_type": "literag",
      "dominio": "LiteRAG_Multihop_01",
      "titulo": "",
      "error": ""
    },
    {
      "question": "Both the regular expressions book and the programming languages theory book deal with formal grammars. What formal language class do regular expressions belong to according to the Chomsky hierarchy discussed in programming language theory?",
      "ground_truth": "Type-3 or regular languages, the lowest level of the Chomsky hierarchy",
      "answer": "The provided text does not explicitly state the Chomsky hierarchy class to which regular expressions belong. However, it does mention that formal grammars are a useful tool for describing the syntax of programming languages. The \"Introduction to the Theory of Programming Languages\" book discusses formal grammars in the context of defining programming language syntax. The \"Introducing Regular Expressions\" book explains that regular expressions are used to find patterns in text strings.\n\nWhile the Chomsky hierarchy is a fundamental concept in formal language theory often discussed in the context of programming language theory, the provided snippets do not offer enough information to directly answer which class regular expressions fall into.",
      "contexts": [
        "## Direct Evidence (Source Text)\n[Direct Result]: a sorting algorithm is a sorted list.\n\nThe last point that remains to discuss is the rôle of the theory of programming languages, and in particular whether its purpose is to describe the existing programming languages, or to propose new languages.\n\nAstronomers study the galaxies that exist, and do not build new ones, whereas chemists study the existing molecules and build new ones. We know that in the latter case, the order in which theories and production techniques appear may vary: the transformation of mass into energy was achieved long time after the theory of relativity, whereas the steam engine appeared before the principles of thermodynamics were established.\n\nThe theory of programming languages has enabled the development of new features, such as static binding, type inference, polymorphic types, garbage collection,... which are now available in commercial languages. In contrast, other functionalities, such as assignments and objects, were introduced in programming languages wildly, and the theory has been slow to follow. The development of a formal semantics for these constructs led in turn to new proposals, such as the recent extensions of Java with polymorphic types.\n\nThe theory of programming languages has neither an exclusively descriptive rôle nor an exclusively leading rôle. It is this going backwards and forwards between the description of existing features and the design of new ones that gives the theory of programming languages its dynamics.\nGilles Dowek and Jean-Jacques LévyUndergraduate Topics in Computer ScienceIntroduction to the Theory of Programming Languages10.1007/978-0-85729-076-2© Springer-Verlag London Limited 2011\n\nReferences\n\n1.\n\nAbadi, M., Cardelli, L.: A Theory of Objects. Springer, Berlin (1998)\n\n2.\n\nDybvig, R.K.: The Scheme Programming Language, 2nd edn. Prentice Hall, New York (1996). www.scheme.com/tspl2d/\n\n3.\n\nGunter, C.A.: Semantics of Programming Languages: Structures and Techniques. MIT Press, Cambridge (1992)MATH\n\n4.\n\nKahn, G.: Natural semantics. In: Proceedings of the Symp. on Theoretical Aspects of Computer Science, TACS, Passau (1987)\n\n5.\n\nMitchell, J.C.: Foundations for Programming Languages. MIT Press, Cambridge (1996)\n\n6.\n\nMitchell, J.C.: Concepts in Programming Languages. Cambridge University Press, Cambridge (2002)MATHCrossRef\n\n7.\n\nPeyton Jones, S., Lester, D.: Types and Programming Languages. Prentice Hall, New York (1992)\n\n8.\n\nPierce, B.C.: Types and Programming Languages. MIT Press, Cambridge (2002)\n\n9.\n\nPlotkin, G.D.: LCF considered as a programming language. Theor. Comput. Sci. 5 , 223–255 (1977) MathSciNetCrossRef90044-5)\n\n10.\n\nPlotkin, G.D.: A structural approach to operational semantics. Technical Report DAIMI FN–19, Computer Science Department, Aarhus University, Aarhus, Denmark, September 1981\n\n11.\n\nReynolds, J.C.: Theories of Programming Languages. Cambridge University Press, Cambridge (1998)MATHCrossRef\n\n12.\n\nScott, D.: Continuous Lattices. Lecture Notes in Math., vol. 274, pp. 97–136. Springer, Berlin (1972)\n\n13.\n\nWeis, P., Leroy, X.: Le langage Caml, 2nd edn. Dunod, Paris (1999)\n\n14.\n\nWinskel, G.: The Formal Semantics of Programming Languages. MIT Press, Cambridge (1993)MATH\n\nIndex\n\nA\n\nAbstract machine\n\nAlgorithm\n\nDamas and Milner\n\nHindley's\n\nRobinson's\n\nα -equivalence\n\nAlphabetic equivalence\n\nArity\n\nArray\n\nB\n\nβ -reduction\n\nBinding\n\ndynamic\n\nlate\n\nstatic\n\nC\n\nCall by name\n\nCall by value\n\nChurch numeral\n\nClosed set\n\nClosure\n\nrecursive\n\nCompiler\n\nbootstrapping\n\nComposition\n\nConfluence\n\nConstant\n\nContinuous function\n\nD\n\nDe Bruijn index\n\nDefinition\n\nexplicit\n\ninductive\n\nDerivation\n\nDeterministic\n\nE\n\nEnvironment\n\nsemantic\n\ntyping\n\nEvaluate\n\nEvaluator\n\nF\n\nFields\n\nFixed point\n\nCurry\n\nfirst theorem\n\nfunction construction via\n\nin PCF\n\nsecond theorem\n\nFunctionalisation\n\nH\n\nHeight\n\nI\n\nInterpreter\n\nL\n\nLabel\n\nLanguage\n\nLimit\n\nList\n\nM\n\nMethod\n\ndynamic\n\nstatic\n\nModule\n\nN\n\nNumber of arguments\n\nO\n\nObject\n\nOrdering\n\nScott's\n\nstrongly complete\n\nweakly complete\n\nP\n\nPair\n\nPCF ( Programming language for computable functions )\n\nPolymorphism\n\nPosition numerals\n\nR\n\nRecord\n\nin call by name\n\nin call by value\n\nRedex\n\nReduction\n\ncall by name\n\ncall by value\n\nlazy\n\nweak\n\nReference\n\nRegister\n\naccumulator\n\ncode\n\nenvironment\n\nstack\n\nRenaming\n\nResult\n\nRule\n\nS\n\nSemantics\n\nbig-step operational\n\ndenotational\n\nsmall-step operational\n\nSide effect\n\nSolution\n\nprincipal\n\nSort\n\nStrategy\n\nSubject reduction\n\nSubstitution\n\nSystem\n\nF\n\nT\n\nT\n\nTerm\n\nclosed\n\nirreducible\n\nstuck\n\nThunk\n\nTree\n\nType\n\nchecking\n\ninference\n\nprincipal\n\nType preservation\n\nby interpretation\n\nType scheme\n\nU\n\nUnification\n\nV\n\nValue\n\nextended\n\nrational\n\nVariable\n\ncapture\n\nenvironment\n\nmutable\n\n[Direct Result]: Title: Introduction to the Theory of Programming Languages\nAuthors: Gilles Dowek\nDomain: cs\n================================================================================\n\n \nGilles Dowek and Jean-Jacques LévyUndergraduate Topics in Computer ScienceIntroduction to the Theory of Programming Languages10.1007/978-0-85729-076-2© Springer-Verlag London Limited 2011\n\nUndergraduate Topics in Computer Science\n\nSeries EditorIan Mackie\n\nAdvisory EditorsSamson Abramsky, Chris Hankin, Dexter Kozen, Andrew Pitts, Hanne Riis Nielson, Steven Skiena and Iain Stewart\n\nUndergraduate Topics in Computer Science (UTiCS) delivers high-quality instructional content for undergraduates studying in all areas of computing and information science. From core foundational and theoretical material to final-year topics and applications, UTiCS books take a fresh, concise, and modern approach and are ideal for self-study or for a one- or two-semester course. The texts are all authored by established experts in their fields, reviewed by an international advisory board, and contain numerous examples and problems. Many include fully worked solutions.\n\nFor other volumes: http://www.springer.com/series/7592\n\nGilles Dowek and Jean-Jacques Lévy\n\nIntroduction to the Theory of Programming Languages\n\nGilles Dowek\n\nLabo. d'Informatique, École polytechnique, Palaiseau, France\n\nJean-Jacques Lévy\n\nCentre de Recherche Commun, INRIA-Microsoft Research, Parc Orsay Université, Orsay Cedex, France\n\nISSN 1863-7310\n\nISBN 978-0-85729-075-5e-ISBN 978-0-85729-076-2\n\nSpringer London Dordrecht Heidelberg New York\n\nBritish Library Cataloguing in Publication Data A catalogue record for this book is available from the British Library\n\n© Springer-Verlag London Limited 2011\n\nThe work was first published in 2006 by Les editions de l'École polytechnique with the following title: 'Introduction à la théorie des langages de programmation'. The translator of the work is Maribel Fernandez.\n\nApart from any fair dealing for the purposes of research or private study, or criticism or review, as permitted under the Copyright, Designs and Patents Act 1988, this publication may only be reproduced, stored or transmitted, in any form or by any means, with the prior permission in writing of the publishers, or in the case of reprographic reproduction in accordance with the terms of licenses issued by the Copyright Licensing Agency. Enquiries concerning reproduction outside those terms should be sent to the publishers.\n\nThe use of registered names, trademarks, etc., in this publication does not imply, even in the absence of a specific statement, that such names are exempt from the relevant laws and regulations and therefore free for general use.\n\nThe publisher makes no representation, express or implied, with regard to the accuracy of the information contained in this book and cannot accept any legal responsibility or liability for any errors or omissions that may be made.\n\nPrinted on acid-free paper\n\nSpringer is part of Springer Science+Business Media (www.springer.com)\n\nWhat Is the Theory of Programming Languages?\n\nThe ultimate, definitive programming language has not been created yet, far from it. Almost every day a new language is created, and new functionalities are added to existing languages. Improvements in programming languages contribute to making programs more reliable, shorten the development time, and make programs easier to maintain. Improvements are also needed to satisfy new requirements, such as the development of parallel, distributed or mobile programs.\n\nThe first thing that we need to describe, when defining a programming language, is its syntax . Should we write x := 1 or x = 1 ? Should we put brackets after an if or not? More generally, what are the strings of symbols that can be used as a program? There is a useful tool for this: the notion of a formal grammar . Using a grammar, we can describe the syntax of the language in a precise way, and this makes it possible to build programs to check the syntactical correctness of programs.\n\nBut it is not sufficient to know what a syntactically correct program is in order to know what is going to happen when we run the program. When defining a programming language, it is also necessary to describe its semantics , that is, the expected behaviour of the program when it is executed. Two languages may have the same syntax but different semantics.\n\nThe following is an example of what is meant (informally) by semantics. Function evaluation is often explained as follows. \" The resultVof the evaluation of an expression of the formfe1...en , where the symbolfis a function defined by the expressionfx1...xn= e' , is obtained in the following way. First, the argumentse1, ...,enare evaluated, returning valuesW1, ...,Wn . Then, these values are associated to the variablesx1, ...,xn , and finally the expressione'is evaluated. The valueVis the result of this evaluation .\"\n\nThis explanation of the semantics of the language, expressed in a natural language (English), allows us to understand what happens when a program is executed, but is it precise? Consider, for example, the program\n\nDepending on the way we interpret the explanation given above, we can deduce that the program will result in the value 2 or in the value 9 . This is because the natural language explanation does not indicate whether we have to evaluate g 2 before or after g 7 , and the order in which we evaluate these expressions is important in this case. Instead, the explanation should have said: \"the arguments e1, ...,en are evaluated starting frome1 \" or else \" starting fromen \".\n\nIf two different programmers read an ambiguous\n\n[Direct Result]: Title: Introducing Regular Expressions\nAuthors: Michael Fitzgerald\nDomain: cs\n================================================================================\n\n \n# Introducing Regular Expressions\n\n### Michael Fitzgerald\n\nPublished by O'Reilly Media\n\nBeijing ⋅ Cambridge ⋅ Farnham ⋅ Köln ⋅ Sebastopol ⋅ Tokyo\n\n# SPECIAL OFFER: Upgrade this ebook with O'Reilly\n\nClick here for more information on this offer!\n\n _Please note that upgrade offers are not available from sample content._\n\n# Preface\n\nThis book shows you how to write regular expressions through examples. Its goal is to make learning regular expressions as easy as possible. In fact, this book demonstrates nearly every concept it presents by way of example so you can easily imitate and try them yourself.\n\nRegular expressions help you find patterns in text strings. More precisely, they are specially encoded text strings that match patterns in sets of strings, most often strings that are found in documents or files.\n\nRegular expressions began to emerge when mathematician Stephen Kleene wrote his book _Introduction to Metamathematics_ (New York, Van Nostrand), first published in 1952, though the concepts had been around since the early 1940s. They became more widely available to computer scientists with the advent of the Unix operating system—the work of Brian Kernighan, Dennis Ritchie, Ken Thompson, and others at AT&T Bell Labs—and its utilities, such as _sed_ and _grep_ , in the early 1970s.\n\nThe earliest appearance that I can find of regular expressions in a computer application is in the QED editor. QED, short for Quick Editor, was written for the Berkeley Timesharing System, which ran on the Scientific Data Systems SDS 940. Documented in 1970, it was a rewrite by Ken Thompson of a previous editor on MIT's Compatible Time-Sharing System and yielded one of the earliest if not first practical implementations of regular expressions in computing. (Table A-1 in Appendix A documents the regex features of QED.)\n\nI'll use a variety of tools to demonstrate the examples. You will, I hope, find most of them usable and useful; others won't be usable because they are not readily available on your Windows system. You can skip the ones that aren't practical for you or that aren't appealing. But I recommend that anyone who is serious about a career in computing learn about regular expressions in a Unix-based environment. I have worked in that environment for 25 years and still learn new things every day.\n\n> \"Those who don't understand Unix are condemned to reinvent it, poorly.\" —Henry Spencer\n\nSome of the tools I'll show you are available online via a web browser, which will be the easiest for most readers to use. Others you'll use from a command or a shell prompt, and a few you'll run on the desktop. The tools, if you don't have them, will be easy to download. The majority are free or won't cost you much money.\n\nThis book also goes light on jargon. I'll share with you what the correct terms are when necessary, but in small doses. I use this approach because over the years, I've found that jargon can often create barriers. In other words, I'll try not to overwhelm you with the dry language that describes regular expressions. That is because the basic philosophy of this book is this: Doing useful things can come before knowing everything about a given subject.\n\nThere are lots of different implementations of regular expressions. You will find regular expressions used in Unix command-line tools like _vi_ ( _vim_ ), _grep_ , and _sed_ , among others. You will find regular expressions in programming languages like Perl (of course), Java, JavaScript, C# or Ruby, and many more, and you will find them in declarative languages like XSLT 2.0. You will also find them in applications like Notepad++, Oxygen, or TextMate, among many others.\n\nMost of these implementations have similarities and differences. I won't cover all those differences in this book, but I will touch on a good number of them. If I attempted to document _all_ the differences between _all_ implementations, I'd have to be hospitalized. I won't get bogged down in these kinds of details in this book. You're expecting an introductory text, as advertised, and that is what you'll get.\n\n# Who Should Read This Book\n\nThe audience for this book is people who haven't ever written a regular expression before. If you are new to regular expressions or programming, this book is a good place to start. In other words, I am writing for the reader who has heard of regular expressions and is interested in them but who doesn't really understand them yet. If that is you, then this book is a good fit.\n\nThe order I'll go in to cover the features of regex is from the simple to the complex. In other words, we'll go step by simple step.\n\nNow, if you happen to already know something about regular expressions and how to use them, or if you are an experienced programmer, this book may not be where you want to start. This is a beginner's book, for rank beginners who need some hand-holding. If you have written some regular expressions before, and feel familiar with them, you can start here if you want, but I'm planning to take it slower than you will probably like.\n\nI recommend several books to read after this one. First, try Jeff Friedl's _Mastering Regular Expressions, Third Edition_ (see <http://shop.oreilly.com/product/9781565922570.do>). Friedl's book gives regular expressions a thorough going over, and I highly recommend it. I also recommend the _Regular_ Expressions _Cookbook_ (see <http://shop.oreilly.com/product/978059652"
      ],
      "latency_s": 2.27,
      "rag_type": "literag",
      "dominio": "LiteRAG_Multihop_01",
      "titulo": "",
      "error": ""
    },
    {
      "question": "The statistics book covers probability distributions and the Spark book applies them to machine learning. Which probability distribution is foundational to the Naive Bayes classifier available in Spark MLlib?",
      "ground_truth": "The multinomial or Bernoulli distribution (conditional probability)",
      "answer": "The provided text does not specify which probability distribution is foundational to the Naive Bayes classifier available in Spark MLlib. It only mentions that Naive Bayes models are simple, easy to train efficiently, and can provide reasonable performance with appropriate feature engineering.",
      "contexts": [
        "## Direct Evidence (Source Text)\n[Direct Result]: to a given item. Finally, we explored common metrics to evaluate the predictive capability of our recommendation model.\n\nIn the next chapter, you will learn how to use Spark to train a model to classify your data and to use standard evaluation mechanisms to gauge the performance of your model.\n\n# Chapter 5. Building a Classification Model with Spark\n\nIn this chapter, you will learn the basics of classification models and how they can be used in a variety of contexts. Classification generically refers to classifying things into distinct categories or classes. In the case of a classification model, we typically wish to assign classes based on a set of features. The features might represent variables related to an item or object, an event or context, or some combination of these.\n\nThe simplest form of classification is when we have two classes; this is referred to as binary classification. One of the classes is usually labeled as the positive class (assigned a label of 1), while the other is labeled as the negative class (assigned a label of -1 or, sometimes, 0).\n\nA simple example with two classes is shown in the following figure. The input features in this case have two dimensions, and the feature values are represented on the _x_ and _y_ axes in the figure.\n\nOur task is to train a model that can classify new data points in this two-dimensional space as either one class (red) or the other (blue).\n\nA simple binary classification problem\n\nIf we have more than two classes, we would refer to multiclass classification, and classes are typically labeled using integer numbers starting at 0 (for example, five different classes would range from label 0 to 4). An example is shown in the following figure. Again, the input features are assumed to be two-dimensional for ease of illustration.\n\nA simple multiclass classification problem\n\nClassification is a form of supervised learning where we train a model with training examples that include known targets or outcomes of interest (that is, the model is supervised with these example outcomes). Classification models can be used in many situations, but a few common examples include:\n\n  * Predicting the probability of Internet users clicking on an online advert; here, the classes are binary in nature (that is, click or no click)\n  * Detecting fraud; again, in this case, the classes are commonly binary (fraud or no fraud)\n  * Predicting defaults on loans (binary)\n  * Classifying images, video, or sounds (most often multiclass, with potentially very many different classes)\n  * Assigning categories or tags to news articles, web pages, or other content (multiclass)\n  * Discovering e-mail and web spam, network intrusions, and other malicious behavior (binary or multiclass)\n  * Detecting failure situations, for example in computer systems or networks\n  * Ranking customers or users in order of probability that they might purchase a product or use a service (this can be framed as classification by predicting probabilities and then ranking in the descending order)\n  * Predicting customers or users who might stop using a product, service, or provider (called churn)\n\nThese are just a few possible use cases. In fact, it is probably safe to say that classification is one of the most widely used machine learning and statistical techniques in modern businesses and especially online businesses.\n\nIn this chapter, we will:\n\n  * Discuss the types of classification models available in MLlib\n  * Use Spark to extract the appropriate features from raw input data\n  * Train a number of classification models using MLlib\n  * Make predictions with our classification models\n  * Apply a number of standard evaluation techniques to assess the predictive performance of our models\n  * Illustrate how to improve model performance using some of the feature-extraction approaches from Chapter 3, _Obtaining, Processing, and Preparing Data with Spark_\n  * Explore the impact of parameter tuning on model performance and learn how to use cross-validation to select the most optimal model parameters\n\n# Types of classification models\n\nWe will explore three common classification models available in Spark: linear models, decision trees, and naive Bayes models. Linear models, while less complex, are relatively easier to scale to very large datasets. Decision tree is a powerful nonlinear technique that can be a little more difficult to scale up (fortunately, MLlib takes care of this for us!) and more computationally intensive to train, but delivers leading performance in many situations. Naive Bayes models are more simple but are easy to train efficiently and parallelize (in fact, they require only one pass over the dataset). They can also give reasonable performance in many cases when appropriate feature engineering is used. A naive Bayes model also provides a good baseline model against which we can measure the performance of other models.\n\nCurrently, Spark's MLlib library supports binary classification for linear models, decision trees, and naive Bayes models and multiclass classification for decision trees and naive Bayes models. In this book, for simplicity in illustrating the examples, we will focus on the binary case.\n\n## Linear models\n\nThe core idea of linear models (or generalized linear models) is that we model the predicted outcome of interest (often called the target or dependent variable) as a function of a simple linear predictor applied to the input variables (also referred to as features or independent variables).\n\n    y = f(wTx)\n\nHere, _y_ is the target variable, _w_ is the vector of parameters (known as the weight vector), and _x_ is the vector of input features.\n\n _w Tx_ is the linear predictor (or vector dot product) of the weight vector _w_ and feature vector _x_. To this linear predictor, we applied a function _f_ (called the link function).\n\nLinear models can, in fact, be used for both classification and regression, simply by changing the link function. Standard linear regression (covered in the next chapter) uses an identity link (that\n\n[Direct Result]: bottom line.\n\nNick is a member of the Apache Spark Project Management Committee.\n\n# Acknowledgments\n\nWriting this book has been quite a rollercoaster ride over the past year, with many ups and downs, late nights, and working weekends. It has also been extremely rewarding to combine my passion for machine learning with my love of the Apache Spark project, and I hope to bring some of this out in this book.\n\nI would like to thank the Packt Publishing team for all their assistance throughout the writing and editing process: Rebecca, Susmita, Sudhir, Amey, Neil, Vivek, Pankaj, and everyone who worked on the book.\n\nThanks also go to Debora Donato at StumbleUpon for assistance with data- and legal-related queries.\n\nWriting a book like this can be a somewhat lonely process, so it is incredibly helpful to get the feedback of reviewers to understand whether one is headed in the right direction (and what course adjustments need to be made). I'm deeply grateful to Andrea Mostosi, Hao Ren, and Krishna Sankar for taking the time to provide such detailed and critical feedback.\n\nI could not have gotten through this project without the unwavering support of all my family and friends, especially my wonderful wife, Tammy, who will be glad to have me back in the evenings and on weekends once again. Thank you all!\n\nFinally, thanks to all of you reading this; I hope you find it useful!\n\n# About the Reviewers\n\n **Andrea Mostosi** is a technology enthusiast. An innovation lover since he was a child, he started a professional job in 2003 and worked on several projects, playing almost every role in the computer science environment. He is currently the CTO at The Fool, a company that tries to make sense of web and social data. During his free time, he likes traveling, running, cooking, biking, and coding.\n\n ****\n\nI would like to thank my geek friends: Simone M, Daniele V, Luca T, Luigi P, Michele N, Luca O, Luca B, Diego C, and Fabio B. They are the smartest people I know, and comparing myself with them has always pushed me to be better.\n\n **Hao Ren** is a software developer who is passionate about Scala, distributed systems, machine learning, and Apache Spark. He was an exchange student at EPFL when he learned about Scala in 2012. He is currently working in Paris as a backend and data engineer for ClaraVista--a company that focuses on high-performance marketing. His work responsibility is to build a Spark-based platform for purchase prediction and a new recommender system.\n\nBesides programming, he enjoys running, swimming, and playing basketball and badminton. You can learn more at his blog <http://www.invkrh.me>.\n\n **Krishna Sankar** is a chief data scientist at BlackArrow, where he is focusing on enhancing user experience via inference, intelligence, and interfaces. Earlier stints include working as a principal architect and data scientist at Tata America International Corporation, director of data science at a bioinformatics start-up company, and as a distinguished engineer at Cisco Systems, Inc. He has spoken at various conferences about data science (<http://goo.gl/9pyJMH>), machine learning (<http://goo.gl/sSem2Y>), and social media analysis (<http://goo.gl/D9YpVQ>). He has also been a guest lecturer at the Naval Postgraduate School. He has written a few books on Java, wireless LAN security, Web 2.0, and now on Spark. His other passion is LEGO robotics. Earlier in April, he was at the St. Louis FLL World Competition as a robots design judge.\n\n# www.PacktPub.com\n\n# Support files, eBooks, discount offers, and more\n\nFor support files and downloads related to your book, please visit www.PacktPub.com.\n\nDid you know that Packt offers eBook versions of every book published, with PDF and ePub files available? You can upgrade to the eBook version at www.PacktPub.com and as a print book customer, you are entitled to a discount on the eBook copy. Get in touch with us at `<service@packtpub.com>` for more details.\n\nAt www.PacktPub.com, you can also read a collection of free technical articles, sign up for a range of free newsletters and receive exclusive discounts and offers on Packt books and eBooks.\n\n<https://www2.packtpub.com/books/subscription/packtlib>\n\nDo you need instant solutions to your IT questions? PacktLib is Packt's online digital book library. Here, you can search, access, and read Packt's entire library of books.\n\n## Why subscribe?\n\n  * Fully searchable across every book published by Packt\n  * Copy and paste, print, and bookmark content\n  * On demand and accessible via a web browser\n\n## Free access for Packt account holders\n\nIf you have an account with Packt at www.PacktPub.com, you can use this to access PacktLib today and view 9 entirely free books. Simply use your login credentials for immediate access.\n\n# Preface\n\nIn recent years, the volume of data being collected, stored, and analyzed has exploded, in particular in relation to the activity on the Web and mobile devices, as well as data from the physical world collected via sensor networks. While previously large-scale data storage, processing, analysis, and modeling was the domain of the largest institutions such as Google, Yahoo!, Facebook, and Twitter, increasingly, many organizations are being faced with the challenge of how to handle a massive amount of data.\n\nWhen faced with this quantity of data and the common requirement to utilize it in real time, human-powered systems quickly become infeasible. This has led to a rise in the so-called big data and\n\n[Direct Result]: You will learn some common dimensionality-reduction techniques and how to apply and analyze them, as well as how to use the resulting data representation as input to another machine learning model.\n\nChapter 9, _Advanced Text Processing with Spark_ , introduces approaches to deal with large-scale text data, including techniques for feature extraction from text and dealing with the very high-dimensional features typical in text data.\n\nChapter 10, _Real-time Machine Learning with Spark Streaming_ , provides an overview of Spark Streaming and how it fits in with the online and incremental learning approaches to apply machine learning on data streams.\n\n# What you need for this book\n\nThroughout this book, we assume that you have some basic experience with programming in Scala, Java, or Python and have some basic knowledge of machine learning, statistics, and data analysis.\n\n# Who this book is for\n\nThis book is aimed at entry-level to intermediate data scientists, data analysts, software engineers, and practitioners involved in machine learning or data mining with an interest in large-scale machine learning approaches, but who are not necessarily familiar with Spark. You may have some experience of statistics or machine learning software (perhaps including MATLAB, scikit-learn, Mahout, R, Weka, and so on) or distributed systems (perhaps including some exposure to Hadoop).\n\n# Conventions\n\nIn this book, you will find a number of styles of text that distinguish between different kinds of information. Here are some examples of these styles, and an explanation of their meaning.\n\nCode words in text, database table names, folder names, filenames, file extensions, pathnames, dummy URLs, user input, and Twitter handles are shown as follows: \"Spark places user scripts to run Spark in the `bin` directory.\"\n\nA block of code is set as follows:\n\n    val conf = new SparkConf()\n    .setAppName(\"Test Spark App\")\n    .setMaster(\"local[4]\")\n    val sc = new SparkContext(conf)\n\nAny command-line input or output is written as follows:\n\n    **> tar xfvz spark-1.2.0-bin-hadoop2.4.tgz**\n    **> cd spark-1.2.0-bin-hadoop2.4**\n\n**New terms** and **important words** are shown in bold. Words that you see on the screen, in menus or dialog boxes for example, appear in the text like this: \"These can be obtained from the AWS homepage by clicking **Account** | **Security Credentials** | **Access Credentials**.\"\n\n### Note\n\nWarnings or important notes appear in a box like this.\n\n### Tip\n\nTips and tricks appear like this.\n\n# Reader feedback\n\nFeedback from our readers is always welcome. Let us know what you think about this book--what you liked or may have disliked. Reader feedback is important for us to develop titles that you really get the most out of.\n\nTo send us general feedback, simply send an e-mail to `<feedback@packtpub.com>`, and mention the book title through the subject of your message.\n\nIf there is a topic that you have expertise in and you are interested in either writing or contributing to a book, see our author guide on www.packtpub.com/authors.\n\n# Customer support\n\nNow that you are the proud owner of a Packt book, we have a number of things to help you to get the most from your purchase.\n\n## Downloading the example code\n\nYou can download the example code files for all Packt books you have purchased from your account at <http://www.packtpub.com>. If you purchased this book elsewhere, you can visit <http://www.packtpub.com/support> and register to have the files e-mailed directly to you.\n\n## Errata\n\nAlthough we have taken every care to ensure the accuracy of our content, mistakes do happen. If you find a mistake in one of our books--maybe a mistake in the text or the code--we would be grateful if you would report this to us. By doing so, you can save other readers from frustration and help us improve subsequent versions of this book. If you find any errata, please report them by visiting <http://www.packtpub.com/support>, selecting your book, clicking on the **Errata Submission Form** link, and entering the details of your errata. Once your errata are verified, your submission will be accepted and the errata will be uploaded to our website or added to any list of existing errata under the Errata section of that title.\n\nTo view the previously submitted errata, go to <https://www.packtpub.com/books/content/support> and enter the name of the book in the search field. The required information will appear under the **Errata** section.\n\n## Piracy\n\nPiracy of copyright material on the Internet is an ongoing problem across all media. At Packt, we take the protection of our copyright and licenses very seriously. If you come across any illegal copies of our works, in any form, on the Internet, please provide us with the location address or website name immediately so that we can pursue a remedy.\n\nPlease contact us at `<copyright@packtpub.com>` with a link to the suspected pirated material.\n\nWe appreciate your help in protecting our authors, and our ability to bring you valuable content.\n\n## Questions\n\nYou can contact us at `<questions@packtpub.com>` if you are having a problem with any aspect of the book, and we will do our best to address it.\n\n# Chapter 1. Getting Up and Running with Spark\n\nApache Spark is a framework for distributed computing; this framework aims to make it simpler to write programs that run in parallel across many nodes in a cluster of computers. It tries to abstract the tasks of resource scheduling, job submission, execution, tracking, and communication between nodes, as well as the low-level operations that are inherent in parallel data processing. It also provides a higher level"
      ],
      "latency_s": 18.8,
      "rag_type": "literag",
      "dominio": "LiteRAG_Multihop_01",
      "titulo": "",
      "error": ""
    },
    {
      "question": "The SQL Server book and the statistics book both deal with aggregation. What SQL aggregate function directly computes the statistical concept of variance described by Forsyth?",
      "ground_truth": "VAR() or VARIANCE()",
      "answer": "The SQL aggregate function that directly computes the statistical concept of variance described by Forsyth is **VAR**.",
      "contexts": [
        "## Direct Evidence (Source Text)\n[Direct Result]: (OrderDate, SalesOrderID )\n\nThis function is not compatible with the OVER operator.\n\nCHECKSUM_AGG\n\nLike CHECKSUM, this is a basic hash algorithm usually used to detect changes or consistency in data. The primary difference is that CHECKSUM is oriented around rows, whereas CHECKSUM_AGG is oriented around columns. The basic syntax is:\n\nCHECKSUM_AGG( [ALL | DISTINCT] <expression>)\n\nThe expression value can be virtually anything, including, if you wish, concatenation of columns (just remember to cast as necessary); however, remember that expression order does matter, so if you're concatenating, Col1 + Col2 does not equal Col2 + Col1.\n\nCOUNT\n\nCOUNT returns the number of items in expression. The data type returned is of type int. The syntax is as follows:\n\nCOUNT\n\n(\n\n[ALL | DISTINCT] <expression> | *\n\n)\n\nThe expression cannot be of the uniqueidentifier, text, image, or ntext data types. The * argument returns the number of rows in the table; it does not eliminate duplicate or NULL values.\n\nThis function supports the OVER operator described in the ranking functions section of this appendix.\n\nCOUNT_BIG\n\nCOUNT_BIG returns the number of items in a group. This is very similar to the COUNT function, with the exception that the return value has a data type of bigint. The syntax is as follows:\n\nCOUNT_BIG\n\n(\n\n[ALL | DISTINCT ] <expression> | *\n\n)\n\nLike COUNT, this function supports the OVER operator described in the ranking functions section of this appendix.\n\nGROUPING\n\nGROUPING adds an extra column to the output of a SELECT statement. The GROUPING function is used in conjunction with CUBE or ROLLUP to distinguish between normal NULL values and those added as a result of CUBE and ROLLUP operations. Its syntax is:\n\nGROUPING (<column_name>)\n\nGROUPING is used only in the SELECT list. Its argument is a column that is used in the GROUP BY clause and that is to be checked for NULL values.\n\nThis function supports the OVER operator described in the ranking functions section of this appendix.\n\nMAX\n\nThe MAX function returns the maximum value from expression. The syntax is as follows:\n\nMAX([ALL | DISTINCT] <expression>)\n\nMAX ignores any NULL values.\n\nThis function supports the OVER operator described in the ranking functions section of this appendix.\n\nMIN\n\nThe MIN function returns the smallest value from expression. The syntax is as follows:\n\nMIN([ALL | DISTINCT] <expression>)\n\nMIN ignores NULL values.\n\nThis function supports the OVER operator described in the ranking functions section of this appendix.\n\nSTDEV\n\nThe STDEV function returns the standard deviation of all values in expression. The syntax is as follows:\n\nSTDEV(<expression>)\n\nSTDEV ignores NULL values.\n\nThis function supports the OVER operator described in the ranking functions section of this appendix.\n\nSTDEVP\n\nThe STDEVP function returns the standard deviation for the population of all values in expression. The syntax is as follows:\n\nSTDEVP(<expression>)\n\nSTDEVP ignores NULL values.\n\nThis function supports the OVER operator described in the ranking functions section of this appendix.\n\nSUM\n\nThe SUM function will return the total of all values in expression. The syntax is as follows:\n\nSUM([ALL | DISTINCT] <expression>)\n\nSUM ignores NULL values.\n\nThis function supports the OVER operator described in the ranking functions section of this appendix.\n\nVAR\n\nThe VAR function returns the variance of all values in expression. The syntax is as follows:\n\nVAR(<expression>)\n\nVAR ignores NULL values.\n\nThis function supports the OVER operator described in the ranking functions section of this appendix.\n\nVARP\n\nThe VARP function returns the variance for the population of all values in expression. The syntax is as follows:\n\nVARP(<expression>)\n\nVARP ignores NULL values.\n\nThis function supports the OVER operator described in the ranking functions section of this appendix.\n\nConfiguration Functions\n\nWell, I'm sure it will come as a complete surprise (ok, not really...), but configuration functions are those functions that tell us about options as they are set for the current server or database (as appropriate).\n\n@@DATEFIRST\n\nReturns the numeric value that corresponds to the day of the week that the system considers the first day of the week.\n\nThe default in the United States is 7, which equates to Sunday. The values convert as follows:\n\n  * 1—Monday (the first day for most of the world)\n  * 2—Tuesday\n  * 3—Wednesday\n  * 4—Thursday\n  * 5—Friday\n  * 6—Saturday\n  * 7—Sunday\n\nThis can be really handy when dealing with localization issues, so you can properly layout any calendar or other day-of-week-dependent information you have.\n\nUse the SET DATEFIRST function to alter this setting.\n\n@@DBTS\n\nReturns the last used timestamp for the current database.\n\nAt first look, this one seems to act an awful lot like @@IDENTITY in that it gives you the chance to get back the last value set by the system (this time, it's the last timestamp instead of the last identity value). The things to watch out for on this one include:\n\n  * The value changes based on any change in the database, not just the table you're working on.\n  * Any timestamp change in the database is reflected, not just those for the current connection.\n\nBecause you can't count on this value truly being the last one that you used (someone else may have done something that would change it), I personally find very little practical use for this one.\n\n@@LANGID and @@LANGUAGE\n\nRespectively return the ID and the name of the language currently in use.\n\nThese can be handy for figuring out if your product has been installed in a localization situation or not, and if so what language is the default.\n\nFor a full listing of the languages currently supported by SQL Server, use the system stored\n\n[Direct Result]: Returns the time in milliseconds (based on the resolution of the system timer) that SQL Server has been idle since it was last started.\n\nYou can think of this one as being something of the inverse of @@CPU_BUSY. Essentially, it tells you how much time your SQL Server has spent doing nothing. If anyone finds a programmatic use for this one, send me an e-mail (robv@professionalsql.com). I'd love to hear about it (I can't think of one).\n\n@@IO_BUSY\n\nReturns the time in milliseconds (based on the resolution of the system timer) that SQL Server has spent doing input and output operations since it was last started. This value is reset every time SQL Server is started.\n\nThis one doesn't really have any rocket science to it, and it is another one of those that I find falls into the \"no real programmatic use\" category.\n\n@@PACK_RECEIVED and @@PACK_SENT\n\nRespectively return the number of input packets read to and written from the network by SQL Server since it was last started.\n\nPrimarily, these are network troubleshooting tools.\n\n@@PACKET_ERRORS\n\nReturns the number of network packet errors that have occurred on connections to your SQL Server since the last time the SQL Server was started.\n\nPrimarily a network troubleshooting tool.\n\n@@TIMETICKS\n\nReturns the number of microseconds per tick. This varies by machines and is another of those that falls under the category of \"no real programmatic use.\"\n\n@@TOTAL_ERRORS\n\nReturns the number of disk read/write errors encountered by the SQL Server since it was last started.\n\nDon't confuse this with runtime errors or as having any relation to @@ERROR. This is about problems with physical I/O. This one is another of those of the \"no real programmatic use\" variety. The primary use here would be more along the lines of system diagnostic scripts. Generally speaking, I would use the Windows Reliability and Performance Monitor for this instead.\n\n@@TOTAL_READ and @@TOTAL_WRITE\n\nRespectively return the total number of disk reads/writes by SQL Server since it was last started.\n\nThe names here are a little misleading, as these do not include any reads from cache. They are only physical I/O.\n\n@@TRANCOUNT\n\nReturns the number of active transactions—essentially the transaction nesting level—for the current connection.\n\nThis is a very big one when you are doing transactioning. I'm not normally a big fan of nested transactions, but there are times where they are difficult to avoid. As such, it can be important to know just where you are in the transaction-nesting side of things. (For example, you may have logic that only starts a transaction if you're not already in one.)\n\nIf you're not in a transaction, then @@TRANCOUNT is 0. From there, let's look at a brief example:\n\nSELECT @@TRANCOUNT As TransactionNestLevel --This will be zero at this\n\npoint\n\nBEGIN TRAN\n\nSELECT @@TRANCOUNT As TransactionNestLevel --This will be one at this\n\npoint\n\nBEGIN TRAN\n\nSELECT @@TRANCOUNT As TransactionNestLevel --This will be two at this\n\npoint\n\nCOMMIT TRAN\n\nSELECT @@TRANCOUNT As TransactionNestLevel --This will be back to one\n\n\\--at this point\n\nROLLBACK TRAN\n\nSELECT @@TRANCOUNT As TransactionNestLevel --This will be back to zero\n\n\\--at this point\n\nNote that, in this example, the @@TRANCOUNT at the end would also have reached zero if we had a COMMIT as our last statement.\n\nAggregate Functions\n\nAggregate functions are applied to sets of records rather than to a single record. The information in the multiple records is processed in a particular manner and then is displayed in a single record answer. Aggregate functions are often used in conjunction with the GROUP BY clause.\n\nThe aggregate functions are:\n\n  * AVG\n  * CHECKSUM\n  * CHECKSUM_AGG\n  * COUNT\n  * COUNT_BIG\n  * GROUPING\n  * MAX\n  * MIN\n  * STDEV\n  * STDEVP\n  * SUM\n  * VAR\n  * VARP\n\nIn most aggregate functions, the ALL or DISTINCT keywords can be used. The ALL argument is the default and will apply the function to all the values in the expression, even if a value appears numerous times. The DISTINCT argument means that a value will only be included in the function once, even if it occurs several times.\n\nAggregate functions cannot be nested. The expression cannot be a subquery.\n\nAVG\n\nAVG returns the average of the values in expression. The syntax is as follows:\n\nAVG([ALL | DISTINCT] <expression>)\n\nThe expression must contain numeric values. NULL values are ignored. This function supports the OVER operator described in the ranking functions section of this appendix.\n\nCHECKSUM\n\nThis is a basic hash algorithm usually used to detect changes or consistency in data. This particular function accepts either an expression as an argument or a * (which implies that you want all columns in all the joined tables to be included). The basic syntax is:\n\nCHECKSUM(<expression>, [...n] | * )\n\nNote that the order of your expression, or in the case of a *, the join order, will affect the checksum value, so, for example:\n\nCHECKSUM(SalesOrderID, OrderDate)\n\nwould not give the same result as:\n\nCHECKSUM(OrderDate, SalesOrderID )\n\nThis function is not compatible with the OVER operator.\n\nCHECKSUM_AGG\n\nLike CHECKSUM, this is a basic hash algorithm usually used to detect changes or consistency in data. The primary difference is that CHECKSUM is oriented around rows, whereas CHECKSUM_AGG is oriented around columns. The basic syntax is:\n\nCHECKSUM_AGG( [ALL | DISTINCT] <expression>)\n\nThe expression value can be virtually anything, including, if you wish, concatenation of\n\n[Direct Result]: very slightly) different numbers are called the standard deviation of a dataset. One—the one we use in this chapter—is an estimate of the scale of the data, as we describe it. The other differs from our expression very slightly; one computes\n\n![\n$$\\\\displaystyle{\\\\mathsf{stdunbiased}\\\\left \\(\\\\left \\\\{x\\\\right \\\\}\\\\right \\) = \\\\sqrt{\\\\frac{\\\\sum _{i } \\(x_{i } - \\\\mathsf{mean } \\\\left \\(\\\\left \\\\{x\\\\right \\\\} \\\\right \\) \\)^{2 } } {N - 1}} }$$\n](A442674_1_En_1_Chapter_Equr.gif)\n\n(notice the N − 1 for our N). If N is large, this number is basically the same as the number we compute, but for smaller N there is a difference that can be significant. Irritatingly, this number is also called the standard deviation; even more irritatingly, we will have to deal with it, but not yet. I mention it now because you may look up terms I have used, find this definition, and wonder whether I know what I'm talking about. In this case, I do (although I would say that).\n\nThe confusion arises because sometimes the datasets we see are actually samples of larger datasets. For example, in some circumstances you could think of the net worth dataset as a sample of all the net worths in the USA. In such cases, we are often interested in the standard deviation of the underlying dataset that was sampled (rather than of the dataset of samples that you have). The second number is a slightly better way to estimate this standard deviation than the definition we have been working with. Don't worry—the N in our expressions is the right thing to use for what we're doing.\n\n### 1.3.3 Computing Mean and Standard Deviation Online\n\nOne useful feature of means and standard deviations is that you can estimate them online. Assume that, rather than seeing N elements of a dataset in one go, you get to see each one once in some order, and you cannot store them. This means that after seeing k elements, you will have an estimate of the mean based on those k elements. Write ![\n$$\\\\hat{\\\\mu }_{k}$$\n](A442674_1_En_1_Chapter_IEq11.gif) for this estimate. Because\n\n![\n$$\\\\displaystyle{\\\\mathsf{mean}\\\\left \\(\\\\left \\\\{x\\\\right \\\\}\\\\right \\) = \\\\frac{\\\\sum _{i}x_{i}} {N} }$$\n](A442674_1_En_1_Chapter_Equs.gif)\n\nand\n\n![\n$$\\\\displaystyle{\\\\sum _{i=1}^{k+1}x_{ i} = \\\\left \\(\\\\sum _{i=1}^{k}x_{ i}\\\\right \\) + x_{k+1},}$$\n](A442674_1_En_1_Chapter_Equt.gif)\n\nwe have the following recursion\n\n![\n$$\\\\displaystyle{\\\\hat{\\\\mu }_{k+1} = \\\\frac{\\\\left \\(k\\\\hat{\\\\mu }_{k}\\\\right \\) + x_{k+1}} {\\(k + 1\\)}.}$$\n](A442674_1_En_1_Chapter_Equu.gif)\n\nSimilarly, after seeing k elements, you will have an estimate of the standard deviation based on those k elements. Write ![\n$$\\\\hat{\\\\sigma }_{k}$$\n](A442674_1_En_1_Chapter_IEq12.gif) for this estimate. We have the recursion\n\n![\n$$\\\\displaystyle{\\\\hat{\\\\sigma }_{k+1} = \\\\sqrt{\\\\frac{\\(k\\\\hat{\\\\sigma }_{k }^{2 }\\) + \\(x_{k+1 } -\\\\hat{\\\\mu } _{k+1 } \\)^{2 } } {\\(k + 1\\)}}.}$$\n](A442674_1_En_1_Chapter_Equv.gif)\n\n### 1.3.4 Variance\n\nIt turns out that thinking in terms of the square of the standard deviation, which is known as the variance, will allow us to generalize our summaries to apply to higher dimensional data.\n\nDefinition 1.3 (Variance)\n\nAssume we have a dataset {x} of N data items, x 1,..., x N . where N > 1. Their variance is:\n\n![\n$$\\\\displaystyle\\\\begin{array}{rcl} \\\\mathsf{var}\\\\left \\(\\\\left \\\\{x\\\\right \\\\}\\\\right \\)& =& \\\\frac{1} {N}\\\\left \\(\\\\sum _{i=1}^{i=N}\\(x_{ i} -\\\\mathsf{mean}\\\\left \\(\\\\left \\\\{x\\\\right \\\\}\\\\right \\)\\)^{2}\\\\right \\) {}\\\\\\\\ & =& \\\\mathsf{mean}\\\\left \\(\\\\left \\\\{\\(x_{i} -\\\\mathsf{mean}\\\\left \\(\\\\left \\\\{x\\\\right \\\\}\\\\right \\)\\)^{2}\\\\right \\\\}\\\\right \\). {}\\\\\\\\ \\\\end{array}$$\n](A442674_1_En_1_Chapter_Equ3.gif)\n\nOne good way to think of the variance is as the mean-square error you would incur if you replaced each data item with the mean. Another is that it is the square of the standard deviation. The properties of the variance follow from the fact that it is the square of the standard deviation. I have broken these out in a box, for emphasis.\n\nUseful\n\n[Direct Result]: creating\n\ndropping\n\nmaster database\n\npopulation\n\nstop lists\n\nFull-Text Search (FTS)\n\nAcrobat\n\nAdventureWorks\n\narchitecture\n\nBoolean\n\ndatabases\n\nExcel\n\nindexes\n\nkeywords\n\nphrases\n\nproximity\n\nqueries\n\nWEIGHT\n\nWord\n\nFULLTEXTCATALOGPROPERTY\n\nFULLTEXTSERVICEPROPERTY\n\nG\n\nGAM. See Global Allocation Map\n\nGeneral Statistics\n\nGenerateImportFile\n\ngeodetic data\n\nGEOGRAPHY\n\nGEOGRAPHY\n\ngeodetic data\n\nGeography Markup Language (GML)\n\nGEOMETRY\n\nplanar data\n\nGetAncester()\n\nHierarchyID\n\nGETANSINULL\n\nGETDATE()\n\nGetDescendant\n\nGetDescendant( < child1 > , < child2 > )\n\nGetLevel\n\nGetLevel()\n\nGetReparentedValue( < old root > , < new root > )\n\nGetReparentedValue(), UPDATE\n\nGetRoot()\n\ngetting direct reports\n\nGETUTCDATE\n\nGlobal Allocation Map (GAM)\n\nGLOBAL, cursors\n\nglobal subscribers\n\nGlobal Variables\n\nGlobally Unique Identifier (GUID)\n\n@job_id\n\nGML. See Geography Markup Language\n\nGO\n\nADO\n\nADO.NET\n\nbatches\n\nODBC\n\nOLE DB\n\nT-SQL\n\nGOTO\n\ngrafting\n\nGRANT\n\nbulkadmin\n\nDENY\n\ngranularity\n\ngraphical showplan\n\nactual\n\nestimated\n\nhierarchy\n\nQuery Optimizer\n\nGROUP BY\n\nGROUPING\n\nguest accounts, security\n\nGUID. See Globally Unique Identifier\n\nH\n\nhardware\n\nbeing down\n\nCPU\n\ndriver support\n\nexclusive server\n\nideal\n\nI/O\n\nlost data\n\nmaintenance\n\nOLTP vs. OLAP\n\non-site vs. off-site\n\nRAID\n\nsecurity\n\nHAS_DBACCESS\n\nHASHED\n\nHAVING\n\n@hdoc\n\nheaps\n\n-h\"hint[,...]\"\n\nhide\n\nhierarchical data\n\nhorizontal indexing\n\nvertical indexing\n\nXML\n\nhierarchy\n\nEXPLICIT\n\ngraphical showplan\n\nhorizontal indexes\n\nlockable resources\n\nrecursive queries\n\nvertical indexes\n\nHierarchyID\n\nGetAncester()\n\nmethods\n\nstructure\n\nvalues\n\n-HINT\n\nHOLDLOCK, client-side vs. server-side\n\nhorizontal filtering\n\nhorizontal indexes, hierarchy\n\nhorizontal partitioning\n\nWHERE\n\nHOST_ID\n\nHOST_NAME\n\nhyhen, bcp\n\nI\n\nid\n\nXMLDATA\n\nIDEF1X\n\nIDENT_CURRENT\n\nidentifiers, objects\n\nidentifying relationship\n\nIDENT_INCR\n\nIDENTITY\n\n@@IDENTITY\n\nIDENTITY_INSERT ON\n\nIDENT_SEED\n\n@@IDLE\n\nidref\n\nXMLDATA\n\nidrefs\n\nUNION\n\nXMLDATA\n\nIE. See Information Engineering\n\nIEnumerable, .NET\n\nIF\n\nnon-repeatable reads\n\nIF EXISTS\n\nIF...ELSE\n\nsprocs\n\niFilter\n\nIGNORE_DUP_KEY\n\n-i < input file >\n\nIIS. See Internet Information Services\n\nImage\n\nimage\n\nimage functions\n\nimmediate-updating subscribers\n\nsnapshot replication\n\ntransactional replication\n\nimplicit transactions\n\nSET\n\nIMPLICIT_TRANSACTIONS\n\nImport/Export Wizard\n\nimporting\n\nbcp\n\nINSERT\n\nlogin\n\nSELECT\n\nimports\n\nin\n\nIN PATH\n\nINCLUDE\n\ninclude\n\nINCREMENTAL\n\nincremental population\n\nINDE\n\nIndex Tuning Wizard\n\nINDEX_COL\n\nindex_depth\n\nindexed view\n\nindexes\n\nbackward compatibility\n\nbreadth-first\n\nB-Tree\n\nchoices\n\nclustered\n\nB-Tree\n\nprimary keys\n\ncolumns\n\nconstraints\n\ndeletes\n\nfragmentation\n\nFTS\n\nfull-text\n\naltering\n\nbackward compatibility\n\ncolumns\n\ncreating\n\ndropping\n\nmaster database\n\npopulation\n\nstop lists\n\nhorizontal, hierarchy\n\ninserts\n\nJOIN\n\nmaintenance\n\nmaintenance planning\n\nnames\n\nnavigation\n\nnon-clustered\n\non a clustered table\n\non a heap\n\nORDER BY\n\npages\n\nselectivity\n\nSMO\n\nSQL Server Management Studio\n\nstorage\n\ntemporary tables\n\ntoken-based structure\n\ntriggers\n\nT-SQL\n\ntypes\n\nupdates\n\nvertical, hierarchy\n\nWHERE\n\nXML\n\ncreating\n\nPATH\n\nprimary\n\nPROPERTY\n\nsecondary\n\nVALUE\n\nINDEXKEY_PROPERTY\n\nIndexKeyType\n\nindex_level\n\nINDEXPROPERTY\n\nindex_type_desc\n\n[IN|EXISTS|ANY|ALL]\n\nINFECTIONAL, FREETEXT\n\nInformation Engineering (IE)\n\nentity box\n\ninformation_schema\n\nINIT\n\nInit\n\ninline errors\n\ninner joins\n\nINSERT\n\nbulkadmin\n\ncode\n\ndb_denydatawriter\n\nimporting\n\nMERGE\n\nobject permissions\n\nscripts\n\ntransactional replication\n\ntransactions\n\ntriggers\n\ninsert(s)\n\ndata warehousing\n\nindexes\n\nOLAP\n\nOLTP\n\nINSERT INTO\n\nINSERT INTO...SELECT\n\ninsert, XQuery\n\nINSERTED\n\nInserted\n\nINSERT..SELECT\n\nINST\n\n< instance of xml data type > .<method>\n\nINSTEAD OF\n\nSELECT\n\ntriggers\n\nINSTEAD OF DELETE, triggers\n\nINSTEAD OF INSERT, triggers\n\nINSTEAD OF UPDATE, triggers\n\nInt\n\nint\n\nIntegration Services. See SQL Server Integration Services\n\nintent exclusive lock\n\nintent locks\n\nintent shared lock\n\nInternet Information Services (IIS)\n\nInternet server provider (ISP)\n\nINTERSECT\n\nEXISTS\n\nNOT EXISTS\n\nINTO, CTEs\n\nInversion Entry\n\nInvoke-Sqlcmd\n\nI/O\n\nTEXT|ALL\n\n@@IO_BUSY\n\nIP addresses\n\nISABOUT()\n\nISAM\n\ncursors\n\nISDATE\n\nIsDescendantOf( < node > )\n\nIS_MEMBER\n\nISNULL\n\nISNUMERIC\n\nISOLATION LEVEL\n\nisolation levels\n\ntransaction isolation level\n\nleast restrictive\n\nISP. See Internet server provider\n\nisql\n\nIsRowGuid\n\nIS_SRVROLEMEMBER\n\nJ\n\nJDBC, cursors\n\nJOBID\n\n@job_id\n\nDatabase Mail\n\nGUID\n\nuniqueidentifier\n\n@job_name\n\njobs\n\ncreating\n\ndeleting\n\nDMO\n\nmaintaining\n\nmsdb database\n\nscheduling\n\nSQL Server Management Studio\n\nT-SQL\n\nUSE\n\nJOIN\n\nindexes\n\njoins\n\nalternative syntax\n\ncolumns\n\ncorrelated subqueries"
      ],
      "latency_s": 17.03,
      "rag_type": "literag",
      "dominio": "LiteRAG_Multihop_01",
      "titulo": "",
      "error": ""
    },
    {
      "question": "Both the Linux Kernel and the Spark book operate on distributed or parallel data flows. What kernel networking concept is analogous to Spark's concept of data partitioning across nodes?",
      "ground_truth": "Network packet routing across multiple network interfaces or NUMA nodes",
      "answer": "The provided text does not contain information about the Linux Kernel Networking concept analogous to Spark's data partitioning. The text focuses on the Linux Kernel Networking stack's implementation and theory, as well as Apache Spark's framework for distributed computing.",
      "contexts": [
        "## Direct Evidence (Source Text)\n[Direct Result]: Index599\nRami RosenLinux Kernel NetworkingImplementation and Theory10.1007/978-1-4302-6197-1_1\n\n© Rami Rosen 2014\n\n# 1. Introduction\n\nRami Rosen1\n\n(1)\n\nHaifa, Israel\n\nAbstract\n\nThis book deals with the implementation of the Linux Kernel Networking stack and the theory behind it. You will find in the following pages an in-depth and detailed analysis of the networking subsystem and its architecture. I will not burden you with topics not directly related to networking, which you may encounter while reading kernel networking code (for example, locking and synchronization, SMP, atomic operations, and so on). There are plenty of resources about such topics. On the other hand, there are very few up-to-date resources that focus on kernel networking proper. By this I mean primarily describing the traversal of the packet in the Linux Kernel Networking stack and its interaction with various networking layers and subsystems—and how various networking protocols are implemented.\n\nThis book deals with the implementation of the Linux Kernel Networking stack and the theory behind it. You will find in the following pages an in-depth and detailed analysis of the networking subsystem and its architecture. I will not burden you with topics not directly related to networking, which you may encounter while reading kernel networking code (for example, locking and synchronization, SMP, atomic operations, and so on). There are plenty of resources about such topics. On the other hand, there are very few up-to-date resources that focus on kernel networking proper. By this I mean primarily describing the traversal of the packet in the Linux Kernel Networking stack and its interaction with various networking layers and subsystems—and how various networking protocols are implemented.\n\nThis book is also not a cumbersome, line-by-line code walkthrough. I focus on the essence of the implementation of each network layer and the theory guidelines and principles that led to this implementation. The Linux operating system has proved itself in recent years as a successful, reliable, stable, and popular operating system. And it seems that its popularity is growing steadily, in a wide variety of flavors, from mainframes, data centers, core routers, and web servers to embedded devices like wireless routers, set-top boxes, medical instruments, navigation equipment (like GPS devices), and consumer electronics devices. Many semiconductor vendors use Linux as the basis for their Board Support Packages (BSPs). The Linux operating system, which started as a project of a Finnish student named Linus Torvalds back in 1991, based on the UNIX operating system, proved to be a serious and reliable operating system and a rival for veteran proprietary operating systems.\n\nLinux began as an Intel x86-based operating system but has been ported to a very wide range of processors, including ARM, PowerPC, MIPS, SPARC, and more. The Android operating system, based upon the Linux kernel, is common today in tablets and smartphones, and seems likely to gain popularity in the future in smart TVs. Apart from Android, Google has also contributed some kernel networking features that were merged into the mainline kernel.\n\nLinux is an open source project, and as such it has an advantage over other proprietary operating systems: its source code is freely available under the General Public License (GPL). Other open source operating systems, like the different types of BSD, have much less popularity. I should also mention in this context the OpenSolaris project, based on the Common Development and Distribution License (CDDL). This project, started by Sun Microsystems, has not achieved the popularity that Linux has. Among the large community of active Linux developers, some contribute code on behalf of the companies they work for, and some contribute code voluntarily. All of the kernel development process is accessible via the kernel mailing lists. There is one central mailing list, the Linux Kernel Mailing List (LKML), and many subsystems have their own mailing lists. Contributing code is done via sending patches to the appropriate kernel mailing lists and to the maintainers, and these patches are discussed over the mailing lists.\n\nThe Linux Kernel Networking stack is a very important subsystem of the Linux kernel. It is quite difficult to find a Linux-based system, whether it is a desktop, a server, a mobile device or any other embedded device, that does not use any kind of networking. Even in the rare case when a machine doesn't have any hardware network devices, you will still be using networking (maybe unconsciously) when you use X-Windows, as X-Windows itself is based upon client-server networking. A wide range of projects are related to the Linux Networking stack, from core routers to small embedded devices. Some of these projects deal with adding vendor-specific features. For example, some hardware vendors implement Generic Segmentation Offload (GSO) in some network devices. GSO is a networking feature of the kernel network stack that divides a large packet into smaller ones in the Tx path. Many hardware vendors implement checksumming in hardware in their network devices. Checksum is a mechanism to verify that a packet was not damaged on transit by calculating some hash from the packet and attaching it to the packet. Many projects provide some security enhancements for Linux. Sometimes these enhancements require some changes in the networking subsystem, as you will see, for example, in Chapter 3, when discussing the Openwall GNU/*/Linux project. In the embedded device arena there are, for example, many wireless routers that are Linux based; one example is the WRT54GL Linksys router, which runs Linux. There is also an open source, Linux-based operating system that can run on this device (and on some other devices), named OpenWrt, with a large and active community of developers (see  https://openwrt.org/ ). Learning about how the various protocols are implemented by the Linux Kernel Networking stack and becoming familiar with the main data structures and the main paths of a packet in it are essential to understanding it better.\n\n## The Linux Network Stack\n\n[Direct Result]: from the physical world collected via sensor networks. While previously large-scale data storage, processing, analysis, and modeling was the domain of the largest institutions such as Google, Yahoo!, Facebook, and Twitter, increasingly, many organizations are being faced with the challenge of how to handle a massive amount of data.\n\nWhen faced with this quantity of data and the common requirement to utilize it in real time, human-powered systems quickly become infeasible. This has led to a rise in the so-called big data and machine learning systems that learn from this data to make automated decisions.\n\nIn answer to the challenge of dealing with ever larger-scale data without any prohibitive cost, new open source technologies emerged at companies such as Google, Yahoo!, Amazon, and Facebook, which aimed at making it easier to handle massive data volumes by distributing data storage and computation across a cluster of computers.\n\nThe most widespread of these is Apache Hadoop, which made it significantly easier and cheaper to both store large amounts of data (via the Hadoop Distributed File System, or HDFS) and run computations on this data (via Hadoop MapReduce, a framework to perform computation tasks in parallel across many nodes in a computer cluster).\n\nHowever, MapReduce has some important shortcomings, including high overheads to launch each job and reliance on storing intermediate data and results of the computation to disk, both of which make Hadoop relatively ill-suited for use cases of an iterative or low-latency nature. Apache Spark is a new framework for distributed computing that is designed from the ground up to be optimized for low-latency tasks and to store intermediate data and results in memory, thus addressing some of the major drawbacks of the Hadoop framework. Spark provides a clean, functional, and easy-to-understand API to write applications and is fully compatible with the Hadoop ecosystem.\n\nFurthermore, Spark provides native APIs in Scala, Java, and Python. The Scala and Python APIs allow all the benefits of the Scala or Python language, respectively, to be used directly in Spark applications, including using the relevant interpreter for real-time, interactive exploration. Spark itself now provides a toolkit (called MLlib) of distributed machine learning and data mining models that is under heavy development and already contains high-quality, scalable, and efficient algorithms for many common machine learning tasks, some of which we will delve into in this book.\n\nApplying machine learning techniques to massive datasets is challenging, primarily because most well-known machine learning algorithms are not designed for parallel architectures. In many cases, designing such algorithms is not an easy task. The nature of machine learning models is generally iterative, hence the strong appeal of Spark for this use case. While there are many competing frameworks for parallel computing, Spark is one of the few that combines speed, scalability, in-memory processing, and fault tolerance with ease of programming and a flexible, expressive, and powerful API design.\n\nThroughout this book, we will focus on real-world applications of machine learning technology. While we may briefly delve into some theoretical aspects of machine learning algorithms, the book will generally take a practical, applied approach with a focus on using examples and code to illustrate how to effectively use the features of Spark and MLlib, as well as other well-known and freely available packages for machine learning and data analysis, to create a useful machine learning system.\n\n# What this book covers\n\nChapter 1, _Getting Up and Running with Spark_ , shows how to install and set up a local development environment for the Spark framework as well as how to create a Spark cluster in the cloud using Amazon EC2. The Spark programming model and API will be introduced, and a simple Spark application will be created using each of Scala, Java, and Python.\n\nChapter 2, _Designing a Machine Learning System_ , presents an example of a real-world use case for a machine learning system. We will design a high-level architecture for an intelligent system in Spark based on this illustrative use case.\n\nChapter 3, _Obtaining, Processing, and Preparing Data with Spark_ , details how to go about obtaining data for use in a machine learning system, in particular from various freely and publicly available sources. We will learn how to process, clean, and transform the raw data into features that may be used in machine learning models, using available tools, libraries, and Spark's functionality.\n\nChapter 4, _Building a Recommendation Engine with Spark_ , deals with creating a recommendation model based on the collaborative filtering approach. This model will be used to recommend items to a given user as well as create lists of items that are similar to a given item. Standard metrics to evaluate the performance of a recommendation model will be covered here.\n\nChapter 5, _Building a Classification Model with Spark_ , details how to create a model for binary classification as well as how to utilize standard performance-evaluation metrics for classification tasks.\n\nChapter 6, _Building a Regression Model with Spark_ , shows how to create a model for regression, extending the classification model created in Chapter 5, _Building a Classification Model with Spark_. Evaluation metrics for the performance of regression models will be detailed here.\n\nChapter 7, _Building a Clustering Model with Spark_ , explores how to create a clustering model as well as how to use related evaluation methodologies. You will learn how to analyze and visualize the clusters generated.\n\nChapter 8, _Dimensionality Reduction with Spark_ , takes us through methods to extract the underlying structure from and reduce the dimensionality of our data. You will learn some common dimensionality-reduction techniques and how to apply and analyze them, as well as how to use the resulting data representation as input to another machine learning model.\n\nChapter 9, _Advanced Text Processing with Spark_ , introduces approaches to deal with large-scale text data, including techniques for feature extraction from text and dealing with the very high-dimensional features typical in text data.\n\nChapter 10, _Real-time Machine Learning with Spark Streaming_ , provides an overview of Spark Streaming and how\n\n[Direct Result]: the book, and we will do our best to address it.\n\n# Chapter 1. Getting Up and Running with Spark\n\nApache Spark is a framework for distributed computing; this framework aims to make it simpler to write programs that run in parallel across many nodes in a cluster of computers. It tries to abstract the tasks of resource scheduling, job submission, execution, tracking, and communication between nodes, as well as the low-level operations that are inherent in parallel data processing. It also provides a higher level API to work with distributed data. In this way, it is similar to other distributed processing frameworks such as Apache Hadoop; however, the underlying architecture is somewhat different.\n\nSpark began as a research project at the University of California, Berkeley. The university was focused on the use case of distributed machine learning algorithms. Hence, it is designed from the ground up for high performance in applications of an iterative nature, where the same data is accessed multiple times. This performance is achieved primarily through caching datasets in memory, combined with low latency and overhead to launch parallel computation tasks. Together with other features such as fault tolerance, flexible distributed-memory data structures, and a powerful functional API, Spark has proved to be broadly useful for a wide range of large-scale data processing tasks, over and above machine learning and iterative analytics.\n\n### Note\n\nFor more background on Spark, including the research papers underlying Spark's development, see the project's history page at <http://spark.apache.org/community.html#history>.\n\nSpark runs in four modes:\n\n  * The standalone local mode, where all Spark processes are run within the same **Java Virtual Machine** ( **JVM** ) process\n  * The standalone cluster mode, using Spark's own built-in job-scheduling framework\n  * Using Mesos, a popular open source cluster-computing framework\n  * Using YARN (commonly referred to as NextGen MapReduce), a Hadoop-related cluster-computing and resource-scheduling framework\n\nIn this chapter, we will:\n\n  * Download the Spark binaries and set up a development environment that runs in Spark's standalone local mode. This environment will be used throughout the rest of the book to run the example code.\n  * Explore Spark's programming model and API using Spark's interactive console.\n  * Write our first Spark program in Scala, Java, and Python.\n  * Set up a Spark cluster using Amazon's **Elastic Cloud Compute** ( **EC2** ) platform, which can be used for large-sized data and heavier computational requirements, rather than running in the local mode.\n\n### Tip\n\nSpark can also be run on Amazon's Elastic MapReduce service using custom bootstrap action scripts, but this is beyond the scope of this book. The following article is a good reference guide: <http://aws.amazon.com/articles/Elastic-MapReduce/4926593393724923>.\n\nAt the time of writing this book, the article covers running Spark Version 1.1.0.\n\nIf you have previous experience in setting up Spark and are familiar with the basics of writing a Spark program, feel free to skip this chapter.\n\n# Installing and setting up Spark locally\n\nSpark can be run using the built-in standalone cluster scheduler in the local mode. This means that all the Spark processes are run within the same JVM--effectively, a single, multithreaded instance of Spark. The local mode is very useful for prototyping, development, debugging, and testing. However, this mode can also be useful in real-world scenarios to perform parallel computation across multiple cores on a single computer.\n\nAs Spark's local mode is fully compatible with the cluster mode, programs written and tested locally can be run on a cluster with just a few additional steps.\n\nThe first step in setting up Spark locally is to download the latest version (at the time of writing this book, the version is 1.2.0). The download page of the Spark project website, found at <http://spark.apache.org/downloads.html>, contains links to download various versions as well as to obtain the latest source code via GitHub.\n\n### Tip\n\nThe Spark project documentation website at <http://spark.apache.org/docs/latest/> is a comprehensive resource to learn more about Spark. We highly recommend that you explore it!\n\nSpark needs to be built against a specific version of Hadoop in order to access **Hadoop Distributed File System** ( **HDFS** ) as well as standard and custom Hadoop input sources. The download page provides prebuilt binary packages for Hadoop 1, CDH4 (Cloudera's Hadoop Distribution), MapR's Hadoop distribution, and Hadoop 2 (YARN). Unless you wish to build Spark against a specific Hadoop version, we recommend that you download the prebuilt Hadoop 2.4 package from an Apache mirror using this link: <http://www.apache.org/dyn/closer.cgi/spark/spark-1.2.0/spark-1.2.0-bin-hadoop2.4.tgz>.\n\nSpark requires the Scala programming language (version 2.10.4 at the time of writing this book) in order to run. Fortunately, the prebuilt binary package comes with the Scala runtime packages included, so you don't need to install Scala separately in order to get started. However, you will need to have a **Java Runtime Environment** ( **JRE** ) or **Java Development Kit** ( **JDK** ) installed (see the software and hardware list in this book's code bundle for installation instructions).\n\nOnce you have downloaded the Spark binary package, unpack the contents of the package and change into the newly created directory by running the following commands:\n\n    **> tar xfvz spark-1.2.0-bin-hadoop2.4.tgz**\n    **> cd spark-1.2.0-bin-hadoop2.4**\n\nSpark places user scripts to run Spark in the `bin` directory"
      ],
      "latency_s": 11.98,
      "rag_type": "literag",
      "dominio": "LiteRAG_Multihop_01",
      "titulo": "",
      "error": ""
    },
    {
      "question": "The regular expressions book and the SQL book both provide pattern-matching capabilities. What SQL operator uses a simplified form of pattern matching analogous to regular expressions?",
      "ground_truth": "LIKE operator",
      "answer": "This document does not contain information about SQL operators that use a simplified form of pattern matching analogous to regular expressions.",
      "contexts": [
        "## Direct Evidence (Source Text)\n[Direct Result]: that is, the prefix in the group is not required.\n\n  * `\\d` matches a digit.\n\n  * `{3}` matches exactly three digits.\n\n  * `[.-]?` matches another optional dot or hyphen.\n\n  * `\\d` matches a digit.\n\n  * `{4}` matches exactly four digits.\n\n  * `$` matches the end of a line.\n\nThis final regular expression matches a 10-digit, North American telephone number, with or without parentheses, hyphens, or dots. Try different forms of the number to see what will match (and what won't).\n\n### Note\n\nThe capturing group in the above regular expression is not necessary. The group is necessary, but the capturing part is not. There is a better way to do this: a non-capturing group. When we revisit this regular expression in the last chapter of the book, you'll understand why.\n\n# A Sample of Applications\n\nTo conclude this chapter, I'll show you the regular expression for a phone number in several applications.\n\nTextMate is an editor that is available only on the Mac and uses the same regular expression library as the Ruby programming language. You can use regular expressions through the Find (search) feature, as shown in Figure 1-3. Check the box next to _Regular expression_.\n\nFigure 1-3. Phone number regex in TextMate\n\nNotepad++ is available on Windows and is a popular, free editor that uses the PCRE regular expression library. You can access them through search and replace (Figure 1-4) by clicking the radio button next to _Regular expression_.\n\nFigure 1-4. Phone number regex in Notepad++\n\nOxygen is also a popular and powerful XML editor that uses Perl 5 regular expression syntax. You can access regular expressions through the search and replace dialog, as shown in Figure 1-5, or through its regular expression builder for XML Schema. To use regular expressions with Find/Replace, check the box next to _Regular expression_.\n\nFigure 1-5. Phone number regex in Oxygen\n\nThis is where the introduction ends. Congratulations. You've covered a lot of ground in this chapter. In the next chapter, we'll focus on simple pattern matching.\n\n# What You Learned in Chapter 1\n\n  * What a regular expression is\n\n  * How to use Regexpal, a simple regular expression processor\n\n  * How to match string literals\n\n  * How to match digits with a character class\n\n  * How to match a digit with a character shorthand\n\n  * How to match a non-digit with a character shorthand\n\n  * How to use a capturing group and a backreference\n\n  * How to match an exact quantity of a set of strings\n\n  * How to match a character optionally (zero or one) or one or more times\n\n  * How to match strings at either the beginning or the end of a line\n\n# Technical Notes\n\n  * Regexpal (<http://www.regexpal.com>) is a web-based, JavaScript-powered regex implementation. It's not the most complete implementation, and it doesn't do everything that regular expressions can do; however, it's a clean, simple, and very easy-to-use learning tool, and it provides plenty of features for you to get started.\n\n  * You can download the Chrome browser from <https://www.google.com/chrome> or Firefox from <http://www.mozilla.org/en-US/firefox/new/>.\n\n  * Why are there so many ways of doing things with regular expressions? One reason is because regular expressions have a wonderful quality called _composability_. A language, whether a formal, programming or schema language, that has the quality of _composability_ (James Clark explains it well at <http://www.thaiopensource.com/relaxng/design.html#section:5>) is one that lets you take its atomic parts and composition methods and then recombine them easily in different ways. Once you learn the different parts of regular expressions, you will take off in your ability to match strings of any kind.\n\n  * TextMate is available at <http://www.macromates.com>. For more information on regular expressions in TextMate, see <http://manual.macromates.com/en/regular_expressions>.\n\n  * For more information on Notepad, see <http://notepad-plus-plus.org>. For documentation on using regular expressions with Notepad, see <http://sourceforge.net/apps/mediawiki/notepad-plus/index.php?title=Regular_Expressions>.\n\n  * Find out more about Oxygen at <http://www.oxygenxml.com>. For information on using regex through find and replace, see <http://www.oxygenxml.com/doc/ug-editor/topics/find-replace-dialog.html>. For information on using its regular expression builder for XML Schema, see <http://www.oxygenxml.com/doc/ug-editor/topics/XML-schema-regexp-builder.html>.\n\n# Chapter 2. Simple Pattern Matching\n\nRegular expressions are all about matching and finding patterns in text, from simple patterns to the very complex. This chapter takes you on a tour of some of the simpler ways to match patterns using:\n\n  * String literals\n\n  * Digits\n\n  * Letters\n\n  * Characters of any kind\n\nIn the first chapter, we used Steven Levithan's RegexPal to demonstrate regular expressions. In this chapter, we'll use Grant Skinner's RegExr site, found at <http://gskinner.com/regexr> (see Figure 2-1).\n\n### Note\n\nEach page of this book will take you deeper into the regular expression jungle. Feel free, however, to stop and smell the syntax. What I mean is, start trying out new things as soon as you discover them. Try. Fail fast. Get a grip. Move on. Nothing makes learning sink in like _doing_ something with it.\n\nFigure 2-\n\n[Direct Result]: )\n\nThis book has a web page listing errata, examples, and any additional information. You can access this page at:\n\n<http://orei.ly/intro_regex>  \n---\n\nTo comment or to ask technical questions about this book, send email to:\n\nbookquestions@oreilly.com  \n---\n\nFor more information about O'Reilly books, courses, conferences, and news, see its website at <http://www.oreilly.com>.\n\nFind O'Reilly on Facebook: <http://facebook.com/oreilly>\n\nFollow O'Reilly on Twitter: <http://twitter.com/oreillymedia>\n\nWatch O'Reilly on YouTube: <http://www.youtube.com/oreillymedia>\n\n# Acknowledgments\n\nOnce again, I want to express appreciation to my editor at O'Reilly, Simon St. Laurent, a very patient man without whom this book would never have seen the light of day. Thank you to Seara Patterson Coburn and Roger Zauner for your helpful reviews. And, as always, I want to recognize the love of my life, Cristi, who is my _raison d'être_.\n\n# Chapter 1. What Is a Regular Expression?\n\nRegular expressions are specially encoded text strings used as patterns for matching sets of strings. They began to emerge in the 1940s as a way to describe regular languages, but they really began to show up in the programming world during the 1970s. The first place I could find them showing up was in the QED text editor written by Ken Thompson.\n\n> \"A regular expression is a pattern which specifies a set of strings of characters; it is said to match certain strings.\" —Ken Thompson\n\nRegular expressions later became an important part of the tool suite that emerged from the Unix operating system—the _ed_ , _sed_ and _vi_ ( _vim_ ) editors, _grep_ , _AWK_ , among others. But the ways in which regular expressions were implemented were not always so regular.\n\n### Note\n\nThis book takes an inductive approach; in other words, it moves from the specific to the general. So rather than an example after a treatise, you will often get the example first and then a short treatise following that. It's a learn-by-doing book.\n\nRegular expressions have a reputation for being gnarly, but that all depends on how you approach them. There is a natural progression from something as simple as this:\n\n    \\d\n\na _character shorthand_ that matches any digit from 0 to 9, to something a bit more complicated, like:\n\n    ^(\\(\\d{3}\\)|^\\d{3}[.-]?)?\\d{3}[.-]?\\d{4}$\n\nwhich is where we'll wind up at the end of this chapter: a fairly robust regular expression that matches a 10-digit, North American telephone number, with or without parentheses around the area code, or with or without hyphens or dots (periods) to separate the numbers. (The parentheses must be balanced, too; in other words, you can't just have one.)\n\n### Note\n\nChapter 10 shows you a slightly more sophisticated regular expression for a phone number, but the one above is sufficient for the purposes of this chapter.\n\nIf you don't get how that all works yet, don't worry: I'll explain the whole expression a little at a time in this chapter. If you will just follow the examples (and those throughout the book, for that matter), writing regular expressions will soon become second nature to you. Ready to find out for yourself?\n\nI at times represent Unicode characters in this book using their code point—a four-digit, hexadecimal (base 16) number. These code points are shown in the form _U+0000_. U+002E, for example, represents the code point for a full stop or period (.).\n\n# Getting Started with Regexpal\n\nFirst let me introduce you to the Regexpal website at <http://www.regexpal.com>. Open the site up in a browser, such as Google Chrome or Mozilla Firefox. You can see what the site looks like in Figure 1-1.\n\nFigure 1-1. Regexpal in the Google Chrome browser\n\nYou can see that there is a text area near the top, and a larger text area below that. The top text box is for entering regular expressions, and the bottom one holds the subject or target text. The target text is the text or set of strings that you want to match.\n\n### Note\n\nAt the end of this chapter and each following chapter, you'll find a \"Technical Notes\" section. These notes provide additional information about the technology discussed in the chapter and tell you where to get more information about that technology. Placing these notes at the end of the chapters helps keep the flow of the main text moving forward rather than stopping to discuss each detail along the way.\n\n# Matching a North American Phone Number\n\nNow we'll match a North American phone number with a regular expression. Type the phone number shown here into the lower section of Regexpal:\n\n    707-827-7019\n\nDo you recognize it? It's the number for O'Reilly Media.\n\nLet's match that number with a regular expression. There are lots of ways to do this, but to start out, simply enter the number itself in the upper section, exactly as it is written in the lower section (hold on now, don't sigh):\n\n    707-827-7019\n\nWhat you should see is the phone number you entered in the lower box highlighted from beginning to end in yellow. If that is what you see (as shown in Figure 1-2), then you are in business.\n\n### Note\n\nWhen I mention colors in this book, in relation to something you might see in an image or a screenshot, such as the highlighting in Reg\n\n[Direct Result]: C and was written specifically to support Ruby. You can try out Ruby's regular expression using Rubular, an online app that supports both 1.8.7 and 1.9.2 (see <http://www.rubular.com> and Figure 10-1). TextMate, by the way, uses the Oniguruma library.\n\nFigure 10-1. Phone number regex in Rubular\n\n## Python\n\nPython is a general-purpose programming language that supports regular expressions (see <http://www.python.org>). It was first created by Guido van Rossum in 1991. You can read about Python 3's regular expression syntax here: <http://docs.python.org/py3k/library/re.html?highlight=regular%20expressions>.\n\n## RE2\n\nRE2 is a non-backtracking C++ regular expression library (see <http://code.google.com/p/re2>). While RE2 is quite fast, it does not do backtracking or backreferences. It is available as a CPAN package for Perl and can fall back on Perl's native library if backreferences are needed. For instructions on making API calls, see <http://code.google.com/p/re2/wiki/CplusplusAPI>. For an interesting discussion on RE2, see \"Regular Expression Matching in the Wild\" at <http://swtch.com/~rsc/regexp/regexp3.html>.\n\n# Matching a North American Phone Number\n\nYou remember the North American phone number example from the first chapter? You've come a long way since then.\n\nHere is a more robust regular expression for matching phone numbers than the one we used there. It is adapted from Goyvaerts and Levithan's example on page 235 of their _Regular Expressions Cookbook_ (first edition).\n\n    ^\\(?(?:\\d{3})\\)?[-.]?(?:\\d{3})[-.]?(?:\\d{4})$\n\nPlay with it with the tool of your choice (see it in Reggy in Figure 10-2). By now, you should be able to pick this regex apart with hardly any hand-holding. I'm proud of you for that. But I'll go over it for good measure.\n\n  * `^` is the zero-width assertion for the beginning of a line or subject.\n\n  * `\\(?` is a literal left parenthesis, but it is optional (`?`).\n\n  * `(?:\\d{3})` is a non-capturing group matching three consecutive digits.\n\n  * `\\)?` is an optional right parenthesis.\n\n  * `[-.]?` allows for an optional hyphen or period (dot).\n\n  * `(?:\\d{3})` is another non-capturing group matching three more consecutive digits.\n\n  * `[-.]?` allows for an optional hyphen or dot again.\n\n  * `(?:\\d{4})` is yet another non-capturing group matching exactly four consecutive digits.\n\n  * `$` matches the end of a line or subject.\n\nThis expression could be even more refined, but I leave that to you because you can now do it on your own.\n\nFigure 10-2. Phone number regex in Reggy\n\n# Matching an Email Address\n\nLastly, I'll throw one more regular expression at you, an email address:\n\n    ^([\\w-.!#$%&'*+-/=?^_`{|}~]+)@((?:\\w+\\.)+)(?:[a-zA-Z]{2,4})$\n\nThis is an adaptation of one provided by Grant Skinner with RegExr. I'd like to challenge you to do your best to explain what each character means in the context of a regular expression, and to see if you can improve on it. I am sure you can.\n\nThank you for your time. I've enjoyed spending it with you. You should now have a good grasp of the fundamental concepts of regular expressions. You are no longer a member of the beginners' club. I hope you've made friends with regular expressions and learned something worthwhile along the way.\n\n# What You Learned in Chapter 10\n\n  * How to extract a list of XML elements from a document and convert the list into an XSLT stylesheet.\n\n  * Where to find additional resources for learning about regular expressions.\n\n  * What are some notable regex tools, implementations, and libraries.\n\n  * A slightly, more robust pattern for matching a North American phone number.\n\n# Appendix A. Regular Expression Reference\n\nThis appendix is a reference for regular expressions.\n\n# Regular Expressions in QED\n\nQED (short for Quick Editor) was originally written for the Berkeley Time-Sharing System, which ran on the Scientific Data Systems SDS 940. A rewrite of the original QED editor by Ken Thompson for MIT's Compatible Time-Sharing System yielded one of the earliest (if not the first) practical implementation of regular expressions in computing. Table A-1, taken from pages 3 and 4 of a 1970 Bell Labs memo, outlines the regex features in QED. It amazes me that most of this syntax has remained in use to this day, over 40 years later.\n\nTable A-1. QED regular expressions\n\nFeature| Description  \n---|---\n\n_literal_ | \"a) An ordinary character [literal] is a regular expression which matches that character.\"\n\n^ | \"b) _^_ is a regular expression which matches the null character at the beginning of a line.\"\n\n$ | \"c) _$_ is a regular expression which matches the null character before the character <nl> [newline] (usually at the end of a line).\"\n\n. | \"d) _._ is a regular expression which matches any character except <nl> [newline].\"\n\n[<string>] | \"e) \"[<string>]\" is a regular expression which matches any of the characters in the <"
      ],
      "latency_s": 7.29,
      "rag_type": "literag",
      "dominio": "LiteRAG_Multihop_01",
      "titulo": "",
      "error": ""
    },
    {
      "question": "The Java book covers object-oriented inheritance and the VBA book covers object models. What object in the Excel object model, described in the VBA book, would a Java developer recognize as equivalent to the root object in a class hierarchy?",
      "ground_truth": "The Application object, equivalent to a root superclass",
      "answer": "In the Excel object model, the **Application object** would be recognized by a Java developer as equivalent to the root object in a class hierarchy. This is because the Application object represents the Excel application as a whole and essentially contains all other objects within the Excel environment, much like a root object in a class hierarchy encapsulates or is the ultimate ancestor of other objects.",
      "contexts": [
        "## Direct Evidence (Source Text)\n[Direct Result]: at the ways OOP is employed in team programming at the end of this chapter.\n\nObjects can—and frequently do—contain other objects. Typically, the objects in an object-oriented application are arranged into a hierarchy called the _object model_ of the application. This hierarchy is intended to make it easier to figure out where—within a large library of objects—you'll find a particular object that you want to use in your macros. It's similar to the way a biography is likely to be found in the library's nonfiction area.\n\n* * *\n\nObject Models Covered in Depth Later in the Book\n\nThis chapter discusses object models only a little, at the conceptual level: You need to know what an object model is in order to make sense of what you'll be learning in the following chapters, but you don't need to know the specifics of each object model to manipulate the objects used in the examples. Part 5 of this book, \"Creating Effective Code,\" examines the object models of each of the applications covered in this book in enough detail to get you started on exploring the depths of each object model on your own.\n\n* * *\n\nMost VBA host applications, including all the major Office applications, have an Application object that represents the application as a whole. The Application object has properties and methods for things that apply to the application as a whole. For example, many applications have a Quit method that exits the application and a Visible property that controls whether the application is visible or hidden.\n\nIn a typical object model, the Application object essentially contains all the other objects (and collections—groups—of objects) that make up the application. For example, Excel has an Application object that represents the Excel application, a Workbook object (grouped into the Workbooks collection) that represents a workbook, and a Worksheet object (grouped into the Sheets collection) that represents a worksheet. The Workbook object is contained within the Application object because you normally need to have the Excel application open to work with an Excel workbook.\n\nIn turn, the Worksheet object is contained within the Workbook object because you need to have an Excel workbook open to use a worksheet. Walking further down the object model, the Worksheet object contains assorted other objects, including Row objects that represent the individual rows in the worksheet, Column objects that represent columns in the worksheet, and Range objects (which represent ranges of cells). And these objects in turn contain further objects.\n\nTo get to an object, you typically walk down through the hierarchy of the object model until you reach the object you're looking for.\n\nTo get to a Range object in Excel, for example, you would go through the Application object to the Workbook object, through the Workbook object to the appropriate Sheet object, and then finally to the Range object. The following statement shows how to select the range A1 in the first worksheet in the first open workbook (more on this in a minute):\n\n    Application.Workbooks(1).Sheets(1).Range(\"A1\").Select\n\n## Understanding Creatable Objects\n\nThe Application object, however, is optional and is usually left out of code lines. Why? Because you'd have to go through the Application object to get to pretty much _anything_ in the application, most applications _expose_ (make available to you) a number of _creatable_ objects. Creatable merely means that you can access something without having to type the word Application in your code. It's assumed. This is similar to the fact that you don't have to include the word _Earth_ when addressing an envelope. There's only that one possibility.\n\nThese creatable objects are usually the most-used objects for the application, and by going through them, you can access most of the other objects without having to refer to the Application object. For example, Excel exposes the Workbooks collection as a creatable object, so you can use the following statement, which doesn't require that you type in Application. See the alternative example a couple of paragraphs earlier in this chapter.\n\n    Workbooks(1).Sheets(1).Range(\"A1\").Select\n\nAny object can have properties and methods. The next sections discuss these items in detail.\n\n## Properties\n\nIn VBA, a _property_ is an attribute or characteristic of an object. Most objects have multiple properties that specify each aspect of it.\n\nEach property has a specific data type for the information it stores. For example, the objects that represent files (such as documents, workbooks, or presentations) typically have a Boolean property named Saved that stores a value denoting whether all changes in the object have been saved (a value of True) or not (a value of False). These two values encompass the entire range of possibilities for the object: it can either contain unsaved changes or not contain unsaved changes. There is no third state. And a Boolean data type is used because that type has only two possible values.\n\nSimilarly, most objects that represent files have a Name property that contains the name of the file in question. The Name property contains a String data type because it needs to contain text. And that text can be just about anything, limited only by the 255-character path that Windows permits for files and by certain characters—such as colons and pipe (|) characters—that Windows forbids in filenames.\n\nTo work with a property, you _get_ (fetch or return) it to find out its current value or _set_ (change) it to a value of your choosing. Many properties are _read/write_ , meaning that you can both _get_ and _set_ their values, but some properties are _read-only_ , meaning that you can view their values but not change them.\n\nThe Saved property is read/write for most applications, so you can set it. This means that you can tell the application that a file contains unsaved changes when it really doesn't or that it contains no unsaved changes when it actually has some. (Changing\n\n[Direct Result]: In other words, you want to remove the web-page table definitions but leave the data in a usable format within Word.\n\nThe following macro does just that:\n\n    Sub Untable()\n\n    On Error Resume Next\n\n       Selection.Rows.ConvertToText Separator:=wdSeparateByCommas, NestedTables:= _\n         True\n       Selection.MoveDown Unit:=wdLine, Count:=1\n\n    If Err Then MsgBox \"No table was detected, dude.\"\n\n    End Sub\n\nTo use this macro, click somewhere within the text you've pasted from the Internet to put the insertion cursor in a table (or a suspected table; they often don't look like tables, merely like an area of bizarre formatting), then execute the macro. You may need to execute this macro more than once to completely eliminate all the tabular formatting debris left over from the original HTML. The macro tells you when all table structures have been destroyed, and not only that—it calls you \"dude.\"\n\n# The Bottom Line\n\n**Use Find and Replace via VBA.**\n\nWord's Find and Replace utilities are frequently valuable to the VBA programmer. You'll want to master them and also some subtleties associated with their use.\n\nMaster It\n\nSometimes when replacing, you need to go through a document more than once—using a loop structure. Why would you ever need to repeatedly search and replace the same document? Doesn't the Replace All setting in fact _replace all_?\n\n**Work with headers, footers, and page numbers.**\n\nAll Word documents contain headers and footers, even if they are empty. In addition, you can insert various types of headers and footers.\n\nMaster It\n\nName two types of headers you can use in a Word document.\n\n**Manage sections, page setup, windows, and views.**\n\nAmong the various ways you can view a document, you sometimes want to have the document automatically scroll to a particular table, graphic, or other target.\n\nMaster It\n\nWhat method of the Window object can be used to easily accomplish this task?\n\n**Manipulate tables.**\n\nWhen you need to manage tables in Word documents, you can employ VBA to work with the Table object to represent a single table. If there is more than one table, they are referenced by a collection of Table objects.\n\nMaster It\n\nName two important and useful objects within the Tables collection or the Table object.\nChapter 22\n\nUnderstanding the Excel Object Model and Key Objects\n\nThis chapter shows you how to start working with the Excel object model, the architecture underlying Excel. It also shows you how to perform common actions with the most immediately useful Excel objects. These objects include the Workbooks collection and the Workbook object, the ActiveCell object, and Range objects. You'll also see how to set options in Excel.\n\nIn this chapter you will learn to do the following:\n\n  * Work with workbooks\n  * Work with worksheets\n  * Work with the active cell or selection\n  * Work with ranges\n  * Set options\n\n# Getting an Overview of the Excel Object Model\n\nAs with the other Office applications, it's not necessary (or even possible for most people) to understand how the entire Excel object model fits together in order to work with VBA in Excel, but most people find that knowing the main objects in the object model is helpful. And often the code examples in the Help system's object-model reference are invaluable—showing you how and where to employ objects in your own programming.\n\nTo see the Excel object-model reference, follow these steps:\n\n1. Launch or activate Excel, and then press Alt+F11 to launch or activate the VBA Editor.\n\n2. Move your cursor to a blank space in the code window (to avoid context-sensitive help).\n\n3. Press F1 in the Editor to launch the web page for the VBA language reference for Office 2013.\n\n4. In the Bing search field, type **excel 2013 object model** and press Enter.\n\n5. Click the link _Object Model Reference_ ( _Excel 2013 Developer Reference_ ). You'll now have access to the whole collection of syntax specifications, useful descriptions, and code examples, as shown in Figure 22.1.\n\nFigure 22.1 The entries in the Excel object model reference will help you write your own VBA code.\n\n* * *\n\nHelp When Migrating Legacy Code from Earlier Office Projects\n\nIf you've inherited VBA code written in earlier versions of Office, those procedures might contain objects, methods, and properties that have been changed in Office 2013. Though modifications to object models are generally few, some incompatibilities can crop up and \"break\" the code so it won't run correctly. Fortunately, you can download a free utility, the Office Code Compatibility Inspector, that will flag objects and their members that have changed. It does a text comparison of the Office 2013 object model against VBA code written in earlier versions of Office. You can download the Compatibility Inspector from this web page:\n\nwww.microsoft.com/en-us/download/details.aspx?id=15001\n\n* * *\n\n# Understanding Excel's Creatable Objects\n\nExcel _exposes_ (makes available for your use in code) various _creatable_ objects, meaning that you can employ most of the important objects in its object model without explicitly going through (mentioning) the Application object. For most programming purposes, these creatable objects are the most commonly used objects. Here's a list:\n\n  * The Workbooks collection contains the Workbook objects that represent all the open workbooks. Within a workbook, the Sheets collection contains the Worksheet objects that represent the worksheets and the Chart objects that represent chart sheets. On a sheet, the Range object gives you access to ranges, which can be anything from an individual cell to a complete worksheet. Remember that, because the workbooks object is creatable, you need not write Application.Workbooks in your code. You can leave off the\n\n[Direct Result]: saved with the document or template that contains it and can be accessed at any time (whether or not a procedure is running).\n\n**Manipulate options**\n\nWord contains many options that can be manipulated from within VBA.\n\n**Master It**\n\nIn Word, one object controls many of the options. This object has dozens of properties but no methods. Name this object.\n\n**Solution**\n\nThe Options object controls many of the options in Word.\n\n# Chapter 21: Working with Widely Used Objects in Word\n\n**Use Find and Replace via VBA.**\n\nWord's Find and Replace utilities are frequently valuable to the VBA programmer. You'll want to master them and also some subtleties associated with their use.\n\n**Master It**\n\nSometimes when replacing, you need to go through a document more than once—using a loop structure. Why would you ever need to repeatedly search and replace the same document? Doesn't the Replace All setting in fact _replace all_?\n\n**Solution**\n\nIn some situations, the act of replacing actually generates new instances of the target of the replacement activity. Let's say you want only single-space strings in a document. (For example, you want sentences separated by only a single space character, but sometimes a typist accidentally presses two or more spaces.) You set up a search and replace that looks for double-space character strings and replaces them with single-space characters. You have to take into account that there can also be some multiple-space-character strings. Consider a string of six adjacent space characters. During the first pass, your double-to-single search and replace reduces the six-space string to a three-space string (three instances of double spaces would reduce to three instances of single spaces). The second pass through a loop would reduce it to a two-space string, requiring yet a third pass through the loop to achieve the desired single space. This same situation can apply to multiple-paragraph spacing (multiple blank lines) and tabs.\n\n**Work with headers, footers, and page numbers.**\n\nAll Word documents contain headers and footers, even if they are empty. In addition, you can insert various types of headers and footers.\n\n**Master It**\n\nName two types of headers you can use in a Word document.\n\n**Solution**\n\nHere are the major types of Word headers: the primary header, different first-page headers, different even-page headers, and different sets of headers for each of the sections in the document.\n\n**Manage sections, page setup, windows, and views.**\n\nAmong the various ways you can view a document, you sometimes want to have the document automatically scroll to a particular table, graphic, or other target.\n\n**Master It**\n\nWhat method of the Window object can be used to easily accomplish this task?\n\n**Solution**\n\nThe ScrollIntoView method of the Window object moves the view to a target you specify.\n\n**Manipulate tables.**\n\nWhen you need to manage tables in Word documents, you can employ VBA to work with the Table object to represent a single table. If there is more than one table, they are referenced by a collection of Table objects.\n\n**Master It**\n\nName two important and useful objects within the Tables collection or the Table object.\n\n**Solution**\n\nSome of the most useful objects within a Table object or a Tables collection are as follows:\n\nThe Rows collection contains the rows in the table. Each row is represented by a Row object.\n\nThe Columns collection contains the columns in the table. Each column is represented by a Column object.\n\nThe Cell object provides access to a specified cell directly from the Table object. You can also reach the cells in the table by going through the row or column in which they reside.\n\nThe Range object provides access to ranges within the table.\n\nThe Borders collection contains all the borders for the table.\n\nThe Shading object contains all the shading for the table.\n\n# Chapter 22: Understanding the Excel Object Model and Key Objects\n\n**Work with workbooks.**\n\nYou often need to create a new, blank workbook in a macro (mimicking a user clicking the File tab on the Ribbon, then clicking the New button). And writing code that accomplishes this is not difficult. It requires only two words.\n\n**Master It**\n\nWhat code would you write to create a new, blank notebook?\n\n**Solution**\n\nTo create a blank workbook, omit the Template argument, like this:\n\n     Workbooks.Add\n\n**Work with worksheets.**\n\nMost workbooks you access via VBA will contain one or more worksheets, so most procedures will need to work with worksheets—inserting, deleting, copying, or moving them, or simply printing the appropriate range from them.\n\n**Master It**\n\nName the object you use in VBA code to represent a worksheet.\n\n**Solution**\n\nEach worksheet is represented by a Sheet object. The Sheet objects are contained within the Sheets collection.\n\n**Work with the active cell or selection.**\n\nIn a procedure that manipulates a selection that the user has made, you'll typically work with either the active cell or the current selection.\n\n**Master It**\n\nWhat is the difference between the active cell and a selection?\n\n**Solution**\n\nThe active cell is always a single cell, but the selection can either be a single cell or encompass multiple cells or other objects.\n\n**Work with ranges.**\n\nWithin a worksheet, you'll often need to manipulate ranges of cells. Excel includes a special kind of range—represented by the UsedRange property.\n\n**Master It**\n\nWhat is unique about UsedRange?\n\n**Solution**\n\nIf you need to work with all the cells on a worksheet (but not with any unoccupied areas of the worksheet), use the UsedRange property. UsedRange ignores empty areas of a worksheet.\n\n**Set options.**\n\nWord employs an Options object to contain most of the options that you find in the Word Options dialog box (click the File tab on the Ribbon, then click Options). Excel uses a different object to contain its options.\n\n**Master It**\n\nFrom which object do you access\n\n## Entity Definitions\n**EXCEL OBJECT MODEL**: The EXCEL OBJECT MODEL is the underlying architecture of Microsoft Excel, providing a hierarchical structure that represents all the elements within the application. This structure allows users to programmatically access and manipulate various Excel components using Visual Basic for Applications (VBA). Essentially, it defines the relationships between different objects in Excel, such as workbooks, worksheets, cells, charts, and more, enabling developers to automate tasks, customize functionality, and build sophisticated Excel-based solutions.\n\n## Community Context\n\n**Community 13**: The community is centered around Visual Basic for Applications (VBA) and its extensive integration with Microsoft Office applications, particularly Word and Outlook. VBA serves as a powerful tool for automating tasks, customizing functionalities, and developing custom applications within these environments. The relationships highlight how VBA is used to enhance productivity, manage data, and create user interfaces, with specific mentions of its role in handling dialog boxes, ribbons, and properties. The presence of entities like 'Richard Mansfield' and the book 'Mastering VBA for Microsoft Office 2013' indicates a focus on learning and mastering VBA. The broader ecosystem includes related programming concepts and functions that are utilized within VBA."
      ],
      "latency_s": 15.55,
      "rag_type": "literag",
      "dominio": "LiteRAG_Multihop_01",
      "titulo": "",
      "error": ""
    },
    {
      "question": "The optimization book uses the R function optim() and the Spark book uses MLlib. If a data scientist wanted to implement Simulated Annealing from the R book as a Spark job, which Spark abstraction would be most appropriate for distributing candidate solution evaluations?",
      "ground_truth": "RDD or DataFrame with parallel map transformations",
      "answer": "To distribute candidate solution evaluations for Simulated Annealing as a Spark job, the most appropriate Spark abstraction would be **Resilient Distributed Datasets (RDDs)**.\n\nHere's why:\n\n*   **Parallel Evaluation:** Simulated Annealing involves generating multiple candidate solutions and evaluating them. RDDs are designed for parallel processing of data across a cluster. Each candidate solution's evaluation can be performed independently on different nodes in the Spark cluster.\n*   **Transformation and Action:** RDDs support transformations (like `map` to apply an evaluation function to each candidate solution) and actions (like `collect` to gather the results). This aligns well with the iterative nature of Simulated Annealing where evaluations are performed, and the best solutions are selected.\n*   **Flexibility:** RDDs are a fundamental abstraction in Spark and can be used to represent various types of data, including the candidate solutions and their evaluation metrics.\n\nWhile other Spark abstractions like DataFrames and Datasets offer higher-level APIs and optimizations, RDDs provide the foundational, flexible mechanism for distributing arbitrary computations, which is suitable for the evaluation step of an algorithm like Simulated Annealing.",
      "contexts": [
        "## Direct Evidence (Source Text)\n[Direct Result]: :\n\n  * meanint (from package rminer )—computes the mean and t-student confidence intervals;\n\n  * segments —draws a segment;\n\n  * par —sets graphical parameters used by plot; and\n\n  * lines —joints points into line segments.\n\nThe result execution of file compare.R is presented in Fig. 4.4. Initially, all methods present a fast and similar convergence. However, after around 1,000 evaluations, the hill climbing and simulated annealing methods start to outperform the random search (Monte Carlo). The confidence interval bars show that after around 4,000 evaluations, the local search methods are statistically better when compared with Monte Carlo. In this experiment, simulated annealing produces only a slight best average result and the differences are not statistically significant when compared with hill climbing (since confidence intervals overlap).\n\nFig. 4.4\n\nLocal search comparison example for the rastrigin task (D = 20)\n\n## 4.6 Command Summary\n\nceiling() | returns the closest upper integer\n\n---|---\n\nhchange() | slight random change of a vector (chapter file \"hill.R\")\n\nhclimbing() | standard hill climbing search (chapter file \"hill.R\")\n\nifelse() | conditional element selection\n\nlines() | joints points into line segments\n\nmeanint | computes the mean and t-student confidence intervals (package rminer)\n\noptim() | general-purpose optimization (includes simulated annealing)\n\npar() | set or query graphical parameters used by plot()\n\nrminer | package for simpler use of data mining (classification and regression) methods\n\nsegments | draws a segment line\n\ntabuSearch | package for tabu search\n\ntabuSearch() | tabu search for binary string maximization (package tabuSearch)\n\n## 4.7 Exercises\n\n4.1.\n\nAdapt the function hclimbing function to accept an additional control parameter (N). When N = 0, the function should execute the standard hill climbing, while when N > 0, the function should implement the steepest ascent hill climbing method. This last variant works by searching first N neighbor solutions within each iteration, in order to select the best new solution to be compared with current search point.\n\n4.2.\n\nExplore the optimization of the binary max sin task with a higher dimension (D = 16), under hill climbing, simulated annealing, and tabu search methods. Use the zero vector as the starting point and a maximum of 20 iterations. Show the optimized solutions and evaluation values.\n\n4.3.\n\nExecute the optimization of the rastrigin function (D = 8) with the tabuSearch function. Adopt a binary representation such that each dimension value is encoded into 8 bits, denoting any of the 256 regular levels within the range [−5. 2, 5. 2]. Use the control parameters: maxit = 500, N = 8, L = 8 and nRestarts=1 and a randomly generated initial point.\n\nReferences\n\nBélisle CJ (1992) Convergence theorems for a class of simulated annealing algorithms on R d. J Appl Probab 29:885–895CrossRefMATHMathSciNet\n\nBrownlee J (2011) Clever algorithms: nature-inspired programming recipes, Lulu\n\nGlover F (1986) Future paths for integer programming and links to artificial intelligence. Comput Oper Res 13(5):533–549CrossRef90048-1)MATHMathSciNet\n\nGlover F (1990) Tabu search: a tutorial. Interfaces 20(4):74–94CrossRef\n\nLuke S (2012) Essentials of metaheuristics. Lulu.com, online version at http://​cs.​gmu.​edu/​~sean/​book/​metaheuristics\n\nMendes R (2004) Population topologies and their influence in particle swarm performance. Ph.D. thesis, Universidade do Minho\n\nMichalewicz Z, Schmidt M, Michalewicz M, Chiriac C (2006) Adaptive business intelligence. Springer, Berlin\n\nMichalewicz Z, Schmidt M, Michalewicz M, Chiriac C (2007) Adaptive business intelligence: three case studies. In: Evolutionary computation in dynamic and uncertain environments. Springer, Berlin, pp 179–196\n\nWolpert DH, Macready WG (1997) No free lunch theorems for optimization. IEEE Trans Evol Comput 1(1):67–82CrossRef\n© Springer International Publishing Switzerland 2014\n\nPaulo CortezModern Optimization with RUse R!10.1007/978-3-319-08263-9_5\n\n# 5. Population Based Search\n\nPaulo Cortez1\n\n(1)\n\nDepartment of Information Systems, University of Minho, Guimarães, Portugal\n\n## 5.1 Introduction\n\nIn previous chapter, several local based search methods were presented, such as hill climbing, simulated annealing, and tabu search. All these methods are single-state, thus operating their effort around the neighborhood of a current solution. This type of search is simple and quite often efficient (Michalewicz et al. 2006). However, there is another interesting class of search methods, known as population based search , that use a pool of candidate solutions rather than a single search point. Thus, population based methods tend to require more computation when compared with simpler local methods, although they tend to work better as global optimization methods, quickly finding interesting regions of the search space (Michalewicz and Fogel 2004).\n\nAs shown in Fig. 5.1, population based methods tend to explore more distinct regions of the search space, when compared with single-state methods\n\n[Direct Result]: minimizes!\n\n# SANN for sum of bits, one run:\n\nD=8 # dimension\n\ns=rep(0,D) # c(0,0,0,0,...)\n\nC=list(maxit=10,temp=10,tmax=1,trace=TRUE,REPORT=1)\n\nbchange=function(par) # binary change\n\n{ D=length(par)\n\nhchange(par,lower=rep(0,D),upper=rep(1,D),rnorm,mean=0,sd=1)\n\n}\n\ns=optim(s,minsumbin,gr=bchange,method=\"SANN\",control=C)\n\ncat(\"best:\",s$par,\"f:\",s$value,\"(max: fs:\",sum(s$par),\")\\n\")\n\nGiven that optim only performs minimization, the evaluation function needs to be adapted (as discussed in Sect. 1.​3). In this example, it was set to have a minimum of zero. Also, given that method=\"SANN\" does not include lower and upper bonds, it is the responsibility of the change function (gr) to not generate unfeasible solutions. In this case, the auxiliary binary change function (bchange) uses the hchange function (from file hill.R) to set the 0 and 1 bounds for all D values. An execution example of file sumbits-sann.R is:\n\n> source(\"sumbits-sann.R\")\n\nsann objective function values\n\ninitial value 8.000000\n\niter 1 value 7.000000\n\niter 2 value 2.000000\n\niter 3 value 2.000000\n\niter 4 value 1.000000\n\niter 5 value 1.000000\n\niter 6 value 1.000000\n\niter 7 value 1.000000\n\niter 8 value 1.000000\n\niter 9 value 1.000000\n\nfinal value 1.000000\n\nsann stopped after 9 iterations\n\nbest: 1 1 1 1 1 1 1 0 f: 1 (max: fs: 7 )\n\nThe simulated annealing search is also adapted for bag prices (D = 5) and sphere tasks (D = 2), by setting maxit = 10, 000, T = 1, 000 and tmax = 10 (file bs-sann.R):\n\n### bs-sann.R file ###\n\nsource(\"hill.R\") # load the hchange method\n\nsource(\"functions.R\") # load the profit function\n\neval=function(x) -profit(x) # optim minimizes!\n\n# hill climbing for all bag prices, one run:\n\nD=5; C=list(maxit=10000,temp=1000,trace=TRUE,REPORT=10000)\n\ns=sample(1:1000,D,replace=TRUE) # initial search\n\nichange=function(par) # integer value change\n\n{ D=length(par)\n\nhchange(par,lower=rep(1,D),upper=rep(1000,D),rnorm,mean=0,\n\nsd=1)\n\n}\n\ns=optim(s,eval,gr=ichange,method=\"SANN\",control=C)\n\ncat(\"best:\",s$par,\"profit:\",abs(s$value),\"\\n\")\n\n# hill climbing for sphere, one run:\n\nsphere=function(x) sum(x^2)\n\nD=2; C=list(maxit=10000,temp=1000,trace=TRUE,REPORT=10000)\n\ns=runif(D,-5.2,5.2) # initial search\n\n# SANN with default change (gr) function:\n\ns=optim(s,sphere,method=\"SANN\",control=C)\n\ncat(\"best:\",s$par,\"f:\",s$value,\"\\n\")\n\nAn example execution of file bs-sann.R is:\n\n> source(\"bs-sann.R\")\n\nsann objective function values\n\ninitial value -35982.000000\n\nfinal value -39449.000000\n\nsann stopped after 9999 iterations\n\nbest: 293 570 634 606 474 profit: 39449\n\nsann objective function values\n\ninitial value 21.733662\n\nfinal value 1.243649\n\nsann stopped after 9999 iterations\n\nbest: -0.6856747 -0.8794882 f: 1.243649\n\nIn this execution, the initial solution was improved $3,467 (bag prices) and 20.49 (sphere). For the last task execution, Fig. 4.3 shows the evolution of the temperature values (left) and points searched (right). While the initial point is within the [−5. 2, 5. 2] range, the default and unbounded Gaussian Markov change function searches for several solutions outside the initial range. However, as the search proceeds, more solutions tend to converge to the origin point, which is the optimum.\n\nFig. 4.3\n\nExample of the temperature cooling (left) and simulated annealing search (right) for sphere and D = 2\n\n## 4.4 Tabu Search\n\nTabu search was created by Glover (1986) and uses the concept of \"memory\" to force the search into new areas. The algorithm is a variation of the hill climbing method that includes in a tabu list of length L, which stores the most recent solutions that become \"tabu\" and thus cannot be used when selecting a new solution. The intention is to keep a short-term memory of recent changes, preventing future moves from deleting these changes (Brownlee 2011). Similarly to the hill climbing method, the search of solutions within the neighborhood of the current solution (function change) can be deterministic, including the entire neighborhood, or stochastic (e.g., small random perturbation). Also, the\n\n[Direct Result]: ),control=C,type=\"max\")\n\n# hill climbing for sphere, one run:\n\nsphere=function(x) sum(x^2)\n\nD=2; C=list(maxit=10000,REPORT=10000)\n\nrchange=function(par,lower,upper) # real value change\n\n{ hchange(par,lower,upper,rnorm,mean=0,sd=0.5,round=FALSE) }\n\ns=runif(D,-5.2,5.2) # initial search\n\nhclimbing(s,sphere,change=rchange,lower=rep(-5.2,D),\n\nupper=rep(5.2,D),control=C,type=\"min\")\n\nAn execution example is:\n\n> source(\"bs-hill.R\")\n\ni: 1 s: 136 332 716 748 781 f: 28946 s' 135 332 716 749 781 f: 28890\n\ni: 10000 s: 188 338 743 770 812 f: 31570 s' 189 336 742 769 812 f: 31387\n\nbest: 188 338 743 770 812 f: 31570\n\ni: 1 s: 1.884003 4.549536 f: 24.24775 s' 2.142131 4.349898 f: 23.51034\n\ni: 10000 s: 0.001860534 0.009182373 f: 8.777755e-05 s' 0.5428469 -0.304862 f: 0.3876236\n\nbest: 0.001860534 0.009182373 f: 8.777755e-05\n\nUsing 10,000 iterations, the hill climbing search improved the solution from 28,890 to 31,570 (bag prices) and from 23.51 to 0.00 (sphere). For demonstrative purposes, Fig. 4.2 shows the searched \"down the hill\" (best) points for the sphere task.\n\nFig. 4.2\n\nExample of hill climbing search (only best \"down the hill\" points are shown) for sphere and D = 2\n\n## 4.3 Simulated Annealing\n\nSimulated annealing is a variation of the hill climbing technique that was proposed in the 1980s and that is inspired in the annealing phenomenon of metallurgy, which involves first heating a particular metal and then perform a controlled cooling (Luke 2012). This single-state method differs from the hill climbing search by adopting a control temperature parameter (T) that is used to compute the probability of accepting inferior solutions. In contrast with the stochastic hill climbing, which adopts a fixed value for T, the simulated annealing uses a variable temperature value during the search. The method starts with a high temperature and then gradually decreases (cooling process) the control parameter until a small value is achieved (similar to the hill climbing). Given that simulated annealing is a single-state method, it is described in this chapter. However, it should be noted that for high temperatures the method is almost equivalent to Monte Carlo search, thus behaving more like a global search method (in particular if the change function is set to perform high changes), while for low temperatures the method is similar to the hill climbing local search (Michalewicz et al. 2006).\n\nThis book adopts the simulated annealing implementation of the optim R function, which only performs minimization tasks and that executes several optimization methods by setting argument method, such as:\n\n  * \"Nelder-Mead\"—Nelder and Mead or downhill simplex method;\n\n  * \"BFGS\"—a quasi-Newton method ;\n\n  * \"CG\"—conjugate gradients method ;\n\n  * \"L-BFGS-B\"—modification of the BFGS method with lower and upper bounds; and\n\n  * \"SANN\"—simulated annealing.\n\nAlgorithm 3 presents the pseudo-code of the simulated annealing implementation, which is based on the variant proposed by Bélisle (1992). This implementation includes three search parameters: maxit—the maximum number of iterations; temp (T)—the initial temperature; and tmax—the number of evaluations at each temperature. By default, the values for the control parameters are maxit = 10, 000, T = 10, and tmax = 10. Also, new search points are generated using a Gaussian Markov kernel with a scale proportional to the temperature. Nevertheless, these defaults can be changed by setting two optim arguments: the control list and gr (change) function. The last argument is useful for solving combinatorial problems, i.e., when the representation of the solution includes discrete values. The optim function returns a list with several components, such as $par—the optimized values and $value—the evaluation of the best solution.\n\nAlgorithm 3 Simulated annealing search as implemented by the optim function\n\nSimilarly to the hill climbing demonstration, the sumbits-sann.R file executes ten iterations of the simulated annealing for the sum of bits task:\n\n### sumbits-sann.R file ###\n\nsource(\"hill.R\") # get hchange function\n\n# sum a raw binary object x (evaluation function):\n\nminsumbin=function(x) (length(x)-sum(x)) # optim only minimizes!\n\n# SANN for sum of bits, one run:\n\nD=8 # dimension\n\ns=rep(0,D) # c(0,0,0,0,...)\n\nC=list(maxit=10,temp=10,tmax=1,trace=TRUE,REPORT=1)\n\nbchange=function(par) # binary change\n\n{ D=length(par)\n\nhchange(par,lower=rep(0,D),upper=rep(1,D),rnorm,mean=0,s\n\n[Direct Result]: know the real number of R users (e.g., it may range from 250,000 to 2 million), several estimates show a clear growth in the R popularity. In effect, the R community is very active and new packages are being continuously created, with more than 5800 packages available, thus enhancing the tool capabilities. In particular, several of these packages implement modern optimization methods.\n\nThere are several books that discuss either modern optimization methods or the R tool. However, within the author's knowledge, there is no book that integrates both subjects and under a practical point of view, with several application R code examples that can be easily tested by the readers. Hence, the goal of this book is to gather in a single document (self-contained) the most relevant concepts related with modern optimization methods, showing how such concepts and methods can be addressed using the R tool.\n\nThis book is addressed for several target audience groups. Given that the R tool is free, this book can be easily adopted in several bachelor or master level courses in areas such as \"Operations Research\", \"Decision Support\", \"Business Intelligence\", \"Soft Computing\", or \"Evolutionary Computation\". Thus, this book should be appealing for bachelor's or master's students in Computer Science, Information Technology, or related areas (e.g., Engineering or Science). The book should also be of interest for two types of practitioners: R users interested in applying modern optimization methods and non R expert data analysts or optimization practitioners who want to test the R capabilities for optimizing real-world tasks.\n\n## How to Read This Book\n\nThis book is organized as follows:\n\n  * Chapter   1  introduces the motivation for modern optimization methods and why the R tool should be used to explore such methods. Also, this chapter discusses key modern optimization topics, namely the representation of a solution, the evaluation function, constraints, and an overall view of modern optimization methods. This chapter ends with the description of the optimization tasks that are used for tutorial purposes in the next chapters.\n\n  * Chapter   2  presents basic concepts about the R tool. This chapter is particularly addressed for non R experts, including the necessary knowledge that is required to understand and test the book examples. R experts should skip this chapter.\n\n  * Chapter   3  is about how blind search can be implemented in R. This chapter details in particular three approaches: pure blind, grid, and Monte Carlo search.\n\n  * Chapter   4  introduces local search methods, namely hill climbing, simulated annealing, and tabu search. Then, an example comparison between several local search methods is shown.\n\n  * Chapter   5  presents population-based search methods, namely genetic and evolutionary algorithms, differential evolution, particle swarm optimization and estimation of distribution algorithm. Then, two additional examples are discussed, showing a comparison between population-based methods and how to handle constraints.\n\n  * Chapter   6  is dedicated to multi-objective optimization. This chapter first presents three demonstrative multi-objective tasks and then discusses three multi-objective optimization approaches: weighted-formula, lexicographic, and Pareto (e.g., NSGA-II algorithm).\n\n  * Chapter   7  presents three real-world applications of previously discussed methods, namely traveling salesman problem, time series forecasting, and wine quality classification.\n\nEach chapter starts with an introduction, followed by several chapter topic related sections and ends with an R command summary and exercise sections. Throughout the book, several examples of R code are shown. The code was run using a 64 bit R (version 3.0.2) under on a MacOS laptop. Nevertheless, these examples should be easily reproduced by the readers on other systems, possibly resulting in slight numerical (32 bit version) or graphical differences for deterministic examples. Also, given that a large portion of the discussed methods are stochastic, it is natural that different executions of the same code and under the same system will lead to small differences in the results.\n\nIt is particularly recommended that students should execute the R code and try to solve the proposed exercises. Examples of solutions are presented at the end of this book. All these code files and data examples are available at: http://​www3.​dsi.​uminho.​pt/​pcortez/​mor .\n\n## Production\n\nSeveral contents of this book were taught by the author in the last 5 years in distinct course units of master and doctoral programs. At the master's level, it included the courses \"Adaptive Business Intelligence\" (Masters in Information Technology, University of Minho, Portugal) and \"Business Intelligence\" (Masters in Information Systems Management, Lisbon University Institute, Portugal). The doctoral course was \"Adaptive Business Intelligence\" (Doctoral Program in Computer Science, Universities of Minho, Aveiro and Porto, Portugal). Also, some material was lectured at a tutorial given in the European Simulation and Modelling Conference (ESM 2011), held at Guimarães.\n\nThis book was written in LaTeX, using the texstudio editor ( http://​texstudio.​sourceforge.​net ) and its US English spell checker. Most figures were made in R, while some of the figures were designed using xfig ( http://​www.​xfig.​org ), an open source vector graphical tool.\n\nPaulo Cortez\n\nGuimarães, Portugal\n\nContents\n\n1 Introduction 1\n\n1.​1 Motivation 1\n\n1.​2 Why R?​ 2\n\n1.​3 Representation of a Solution 3\n\n1.​4 Evaluation Function 3\n\n1.​5 Constraints 4\n\n1.​6 Optimization Methods 5\n\n1.​7 Demonstrative Problems 7\n\n2 R Basics 11\n\n2.​1 Introduction 11\n\n2.​2 Basic Objects and Functions 13\n\n2.​3 Controlling Execution and Writing Functions 20\n\n2.​"
      ],
      "latency_s": 7.58,
      "rag_type": "literag",
      "dominio": "LiteRAG_Multihop_01",
      "titulo": "",
      "error": ""
    },
    {
      "question": "Dowek's programming languages book discusses type checking and Streib's Java book covers the final keyword. What type-theoretic property does marking a Java class as final enforce, in terms of the substitution principle?",
      "ground_truth": "It prevents subtype polymorphism for that class, violating open extensibility but enforcing a closed type",
      "answer": "I am sorry, but the provided text does not contain information about Streib's Java book, the `final` keyword in Java, or the substitution principle in relation to type-theoretic properties. Therefore, I cannot answer your question.",
      "contexts": [
        "## Direct Evidence (Source Text)\n[Direct Result]: a sorting algorithm is a sorted list.\n\nThe last point that remains to discuss is the rôle of the theory of programming languages, and in particular whether its purpose is to describe the existing programming languages, or to propose new languages.\n\nAstronomers study the galaxies that exist, and do not build new ones, whereas chemists study the existing molecules and build new ones. We know that in the latter case, the order in which theories and production techniques appear may vary: the transformation of mass into energy was achieved long time after the theory of relativity, whereas the steam engine appeared before the principles of thermodynamics were established.\n\nThe theory of programming languages has enabled the development of new features, such as static binding, type inference, polymorphic types, garbage collection,... which are now available in commercial languages. In contrast, other functionalities, such as assignments and objects, were introduced in programming languages wildly, and the theory has been slow to follow. The development of a formal semantics for these constructs led in turn to new proposals, such as the recent extensions of Java with polymorphic types.\n\nThe theory of programming languages has neither an exclusively descriptive rôle nor an exclusively leading rôle. It is this going backwards and forwards between the description of existing features and the design of new ones that gives the theory of programming languages its dynamics.\nGilles Dowek and Jean-Jacques LévyUndergraduate Topics in Computer ScienceIntroduction to the Theory of Programming Languages10.1007/978-0-85729-076-2© Springer-Verlag London Limited 2011\n\nReferences\n\n1.\n\nAbadi, M., Cardelli, L.: A Theory of Objects. Springer, Berlin (1998)\n\n2.\n\nDybvig, R.K.: The Scheme Programming Language, 2nd edn. Prentice Hall, New York (1996). www.scheme.com/tspl2d/\n\n3.\n\nGunter, C.A.: Semantics of Programming Languages: Structures and Techniques. MIT Press, Cambridge (1992)MATH\n\n4.\n\nKahn, G.: Natural semantics. In: Proceedings of the Symp. on Theoretical Aspects of Computer Science, TACS, Passau (1987)\n\n5.\n\nMitchell, J.C.: Foundations for Programming Languages. MIT Press, Cambridge (1996)\n\n6.\n\nMitchell, J.C.: Concepts in Programming Languages. Cambridge University Press, Cambridge (2002)MATHCrossRef\n\n7.\n\nPeyton Jones, S., Lester, D.: Types and Programming Languages. Prentice Hall, New York (1992)\n\n8.\n\nPierce, B.C.: Types and Programming Languages. MIT Press, Cambridge (2002)\n\n9.\n\nPlotkin, G.D.: LCF considered as a programming language. Theor. Comput. Sci. 5 , 223–255 (1977) MathSciNetCrossRef90044-5)\n\n10.\n\nPlotkin, G.D.: A structural approach to operational semantics. Technical Report DAIMI FN–19, Computer Science Department, Aarhus University, Aarhus, Denmark, September 1981\n\n11.\n\nReynolds, J.C.: Theories of Programming Languages. Cambridge University Press, Cambridge (1998)MATHCrossRef\n\n12.\n\nScott, D.: Continuous Lattices. Lecture Notes in Math., vol. 274, pp. 97–136. Springer, Berlin (1972)\n\n13.\n\nWeis, P., Leroy, X.: Le langage Caml, 2nd edn. Dunod, Paris (1999)\n\n14.\n\nWinskel, G.: The Formal Semantics of Programming Languages. MIT Press, Cambridge (1993)MATH\n\nIndex\n\nA\n\nAbstract machine\n\nAlgorithm\n\nDamas and Milner\n\nHindley's\n\nRobinson's\n\nα -equivalence\n\nAlphabetic equivalence\n\nArity\n\nArray\n\nB\n\nβ -reduction\n\nBinding\n\ndynamic\n\nlate\n\nstatic\n\nC\n\nCall by name\n\nCall by value\n\nChurch numeral\n\nClosed set\n\nClosure\n\nrecursive\n\nCompiler\n\nbootstrapping\n\nComposition\n\nConfluence\n\nConstant\n\nContinuous function\n\nD\n\nDe Bruijn index\n\nDefinition\n\nexplicit\n\ninductive\n\nDerivation\n\nDeterministic\n\nE\n\nEnvironment\n\nsemantic\n\ntyping\n\nEvaluate\n\nEvaluator\n\nF\n\nFields\n\nFixed point\n\nCurry\n\nfirst theorem\n\nfunction construction via\n\nin PCF\n\nsecond theorem\n\nFunctionalisation\n\nH\n\nHeight\n\nI\n\nInterpreter\n\nL\n\nLabel\n\nLanguage\n\nLimit\n\nList\n\nM\n\nMethod\n\ndynamic\n\nstatic\n\nModule\n\nN\n\nNumber of arguments\n\nO\n\nObject\n\nOrdering\n\nScott's\n\nstrongly complete\n\nweakly complete\n\nP\n\nPair\n\nPCF ( Programming language for computable functions )\n\nPolymorphism\n\nPosition numerals\n\nR\n\nRecord\n\nin call by name\n\nin call by value\n\nRedex\n\nReduction\n\ncall by name\n\ncall by value\n\nlazy\n\nweak\n\nReference\n\nRegister\n\naccumulator\n\ncode\n\nenvironment\n\nstack\n\nRenaming\n\nResult\n\nRule\n\nS\n\nSemantics\n\nbig-step operational\n\ndenotational\n\nsmall-step operational\n\nSide effect\n\nSolution\n\nprincipal\n\nSort\n\nStrategy\n\nSubject reduction\n\nSubstitution\n\nSystem\n\nF\n\nT\n\nT\n\nTerm\n\nclosed\n\nirreducible\n\nstuck\n\nThunk\n\nTree\n\nType\n\nchecking\n\ninference\n\nprincipal\n\nType preservation\n\nby interpretation\n\nType scheme\n\nU\n\nUnification\n\nV\n\nValue\n\nextended\n\nrational\n\nVariable\n\ncapture\n\nenvironment\n\nmutable\n\n[Direct Result]: 91893 Orsay Cedex, France\n\nGilles Dowek (Corresponding author)\n\nEmail: gilles.dowek@polytechnique.edu\n\nJean-Jacques Lévy\n\nEmail: jean-jacques.levy@inria.fr\n\nAbstract\n\nThe Epilogue discusses the goals of the theory of programming languages: building tools to describe existing languages or to define new ones?\n\nThe first goal of this book was to present the main tools to define the semantics of a programming language: small-step operational semantics, big-step operational semantics, and denotational semantics.\n\nWe have stressed the fact that these three tools have the same purpose. In the three cases, the goal is to define a relation ↪ between a program, an input value and an output value. Since the goal is to define a relation, the question that arises naturally is: how do we define relations in mathematical language?\n\nThe answer is the same in the three cases: the means to achieve the goal is the fixed point theorem. However, the similarity is superficial, because the fixed point theorems are used in different ways in the three semantics. By giving rise to inductive definitions, and hence reflexive-transitive closures, the fixed point theorem plays a major rôle in operational semantics. In contrast, it plays a minor rôle in denotational semantics, because it is only used to give the meaning of the construction fix. The denotational semantics of a language without fixed point, such as Gödel's System T—see Exercise 5.13—can be defined without using the fixed point theorem.\n\nTo highlight the differences, we can look at the rôle of derivations. To establish that a term t has the value V in operational semantics, it is sufficient to show a derivation, or a sequence of reductions, that is, finite objects. In contrast, in denotational semantics the meaning of a term of the form fix is given as the least fixed point of a function, that is, a limit. For this reason, to establish that the value of a term t is V we sometimes need to compute the limit of a sequence, that is, we sometimes need to deal with an infinite object.\n\nOperational semantics have an advantage over denotational ones, because the relation ↪ can be defined in a more concrete way operationally. But on the other hand, operationally we can only define relations that are recursively enumerable, whereas denotationally we can define arbitrary relations. For this reason, in operational semantics we cannot complete the definition of the relation ↪ by adding a value ⊥ for the terms that do not terminate, because the resulting relation is not recursive, it cannot be effectively defined by induction. In contrast, denotationally it is not a problem to add such a value.\n\nWe see here the dilemma that arises from the undecidability of the halting problem: we cannot complete the relation ↪ by adding ⊥ for the non-terminating terms, and at the same time define it inductively. We have to choose between completing the relation or defining it inductively, which leads to two different semantics. The readers who have followed logic courses before will recognise here the same issues that distinguish the truth judgements that are inductively defined, by the existence of a proof, from those that are defined by their validity in a model.\n\nThe second goal of this book was to give the semantics of some programming language features: explicit definitions of functions, functions defined by fixed points, assignment, records, objects.... Here again, since the goal is to define functions, it is useful to start by looking at the ways in which functions are defined in Mathematics. In general, the comparison between the mathematical language and programming languages is fruitful, since the mathematical language is the closest we have to programming languages. This comparison shows some common points, but also some differences.\n\nThe purpose of the study of programming language features is not to be exhaustive, but to show some informative examples. The point to remember is that, in the same way that Zoology is not the study of all the animal species one after the other, the study of programming languages should not consist of studying all languages one after the other. They should be organised according to their main features.\n\nWe could continue this study by defining data types and exceptions. The study of data types would give us the opportunity to use again the fixed point theorem, and Robinson's unification algorithm, of which matching is a particular case. Going forward in this direction we could study the notion of backtracking which leads to Prolog. Other important points that we have left aside are the polymorphic typing of references, the notion of array, imperative objects, modules, type systems for records and objects (and in particular the notion of sub-type), concurrency....\n\nThe final goal of this book was to present a number of applications of these tools, in particular for the design and implementation of interpreters and compilers, and also the implementation of type inference systems. The main point here is that the structure of a compiler is derived directly from the operational semantics of the language to be compiled. The next step would be the study of implementation techniques for abstract machines, and this would lead us to the study of memory management and garbage collection. We could also study program analysis, and design systems to deduce in an automatic or interactive way properties of programs, for instance, the property that states that the value returned by a sorting algorithm is a sorted list.\n\nThe last point that remains to discuss is the rôle of the theory of programming languages, and in particular whether its purpose is to describe the existing programming languages, or to propose new languages.\n\nAstronomers study the galaxies that exist, and do not build new ones, whereas chemists study the existing molecules and build new ones. We know that in the latter case, the order in which theories and production techniques appear may vary: the transformation of mass into\n\n[Direct Result]: A -> B is strictly greater than that of A. The equation A = (nat ref) × (nat ref) × (A -> nat -> nat) × (A -> nat -> nat) does not have a solution either. As with the construction fix in PCF, it is not trivial to give a denotational semantics for the fixed point operator on types.\n\n### 8.2.2 What Is \"Self\"?\n\nIf t is the object built in Exercise 8.6, to know whether the booking is closed or there are still orchestra tickets, we need to interpret the term t.free t 0. Indeed, the function t.free takes an object u and a natural number n and indicates whether the field associated to n in u—orchestra if n = 0, balcony if n = 1—is zero or not. In other words, the method free is static, as defined for example in Java.\n\nWe now want the method free of the object t to apply to the object t itself, that is, we want to invoke it by interpreting the term t#free 0 instead of t.free t 0. In other words, we want this method to be dynamic.\n\nOne way to achieve this is to consider the term t#l as an abbreviation for t.l t. The difficulty here is that if t is an object and l a label in this object, we can only use the term t#l if the field l is a function of type A -> ... where A is the type of t itself. In other words, we can only use the term t#l if l is the label of a method. If l is the label of a field that is not a method, we still need to write t.l.\n\nTo avoid this distinction, we can state that all fields are functions. If a field a of an object t has the value 3, we transform it into a field with functional value fun s -> 3. Thus, the term t#a, that is, t.a t or (fun s -> 3) t, is interpreted as the value 3.\n\nThe first argument of each method in the object is then a bound variable, which is usually called self or this. In fact, most programming languages use a special variable self or this which is implicitly bound in the object, and which denotes the object itself.\n\nWhen all methods in a record are terms of the form fun x -> ..., they can be interpreted as themselves, and we can simplify the rule\n\nby using\n\nSimilarly, the rule\n\nspecialises to\n\nand finally the rule\n\ncan be replaced by\n\nTo force all fields to be functions, we can modify the language of records, passing from a record language to an object-oriented language. The symbol {} now binds a variable in each even argument—terms—, the symbol . is replaced by the symbol #, the symbol <- now binds a variable in the third argument.\n\nThe term {}(l1,s1t1, ...,ln,sntn) is written {l1 =ςs1t1, ...,ln =ςsntn}, the term #(t,l) is written t#l and the term <-(t,l,s u) is written t(l <-ςs u). The rules of the big-step operational semantics are now\n\nExercise 8.7\n\nWrite an interpreter for the language PCF with objects.\n\nExercise 8.8\n\n(Late binding) Consider the term\n\nIs the value of this term 10 or 11? Compare this result with that of Exercise 2.8.\n\n### 8.2.3 Objects and References\n\nThe standard definition of object includes a notion of internal state, which evolves in time. Thus, it combines the notion of object and reference, which are clearly separate in the definition of functional object given above.\n\nIn a language with objects and references, when a non-functional field a = u is transformed into a = fun x -> u, the interpretation of fun x -> u does not produce the side effects produced by the interpretation of u. It is only when we access the field that the side effects will be visible. Thus, the behaviour is similar to that of records under call by name. The term\n\nis interpreted as the value 0 and not 1 as the term\n\nin call by value. We need to rewrite this term as follows\n\nif we want the interpretation to be the value 1.\n\nExercise 8.9\n\nWhen we interpret a term of the form t#l, how many times is the term t interpreted? If the interpretation of t includes side effects, how many times will they take place? How can we force the term t to be interpreted only once?\nGilles Dowek and Jean-Jacques LévyUndergraduate Topics in Computer ScienceIntroduction to the Theory of Programming Languages10.1007/978-0-85729-076-2_9© Springer-Verlag London Limited 2011\n\n# 9. Epilogue\n\nGilles Dowek1  and Jean-Jacques Lévy2\n\n(1)\n\nLabo. d'Informatique, École polytechnique, route de Saclay, 91128 Palaiseau, France\n\n(2)\n\nCentre de Recherche Commun, INRIA-Microsoft Research, Parc Orsay Université, 28 rue Jean Rostand, 91893 Orsay Cedex, France\n\nGilles Dowek (Corresponding author)\n\nEmail: gilles.dowek@polytechnique.edu\n\nJean-Jacques Lévy\n\nEmail: jean-jacques.levy@inria.fr\n\nAbstract\n\nThe Epilogue discusses the goals of the theory of programming languages: building tools to describe existing languages or to define new ones?\n\nThe first goal of this book was to present the main tools to define the semantics of a programming"
      ],
      "latency_s": 10.75,
      "rag_type": "literag",
      "dominio": "LiteRAG_Multihop_01",
      "titulo": "",
      "error": ""
    },
    {
      "question": "The statistics book covers Chebyshev's inequality and the machine learning book uses model evaluation metrics. How does Chebyshev's inequality relate to the concept of model variance in the bias-variance tradeoff discussed in machine learning?",
      "ground_truth": "Chebyshev's inequality provides a probabilistic upper bound on deviation from the mean, directly formalizing the concept of high variance in model predictions",
      "answer": "The provided text does not contain information that directly connects Chebyshev's inequality to the concept of model variance in the bias-variance tradeoff.\n\nThe text mentions Chebyshev's inequality in the context of a chapter on random variables, alongside Markov's inequality and the weak law of large numbers. It states that these inequalities are often covered in statistics courses and can be useful for students to have seen before encountering them in later theory courses.\n\nThe bias-variance tradeoff and model evaluation metrics are discussed in the context of machine learning, with the \"Tools\" section mentioning \"Basic ideas in classification,\" \"Nearest neighbors classification,\" \"Naive Bayes classification,\" \"Classifying with a linear SVM trained with stochastic gradient descent,\" and \"Classifying with a random forest.\" However, there is no explicit link made between these machine learning concepts and Chebyshev's inequality.",
      "contexts": [
        "## Direct Evidence (Source Text)\n[Direct Result]: inequality\n\nclass conditional probability\n\nclass confusion matrix\n\nclass error rate\n\nclass-conditional histograms\n\nClassification with a decision forest\n\nClassifier\n\nclassifier\n\ndefinition\n\nnearest neighbors\n\ncluster center\n\nclustering\n\nusing K-means\n\nclusters\n\ncolor constancy\n\ncomparing to chance\n\ncomplete-link clustering\n\nComputing a one-sided p-value for a T-test\n\nComputing a two-sided p-value for a T-test\n\nconditional histograms\n\nConditional independence\n\nConditional probability\n\nConditional probability for independent events\n\nConditional probability formulas\n\nConfidence interval for a population mean\n\nconjugacy\n\nconjugate prior\n\nconsistency\n\nConstructing a centered 1 − 2 α confidence interval for a population mean for a large sample\n\nConstructing a centered 1 − 2 α confidence interval for a population mean for a small sample\n\ncontinuous\n\ncontrasts\n\ncorrelation\n\nCorrelation coefficient\n\ncost to go function\n\nCovariance\n\ncovariance ellipses\n\nCovariance Matrix\n\nCovariance, useful expression\n\ncross-validation\n\nCumulative distribution of a discrete random variable\n\nD\n\ndecision function\n\ndecision boundary\n\ndecision forest\n\ndecision tree\n\ndegrees of freedom\n\ndendrogram\n\ndensity\n\ndependent variable\n\ndescent direction\n\ndescriptive statistics\n\ndiagonal\n\ndiagonalizing\n\nDiagonalizing a symmetric matrix\n\nDiscrete random variable\n\ndistributions\n\nhow often a normal random variable is how far from the mean\n\nmean and variance of a bernoulli random variable\n\nmean and variance of a beta distribution\n\nmean and variance of a geometric distribution\n\nmean and variance of the binomial distribution\n\nmean and variance of the exponential distribution\n\nmean and variance of the gamma distribution\n\nmean and variance of the normal distribution\n\nmean and variance of the poisson distribution\n\nmean and variance of the standard normal distribution\n\nDivisive Clustering\n\ndynamic programming\n\nE\n\nEasy confidence intervals for a big sample\n\neigenvalue\n\neigenvector\n\nemission distribution\n\nempirical distribution\n\nentropy\n\nepoch\n\nerror\n\nerror bars\n\nerror function\n\nEstimating Confidence Intervals for Maximum Likelihood Estimates using Simulation\n\nEstimating with maximum likelihood\n\nEvaluating whether a treatment has significant effects with a one-way ANOVA for balanced experiments\n\nEvent\n\nExpectation\n\nExpectation of a continuous random variable\n\nExpectations are linear\n\nExpected value\n\nExpected value of a continuous random variable\n\nexplanatory variables\n\nExponential distribution\n\nExpressions for mean and variance of the sample mean\n\nF\n\nF-distribution\n\nF-statistic\n\nfalse positive rate\n\nfalse negative rate\n\nfeature vector\n\nfiltering\n\nfold\n\nForming and interpreting a two-way ANOVA table\n\nFrobenius norm\n\nG\n\ngambler's fallacy\n\nGamma distribution\n\ngaussian distributions\n\ngeneralizing badly\n\nGeometric distribution\n\ngradient descent\n\ngroup average clustering\n\nH\n\nheat map\n\nhidden Markov model\n\nhinge loss\n\nhistogram\n\nI\n\nIID\n\niid samples\n\nindependent and identically distributed\n\nIndependent events\n\nindependent identically distributed samples\n\nIndependent random variables\n\nIndependent random variables have zero covariance\n\nindicator function\n\nIndicator functions\n\ninformation gain\n\nintensity\n\ninteraction mean squares\n\nInterquartile Range\n\ninverse error function\n\nirreducible\n\nJ\n\njoint\n\nJoint probability distribution of two discrete random variables\n\nK\n\nk-means\n\nSeeclustering, 287\n\nK-Means Clustering\n\nK-Means with Soft Weights\n\nL\n\nlatent variable\n\nlearning curves\n\nlearning rate\n\nleave-one-out cross-validation\n\nLikelihood\n\nlikelihood\n\nLikert scales\n\nline search\n\nLinear regression\n\nLinear Regression using Least Squares\n\nlocation parameter\n\nLog-likelihood of a dataset under a model\n\nM\n\nMany Markov chains have stationary distributions\n\nMAP estimate\n\nMarginal probability of a random variable\n\nMarkov chain\n\nMarkov chains\n\nMarkov's inequality\n\nmaximum a posteriori estimate\n\nMaximum likelihood principle\n\nMean\n\nmean and variance of\n\na bernoulli random variable\n\na beta distribution\n\na geometric distribution\n\nthe binomial distribution\n\nthe exponential distribution\n\nthe gamma distribution\n\nthe normal distribution\n\nthe poisson distribution\n\nthe standard normal distribution\n\nMean or expected value\n\nmean square error\n\nMedian\n\nmode\n\nmultidimensional scaling\n\nmultimodal\n\nMultinomial distribution\n\nN\n\nn-gram models\n\nn-grams\n\nnormal distribution\n\nNormal data\n\nNormal distribution\n\nnormal distribution\n\nNormal posteriors can be updated online\n\nnormal quantile function\n\nnormal random variable\n\nnormalizing\n\nnormalizing constant\n\nO\n\nodds\n\none factor\n\none-sided p-value\n\none-vs-all\n\nordinal\n\northonormal\n\nOrthonormal matrices are rotations\n\noutcomes\n\noutlier\n\noutliers\n\noverfitting\n\nP\n\np-value\n\np-value hacking\n\nPairwise independence\n\nParameters of a Multivariate Normal Distribution\n\npdf\n\nPercentile\n\nphonemes\n\npie chart\n\nPoisson distribution\n\nPoisson point process\n\npopulation\n\npopulation mean\n\npositive definite\n\npositive semidefinite\n\nposterior\n\nPredicting a value using correlation\n\nPredicting a value using correlation: Rule of thumb - 1\n\nPredicting a value using correlation: Rule of thumb - 2\n\nprincipal components\n\nPrincipal Components Analysis\n\nPrincipal Coordinate Analysis\n\nprincipal coordinate analysis\n\nprior\n\nprior probability distribution\n\nprobability\n\nprobability density function\n\nProbability distribution of a discrete random variable\n\nprobability mass function\n\nprobit function\n\nprocedure\n\npredicting a value using correlation\n\nthe t-test of significance for a hypothesized mean\n\nagglomerative clustering\n\napproximating a symmetric matrix with a low rank matrix\n\napproximating a symmetric matrix with low dimensional factors\n\nbuilding a decision forest\n\nbuilding a decision forest using bagging\n\nbuilding a decision tree: overall\n\nclassification with a decision forest\n\ncomputing a one-sided p-value for a t-test\n\ncomputing a two-sided p-value for a t-test\n\nconstructing a centered 1 −\n\n[Direct Result]: this chapter.\n\nThe regression material is also quite simple and is also easy to teach. The main obstacle here is that students feel something more complicated must necessarily work better (and they're not the only ones). I also don't think you could omit anything in this chapter.\n\nIn my experience, computer science students find simple Markov chains natural (though they might find the notation annoying) and will suggest simulating a chain before the instructor does. The examples of using Markov chains to produce natural language (particularly Garkov and wine reviews) are wonderful fun and you really should show them in lectures. You could omit the discussion of ranking the Web. About half of each class I've dealt with has found hidden Markov models easy and natural, and the other half has been wishing the end of the semester was closer. You could omit this topic if you sense likely resistance, and have those who might find it interesting read it.\n\n## Mathematical Bits and Pieces\n\nThis is a chapter of collected mathematical facts some readers might find useful, together with some slightly deeper information on decision tree construction. Not necessary to lecture this.\n\nDavid Forsyth\n\nUrbana, IL, USA\n\nNotation and Conventions\n\nA dataset is a collection of d -tuples (a d -tuple is an ordered list of d elements). Tuples differ from vectors, because we can always add and subtract vectors, but we cannot necessarily add or subtract tuples. There are always N items in any dataset. There are always d elements in each tuple in a dataset. The number of elements will be the same for every tuple in any given tuple. Sometimes we may not know the value of some elements in some tuples.\n\nWe use the same notation for a tuple and for a vector. Most of our data will be vectors. We write a vector in bold, so x could represent a vector or a tuple (the context will make it obvious which is intended).\n\nThe entire dataset is { x }. When we need to refer to the i th data item, we write x i . Assume we have N data items, and we wish to make a new dataset out of them; we write the dataset made out of these items as { x i } (the i is to suggest you are taking a set of items and making a dataset out of them). If we need to refer to the j th component of a vector x i , we will write x i ( j )  (notice this isn't in bold, because it is a component, not a vector, and the j is in parentheses because it isn't a power). Vectors are always column vectors.\n\nWhen I write { kx }, I mean the dataset created by taking each element of the dataset { x } and multiplying by k ; and when I write { x \\+ c }, I mean the dataset created by taking each element of the dataset { x } and adding c .\n\n## Terms\n\n  *   is the mean of the dataset { x } (Definition 1.​1 , page 7).\n\n  *   is the standard deviation of the dataset { x } (Definition 1.​2 , page 10).\n\n  *   is the standard deviation of the dataset { x } (Definition 1.​3 , page 13).\n\n  *   is the standard deviation of the dataset { x } (Definition 1.​4 , page 13).\n\n  * percentile ({ x }, k ) is the k% percentile of the dataset { x } (Definition 1.​5 , page 14).\n\n  * iqr { x } is the interquartile range of the dataset { x } (Definition 1.​7 , page 15).\n\n  *   is the dataset { x }, transformed to standard coordinates (Definition 1.​8 , page 18).\n\n  * Standard normal data is defined in Definition 18 (page 19).\n\n  * Normal data is defined in Definition 1.​10 (page 19).\n\n  *   is the correlation between two components x and y of a dataset (Definition 2.​1 , page 39).\n\n  * ∅ is the empty set.\n\n  *   is the set of all possible outcomes of an experiment.\n\n  * Sets are written as   .\n\n  *   is the complement of the set   (i.e.,   ).\n\n  *   is an event (page 341).\n\n  *   is the probability of event   (page 341).\n\n  *   is the probability of event   , conditioned on event   (page 341).\n\n  * p ( x ) is the probability that random variable X will take the value x , also written as P ({ X = x }) (page 341).\n\n  * p ( x , y ) is the probability that random variable X will take the value x and random variable Y will take the value y , also written as P ({ X = x } ∩{ Y = y }) (page 341).\n\n  *   means the value of x that maximizes f ( x ).\n\n  *   means the value of x that minimizes f ( x ).\n\n  * max  i ( f ( x i )) means the largest value that f takes on different elements of the dataset { x i }.\n\n  *   is an estimated value of a parameter θ .\n\n## Background Information\n\nCards : A standard deck of playing cards contains 52 cards. These cards are divided into four suits. The suits are spades and clubs (which are black) and hearts and diamonds (which are red). Each suit contains 13 cards: ace, 2, 3, 4, 5, 6, 7, 8, 9, 10, jack (sometimes called knave), queen, and king. It is common to call jack, queen, and king court cards .\n\nDice : If you look hard enough, you can\n\n[Direct Result]: law of large numbers\n\n  * A selection of facts about an assortment of useful probability distributions\n\n  * The normal approximation to a binomial distribution with large N\n\nI've been quite careful developing discrete probability fairly formally. Most people find conditional probability counterintuitive (or, at least, behave as if they do—you can still start a fight with the Monty Hall problem), and so I've used a number of (sometimes startling) examples to emphasize how useful it is to tread carefully here. In my experience, worked examples help learning, but I found that too many worked examples in any one section could become distracting, so there's an entire section of extra worked examples. You can't omit anything here, except perhaps the extra worked examples.\n\nThe chapter on random variables largely contains routine material, but there I've covered Markov's inequality, Chebyshev's inequality, and the weak law of large numbers. In my experience, computer science undergraduates find simulation absolutely natural (why do sums when you can write a program?) and enjoy the weak law as a license to do what they would do anyway. You could omit the inequalities and just describe the weak law, though most students run into the inequalities in later theory courses; the experience is usually happier if they've seen them once before.\n\nThe chapter on useful probability distributions again largely contains routine material. When I teach this course, I skim through the chapter fairly fast and rely on students reading the chapter. However, there is a detailed discussion of a normal approximation to a binomial distribution with large N . In my experience, no one enjoys the derivation, but you should know the approximation is available, and roughly how it works. I lecture this topic in some detail, mainly by giving examples.\n\n## Inference\n\nThis part covers:\n\n  * Samples and populations\n\n  * Confidence intervals for sampled estimates of population means\n\n  * Statistical significance, including t-tests, F-tests, and χ 2 -tests\n\n  * Very simple experimental design, including one-way and two-way experiments\n\n  * ANOVA for experiments\n\n  * Maximum likelihood inference\n\n  * Simple Bayesian inference\n\n  * A very brief discussion of filtering\n\nThe material on samples covers only sampling with replacement; if you need something more complicated, this will get you started. Confidence intervals are not much liked by students, I think because the true definition is quite delicate; but getting a grasp of the general idea is useful. You really shouldn't omit these topics.\n\nYou shouldn't omit statistical significance either, though you might feel the impulse. I have never dealt with anyone who found their first encounter with statistical significance pleasurable (such a person might exist, the population being very large). But the idea is so useful and so valuable that you just have to take your medicine. Statistical significance is often seen and sometimes taught as a powerful but fundamentally mysterious apotropaic ritual. I try very hard not to do this.\n\nI have often omitted teaching simple experimental design and ANOVA, but in retrospect this was a mistake. The ideas are straightforward and useful. There's a bit of hypocrisy involved in teaching experimental design using other people's datasets. The (correct) alternative is to force students to plan and execute experiments; there just isn't enough time in a usual course to fit this in.\n\nFinally, you shouldn't omit maximum likelihood inference or Bayesian inference. Many people don't need to know about filtering, though.\n\n## Tools\n\nThis part covers:\n\n  * Principal component analysis\n\n  * Simple multidimensional scaling with principal coordinate analysis;\n\n  * Basic ideas in classification;\n\n  * Nearest neighbors classification;\n\n  * Naive Bayes classification;\n\n  * Classifying with a linear SVM trained with stochastic gradient descent;\n\n  * Classifying with a random forest;\n\n  * The curse of dimension;\n\n  * Agglomerative and divisive clustering;\n\n  * K-means clustering;\n\n  * Vector quantization;\n\n  * A superficial mention of the multivariate normal distribution;\n\n  * Linear regression;\n\n  * A variety of tricks to analyze and improve regressions;\n\n  * Nearest neighbors regression;\n\n  * Simple Markov chains;\n\n  * Hidden Markov models.\n\nMost students in my institution take this course at the same time they take a linear algebra course. When I teach the course, I try and time things so they hit PCA shortly after hitting eigenvalues and eigenvectors. You shouldn't omit PCA. I lecture principal coordinate analysis very superficially, just describing what it does and why it's useful.\n\nI've been told, often quite forcefully, you can't teach classification to undergraduates. I think you have to, and in my experience, they like it a lot. Students really respond to being taught something that is extremely useful and really easy to do. Please, please, don't omit any of this stuff.\n\nThe clustering material is quite simple and easy to teach. In my experience, the topic is a little baffling without an application. I always set a programming exercise where one must build a classifier using features derived from vector quantization. This is a great way of identifying situations where people think they understand something, but don't really. Most students find the exercise challenging, because they must use several concepts together. But most students overcome the challenges and are pleased to see the pieces intermeshing well. The discussion of the multivariate normal distribution is not much more than a mention. I don't think you could omit anything in this chapter.\n\nThe regression material is also quite simple and is also easy to teach. The main obstacle here is that students feel something more complicated must necessarily work better (and they're not the only ones). I also don't think you could omit anything in this chapter.\n\nIn my experience, computer science students find simple Markov chains natural (though they might find the notation annoying) and will suggest simulating a chain before the instructor does. The examples of using Markov chains to produce natural language ("
      ],
      "latency_s": 8.6,
      "rag_type": "literag",
      "dominio": "LiteRAG_Multihop_01",
      "titulo": "",
      "error": ""
    },
    {
      "question": "Both Celko's SQL book and the SQL Server book discuss query performance. What SQL Server feature described by Vieira enforces the style rule Celko advocates of avoiding implicit column ordering?",
      "ground_truth": "Explicit column lists in SELECT statements, enforced by good practice and partially by SQL Server's strict mode or stored procedure linting",
      "answer": "I am sorry, but the provided text does not contain information about SQL Server features that enforce style rules related to implicit column ordering. The text mentions Celko's book \"Joe Celko's SQL Programming Style\" and discusses various SQL programming practices, including column ordering in CREATE TABLE statements (Chapter 3, point 3.5), but it does not reference any specific SQL Server features or the book by Vieira.",
      "contexts": [
        "## Direct Evidence (Source Text)\n[Direct Result]: 68\n\nrelationship,\n\nrenaming,\n\nsequence, 163–66\n\nsplitting attributes into,\n\nstar schema,\n\nsynchronizing VIEWs with, 145–46\n\ntemporary,\n\ntranslation, 93–95\n\nTemporal cohesion,\n\nTemporal syntax, 107–8\n\nTemporal values,\n\nTemporary tables,\n\nTeradata standards,\n\nTesting SQL, 130–31\n\ncharacter columns,\n\nCHECK() constraints, 130–31\n\nNULL combinations,\n\nfor size,\n\nTranslation, 93–96\n\nTranslation tables, 93–94\n\nTriggers\n\nANSI version,\n\navoiding, 120–22\n\nINSTEAD OF, ,\n\nlength,\n\nstored procedures vs., 121–22\n\n# U\n\nUNIONs, 127–30\n\nUnits\n\nderived, 79–80,\n\ndisplay,\n\nprimary,\n\nstandard, 80–81\n\nUpdatable VIEWs, 143–44\n\nINSTEAD OF triggers,\n\nWITH CHECK OPTION clause, 143–44\n\nSee _also_ VIEWs\n\nUPDATE statement, ,\n\nUser-defined functions, 123–24\n\nmultiple language problems,\n\noptimization problems,\n\nportability problems,\n\n# V\n\nValidation, 95–96\n\nVALUES() list,\n\nVector encoding, 90–91\n\nadvantages,\n\ndefined,\n\ndisadvantages, 90–91\n\nSee _also_ Encoding schemes\n\nVerbs, active,\n\nVertical spacing,\n\nVery Large Database (VLDB),\n\nVIEWs, 133–50\n\napplication/business requirements, 144–45\n\ncolumn-level security, 136–37\n\ncolumns,\n\ndata derivation, 139–40\n\ndefined,\n\nfor domain support, 146–47\n\nefficient access paths,\n\nimproper use, 146–49\n\nintegrity constraints enforcement, 140–42\n\ninvocation,\n\nmasking complexity, 138–39\n\nmaterialized, 149–50\n\nnames, 14–15\n\nproliferation, avoiding,\n\nreasons for, 144–45\n\nrename tables/columns,\n\nrow-level security, 136–37\n\nrows,\n\nsingle-solution, 147–48\n\nsynchronizing, 145–46\n\nupdatable, 143–44\n\nuses,\n\n# W\n\nWeinberg, Jerry, 99–100\n\nWHERE clause,\n\nWITH CHECK OPTION clause, 143–44\n\nWord spacing, \nABOUT THE AUTHOR\n\n**Joe Celko** is a noted consultant and lecturer, and one of the most-read SQL authors in the world. He is well known for his 10 years of service on the ANSI SQL standards committee, his column in _Intelligent Enterprise_ magazine (which won several Reader's Choice Awards), and the war stories he tells to provide real-world insights into SQL programming. His best-selling books include _Joe Celko's SQL for Smarties: Advanced SQL Programming, second edition; Joe Celko's SQL Puzzles and Answers;_ and _Joe Celko's Trees and Hierarchies in SQL for Smarties._\nInstructions for online access\n\nThank you for your purchase. Please note that your purchase of this Elsevier eBook also includes access to an online version. Please click here (or go to http://ebooks.elsevier.com) to request an activation code and registration instructions in order to gain access to the web version.\n\n[Direct Result]: Title: Joe Celko's SQL Programming Style\nAuthors: Joe Celko\nDomain: cs\n================================================================================\n\n \nJoe Celko's SQL Programming Style\n\nJoe Celko\n\nMorgan Kaufmann\nPublishing Director Michael Forster Publisher Diane Cerra Publishing Services Manager Andre Cuello Senior Production Editor George Morrison Editorial Assistant Asma Stephan Cover Design Side by Side Studios Cover Image Side by Side Studios Composition Multiscience Press, Inc. Copyeditor Multiscience Press, Inc. Proofreader Multiscience Press, Inc. Indexer Multiscience Press, Inc. Interior printer The Maple-Vail Book Manufacturing Group Cover printer Phoenix Color Corp.\n\nMorgan Kaufmann Publishers is an imprint of Elsevier. 500 Sansome Street, Suite 400, San Francisco, CA 94111\n\nThis book is printed on acid-free paper.\n\nDesignations used by companies to distinguish their products are often claimed as trademarks or registered trademarks. In all instances in which Morgan Kaufmann Publishers is aware of a claim, the product names appear in initial capital or all capital letters. Readers, however, should contact the appropriate companies for more complete information regarding trademarks and registration.\n\nNo part of this publication may be reproduced, stored in a retrieval system, or transmitted in any form or by any means-electronic, mechanical, photocopying, scanning, or otherwise-without prior written permission of the publisher.\n\nPermissions may be sought directly from Elsevier's Science & Technology Rights Department in Oxford, UK: phone: (+44) 1865 843830, fax: (+44) 1865 853333, e-mail: permissions@elsevier.com.uk. You may also complete your request on-line via the Elsevier homepage (<http://elsevier.com>) by selecting \"Customer Support\" and then \"Obtaining Permissions\".\n\nLibrary of Congress Cataloging-in-Publication Data\n\nApplication submitted.\n\nISBN: 0-12-088797-5\n\nFor information on all Morgan Kaufmann publications, visit our Web site at www.mkp.com or www.books.elsevier.com\n\nPrinted in the United States of America 05 06 07 08 5 4 3 2 1\nTo Eve Astrid Adersson, Miss American Π and April Wilson, who rubs me the right way\nTable of Contents\n\nInstructions for online access\n\nCover\n\nTitle Page\n\nIntroduction\n\n1.1 Purpose of the Book\n\n1.2 Acknowledgments\n\n1.3 Corrections, Comments, and Future Editions\n\nChapter 1: Names and Data Elements\n\n1.1 Names\n\n1.2 Follow the ISO-11179 Standards Naming Conventions\n\n1.3 Problems in Naming Data Elements\n\nChapter 2: Fonts, Punctuation, and Spacing\n\n2.1 Typography and Code\n\n2.2 Word Spacing\n\n2.3 Follow Normal Punctuation Rules\n\n2.4 Use Full Reserved Words\n\n2.5 Avoid Proprietary Reserved Words if a Standard Keyword Is Available in Your SQL Product\n\n2.6 Avoid Proprietary Statements if a Standard Statement Is Available\n\n2.7 Rivers and Vertical Spacing\n\n2.8 Indentation\n\n2.9 Use Line Spacing to Group Statements\n\nChapter 3: Data Declaration Language\n\n3.1 Put the Default in the Right Place\n\n3.2 The Default Value Should Be the Same Data Type as the Column\n\n3.3 Do Not Use Proprietary Data Types\n\n3.4 Place the PRIMARY KEY Declaration at the Start of the CREATE TABLE Statement\n\n3.5 Order the Columns in a Logical Sequence and Cluster Them in Logical Groups\n\n3.6 Indent Referential Constraints and Actions under the Data Type\n\n3.7 Give Constraints Names in the Production Code\n\n3.8 Put CHECK() Constraint Near what they Check\n\n3.9 Put Multiple Column Constraints as Near to Both Columns as Possible\n\n3.10 Put Table-Level CHECK() Constraints at the End of the Table Declaration\n\n3.11 Use CREATE ASSERTION for Multi-table Constraints\n\n3.12 Keep CHECK() Constraints Single Purposed\n\n3.13 Every Table Must Have a Key to Be a Table\n\n3.14 Do Not Split Attributes\n\n3.15 Do Not Use Object-Oriented Design for an RDBMS\n\nChapter 4: Scales and Measurements\n\n4.1 Measurement Theory\n\n4.2 Types of Scales\n\n4.3 Using Scales\n\n4.4 Scale Conversion\n\n4.5 Derived Units\n\n4.6 Punctuation and Standard Units\n\n4.7 General Guidelines for Using Scales in a Database\n\nChapter 5: Data Encoding Schemes\n\n5.1 Bad Encoding Schemes\n\n5.2 Encoding Scheme Types\n\n5.3 General Guidelines for Designing Encoding Schemes\n\n5.4 Multiple Character Sets\n\nChapter 6: Coding Choices\n\n6.1 Pick Standard Constructions over Proprietary Constructions\n\n6.2 Pick Compact Constructions over Longer Equivalents\n\n6.3 Use Comments\n\n6.4 Avoid Optimizer Hints\n\n6.5 Avoid Triggers in Favor of DRI Actions\n\n6.6 Use SQL Stored Procedures\n\n6.7 Avoid User-Defined Functions and Extensions inside the Database\n\n6.8 Avoid Excessive Secondary Indexes\n\n6.9 Avoid Correlated Subqueries\n\n6.10 Avoid UNIONS\n\n6.11 Testing SQL\n\nChapter 7: How to Use Views\n\n7.1 VIEW Naming Conventions Are the Same as Tables\n\n7.2 VIEWs Provide Row- and Column-Level Security\n\n7.3 VIEWs Ensure Efficient Access Paths\n\n7.4 VIEWs Mask Complexity from the User\n\n7.5 VIEWs Ensure Proper Data Derivation\n\n7.6 VIEWs Rename Tables and/or Columns\n\n7.7 VIEWs Enforce Complicated Integrity Constraints\n\n7.8 Updatable VIEWs\n\n7.9 Have a Reason for Each VIEW\n\n7.10\n\n[Direct Result]: Big VIEW Myth,\" 148–49\n\nBits, ,\n\nBlock puzzle, ,\n\nBouma,\n\nBytes,\n\n# C\n\n**C** Calendar tables,\n\nCamelCase\n\nproblems,\n\nuse avoidance, 29–30\n\nuse exceptions,\n\nCapitalization rules, 6–7\n\nCASE expressions, 110–13\n\nCOALESCE() function, 112–13\n\nfor complex predicate,\n\ndefined,\n\nreplacing IF-THEN-ELSE control flow statements, 162–63\n\nsearched,\n\nsimple, 111–12\n\nusing, 117–18\n\nCase-sensitivity rules, 6–7\n\nCategorical scales, 73–74\n\ncategories,\n\ndefined, 73–74\n\nproperties,\n\n_See also_ Scales\n\nCharacter columns,\n\nCharacter sets,\n\nCHECK() constraints, 46–48\n\napplying to table as whole,\n\ninspecting/testing, 130–31\n\nsingle-purposed,\n\non table declarations,\n\ntable-level,\n\nSee _also_ Constraints\n\nCOALESCE() function, 112–13\n\nCodd, Dr., , , ,\n\nCode\n\nclusters,\n\nindentation, 38–39\n\nline spacing, 39–40\n\nlowercase scalars usage, 25–26\n\nname usage,\n\npunctuation rules, 31–33\n\nreading,\n\nreserved word use, 33–34\n\nstatements, 34–37\n\ntypography and, 23–30\n\nupper-/lowercase letter usage,\n\nword spacing,\n\nCode Museum Effect, ,\n\nCoding\n\nchoices, 99–131\n\ncomments, 118–19\n\ncompact constructions, 109–18\n\ncorrelated subqueries, 125–27\n\noptimizer hints avoidance,\n\nsecondary index avoidance, 124–25\n\nstandard constructions, 100–108\n\nstored procedures, 122–23\n\ntriggers avoidance, 120–22\n\nUNIONs, 127–30\n\nuser-defined functions, 123–24\n\nCohesion, 153–55\n\ncoincidental, 153–54\n\ncommunicational,\n\ndefined,\n\nfunctional,\n\ninformational,\n\nlogical,\n\nprocedural,\n\ntemporal,\n\ntypes,\n\nCoincidental cohesion, 153–54\n\nColumns\n\nadded after schema,\n\ncharacter,\n\nclustering, 44–45\n\nconstraints, 48–49,\n\nas fields, 189–91\n\nnames,\n\nordering, 44–45\n\nrenaming,\n\nsplitting attributes into, 63–65\n\nVIEW,\n\n_See also_ Rows\n\nComma-separated lists, ,\n\nComments\n\non clause,\n\ncontrol statement,\n\nstored procedures,\n\nusing, 118–19\n\nCommon coupling,\n\nCommon language runtime (CLR),\n\nCommunicational cohesion,\n\nCompact constructions, 109–18\n\nCASE family expressions, 110–13\n\nparentheses and, 109–10\n\nredundant expressions and, —14\n\nseeking, 114–18\n\nComplexity, masking, 138–39\n\nConcatenation,\n\nConcatenation encoding,\n\nConsistency,\n\nConstraints\n\nCHECKO, 46–48\n\ncolumn,\n\nintegrity, 140–42\n\nLIKE,\n\nmultiple column, 48–49\n\nmulti-table, 49–50\n\nnames,\n\nin narrative specification,\n\nrange,\n\nreferential,\n\nrows,\n\nSIMILAR TO,\n\nContent coupling, 155–56\n\nControl coupling,\n\nControl statement comments,\n\nControl structures, 156–57\n\nconcatenation,\n\niteration,\n\nselection,\n\nCorrelation names, 15–17\n\ncolumn,\n\nderivation, 15–16\n\nin queries,\n\non table expression,\n\nCoupling, 155–56\n\ncommon,\n\ncontent, 155–56\n\ncontrol,\n\ndata,\n\ndefined,\n\nstamp,\n\ntypes of,\n\nCREATE ASSERTION statement, 49–50,\n\nCREATE PROCEDURE statement,\n\nCREATE TABLE statement, , ,\n\nCROSS JOIN syntax, 105–7,\n\nCursors\n\nporting,\n\nuse avoidance, 159–61\n\nuses, 159–60\n\nCyclomatic complexity,\n\n# D\n\n**D** Data abstraction,\n\nDatabase management system (DBMS),3\n\nDatabases\n\ncodes in, 96–97\n\ncodes storage, 96–97\n\nrelational, , , 66–68\n\nData coupling,\n\nData declaration language (DDL), 41–68\n\nattribute splitting, 62–66\n\nCHECK() constraint placement, 46–48\n\ncolumn ordering, 44–45\n\nconstraint names,\n\nCREATE ASSERTION use, 49–50\n\nDEFAULT value, 41–42\n\nfirst attempts, 177–78\n\nindentation, 45–46\n\nmultiple column constraints, 48–49\n\nobject-oriented design use, 66–68\n\nPRIMARY KEY declaration,\n\nproprietary data types and, 42–44\n\nsingle-purposed CHECKO\n\nconstraints,\n\ntable keys, 51–62\n\ntable-level CHECK() constraints,49\n\nData derivation, 139–40\n\nData elements\n\naffixes,\n\ndescriptive prefixes, 10–12\n\nlogical,\n\nnames in registry,\n\nnaming problems, 18–21\n\npostfixes, 12–14\n\nquery,\n\nscalar,\n\nData encoding schemes, 83–97\n\nData manipulation language (DML),\n\nbad,\n\nfirst attempts, 178–79\n\nData types,\n\nFLOAT,\n\nproprietary, 42–44\n\nREAL,\n\nDecimal places, declaring, 81–82\n\nDEFAULT value, 41–42\n\nDelimited identifiers,\n\nDerived units, 79–80,\n\nDescriptive prefixes, 10–12\n\nDewey Decimal Classification (DDC) system, 89–90\n\nDisplay,\n\nDomain-Key Normal Form (DKNF), 62–63\n\nDROP TABLE statement,\n\nDynamic SQL, 168–70\n\npurpose,\n\nin stored procedures,\n\n# E\n\nElectronic data interchange (EDI) files,8,\n\nEncoding schemes, 83–97\n\nabbreviation, 87–88\n\nalgorithm\n\n[Direct Result]: programming revolution came along was a series of books entitled \"[Pascal | FORTRAN | COBOL | BASIC] with Style: Programming Proverbs\" by Henry Ledgard and some of his colleagues at MIT. The covers were done like a Victorian novel with angels, scrolls, and old-style typographical elements. And like a Victorian novel, the books were subtitled \"Principles of Good Programming with Numerous Examples to Improve Programming Style and Proficiency.\" These books and others made a big difference for most of us because they taught us how to think like good programmers.\n\nMy goals in this book are to improve SQL programming style and proficiency. To be more exact:\n\n1. To _help an individual programmer write Standard SQL without an accent or a dialect._ It is difficult to unlearn old habits but not impossible, and it is best to learn the right way from the start. Amateurs write code for themselves. A professional writes codeto be maintained and used by other people. My rule of thumb has been that you need to have a full year of SQL programming before you have your epiphany and suddenly see the world in three: valued logic, data models, and sets.\n\n2. _To give an SQL shop a coding standard for internal use._ I have tried carefully to give a rationale for each of my rules, and I have given exceptions to those rules when I could think of them. You may disagree with some of my choices, but you will have to provide research and examples to defend your position. It is not good enough to simply declare: \"Well, that's the way we wrote code in FooTran, so it must be the will of God!\" as an argument.\n\nIf you are the team leader, you now have a book (and author) that you can hold up and blame for anything that your people do not like. Even if I am later shown to be wrong about something, you will have been consistent. It is much easier to repair errors if they were made consistently.\n\n3. _To give programmers the mental tools to approach a new problem with SQL as their tool._ I tell people it takes about a year to \"get it\" and drop your procedural programming habits.\n\n# 1.2 Acknowledgments\n\nCraig Mullins provided the structure of the chapter on VIEWs in an article in www.DBAzine.com. The formatting style is taken from a house style I have used in CMP magazines and other publications for more than a decade. Peter Gulutzan provided the data for the naming conventions in actual products from an article inwww.DBAzine.com. The affix conventions in Chapter 1 are based on internal standards from Teradata Corporation. The scales and measurements and the encoding schemes material appeared in several of my old magazine columns in _DBMS_ and _Database Programming & Design_ before they were collected into a chapter in my book _Data & Database_ (Morgan-Kaufmann Publishers). I have tried to give credit in the text, but so many people have participated in the newsgroups over the years that I know I am forgetting someone.\n\nAnd, obviously, thanks to Henry Ledgard and his \"Programming Proverbs\" series for the inspiration.\n\nI would also like to thank all of the newbie programmers who wrote bad code. It sounds a bit sarcastic, but it is not meant to be. Many of thenewbies are programmers who were thrown into a DBA or SQL programmer job by management without training or an experienced mentor. I do not want to blame the victims unless they are really not working on getting better. Your errors in syntax, semantics, and style showed me how you were thinking. Diagnosis is the first step to treatment.\n\n# 1.3 Corrections, Comments, and Future Editions\n\nCorrections and additions for future editions can be sent to Morgan-Kaufmann publishers directly or to me at my e-mail address, jcelko212@earthlink.net.\nCHAPTER 1 Names and Data Elements\n\nThis is the old joke:\n\n\"When I was a kid, we had three cats.\"\n\n\"What were their names?\"\n\n\"Cat, cat, and cat.\"\n\n\"That sounds screwed up. How did you tell them apart?\"\n\n\"Who cares? Cats don't come when you call them anyway!\"\n\nYOUR DATA WILL not come when it is called either if you do not give it a name that is always distinct and recognizable. This is an important part of any database project. Bad names for the data elements make the code difficult, or even impossible, to read.\n\nI am not kidding about impossible to read. In the old days, software companies used to deliberately scramble source code names and remove formatting to hide the algorithm from the buyers. The tradition seems to linger on, even if not by intent. In August 2004, a SQL newsgroup had a posting in which all of the names were one letter and a long string of digits.\n\nThere are now ISO-11179 metadata standards that describe rules for naming data elements and for registering standards. Because they are an ISO standard, they are what you should be using in SQL as well as everywhere else.\n\nThat standard, a bit of typography, and some common sense will give you the rules you need to get started.\n\n# 1.1 Names\n\nIn the early days, every programmer had his or her own personal naming conventions. Unfortunately, they were often highly creative. My favorite was a guy who picked a theme for his COBOL paragraph names: one program might use countries, another might use flowers, and so forth. This is obviously weird behavior even for a programmer, but many programmers had personal systems that made sense to themselves but not to other people.\n\nFor example, the first FORTRAN I used allowed only six-letter names, so I became adept at using and inventing six-letter names. Programmers who started with weakly typed or typeless languages like to use Hungarian notation (see Leszynski and Red"
      ],
      "latency_s": 10.75,
      "rag_type": "literag",
      "dominio": "LiteRAG_Multihop_01",
      "titulo": "",
      "error": ""
    },
    {
      "question": "The regular expressions book covers greedy vs lazy quantifiers and the programming languages theory book covers normal forms. What property of a regex engine's greedy matching strategy is analogous to the concept of outermost reduction strategy in lambda calculus?",
      "ground_truth": "Both apply the reduction or match at the outermost or leftmost position first, corresponding to normal-order reduction",
      "answer": "The provided text does not contain information about regular expressions or their greedy matching strategies. Therefore, I cannot answer the question about the analogy between greedy matching in regex engines and outermost reduction strategy in lambda calculus.",
      "contexts": [
        "## Direct Evidence (Source Text)\n[Direct Result]: can be reduced to at most one irreducible term we need to prove that if two computations originating in the same term produce different terms, then they will eventually reach the same irreducible term.\n\nThis property is a consequence of another property of the relation  : confluence. A relation R is confluent if each time we have aR∗b1 and aR∗b2, there exists some c such that b1R∗ c and b2R∗ c.\n\nIt is not difficult to show that confluence implies that each term has at most one irreducible result. If the term t can be reduced to two irreducible terms u1 and u2, then we have t u1 and t u2. Since   is confluent, there exists a term v such that u1  v and u2  v. Since u1 is irreducible, the only term v such that u1  v is u1 itself. Therefore, u1 = v and similarly u2 = v. We conclude that u1 =u2. In other words, t reduces to at most one irreducible term.\n\nWe will not give here the proof of confluence for the relation  . The idea is that when a term t contains two redexes r1 and r2, and t1 is obtained by reducing r1 and t2 is obtained by reducing r2, then we can find the residuals of r2 in t1 and reduce them. Similarly, we can reduce the residuals of r1 in t2, obtaining the same term. For example, by reducing 5 + 6 in 7 + (5 + 6) and reducing 3 + 4 in (3 + 4) + 11, we obtain the same term: 7 + 11.\n\n## 2.3 Reduction Strategies\n\n### 2.3.1 The Notion of a Strategy\n\nSince in PCF each term has at most one result (due to the unicity property mentioned above), it does not matter in which order we reduce the redexes in a term: if we reach an irreducible term, it will always be the same. However, it may be the case that one sequence of reduction reaches an irreducible term whereas another one does not. For example, let C be the term fun x -> 0 and let b1 be the term (fix f (fun x -> (f x))) 0. The term b1 reduces to b2 = (fun x -> (fix f (fun x -> (f x)) x)) 0 and then again to b1. The term Cb1 contains several redexes, and it can be reduced to 0 and to Cb2 which in turn contains several redexes and can be reduced to 0 and Cb1 (amongst other terms). By reducing always the innermost redex, we can build an infinite reduction sequence Cb1  Cb2  Cb1 , whereas reducing the outermost redex produces the result 0.\n\nThis example may seem an exception, because it contains a function C that does not use its argument; but note that the ifz construct is similar, and in the example of the factorial function, when computing the factorial of 3 for instance, we can observe the same behaviour: The term ifz 0 then 1 else 0 * ((fix f fun n -> ifz n then 1 else n * (f (n - 1))) (0 - 1)) has several redexes. Outermost reduction produces the result 1 (the other redexes disappear), whereas reducing the redex fix f fun n -> ifz n then 1 else n * (f (n - 1)) we get an infinite reduction sequence. In other words, the term fact 3 can be reduced to 6, but it can also generate reductions that go on forever.\n\nBoth Cb1 and fact 3 produce a unique result, but not all reduction sequences reach a result.\n\nSince the term Cb1 has the value 0 according to the PCF semantics, an evaluator, that is, a program that takes as input a PCF term and returns its value, should produce the result 0 when computing Cb1. Let us try to evaluate this term using some current compilers. In Caml, the program\n\ndoes not terminate. In Java, we have the same problem with the program\n\nOnly a small number of compilers, using call by name or lazy evaluation, such as Haskell, Lazy-ML or Gaml, produce a terminating program for this term.\n\nThis is because the small-step semantics of PCF does not correspond to the semantics of Caml or Java. In fact, it is too general and when a term has several redexes it does not specify which one should be reduced first. By default, it imposes termination of all programs that somehow can produce a result. An ingredient is missing in this semantic definition: the notion of a strategy, that specifies the order of reduction of redexes.\n\nA strategy is a partial function that associates to each term in its domain one of its redex occurrences. Given a strategy s, we can define another semantics, replacing the relation   by a new relation   such that t u if s t is defined and u is obtained by reducing the redex s t in t. Then, we define the relation   as the reflexive-transitive closure of  , and the relation ↪s as before.\n\nInstead of defining a strategy, an alternative would be to weaken the reduction rules, in particular the congruence rules, so that only some specific reductions can be performed.\n\n### 2.3.2 Weak Reduction\n\nBefore defining outermost or innermost strategies for the term Cb1, let us give another example to show that the operational semantics defined\n\n[Direct Result]: a sorting algorithm is a sorted list.\n\nThe last point that remains to discuss is the rôle of the theory of programming languages, and in particular whether its purpose is to describe the existing programming languages, or to propose new languages.\n\nAstronomers study the galaxies that exist, and do not build new ones, whereas chemists study the existing molecules and build new ones. We know that in the latter case, the order in which theories and production techniques appear may vary: the transformation of mass into energy was achieved long time after the theory of relativity, whereas the steam engine appeared before the principles of thermodynamics were established.\n\nThe theory of programming languages has enabled the development of new features, such as static binding, type inference, polymorphic types, garbage collection,... which are now available in commercial languages. In contrast, other functionalities, such as assignments and objects, were introduced in programming languages wildly, and the theory has been slow to follow. The development of a formal semantics for these constructs led in turn to new proposals, such as the recent extensions of Java with polymorphic types.\n\nThe theory of programming languages has neither an exclusively descriptive rôle nor an exclusively leading rôle. It is this going backwards and forwards between the description of existing features and the design of new ones that gives the theory of programming languages its dynamics.\nGilles Dowek and Jean-Jacques LévyUndergraduate Topics in Computer ScienceIntroduction to the Theory of Programming Languages10.1007/978-0-85729-076-2© Springer-Verlag London Limited 2011\n\nReferences\n\n1.\n\nAbadi, M., Cardelli, L.: A Theory of Objects. Springer, Berlin (1998)\n\n2.\n\nDybvig, R.K.: The Scheme Programming Language, 2nd edn. Prentice Hall, New York (1996). www.scheme.com/tspl2d/\n\n3.\n\nGunter, C.A.: Semantics of Programming Languages: Structures and Techniques. MIT Press, Cambridge (1992)MATH\n\n4.\n\nKahn, G.: Natural semantics. In: Proceedings of the Symp. on Theoretical Aspects of Computer Science, TACS, Passau (1987)\n\n5.\n\nMitchell, J.C.: Foundations for Programming Languages. MIT Press, Cambridge (1996)\n\n6.\n\nMitchell, J.C.: Concepts in Programming Languages. Cambridge University Press, Cambridge (2002)MATHCrossRef\n\n7.\n\nPeyton Jones, S., Lester, D.: Types and Programming Languages. Prentice Hall, New York (1992)\n\n8.\n\nPierce, B.C.: Types and Programming Languages. MIT Press, Cambridge (2002)\n\n9.\n\nPlotkin, G.D.: LCF considered as a programming language. Theor. Comput. Sci. 5 , 223–255 (1977) MathSciNetCrossRef90044-5)\n\n10.\n\nPlotkin, G.D.: A structural approach to operational semantics. Technical Report DAIMI FN–19, Computer Science Department, Aarhus University, Aarhus, Denmark, September 1981\n\n11.\n\nReynolds, J.C.: Theories of Programming Languages. Cambridge University Press, Cambridge (1998)MATHCrossRef\n\n12.\n\nScott, D.: Continuous Lattices. Lecture Notes in Math., vol. 274, pp. 97–136. Springer, Berlin (1972)\n\n13.\n\nWeis, P., Leroy, X.: Le langage Caml, 2nd edn. Dunod, Paris (1999)\n\n14.\n\nWinskel, G.: The Formal Semantics of Programming Languages. MIT Press, Cambridge (1993)MATH\n\nIndex\n\nA\n\nAbstract machine\n\nAlgorithm\n\nDamas and Milner\n\nHindley's\n\nRobinson's\n\nα -equivalence\n\nAlphabetic equivalence\n\nArity\n\nArray\n\nB\n\nβ -reduction\n\nBinding\n\ndynamic\n\nlate\n\nstatic\n\nC\n\nCall by name\n\nCall by value\n\nChurch numeral\n\nClosed set\n\nClosure\n\nrecursive\n\nCompiler\n\nbootstrapping\n\nComposition\n\nConfluence\n\nConstant\n\nContinuous function\n\nD\n\nDe Bruijn index\n\nDefinition\n\nexplicit\n\ninductive\n\nDerivation\n\nDeterministic\n\nE\n\nEnvironment\n\nsemantic\n\ntyping\n\nEvaluate\n\nEvaluator\n\nF\n\nFields\n\nFixed point\n\nCurry\n\nfirst theorem\n\nfunction construction via\n\nin PCF\n\nsecond theorem\n\nFunctionalisation\n\nH\n\nHeight\n\nI\n\nInterpreter\n\nL\n\nLabel\n\nLanguage\n\nLimit\n\nList\n\nM\n\nMethod\n\ndynamic\n\nstatic\n\nModule\n\nN\n\nNumber of arguments\n\nO\n\nObject\n\nOrdering\n\nScott's\n\nstrongly complete\n\nweakly complete\n\nP\n\nPair\n\nPCF ( Programming language for computable functions )\n\nPolymorphism\n\nPosition numerals\n\nR\n\nRecord\n\nin call by name\n\nin call by value\n\nRedex\n\nReduction\n\ncall by name\n\ncall by value\n\nlazy\n\nweak\n\nReference\n\nRegister\n\naccumulator\n\ncode\n\nenvironment\n\nstack\n\nRenaming\n\nResult\n\nRule\n\nS\n\nSemantics\n\nbig-step operational\n\ndenotational\n\nsmall-step operational\n\nSide effect\n\nSolution\n\nprincipal\n\nSort\n\nStrategy\n\nSubject reduction\n\nSubstitution\n\nSystem\n\nF\n\nT\n\nT\n\nTerm\n\nclosed\n\nirreducible\n\nstuck\n\nThunk\n\nTree\n\nType\n\nchecking\n\ninference\n\nprincipal\n\nType preservation\n\nby interpretation\n\nType scheme\n\nU\n\nUnification\n\nV\n\nValue\n\nextended\n\nrational\n\nVariable\n\ncapture\n\nenvironment\n\nmutable\n\n[Direct Result]: Title: Introducing Regular Expressions\nAuthors: Michael Fitzgerald\nDomain: cs\n================================================================================\n\n \n# Introducing Regular Expressions\n\n### Michael Fitzgerald\n\nPublished by O'Reilly Media\n\nBeijing ⋅ Cambridge ⋅ Farnham ⋅ Köln ⋅ Sebastopol ⋅ Tokyo\n\n# SPECIAL OFFER: Upgrade this ebook with O'Reilly\n\nClick here for more information on this offer!\n\n _Please note that upgrade offers are not available from sample content._\n\n# Preface\n\nThis book shows you how to write regular expressions through examples. Its goal is to make learning regular expressions as easy as possible. In fact, this book demonstrates nearly every concept it presents by way of example so you can easily imitate and try them yourself.\n\nRegular expressions help you find patterns in text strings. More precisely, they are specially encoded text strings that match patterns in sets of strings, most often strings that are found in documents or files.\n\nRegular expressions began to emerge when mathematician Stephen Kleene wrote his book _Introduction to Metamathematics_ (New York, Van Nostrand), first published in 1952, though the concepts had been around since the early 1940s. They became more widely available to computer scientists with the advent of the Unix operating system—the work of Brian Kernighan, Dennis Ritchie, Ken Thompson, and others at AT&T Bell Labs—and its utilities, such as _sed_ and _grep_ , in the early 1970s.\n\nThe earliest appearance that I can find of regular expressions in a computer application is in the QED editor. QED, short for Quick Editor, was written for the Berkeley Timesharing System, which ran on the Scientific Data Systems SDS 940. Documented in 1970, it was a rewrite by Ken Thompson of a previous editor on MIT's Compatible Time-Sharing System and yielded one of the earliest if not first practical implementations of regular expressions in computing. (Table A-1 in Appendix A documents the regex features of QED.)\n\nI'll use a variety of tools to demonstrate the examples. You will, I hope, find most of them usable and useful; others won't be usable because they are not readily available on your Windows system. You can skip the ones that aren't practical for you or that aren't appealing. But I recommend that anyone who is serious about a career in computing learn about regular expressions in a Unix-based environment. I have worked in that environment for 25 years and still learn new things every day.\n\n> \"Those who don't understand Unix are condemned to reinvent it, poorly.\" —Henry Spencer\n\nSome of the tools I'll show you are available online via a web browser, which will be the easiest for most readers to use. Others you'll use from a command or a shell prompt, and a few you'll run on the desktop. The tools, if you don't have them, will be easy to download. The majority are free or won't cost you much money.\n\nThis book also goes light on jargon. I'll share with you what the correct terms are when necessary, but in small doses. I use this approach because over the years, I've found that jargon can often create barriers. In other words, I'll try not to overwhelm you with the dry language that describes regular expressions. That is because the basic philosophy of this book is this: Doing useful things can come before knowing everything about a given subject.\n\nThere are lots of different implementations of regular expressions. You will find regular expressions used in Unix command-line tools like _vi_ ( _vim_ ), _grep_ , and _sed_ , among others. You will find regular expressions in programming languages like Perl (of course), Java, JavaScript, C# or Ruby, and many more, and you will find them in declarative languages like XSLT 2.0. You will also find them in applications like Notepad++, Oxygen, or TextMate, among many others.\n\nMost of these implementations have similarities and differences. I won't cover all those differences in this book, but I will touch on a good number of them. If I attempted to document _all_ the differences between _all_ implementations, I'd have to be hospitalized. I won't get bogged down in these kinds of details in this book. You're expecting an introductory text, as advertised, and that is what you'll get.\n\n# Who Should Read This Book\n\nThe audience for this book is people who haven't ever written a regular expression before. If you are new to regular expressions or programming, this book is a good place to start. In other words, I am writing for the reader who has heard of regular expressions and is interested in them but who doesn't really understand them yet. If that is you, then this book is a good fit.\n\nThe order I'll go in to cover the features of regex is from the simple to the complex. In other words, we'll go step by simple step.\n\nNow, if you happen to already know something about regular expressions and how to use them, or if you are an experienced programmer, this book may not be where you want to start. This is a beginner's book, for rank beginners who need some hand-holding. If you have written some regular expressions before, and feel familiar with them, you can start here if you want, but I'm planning to take it slower than you will probably like.\n\nI recommend several books to read after this one. First, try Jeff Friedl's _Mastering Regular Expressions, Third Edition_ (see <http://shop.oreilly.com/product/9781565922570.do>). Friedl's book gives regular expressions a thorough going over, and I highly recommend it. I also recommend the _Regular_ Expressions _Cookbook_ (see <http://shop.oreilly.com/product/978059652"
      ],
      "latency_s": 14.64,
      "rag_type": "literag",
      "dominio": "LiteRAG_Multihop_01",
      "titulo": "",
      "error": ""
    },
    {
      "question": "The Linux Kernel book discusses the sk_buff structure and the SQL Server book discusses buffer pool management. What common computer science concept underlies both the kernel's socket buffer and SQL Server's buffer pool?",
      "ground_truth": "Memory buffering to decouple I/O speeds — caching data in RAM to minimize latency between producers and consumers",
      "answer": "The common computer science concept underlying both the Linux kernel's `sk_buff` structure and SQL Server's buffer pool management is **buffering**.\n\nThe `sk_buff` (socket buffer) is a structure used by the Linux kernel to represent and manage network packets in transit. It acts as a buffer, holding the packet data as it moves through different layers of the networking stack.\n\nSimilarly, a buffer pool in SQL Server is a memory area used to cache data pages that are frequently accessed. This caching mechanism, also known as buffering, helps to reduce the need for slower disk I/O operations by keeping frequently used data in memory.",
      "contexts": [
        "## Direct Evidence (Source Text)\n[Direct Result]: Index599\nRami RosenLinux Kernel NetworkingImplementation and Theory10.1007/978-1-4302-6197-1_1\n\n© Rami Rosen 2014\n\n# 1. Introduction\n\nRami Rosen1\n\n(1)\n\nHaifa, Israel\n\nAbstract\n\nThis book deals with the implementation of the Linux Kernel Networking stack and the theory behind it. You will find in the following pages an in-depth and detailed analysis of the networking subsystem and its architecture. I will not burden you with topics not directly related to networking, which you may encounter while reading kernel networking code (for example, locking and synchronization, SMP, atomic operations, and so on). There are plenty of resources about such topics. On the other hand, there are very few up-to-date resources that focus on kernel networking proper. By this I mean primarily describing the traversal of the packet in the Linux Kernel Networking stack and its interaction with various networking layers and subsystems—and how various networking protocols are implemented.\n\nThis book deals with the implementation of the Linux Kernel Networking stack and the theory behind it. You will find in the following pages an in-depth and detailed analysis of the networking subsystem and its architecture. I will not burden you with topics not directly related to networking, which you may encounter while reading kernel networking code (for example, locking and synchronization, SMP, atomic operations, and so on). There are plenty of resources about such topics. On the other hand, there are very few up-to-date resources that focus on kernel networking proper. By this I mean primarily describing the traversal of the packet in the Linux Kernel Networking stack and its interaction with various networking layers and subsystems—and how various networking protocols are implemented.\n\nThis book is also not a cumbersome, line-by-line code walkthrough. I focus on the essence of the implementation of each network layer and the theory guidelines and principles that led to this implementation. The Linux operating system has proved itself in recent years as a successful, reliable, stable, and popular operating system. And it seems that its popularity is growing steadily, in a wide variety of flavors, from mainframes, data centers, core routers, and web servers to embedded devices like wireless routers, set-top boxes, medical instruments, navigation equipment (like GPS devices), and consumer electronics devices. Many semiconductor vendors use Linux as the basis for their Board Support Packages (BSPs). The Linux operating system, which started as a project of a Finnish student named Linus Torvalds back in 1991, based on the UNIX operating system, proved to be a serious and reliable operating system and a rival for veteran proprietary operating systems.\n\nLinux began as an Intel x86-based operating system but has been ported to a very wide range of processors, including ARM, PowerPC, MIPS, SPARC, and more. The Android operating system, based upon the Linux kernel, is common today in tablets and smartphones, and seems likely to gain popularity in the future in smart TVs. Apart from Android, Google has also contributed some kernel networking features that were merged into the mainline kernel.\n\nLinux is an open source project, and as such it has an advantage over other proprietary operating systems: its source code is freely available under the General Public License (GPL). Other open source operating systems, like the different types of BSD, have much less popularity. I should also mention in this context the OpenSolaris project, based on the Common Development and Distribution License (CDDL). This project, started by Sun Microsystems, has not achieved the popularity that Linux has. Among the large community of active Linux developers, some contribute code on behalf of the companies they work for, and some contribute code voluntarily. All of the kernel development process is accessible via the kernel mailing lists. There is one central mailing list, the Linux Kernel Mailing List (LKML), and many subsystems have their own mailing lists. Contributing code is done via sending patches to the appropriate kernel mailing lists and to the maintainers, and these patches are discussed over the mailing lists.\n\nThe Linux Kernel Networking stack is a very important subsystem of the Linux kernel. It is quite difficult to find a Linux-based system, whether it is a desktop, a server, a mobile device or any other embedded device, that does not use any kind of networking. Even in the rare case when a machine doesn't have any hardware network devices, you will still be using networking (maybe unconsciously) when you use X-Windows, as X-Windows itself is based upon client-server networking. A wide range of projects are related to the Linux Networking stack, from core routers to small embedded devices. Some of these projects deal with adding vendor-specific features. For example, some hardware vendors implement Generic Segmentation Offload (GSO) in some network devices. GSO is a networking feature of the kernel network stack that divides a large packet into smaller ones in the Tx path. Many hardware vendors implement checksumming in hardware in their network devices. Checksum is a mechanism to verify that a packet was not damaged on transit by calculating some hash from the packet and attaching it to the packet. Many projects provide some security enhancements for Linux. Sometimes these enhancements require some changes in the networking subsystem, as you will see, for example, in Chapter 3, when discussing the Openwall GNU/*/Linux project. In the embedded device arena there are, for example, many wireless routers that are Linux based; one example is the WRT54GL Linksys router, which runs Linux. There is also an open source, Linux-based operating system that can run on this device (and on some other devices), named OpenWrt, with a large and active community of developers (see  https://openwrt.org/ ). Learning about how the various protocols are implemented by the Linux Kernel Networking stack and becoming familiar with the main data structures and the main paths of a packet in it are essential to understanding it better.\n\n## The Linux Network Stack\n\n[Direct Result]: on the netdev_chain, by calling the raw_notifier_call_chain() method.\n\n#### int blocking_notifier_call_chain(struct blocking_notifier_head *nh, unsigned long val, void *v);\n\nThis method is for generating notification events; eventually, after using locking mechanism, it invokes the notifier_call_chain() method.\n\n#### int __atomic_notifier_call_chain(struct atomic_notifier_head *nh,unsigned long val, void *v, int nr_to_call, int *nr_calls);\n\nThis method is for generating notification events. Eventually, after using locking mechanism, it invokes the notifier_call_chain() method.\n\n### Macros\n\nHere you'll find a description of the macro that was covered in this chapter.\n\n#### pci_register_driver()\n\nThis macro registers a PCI driver in the PCI subsystem. It gets a pci_driver object as a parameter. It is usually called in the network driver module_init() method.\nRami RosenLinux Kernel NetworkingImplementation and Theory10.1007/978-1-4302-6197-1_15\n\n© Rami Rosen 2014\n\n# Linux API\n\nRami Rosen1\n\n(1)\n\nHaifa, Israel\n\nAbstract\n\nIn this appendix I cover the two most fundamental data structures in the Linux Kernel Networking stack: the sk_buff and the net_device. This is reference material that can help when reading the rest of this book, as you will probably encounter these two structures in almost every chapter. Becoming familiar with and learning about these two data structures is essential for understanding the Linux Kernel Networking stack. Subsequently, there is a section about remote DMA (RDMA), which is further reference material for Chapter 13. It describes in detail the main methods and the main data structures that are used by RDMA. This appendix is a good place to always return to, especially when looking for definitions of the basic terms.\n\nIn this appendix I cover the two most fundamental data structures in the Linux Kernel Networking stack: the sk_buff and the net_device. This is reference material that can help when reading the rest of this book, as you will probably encounter these two structures in almost every chapter. Becoming familiar with and learning about these two data structures is essential for understanding the Linux Kernel Networking stack. Subsequently, there is a section about remote DMA (RDMA), which is further reference material for Chapter 13. It describes in detail the main methods and the main data structures that are used by RDMA. This appendix is a good place to always return to, especially when looking for definitions of the basic terms.\n\n## The sk_buff Structure\n\nThe sk_buff structure represents a packet. SKB stands for socket buffer. A packet can be generated by a local socket in the local machine, which was created by a userspace application; the packet can be sent outside or to another socket in the same machine. A packet can also be created by a kernel socket; and you can receive a physical frame from a network device (Layer 2) and attach it to an sk_buff and pass it on to Layer 3. When the packet destination is your local machine, it will continue to Layer 4. If the packet is not for your machine, it will be forwarded according to your routing tables rules, if your machine supports forwarding. If the packet is damaged for any reason, it will be dropped. The sk_buff is a very large structure; I mention most of its members in this section. The sk_buff structure is defined in include/linux/skbuff.h . Here is a description of most of its members:\n\n  * ktime_t tstamp\n\nTimestamp of the arrival of the packet. Timestamps are stored in the SKB as offsets to a base timestamp. Note: do not confuse tstamp of the SKB with hardware timestamping, which is implemented with the hwtstamps of skb_shared_info. I describe the skb_shared_info object later in this appenidx.\n\nHelper methods:\n\n  * skb_get_ktime(const struct sk_buff *skb): Returns the tstamp of the specified skb.\n\n  * skb_get_timestamp(const struct sk_buff *skb, struct timeval *stamp): Converts the offset back to a struct timeval.\n\n  * net_timestamp_set(struct sk_buff *skb): Sets the timestamp for the specified skb. The timestamp calculation is done with the ktime_get_real() method, which returns the time in ktime_t format.\n\n  * net_enable_timestamp(): This method should be called to enable SKB timestamping.\n\n  * net_disable_timestamp(): This method should be called to disable SKB timestamping.\n\n  * struct sock *sk\n\nThe socket that owns the SKB, for local generated traffic and for traffic that is destined for the local host. For packets that are being forwarded, sk is NULL. Usually when talking about sockets you deal with sockets which are created by calling the socket() system call from userspace. It should be mentioned that there are also kernel sockets, which are created by calling the sock_create_kern() method. See for example in vxlan_init_net() in the VXLAN driver, drivers/net/vxlan.c.\n\nHelper method:\n\n  * skb_orphan(struct sk_buff *skb): If the specified skb has a destructor, call this destructor; set the sock object (sk) of the specified skb to NULL, and set the destructor of the specified skb to NULL.\n\n  * struct net_device *dev\n\nThe dev member is a net_device object which represents the network interface device associated to the SKB; you will sometimes encounter the term NIC (Network Interface Card) for such a network device. It can be the network device on which the packet arrives, or the network device on which the packet will be sent. The net_device structure will be discussed in depth in the next section.\n\n  * char cb[48]\n\nThis is the control buffer. It is free to use by any layer. This is an opaque area used to store private information. For example, the TCP protocol uses it\n\n[Direct Result]: , netdev: netdev@vger.kernel.org, archived at  www.spinics.net/lists/netdev . This is a high volume list. Most of the posts are patches and Request for Comments (RFCs) for new code, along with comments and discussions about patches. This mailing list handles the Linux Kernel Networking stack and network device drivers, except for cases when dealing with a subsystem that has a specific mailing list and a specific git repository (such as the wireless subsystem, discussed in Chapter 12). Development of the iproute2 and the ethtool userspace packages is also handled in the netdev mailing list. It should be mentioned here that not every networking subsystem has a mailing list of its own; for example, the IPsec subsystem (discussed in Chapter 10), does not have a mailing list, nor does the IEEE 802.15.4 subsystem (Chapter 14). Some networking subsystems have their own specific git tree, maintainer, and mailing list, such as the wireless mailing list and the Bluetooth mailing list. From time to time the maintainers of these subsystems send a pull request for their git trees over the netdev mailing list. Another source of information is Documentation/networking in the kernel tree. It has a lot of information in many files about various networking topics, but keep in mind that the file that you find there is not always up to date.\n\nThe Linux Kernel Networking subsystem is maintained in two git repositories. Patches and RFCs are sent to the netdev mailing list for both repositories. Here are the two git trees:\n\n  * net:  http://git.kernel.org/?p=linux/kernel/git/davem/net.git : for fixes to existing code already in the mainline tree\n\n  * net-next:  http://git.kernel.org/?p=linux/kernel/git/davem/net-next.git : new code for the future kernel release\n\nFrom time to time the maintainer of the networking subsystem, David Miller, sends pull requests for mainline for these git trees to Linus over the LKML. You should be aware that there are periods of time, during merge with mainline, when the net-next git tree is closed, and no patches should be sent. An announcement about when this period starts and another one when it ends is sent over the netdev mailing list.\n\nNote\n\nThis book is based on kernel 3.9. All the code snippets are from this version, unless explicitly specified otherwise. The kernel tree is available from  www.kernel.org  as a tar file. Alternatively, you can download a kernel git tree with git clone (for example, using the URLs of the git net tree or the git net-next tree, which were mentioned earlier, or other git kernel repositories). There are plenty of guides on the Internet covering how to configure, build, and boot a Linux kernel. You can also browse various kernel versions online at  http://lxr.free-electrons.com/ . This website lets you follow where each method and each variable is referenced; moreover, you can navigate easily with a click of a mouse to previous versions of the Linux kernel. In case you are working with your own version of a Linux kernel tree, where some changes were made locally, you can locally install and configure a Linux Cross-Referencer server (LXR) on a local Linux machine. See  http://lxr.sourceforge.net/en/index.shtml .\n\n## Summary\n\nThis chapter is a short introduction to the Linux Kernel Networking subsystem. I described the benefits of using Linux, a popular open source project, and the Kernel Networking Development Model. I also described the network device structure (net_device) and the socket buffer structure (sk_buff), which are the two most fundamental structures of the networking subsystem. You should refer to Appendix A for a detailed description of almost all the members of these structures and their uses. This chapter covered other important topics related to the traversal of a packet in the kernel networking stack, such as the lookup in the routing subsystem, fragmentation and defragmentation, protocol handler registration, and more. Some of these protocols are discussed in later chapters, including IPv4, IPv6, ICMP4 and ICMP6, ARP, and Neighbour Discovery. Several important subsystems, including the wireless subsystem, the Bluetooth subsystem, and the IEEE 812.5.4 subsystem, are also covered in later chapters. Chapter 2 starts the journey in the kernel network stack with netlink sockets, which provide a way for bidirectional communication between the userspace and the kernel, and which are talked about in several other chapters.\nRami RosenLinux Kernel NetworkingImplementation and Theory10.1007/978-1-4302-6197-1_2\n\n© Rami Rosen 2014\n\n# 2. Netlink Sockets\n\nRami Rosen1\n\n(1)\n\nHaifa, Israel\n\nAbstract\n\nChapter 1 discusses the roles of the Linux kernel networking subsystem and the three layers in which it operates. The netlink socket interface appeared first in the 2.2 Linux kernel as AF_NETLINK socket. It was created as a more flexible alternative to the awkward IOCTL communication method between userspace processes and the kernel. The IOCTL handlers cannot send asynchronous messages to userspace from the kernel, whereas netlink sockets can. In order to use IOCTL, there is another level of complexity: you need to define IOCTL numbers. The operation model of netlink is quite simple: you open and register a netlink socket in userspace using the socket API, and this netlink socket handles bidirectional communication with a kernel netlink socket, usually sending messages to configure various system settings and getting responses back from the kernel.\n\nChapter 1 discusses the roles of the Linux kernel networking subsystem and the three layers in which it operates. The netlink socket interface appeared first in the 2.2 Linux kernel as AF_NETLINK socket. It was created as a more flexible alternative to"
      ],
      "latency_s": 1.69,
      "rag_type": "literag",
      "dominio": "LiteRAG_Multihop_01",
      "titulo": "",
      "error": ""
    },
    {
      "question": "The VBA book covers error handling and the Java book covers exception handling. What structural difference exists between VBA's On Error GoTo mechanism and Java's try-catch-finally block?",
      "ground_truth": "VBA uses unstructured goto-based error handling while Java uses structured block-based exception handling with typed exceptions",
      "answer": "The VBA book describes the `On Error GoTo` statement, which triggers when a runtime error occurs and allows for custom code to respond to the error. The Java book describes the `try-catch-finally` block, which is used to handle exceptions.\n\nA key structural difference is that VBA's `On Error GoTo` mechanism branches execution to a specified label (an error handler routine) when an error occurs. In contrast, Java's `try-catch-finally` block is a more structured approach where specific blocks of code are designated for:\n\n*   **`try`**: The code that might throw an exception.\n*   **`catch`**: The code that handles a specific type of exception if it is thrown within the `try` block. Multiple `catch` blocks can be used for different exception types.\n*   **`finally`**: The code that will execute regardless of whether an exception was thrown or caught.\n\nThe Java approach offers more explicit control over which exceptions are handled and provides a dedicated block for cleanup code that must run irrespective of error conditions. VBA's `On Error GoTo` is a more general mechanism that redirects execution flow.",
      "contexts": [
        "## Direct Evidence (Source Text)\n[Direct Result]: its execution. Otherwise, an error is generated, and execution branches to the ErrorHandler label in line 13, where the error handler becomes active.\n  * Line 14 is a spacer. Line 15 then compares the value of the error to 5174 (the error that occurs if VBA can't find the file) and to 5273 (the error that occurs if the document name or path isn't valid in Word). If either of these comparisons matches, line 15 displays a message box advising users of the error and prompting them to enter the correct filename.\n  * The Resume statement in line 16 then returns execution to the StartHere label in line 5. Line 17 is a spacer.\n\n* * *\n\nTry Inserting a Counter Variable to Deal with Repetitious User Errors\n\nFor some procedures, you may want to build in a counter mechanism to prevent users from repeating the same error endlessly because they don't grasp what's wrong. By incrementing a counter variable each time the error handler is invoked and checking the resulting number, you can choose to take a different action after a number of unsuccessful attempts to execute a particular action.\n\n* * *\n\nYou can't use a Resume statement anywhere other than in an error-handling routine (or an On Error Resume Next statement). If you do, VBA reports an error.\n\n## Getting a Description of an Error\n\nTo see the description of the current error, return the Description property of the Err object:\n\n    MsgBox Err.Description\n\nIn general, operating-system and programming-language error messages tend to be terse, cryptic, and of less help to the end user than to the people who built the OS or language. Think twice before displaying one of these error messages to an end user. The error message shown in Figure 17.7 says \"Run-time error '5941': The requested member of the collection does not exist.\" As you can imagine, most users would be baffled by this message; some would panic.\n\nUsually, it's more effective, not to mention kinder, to write and display a more verbose error message of your own devising. It should explain in ordinary English what the problem is—and, preferably, what (if anything) the user can do to solve it.\n\n## Raising Your Own Errors\n\nAs part of your testing, you may want to deliberately simulate errors so that you can see how well your error handler handles them. (Programming lingo sometimes substitutes the word _raise_ for _cause_ or _trigger._ Nobody knows why.)\n\nTo cause an error to be triggered, use the Raise method of the Err object, specifying only the _number_ argument. _number_ is a Long argument giving the number of the error that you want to cause. For example, the following statement \"raises\" error 5121:\n\n    Err.Raise 5121\n\n# Suppressing Alerts\n\nMany of the procedures you build will use message boxes or dialog boxes to allow the user to choose options for the procedure. In some applications—such as Word, Excel, PowerPoint, and Access—you can use the DisplayAlerts property of the Application object to suppress the display of message boxes and errors while a procedure is running:\n\n  * In Word, DisplayAlerts can be set to wdAlertsNone (0) to suppress alerts and message boxes, wdAlertsMessageBox (-2) to suppress alerts but display message boxes, or wdAlertsAll (-1, the default) to display all alerts and message boxes. DisplayAlerts is a sticky setting. You need to set DisplayAlerts explicitly back to one of four things: to True or to wdAlertsAll when you want to see alerts again after setting it to False, to wdAlertsNone, or to wdAlertsMessageBox. VBA resets the default value when you restart Word.\n  * In Excel, DisplayAlerts is a read/write Boolean property that can be set to True to display alerts and False to suppress them. The setting sticks until you change it or restart Excel, at which point VBA resets it to True.\n  * In PowerPoint, DisplayAlerts is a read/write property that can be set to ppAlertsAll to display all alerts and ppAlertsNone to suppress all alerts. The setting sticks until you change it or until you restart PowerPoint, at which point VBA resets it to ppAlertsNone.\n  * In Access, you use the pervasive DoCmd object's SetWarnings method, like this:\n\n          DoCmd.SetWarnings False\n\n# Handling User Interrupts in Word, Excel, and Project\n\nErrors may seem quite enough of a problem, but you also need to decide what will happen if a user tries to interrupt your code by pressing Ctrl+Break during execution. Some VBA hosts, including Word and Excel, offer you three options:\n\n  * You can allow a user interrupt to stop your code. This is the easy way to proceed (and, as the default condition, needs no effort on your part), but in complex procedures, it may cause problems. For example, the user may have spent five minutes typing in data, only to lose it because the data wasn't saved due to the early termination of the program.\n  * You can prevent user interrupts by disabling user input while the procedure is running. This is simple to do, but you run the risk of creating unstoppable code if a procedure enters an endless loop. The user would have to power down the machine or, at least, invoke Task Manager and kill your task. Any unsaved work in the procedure or even the host application will be lost. The user might have been typing for _hours_ without saving their work. Losing this much...it can send some people _right over the edge_.\n  * As a compromise between the first two options, you can allow user interrupts during certain parts of a procedure and prevent user interrupts during more critical parts of a procedure.\n\n## Disabling\n\n[Direct Result]: , the thrown exception is caught, the reference to the object is assigned to the parameter exception , and the error message is displayed. Theoretically in the throw statement, any instance of the Throwable class or its subclasses including the Error class can be created. However, programs should not try to handle objects of the Error class or its subclasses. In general, only an instance of Exception class or its subclasses should be handled by programs, and this is why an object of the RuntimeException class that is a subclass of the Exception class was thrown in Fig. B.4 .\n\nFig. B.4\n\nA program with multiple catch blocks\n\nAlso notice that there are multiple catch blocks in the code shown in Fig. B.4 . When there are multiple catch blocks in a try-catch statement, they are checked in the order they are listed. Once a matching catch block is found, none of the subsequent ones are checked. Using the same input as before, when the input 8o is entered during the first iteration of the while loop, an InputMismatchException will be thrown and control looks for a matching catch block. In this case, the first catch block is executed, and then control will go back to the beginning of the while loop ignoring the second catch block. When the input 180 is entered, which is a valid integer value, the if condition is checked. Because the condition is false , a RuntimeException is thrown and control searches a matching catch block. Since this exception is not an object of the InputMismatchException class, the first catch block is skipped and the second catch block is executed. If the exception is thrown and there is not a matching catch block, then the system will handle the thrown exception by halting execution.\n\nBecause the execution classes form an inheritance hierarchy, it is important to place the catch block for specialized exception classes before those for the more general exception classes. For example, consider the reversed order of the catch blocks from Fig. B.4 as shown below:\n\ntry {\n\nscore = scanner.nextInt();\n\nif(score < 0 || score > 100)\n\nthrow new RuntimeException();\n\nflag = false;\n\n}\n\ncatch(RuntimeException exception) {\n\nSystem.out.println(\"Error: Score must be in 0-100.\");\n\n}\n\ncatch(InputMismatchException exception) {\n\nscanner.next();\n\nSystem.out.println(\"Error: Score must be an integer.\");\n\n}\n\nThis results in a compiler error with the message:\n\nexception java.util.InputMismatchException has already\n\nbeen caught\n\nWhy? Recall that the InputMismatchException class is a subclass of the RuntimeException class as shown in Fig. B.1 and partially repeated below:\n\n  * Exception\n\n    * IOException\n\n      *...\n\n    * RuntimeException\n\n      *...\n\n      * NoSuchElementException\n\n        * InputMismatchException\n\nWhen the object of the InputMismatchException class is thrown, the first catch block is executed and all other catch blocks are ignored. This means that the second catch block will never be executed because any exception object that is an instance of the RuntimeException class or its subclasses will match the first catch block.\n\nWhen there are multiple catch blocks, each catch clause has to correspond to a specific type of exception. With the example above, since the InputMismatchException class is a subclass of the RuntimeException class, both exceptions could be caught by the catch clause with RuntimeExeption . Further, having two catch clauses for the same type of exception in the try-catch statement, as shown below, will cause the compiler to issue an error message \"exception java.lang.RuntimeException has already been caught\" in the second catch clause.\n\ntry {\n\nscore = scanner.nextInt();\n\nif(score < 0 || score > 100)\n\nthrow new RuntimeException();\n\nflag = false;\n\n}\n\ncatch(RuntimeException exception) {\n\nscanner.next();\n\nSystem.out.println(\"Error: Score must be an integer.\");\n\n}\n\ncatch(RuntimeException exception) {\n\nSystem.out.println(\"Error: Score must be in 0-100.\");\n\n}\n\nIf there is a block of code that needs to be executed regardless of whether an exception is thrown, then the try-catch statement can include a finally block which must appear after all of the catch blocks. Consider the following while loop modified from Fig. B.4 with a finally block added at the end of the try-catch statement:\n\nThe output using the same input values, 8o , 180 , and 80 , is shown below:\n\nEnter the score: 8o\n\nError: Score must be integer.\n\nEnd of try-catch statement.\n\nEnter the score: 180\n\nError: Score must be in 0-100.\n\nEnd of try-catch statement.\n\nEnter the score: 80\n\nEnd of try-catch statement.\n\nYour score is 80.\n\nSince the first two inputs were invalid, both an error message from the catch block and a message from the finally block were output. The last input did not throw an exception, so all the catch blocks were skipped, but the message from the finally block was still displayed.\n\n### B.4 Checked and Unchecked Exceptions\n\nAmong the exceptions, including the ones listed in Fig. B.1 , there are two categories: checked and unchecked. Unchecked exceptions are those that inherit from the Error class or the RuntimeException class. They are also called runtime exceptions because they are detected during runtime. As mentioned before, the exceptions that inherit from the Error class are thrown when a critical error occurs, and therefore they should not be handled by the program. Exceptions that were handled in the previous sections are all instances of the RuntimeException class or its subclasses. However, in general not all the possible exceptions from the RuntimeException class are handled in the program because handling each one of them in the program is not practical. As a result, exception handling should only be used when the problem can be corrected, and simply catching and ignoring any exception is a bad practice.\n\nA RuntimeException indicates programming errors, so it could possibly be avoided altogether by writing better code. However, large applications might never be entirely bug-free, and exception handling\n\n[Direct Result]: to the procedure that called it. For example, it might pass back a message describing whether the actions taken in the procedure were (or were not) accomplished successfully.\n\n**Master It**\n\nWhat kind of procedure can pass back information to the caller?\n\n**Solution**\n\nOnly functions can pass back information to a caller. Subroutines can accept data (arguments) like functions, but subroutines cannot pass data back to the caller.\n\n**Understand what classes are and what they're for.**\n\nContemporary computer programs employ classes for various reasons—to help organize large programs, to make code more easily reusable, to provide certain kinds of security, or as a superior substitute for public variables. But beginners sometimes have a hard time wrapping their minds around the concept, particularly the relationship between classes and objects.\n\n**Master It**\n\nWhat is the difference between a class and an object?\n\nChoose the correct answer (only one answer is correct):\n\n**1.** A class is like a cookie and an object is like a cookie cutter.\n\n**2.** A class is like a programmer and an object is like a module.\n\n**3.** A class is like a blueprint and an object is like a house built from that blueprint.\n\n**Solution**\n\nThe answer is 3. A class is like a blueprint and an object is like a house built from that blueprint.\n\n**Create a class.**\n\nThe VBA Editor employs a special kind of module for containing classes.\n\n**Master It**\n\nHow do you create a class module in the VBA Editor?\n\n**Solution**\n\nThere are three ways to create a class module:\n\nRight-click the name of the target project in the Project Explorer (or right-click one of the items contained within the project). Then choose Insert ⇒ Class Module from the context menu.\n\nClick the Insert button on the Standard toolbar and choose Class Module from the drop-down list.\n\nChoose Insert ⇒ Class Module from the menu bar.\n\n# Chapter 17: Debugging Your Code and Handling Errors\n\n**Understand the basic principles of debugging.**\n\nA major aspect of programming is testing your code. Debugging can be enjoyable if you think of it as a puzzle that you can solve. But whether or not you enjoy it, debugging is essential if you want to preserve a reputation as a professional.\n\n**Master It**\n\nWhen testing your code, try to imagine ways that the code could fail. Describe a situation that can produce unanticipated results.\n\n**Solution**\n\nA user may try to run a document-formatting procedure without first opening a document.\n\nOr the user might try to open a file and trigger certain errors—perhaps the file doesn't exist, or is currently in use by another computer, or is on a network drive, floppy drive, CD-ROM drive, or removable drive that isn't available at the time.\n\nYou'll also run into other peripheral-related errors if the user tries to use a printer or other remote device (say, a scanner or a digital camera) that's not present, connected, powered up, or configured correctly.\n\nSimilarly, any procedure that deals with a particular object in a document (for example, a chart in Excel) will run into trouble if that object is not present or not available.\n\n**Recognize the four different types of errors you'll create.**\n\nExperts have concluded that there are four primary categories of error in programs.\n\n**Master It**\n\nName two of the four basic types of programming errors.\n\n**Solution**\n\nHere are the four basic types of programming errors:\n\nLanguage errors\n\nCompile errors\n\nRuntime errors\n\nProgram logic errors\n\n**Employ VBA's debugging tools.**\n\nThe VBA Editor and VBA include a generous assortment of debugging tools to help you track down and remove bugs from your procedures. The main windows you'll employ for debugging are the Immediate window, the Locals window, and the Watch window.\n\n**Master It**\n\nThe Watch window is especially useful because you can set watch expressions (also known as conditional breakpoints). Describe this debugging tactic.\n\n**Solution**\n\nWatch expressions are flexible and powerful debugging tools. You can ask the VBA Editor to break on any kind of expression you can think up, such as any line that causes a variable to exceed a certain value, go below zero, change to a shorter string length, and so on.\n\nYou specify a condition (a watch expression such as X < 0), and the VBA Editor automatically halts execution and displays the line where this occurs.\n\n**Deal with runtime errors**\n\nYou can trap some runtime errors (errors that show up while a procedure is executing) while debugging your code. But others show up only while your user is interacting with your program—and you're probably not there to help them. There is a way, though, to soften the blow and, in some cases, even fix a problem by adding error handlers to your programs.\n\n**Master It**\n\nError handlers are special statements and sections of code that detect and then manage runtime errors. What VBA statement detects a runtime error?\n\n**Solution**\n\nVBA's On Error statement triggers when there is a runtime error, allowing you to write code that responds to the error.\n\n# Chapter 18: Building Well-Behaved Code\n\n**Understand the characteristics of well-behaved procedures.**\n\nWell-behaved procedures don't annoy or alarm the user either during or after their execution.\n\n**Master It**\n\nName two ways programmers can write procedures that don't annoy users.\n\n**Solution**\n\nHere are some ways programmers can avoid annoying users by their procedures' actions:\n\nMake no durable or detectable changes to the user environment—other than changes the procedure is designed to make. In other words, restore the previous settings.\n\nPresent the user with relevant choices for the procedure and relevant information once the procedure has finished running.\n\nShow or tell the user what is happening while the procedure is running.\n\nMake sure whenever possible that conditions are appropriate for the procedure to run successfully—before the procedure takes any actions.\n\nAnticipate or trap errors to"
      ],
      "latency_s": 9.36,
      "rag_type": "literag",
      "dominio": "LiteRAG_Multihop_01",
      "titulo": "",
      "error": ""
    },
    {
      "question": "The optimization book covers the Traveling Salesman Problem and the statistics book covers combinatorics. What combinatorial formula gives the exact number of possible tours for the TSP with n cities, making exact solutions infeasible?",
      "ground_truth": "(n-1)! / 2",
      "answer": "The search space for the Traveling Salesman Problem (TSP) with $n$ cities is $n!$. This is because a tour can be represented as a permutation of the cities, and there are $n!$ possible permutations for $n$ cities.",
      "contexts": [
        "## Direct Evidence (Source Text)\n[Direct Result]: GA, which encodes a different weight vector into each solution of the genetic population (use function rgba); and\n\n2.\n\nNSGA-II algorithm.\n\nFor both approaches, use a population size of 20,100 generations and a dimension of D = 8.\n\nReferences\n\nDeb K (2001) Multi-objective optimization. In: Multi-objective optimization using evolutionary algorithms. Wiley, Chichester, pp 13–46MATH\n\nFreitas AA (2004) A critical review of multi-objective optimization in data mining: a position paper. ACM SIGKDD Explor Newslett 6(2):77–86CrossRefMathSciNet\n\nGoldberg DE, Deb K (1991) A comparative analysis of selection schemes used in genetic algorithms, Urbana 51:61801–62996.\n\nHuband S, Hingston P, Barone L, While L (2006) A review of multiobjective test problems and a scalable test problem toolkit. IEEE Trans Evol Comput 10(5):477–506CrossRef\n\nKonak A, Coit DW, Smith AE (2006) Multi-objective optimization using genetic algorithms: a tutorial. Reliab Eng Syst Saf 91(9):992–1007CrossRef\n\nLuke S (2012) Essentials of metaheuristics. Lulu.com, online version at http://​cs.​gmu.​edu/​~sean/​book/​metaheuristics\n\nMichalewicz Z, Fogel D (2004) How to solve it: modern heuristics. Springer, BerlinCrossRef\n© Springer International Publishing Switzerland 2014\n\nPaulo CortezModern Optimization with RUse R!10.1007/978-3-319-08263-9_7\n\n# 7. Applications\n\nPaulo Cortez1\n\n(1)\n\nDepartment of Information Systems, University of Minho, Guimarães, Portugal\n\n## 7.1 Introduction\n\nPrevious chapters have approached demonstrative optimization tasks that were synthetically generated. The intention was to present a tutorial perspective and thus more simpler tasks were approached. As a complement, this chapter addresses real-world applications, where the data available is taken from a physical phenomena. Exemplifying the optimization of real-world data in R is interesting for two main reasons. First, physical phenomena may contain surprising or unknown features. Second, it provides additional code examples of how to load real-world data into R.\n\nThis chapter addresses three real-world tasks that are discussed in the next sections: traveling salesman problem (TSP), time series forecasting (TSF), and wine quality classification.\n\n## 7.2 Traveling Salesman Problem\n\nThe TSP is a classical combinatorial optimization. The goal is to find the cheapest way of visiting all cities (just once) of a given map, starting in one city and ending in the same city (Reinelt 1994). The complete traveling is known as Hamiltonian cycle or TSP tour. The standard TSP assumes symmetric costs, where the cost of visiting from city A to B is the same as visiting from B to A. This problem is non-deterministic polynomial (NP)-complete, which means that there is no algorithm capable of reaching the optimum solution in a polynomial time (in respect to n) for all possible TSP instances of size n. While being a complex task, TSP has been heavily studied in the last decades and a substantial improvement has been reached. For example, in 1954 an instance with 49 cities was the maximum TSP size solved, while in 2004 the record was established in 24,978 cities (Applegate et al. 2011).\n\nDue to its importance, several optimization methods were devised to specifically address the TSP, such as 2-opt and concorde . The former method is a local search algorithm that is tested in this section and starts with a random tour and then exchanges two cities in order to avoid any two crossing paths until no improvements are possible (Croes 1958). The latter is a recent advanced exact TSP solver for symmetric TSPs and that is based on branch-and-cut approach (Applegate et al. 2001). Rather than competing with these TSP specific methods, in this section the TSP is used as an application domain to show how ordered representations can be handled by modern optimization methods. Also, it is used as example to demonstrate how a Lamarckian evolution works.\n\nAn ordered representation is a natural choice for TSP since it assumes that solutions can be generated as permutations of the symbols from an alphabet. Without losing generality, the alphabet can be defined by the integers in the set {1, 2,..., n} (Rocha et al. 2001). Under this representation, the search space is n! for a particular TSP instance of size n. The adaption of modern optimization methods to this representation type requires assuring that generated solutions (e.g., created in the initialization and change functions of Algorithm 1) are feasible, avoiding missing integers and repeated values.\n\nFor single-state methods, several mutation operators can be adopted to change solutions, such as (Michalewicz and Fogel 2004): exchange , insertion , and displacement . The first operator swaps two randomly selected cities, the second operator inserts a city into a random position and the third operator inserts a random subtour into another position. Figure 7.1 shows examples of these order mutations.\n\nFig. 7.1\n\nExample of three order mutation operators\n\nFor evolutionary approaches, there are several crossover methods that preserve order, such as partially matched crossover (PMX) , order crossover (OX) , and cycle crossover (CX) (Rocha et al. 2001). PMX first selects two cutting points and the corresponding matching section is exchanged between\n\n[Direct Result]: order evolutionary algorithm, the Qatar TSP was selected and that includes 194 cities. Other national TSPs are available at http://​www.​math.​uwaterloo.​ca/​tsp/​world/​countries.​html. The R code is presented in file tsp.R:\n\n### tsp.R file ###\n\nlibrary(TSP) # load TSP package\n\nlibrary(RCurl) # load RCurl package\n\nsource(\"oea.R\") # load ordered evolutionary algorithm\n\n# get Qatar - 194 cities TSP instance:\n\ntxt=getURL(\"http://​www.​math.​uwaterloo.​ca/​tsp/​world/​qa194.​tsp\")\n\n# simple parse of txt object, removing header and last line:\n\ntxt=strsplit(txt,\"NODE_COORD_SECTION\") # split text into 2 parts\n\ntxt=txt[[1]][2] # get second text part\n\ntxt=strsplit(txt,\"EOF\") # split text into 2 parts\n\ntxt=txt[[1]][1] # get first text part\n\n# save data into a simple .csv file, sep=\" \":\n\ncat(txt,file=\"qa194.csv\")\n\n# read the TSP format into Data\n\n# (first row is empty, thus header=TRUE)\n\n# get city Cartesian coordinates\n\nData=read.table(\"qa194.csv\",sep=\" \")\n\nData=Data[,3:2] # longitude and latitude\n\nnames(Data)=c(\"x\",\"y\") # x and y labels\n\nN=nrow(Data) # number of cities\n\n# distance between two cities (EUC_2D-norm)\n\n# Eulidean distance rounded to whole number\n\nD=dist(Data,upper=TRUE)\n\nD[1:length(D)]=round(D[1:length(D)])\n\n# create TSP object from D:\n\nTD=TSP(D)\n\nset.seed(12345) # for replicability\n\ncat(\"2-opt run:\\n\")\n\nPTM=proc.time() # start clock\n\nR1=solve_TSP(TD,method=\"2-opt\")\n\nsec=(proc.time()-PTM)[3] # get seconds elapsed\n\nprint(R1) # show optimum\n\ncat(\"time elapsed:\",sec,\"\\n\")\n\nMAXIT=100000\n\nMethods=c(\"SANN\",\"EA\",\"LEA\") # comparison of 3 methods\n\nRES=matrix(nrow=MAXIT,ncol=length(Methods))\n\nMD=as.matrix(D)\n\n# overall distance of a tour (evaluation function):\n\ntour=function(s)\n\n{ # compute tour length:\n\nEV<<-EV+1 # increase evaluations\n\ns=c(s,s[1]) # start city is also end city\n\nres=0\n\nfor(i in 2:length(s)) res=res+MD[s[i],s[i-1]]\n\n# store memory with best values:\n\nif(res<BEST) BEST<<-res\n\nif(EV<=MAXIT) F[EV]<<-BEST\n\n# only for hybrid method:\n\n# return tour\n\nreturn(res)\n\n}\n\n# move city index according to dir\n\nmindex=function(i,dir,s=NULL,N=length(s))\n\n{ res=i+dir #positive or negative jump\n\nif(res<1) res=N+res else if(res>N) res=res-N\n\nreturn(res)\n\n}\n\n# local improvement and evaluation:\n\n# first tries to improve a solution with a\n\n# local search that uses domain knowledge (MD)\n\n# returns best solution and evaluation value\n\nlocal_imp_tour=function(s,p=NA)\n\n{ # local search\n\nN=length(s); ALL=1:N\n\nif(is.na(p)) p=sample(ALL,1) # select random position\n\nI=setdiff(ALL,p)\n\n# current distance: p to neighbors\n\npprev=mindex(p,-1,N=N); pnext=mindex(p,1,N=N)\n\ndpcur=MD[s[pprev],s[p]]+MD[s[p],s[pnext]]\n\n# new distance if p is remove to another position:\n\ndpnew=MD[s[pprev],s[pnext]]\n\n# search for best insertion position for p:\n\nibest=0;best=-Inf\n\nfor(i in I) # extra cycle that increases computation\n\n{\n\ninext=mindex(i,1,N=N);iprev=mindex(i,-1,N=N)\n\nif(inext==p) inext=pnext\n\nif(iprev==p) iprev=pprev\n\n# dinew: new distance p to neighbors if p inserted:\n\n# current i distance without p:\n\nif(i<p) {dinew=MD[s[iprev],s[p]]+MD[s[p],s[i]]\n\ndicur=MD[s[iprev],s[i]]\n\n}\n\nelse\n\n{ dinew=MD[s[i],s[p]]+MD[s[p],s[inext]]\n\ndicur=MD[s[i],s[inext]]\n\n}\n\n# difference between current tour and new one:\n\ndif=(dicur+dpcur)-(dinew+dpnew)\n\nif(dif>0 && dif>best) # improved solution\n\n{\n\nbest=dif\n\nibest=i\n\n}\n\n}\n\nif(ibest>0) # insert p in i\n\ns=insertion(s,p=p,i=ibest)\n\nreturn(list(eval=tour(s),solution=s))\n\n}\n\n# SANN:\n\ncat(\"SANN run:\\n\")\n\nset.seed(12345) # for replicability\n\ns=sample(1:N,N) # initial solution\n\nEV=0; BEST=Inf; F=rep(NA,MAXIT) # reset these vars.\n\nC=list(maxit=MAXIT,temp=2000,trace=TRUE,REPORT=MAXIT)\n\nPTM=proc.time() # start clock\n\nSANN=optim(s,fn=tour,gr=insertion,method=\"SANN\",control=C)\n\nsec=(proc.time()-PTM)[3] # get seconds elapsed\n\ncat(\"\n\n[Direct Result]: position and the third operator inserts a random subtour into another position. Figure 7.1 shows examples of these order mutations.\n\nFig. 7.1\n\nExample of three order mutation operators\n\nFor evolutionary approaches, there are several crossover methods that preserve order, such as partially matched crossover (PMX) , order crossover (OX) , and cycle crossover (CX) (Rocha et al. 2001). PMX first selects two cutting points and the corresponding matching section is exchanged between the two parents, through position-to-position exchange operations. The OX also exchanges two sections between the parents but keeping an emphasis on the relative order of the genes from both parents. Both operators are shown in Fig. 7.2, while CX is described in Exercise 7.1.\n\nFig. 7.2\n\nExample of PMX and OX crossover operators\n\nIn this section, two modern optimization methods are adapted to TSP: simulated annealing and evolutionary algorithm (under two variants). Simulated annealing uses a mutation operator to change solutions, while the evolutionary variants use specialized crossover and mutation operators. Given that the genalg package is not flexible in terms of accepting new genetic operators, the rbga.bin code was adapted to accept user defined operators under the new oea function. The two evolutionary variants include the standard algorithm and a Lamarckian evolution. The latter employs a greedy approach, where a local learning procedure is used first to improve a solution and then the improved solution replaces the population original solution. The R code that implements the ordered representation operators and Lamarckian evolution option is presented in file oea.R:\n\n### oea.R file ###\n\n### mutation operators:\n\nexchange=function(s,N=length(s))\n\n{ p=sample(1:N,2) # select two positions\n\ntemp=s[p[1]] # swap values\n\ns[p[1]]=s[p[2]]\n\ns[p[2]]=temp\n\nreturn(s)\n\n}\n\ninsertion=function(s,N=length(s),p=NA,i=NA)\n\n{ if(is.na(p)) p=sample(1:N,1) # select a position\n\nI=setdiff(1:N,p) # ALL except p\n\nif(is.na(i)) i=sample(I,1) # select random place\n\nif(i>p) i=i+1 # need to produce a change\n\nI1=which(I<i) # first part\n\nI2=which(I>=i) # last part\n\ns=s[c(I[I1],p,I[I2])] # new solution\n\nreturn(s)\n\n}\n\ndisplacement=function(s,N=length(s))\n\n{ p=c(1,N)\n\n# select random tour different than s\n\nwhile(p[1]==1&&p[2]==N) p=sort(sample(1:N,2))\n\nI=setdiff(1:N,p[1]:p[2]) # ALL except p\n\ni=sample(I,1) # select random place\n\nI1=which(I<i) # first part\n\nI2=which(I>=i) # last part\n\ns=s[c(I[I1],p[1]:p[2],I[I2])]\n\nreturn(s)\n\n}\n\n### crossover operators:\n\n# partially matched crossover (PMX) operator:\n\n# m is a matrix with 2 parent x ordered solutions\n\npmx=function(m)\n\n{\n\nN=ncol(m)\n\np=sample(1:N,2) # two cutting points\n\nc=m # children\n\nfor(i in p[1]:p[2])\n\n{ # rearrange:\n\nc[1,which(c[1,]==m[2,i])]=c[1,i]\n\n# crossed section:\n\nc[1,i]=m[2,i]\n\n# rearrange:\n\nc[2,which(c[2,]==m[1,i])]=c[2,i]\n\n# crossed section:\n\nc[2,i]=m[1,i]\n\n}\n\nreturn(c)\n\n}\n\n# order crossover (OX) operator:\n\n# m is a matrix with 2 parent x ordered solutions\n\nox=function(m)\n\n{\n\nN=ncol(m)\n\np=sort(sample(1:N,2)) # two cutting points\n\nc=matrix(rep(NA,N*2),ncol=N)\n\n# keep selected section:\n\nc[,p[1]:p[2]]=m[,p[1]:p[2]]\n\n# rotate after cut 2 (p[2]):\n\nI=((p[2]+1):(p[2]+N))\n\nI=ifelse(I<=N,I,I-N)\n\na=m[,I]\n\n# fill remaining genes:\n\na1=setdiff(a[2,],c[1,p[1]:p[2]])\n\na2=setdiff(a[1,],c[2,p[1]:p[2]])\n\nI2=setdiff(I,p[1]:p[2])\n\nc[,I2]=rbind(a1,a2)\n\nreturn(c)\n\n}\n\n### order (representation) evolutionary algorithm:\n\n# adapted version of rbga.bin that works with ordered vectors,\n\n# accepts used defined mutation and crossover operators and\n\n# accepts a Lamarckian evolution if evalFunc returns a list\n\n# note: assumes solution with values from the range 1,2,...,size\n\noea=function(size=10,suggestions=NULL,popSize=200,iters=100,mutationChance=NA,\n\nelitism=NA,evalFunc=NULL,\n\ncrossfunc=NULL,mutfunc=mutfunc,REPORT=0)\n\n{\n\nif(is.na(mutationChance)) { mutationChance=0.5 }\n\nif(is.na(elitism)) { elitism=floor(popSize/5)}\n\n# population initialization:\n\npopulation=matrix(nrow=popSize,ncol=size)\n\nif(!is.null(suggestions))\n\n{\n\nsuggestionCount=dim(suggestions)[1]\n\nfor(i in 1:suggestionCount)\n\npopulation[i, ] = suggestions[i, ]\n\nI=(suggestionCount\n\n[Direct Result]: :N,N) # initial solution\n\nEV=0; BEST=Inf; F=rep(NA,MAXIT) # reset these vars.\n\nC=list(maxit=MAXIT,temp=2000,trace=TRUE,REPORT=MAXIT)\n\nPTM=proc.time() # start clock\n\nSANN=optim(s,fn=tour,gr=insertion,method=\"SANN\",control=C)\n\nsec=(proc.time()-PTM)[3] # get seconds elapsed\n\ncat(\"time elapsed:\",sec,\"\\n\")\n\nRES[,1]=F\n\n# EA:\n\ncat(\"EA run:\\n\")\n\nset.seed(12345) # for replicability\n\nEV=0; BEST=Inf; F=rep(NA,MAXIT) # reset these vars.\n\npSize=30;iters=ceiling((MAXIT-pSize)/(pSize-1))\n\nPTM=proc.time() # start clock\n\nOEA=oea(size=N,popSize=pSize,iters=iters,evalFunc=tour,crossfunc=ox,mutfunc=insertion,REPORT=iters,elitism=1)\n\nsec=(proc.time()-PTM)[3] # get seconds elapsed\n\ncat(\"time elapsed:\",sec,\"\\n\")\n\nRES[,2]=F\n\n# Lamarckian EA (LEA):\n\ncat(\"LEA run:\\n\")\n\nset.seed(12345) # for replicability\n\nEV=0; BEST=Inf; F=rep(NA,MAXIT) # reset these vars.\n\npSize=30;iters=ceiling((MAXIT-pSize)/(pSize-1))\n\nPTM=proc.time() # start clock\n\nLEA=oea(size=N,popSize=pSize,iters=iters,evalFunc=local_imp\n\n_tour,crossfunc=ox,mutfunc=insertion,REPORT=iters,elitism=1)\n\nsec=(proc.time()-PTM)[3] # get seconds elapsed\n\ncat(\"time elapsed:\",sec,\"\\n\")\n\nRES[,3]=F\n\n# create PDF with comparison:\n\npdf(\"qa194-opt.pdf\",paper=\"special\")\n\npar(mar=c(4.0,4.0,0.1,0.1))\n\nX=seq(1,MAXIT,length.out=200)\n\nylim=c(min(RES)-50,max(RES))\n\nplot(X,RES[X,1],ylim=ylim,type=\"l\",lty=3,lwd=2,xlab=\"evaluations\",ylab=\"tour distance\")\n\nlines(X,RES[X,2],type=\"l\",lty=2,lwd=2)\n\nlines(X,RES[X,3],type=\"l\",lty=1,lwd=2)\n\nlegend(\"topright\",Methods,lwd=2,lty=3:1)\n\ndev.off()\n\n# create 3 PDF files with best tours:\n\npdf(\"qa194-2-opt.pdf\",paper=\"special\")\n\npar(mar=c(0.0,0.0,0.0,0.0))\n\nplot(Data[c(R1[1:N],R1[1]),],type=\"l\",xaxt=\"n\",yaxt=\"n\")\n\ndev.off()\n\npdf(\"qa194-ea.pdf\",paper=\"special\")\n\npar(mar=c(0.0,0.0,0.0,0.0))\n\nb=OEA$population[which.min(OEA$evaluations),]\n\nplot(Data[c(b,b[1]),],type=\"l\",xaxt=\"n\",yaxt=\"n\")\n\ndev.off()\n\npdf(\"qa194-lea.pdf\",paper=\"special\")\n\npar(mar=c(0.0,0.0,0.0,0.0))\n\nb=LEA$population[which.min(LEA$evaluations),]\n\nplot(Data[c(b,b[1]),],type=\"l\",xaxt=\"n\",yaxt=\"n\")\n\ndev.off()\n\nThe code starts by reading the Qatar TSP instance from the Web by using the getURL function of the RCurl package. The data is originally in the TSPLIB Format (extension .tsp) and thus some parsing (e.g., remove the header part until NODE_COORD_SECTION) is necessary to convert it into a CSV format. The national TSPs assume a traveling cost that is defined by the Euclidean distance rounded to the nearest whole number (TSPLIB EUC_2D-norm). This is easily computed by using the R dist function , which returns a distance matrix between all rows of a data matrix.\n\nThe code tests four methods to solve the Qatar instance: 2-opt, simulated annealing, an order evolutionary algorithm, and an evolutionary Lamarckian variant. The first method is executed using the the TSP package , which is specifically addressed to handle the TSP and includes two useful functions: TSP —generates a TSP object from a distance matrix; and solve_TSP —solves a TSP instance under several method options (e.g., \"2-opt\" and \"concorde\"). To simplify the code and analysis, the remaining optimization methods are only compared under a single run, although a proper comparison would require the use of several runs, as shown in Sect. 4.​5.​ The simulated annealing and evolutionary algorithms are executed under the same conditions. Similarly to the code presented in Sect. 4.​5, the global EV, BEST, and F are used to trace the evolution of optimization according to the number of function evaluations. The method parameters were fixed into a temperature of T = 2, 000 for the simulated annealing and population size of L P = 30 for the evolutionary algorithm. The Lamarckian approach works as follows. When the evaluation function is called, a local search that uses domain knowledge is applied. This"
      ],
      "latency_s": 1.54,
      "rag_type": "literag",
      "dominio": "LiteRAG_Multihop_01",
      "titulo": "",
      "error": ""
    },
    {
      "question": "Both the Spark book and the Linux Kernel book deal with parallel execution. What Linux kernel mechanism for deferring work asynchronously is conceptually similar to Spark's lazy evaluation of transformations?",
      "ground_truth": "Workqueues or tasklets, which defer processing outside the interrupt context similarly to how Spark defers computation until an action is called",
      "answer": "I am sorry, but the provided context does not contain information about the Linux Kernel or its mechanisms for deferring work asynchronously. Therefore, I cannot answer your question about how it relates to Spark's lazy evaluation.",
      "contexts": [
        "## Direct Evidence (Source Text)\n[Direct Result]: the book, and we will do our best to address it.\n\n# Chapter 1. Getting Up and Running with Spark\n\nApache Spark is a framework for distributed computing; this framework aims to make it simpler to write programs that run in parallel across many nodes in a cluster of computers. It tries to abstract the tasks of resource scheduling, job submission, execution, tracking, and communication between nodes, as well as the low-level operations that are inherent in parallel data processing. It also provides a higher level API to work with distributed data. In this way, it is similar to other distributed processing frameworks such as Apache Hadoop; however, the underlying architecture is somewhat different.\n\nSpark began as a research project at the University of California, Berkeley. The university was focused on the use case of distributed machine learning algorithms. Hence, it is designed from the ground up for high performance in applications of an iterative nature, where the same data is accessed multiple times. This performance is achieved primarily through caching datasets in memory, combined with low latency and overhead to launch parallel computation tasks. Together with other features such as fault tolerance, flexible distributed-memory data structures, and a powerful functional API, Spark has proved to be broadly useful for a wide range of large-scale data processing tasks, over and above machine learning and iterative analytics.\n\n### Note\n\nFor more background on Spark, including the research papers underlying Spark's development, see the project's history page at <http://spark.apache.org/community.html#history>.\n\nSpark runs in four modes:\n\n  * The standalone local mode, where all Spark processes are run within the same **Java Virtual Machine** ( **JVM** ) process\n  * The standalone cluster mode, using Spark's own built-in job-scheduling framework\n  * Using Mesos, a popular open source cluster-computing framework\n  * Using YARN (commonly referred to as NextGen MapReduce), a Hadoop-related cluster-computing and resource-scheduling framework\n\nIn this chapter, we will:\n\n  * Download the Spark binaries and set up a development environment that runs in Spark's standalone local mode. This environment will be used throughout the rest of the book to run the example code.\n  * Explore Spark's programming model and API using Spark's interactive console.\n  * Write our first Spark program in Scala, Java, and Python.\n  * Set up a Spark cluster using Amazon's **Elastic Cloud Compute** ( **EC2** ) platform, which can be used for large-sized data and heavier computational requirements, rather than running in the local mode.\n\n### Tip\n\nSpark can also be run on Amazon's Elastic MapReduce service using custom bootstrap action scripts, but this is beyond the scope of this book. The following article is a good reference guide: <http://aws.amazon.com/articles/Elastic-MapReduce/4926593393724923>.\n\nAt the time of writing this book, the article covers running Spark Version 1.1.0.\n\nIf you have previous experience in setting up Spark and are familiar with the basics of writing a Spark program, feel free to skip this chapter.\n\n# Installing and setting up Spark locally\n\nSpark can be run using the built-in standalone cluster scheduler in the local mode. This means that all the Spark processes are run within the same JVM--effectively, a single, multithreaded instance of Spark. The local mode is very useful for prototyping, development, debugging, and testing. However, this mode can also be useful in real-world scenarios to perform parallel computation across multiple cores on a single computer.\n\nAs Spark's local mode is fully compatible with the cluster mode, programs written and tested locally can be run on a cluster with just a few additional steps.\n\nThe first step in setting up Spark locally is to download the latest version (at the time of writing this book, the version is 1.2.0). The download page of the Spark project website, found at <http://spark.apache.org/downloads.html>, contains links to download various versions as well as to obtain the latest source code via GitHub.\n\n### Tip\n\nThe Spark project documentation website at <http://spark.apache.org/docs/latest/> is a comprehensive resource to learn more about Spark. We highly recommend that you explore it!\n\nSpark needs to be built against a specific version of Hadoop in order to access **Hadoop Distributed File System** ( **HDFS** ) as well as standard and custom Hadoop input sources. The download page provides prebuilt binary packages for Hadoop 1, CDH4 (Cloudera's Hadoop Distribution), MapR's Hadoop distribution, and Hadoop 2 (YARN). Unless you wish to build Spark against a specific Hadoop version, we recommend that you download the prebuilt Hadoop 2.4 package from an Apache mirror using this link: <http://www.apache.org/dyn/closer.cgi/spark/spark-1.2.0/spark-1.2.0-bin-hadoop2.4.tgz>.\n\nSpark requires the Scala programming language (version 2.10.4 at the time of writing this book) in order to run. Fortunately, the prebuilt binary package comes with the Scala runtime packages included, so you don't need to install Scala separately in order to get started. However, you will need to have a **Java Runtime Environment** ( **JRE** ) or **Java Development Kit** ( **JDK** ) installed (see the software and hardware list in this book's code bundle for installation instructions).\n\nOnce you have downloaded the Spark binary package, unpack the contents of the package and change into the newly created directory by running the following commands:\n\n    **> tar xfvz spark-1.2.0-bin-hadoop2.4.tgz**\n    **> cd spark-1.2.0-bin-hadoop2.4**\n\nSpark places user scripts to run Spark in the `bin` directory\n\n[Direct Result]: You will learn some common dimensionality-reduction techniques and how to apply and analyze them, as well as how to use the resulting data representation as input to another machine learning model.\n\nChapter 9, _Advanced Text Processing with Spark_ , introduces approaches to deal with large-scale text data, including techniques for feature extraction from text and dealing with the very high-dimensional features typical in text data.\n\nChapter 10, _Real-time Machine Learning with Spark Streaming_ , provides an overview of Spark Streaming and how it fits in with the online and incremental learning approaches to apply machine learning on data streams.\n\n# What you need for this book\n\nThroughout this book, we assume that you have some basic experience with programming in Scala, Java, or Python and have some basic knowledge of machine learning, statistics, and data analysis.\n\n# Who this book is for\n\nThis book is aimed at entry-level to intermediate data scientists, data analysts, software engineers, and practitioners involved in machine learning or data mining with an interest in large-scale machine learning approaches, but who are not necessarily familiar with Spark. You may have some experience of statistics or machine learning software (perhaps including MATLAB, scikit-learn, Mahout, R, Weka, and so on) or distributed systems (perhaps including some exposure to Hadoop).\n\n# Conventions\n\nIn this book, you will find a number of styles of text that distinguish between different kinds of information. Here are some examples of these styles, and an explanation of their meaning.\n\nCode words in text, database table names, folder names, filenames, file extensions, pathnames, dummy URLs, user input, and Twitter handles are shown as follows: \"Spark places user scripts to run Spark in the `bin` directory.\"\n\nA block of code is set as follows:\n\n    val conf = new SparkConf()\n    .setAppName(\"Test Spark App\")\n    .setMaster(\"local[4]\")\n    val sc = new SparkContext(conf)\n\nAny command-line input or output is written as follows:\n\n    **> tar xfvz spark-1.2.0-bin-hadoop2.4.tgz**\n    **> cd spark-1.2.0-bin-hadoop2.4**\n\n**New terms** and **important words** are shown in bold. Words that you see on the screen, in menus or dialog boxes for example, appear in the text like this: \"These can be obtained from the AWS homepage by clicking **Account** | **Security Credentials** | **Access Credentials**.\"\n\n### Note\n\nWarnings or important notes appear in a box like this.\n\n### Tip\n\nTips and tricks appear like this.\n\n# Reader feedback\n\nFeedback from our readers is always welcome. Let us know what you think about this book--what you liked or may have disliked. Reader feedback is important for us to develop titles that you really get the most out of.\n\nTo send us general feedback, simply send an e-mail to `<feedback@packtpub.com>`, and mention the book title through the subject of your message.\n\nIf there is a topic that you have expertise in and you are interested in either writing or contributing to a book, see our author guide on www.packtpub.com/authors.\n\n# Customer support\n\nNow that you are the proud owner of a Packt book, we have a number of things to help you to get the most from your purchase.\n\n## Downloading the example code\n\nYou can download the example code files for all Packt books you have purchased from your account at <http://www.packtpub.com>. If you purchased this book elsewhere, you can visit <http://www.packtpub.com/support> and register to have the files e-mailed directly to you.\n\n## Errata\n\nAlthough we have taken every care to ensure the accuracy of our content, mistakes do happen. If you find a mistake in one of our books--maybe a mistake in the text or the code--we would be grateful if you would report this to us. By doing so, you can save other readers from frustration and help us improve subsequent versions of this book. If you find any errata, please report them by visiting <http://www.packtpub.com/support>, selecting your book, clicking on the **Errata Submission Form** link, and entering the details of your errata. Once your errata are verified, your submission will be accepted and the errata will be uploaded to our website or added to any list of existing errata under the Errata section of that title.\n\nTo view the previously submitted errata, go to <https://www.packtpub.com/books/content/support> and enter the name of the book in the search field. The required information will appear under the **Errata** section.\n\n## Piracy\n\nPiracy of copyright material on the Internet is an ongoing problem across all media. At Packt, we take the protection of our copyright and licenses very seriously. If you come across any illegal copies of our works, in any form, on the Internet, please provide us with the location address or website name immediately so that we can pursue a remedy.\n\nPlease contact us at `<copyright@packtpub.com>` with a link to the suspected pirated material.\n\nWe appreciate your help in protecting our authors, and our ability to bring you valuable content.\n\n## Questions\n\nYou can contact us at `<questions@packtpub.com>` if you are having a problem with any aspect of the book, and we will do our best to address it.\n\n# Chapter 1. Getting Up and Running with Spark\n\nApache Spark is a framework for distributed computing; this framework aims to make it simpler to write programs that run in parallel across many nodes in a cluster of computers. It tries to abstract the tasks of resource scheduling, job submission, execution, tracking, and communication between nodes, as well as the low-level operations that are inherent in parallel data processing. It also provides a higher level\n\n[Direct Result]: from the physical world collected via sensor networks. While previously large-scale data storage, processing, analysis, and modeling was the domain of the largest institutions such as Google, Yahoo!, Facebook, and Twitter, increasingly, many organizations are being faced with the challenge of how to handle a massive amount of data.\n\nWhen faced with this quantity of data and the common requirement to utilize it in real time, human-powered systems quickly become infeasible. This has led to a rise in the so-called big data and machine learning systems that learn from this data to make automated decisions.\n\nIn answer to the challenge of dealing with ever larger-scale data without any prohibitive cost, new open source technologies emerged at companies such as Google, Yahoo!, Amazon, and Facebook, which aimed at making it easier to handle massive data volumes by distributing data storage and computation across a cluster of computers.\n\nThe most widespread of these is Apache Hadoop, which made it significantly easier and cheaper to both store large amounts of data (via the Hadoop Distributed File System, or HDFS) and run computations on this data (via Hadoop MapReduce, a framework to perform computation tasks in parallel across many nodes in a computer cluster).\n\nHowever, MapReduce has some important shortcomings, including high overheads to launch each job and reliance on storing intermediate data and results of the computation to disk, both of which make Hadoop relatively ill-suited for use cases of an iterative or low-latency nature. Apache Spark is a new framework for distributed computing that is designed from the ground up to be optimized for low-latency tasks and to store intermediate data and results in memory, thus addressing some of the major drawbacks of the Hadoop framework. Spark provides a clean, functional, and easy-to-understand API to write applications and is fully compatible with the Hadoop ecosystem.\n\nFurthermore, Spark provides native APIs in Scala, Java, and Python. The Scala and Python APIs allow all the benefits of the Scala or Python language, respectively, to be used directly in Spark applications, including using the relevant interpreter for real-time, interactive exploration. Spark itself now provides a toolkit (called MLlib) of distributed machine learning and data mining models that is under heavy development and already contains high-quality, scalable, and efficient algorithms for many common machine learning tasks, some of which we will delve into in this book.\n\nApplying machine learning techniques to massive datasets is challenging, primarily because most well-known machine learning algorithms are not designed for parallel architectures. In many cases, designing such algorithms is not an easy task. The nature of machine learning models is generally iterative, hence the strong appeal of Spark for this use case. While there are many competing frameworks for parallel computing, Spark is one of the few that combines speed, scalability, in-memory processing, and fault tolerance with ease of programming and a flexible, expressive, and powerful API design.\n\nThroughout this book, we will focus on real-world applications of machine learning technology. While we may briefly delve into some theoretical aspects of machine learning algorithms, the book will generally take a practical, applied approach with a focus on using examples and code to illustrate how to effectively use the features of Spark and MLlib, as well as other well-known and freely available packages for machine learning and data analysis, to create a useful machine learning system.\n\n# What this book covers\n\nChapter 1, _Getting Up and Running with Spark_ , shows how to install and set up a local development environment for the Spark framework as well as how to create a Spark cluster in the cloud using Amazon EC2. The Spark programming model and API will be introduced, and a simple Spark application will be created using each of Scala, Java, and Python.\n\nChapter 2, _Designing a Machine Learning System_ , presents an example of a real-world use case for a machine learning system. We will design a high-level architecture for an intelligent system in Spark based on this illustrative use case.\n\nChapter 3, _Obtaining, Processing, and Preparing Data with Spark_ , details how to go about obtaining data for use in a machine learning system, in particular from various freely and publicly available sources. We will learn how to process, clean, and transform the raw data into features that may be used in machine learning models, using available tools, libraries, and Spark's functionality.\n\nChapter 4, _Building a Recommendation Engine with Spark_ , deals with creating a recommendation model based on the collaborative filtering approach. This model will be used to recommend items to a given user as well as create lists of items that are similar to a given item. Standard metrics to evaluate the performance of a recommendation model will be covered here.\n\nChapter 5, _Building a Classification Model with Spark_ , details how to create a model for binary classification as well as how to utilize standard performance-evaluation metrics for classification tasks.\n\nChapter 6, _Building a Regression Model with Spark_ , shows how to create a model for regression, extending the classification model created in Chapter 5, _Building a Classification Model with Spark_. Evaluation metrics for the performance of regression models will be detailed here.\n\nChapter 7, _Building a Clustering Model with Spark_ , explores how to create a clustering model as well as how to use related evaluation methodologies. You will learn how to analyze and visualize the clusters generated.\n\nChapter 8, _Dimensionality Reduction with Spark_ , takes us through methods to extract the underlying structure from and reduce the dimensionality of our data. You will learn some common dimensionality-reduction techniques and how to apply and analyze them, as well as how to use the resulting data representation as input to another machine learning model.\n\nChapter 9, _Advanced Text Processing with Spark_ , introduces approaches to deal with large-scale text data, including techniques for feature extraction from text and dealing with the very high-dimensional features typical in text data.\n\nChapter 10, _Real-time Machine Learning with Spark Streaming_ , provides an overview of Spark Streaming and how"
      ],
      "latency_s": 22.42,
      "rag_type": "literag",
      "dominio": "LiteRAG_Multihop_01",
      "titulo": "",
      "error": ""
    }
  ],
  "ragas_scores": {
    "faithfulness": 0.7508,
    "answer_relevancy": 0.7013,
    "context_precision": 0.4,
    "context_recall": 0.3
  },
  "avg_latency_s": 9.38,
  "n_errors": 0
}